reviewId,content,sentimentScore
bfd5c1b3-6324-439f-89b0-65a2f2bf6dc6,Excellent app! I'm efficiently tracking my good & bad habits. And it's very eye opening to see the patterns of my thoughts & actions. I wish there was more options. Keep updating & upgrading. Thanks!,5
01a22616-49ca-43d9-9b64-3921b04ac1e4,"I love this app. I find it so useful to have all the small things I want to do every day laid out in front of me. It's also great to be able to see what your friends are up to! I like being able to write notes for each day too. One thing I'd like to see in the future is the ability to add divisions between habits. I have morning, daily anytime, evening, and weekly habits right now. I'd love to be able to add named dividers between them or be able to add categories in some way.",5
c6424e3e-ff65-4d1c-b3ce-c05117e80576,Easy to use,5
85a7fd7c-702a-4073-a7f6-1bea4e72e376,Just downloaded it... love it... lets see how it works for a long run.,5
cd02effb-437d-4561-8388-4ce4f47d9dcd,Amazing app!! Super simple to use and the share with friends feature is the perfect way to ensure accountability.,5
c521ab76-b4da-4db3-ba2a-02bf6eacb23a,Having my habits written down and having my willpower graded has made a huge difference! This app automates the dull task of keeping track of the things I need to do and injects some much-needed excitement into the process of actually doing them. My partner also loves this app and we keep each other accountable.,5
40808d2b-3ea0-4336-b706-d7fd6e8fa09f,this app has been so helpful and has made it easy to stick to my habits. definitely recommend!!,5
011a1cb4-ce45-40f3-8d98-ad4a19f1e4bc,I have used many other habit tracking apps but I have started to really like HabitShare and have been using it continously for over a week . The interface is simple and easy to use and it allows for sharing of habits with friends. Great job guys!,5
087358fa-21c0-4f50-bfe3-01ad72f4110b,Great app. Really love it highly recommend!!,5
49ca0518-8ce9-45eb-b202-85d4cc2a5792,"I LOVE THIS because it's plain and simple and has NO ADS! Thank you so much omg this is real philanthropic app making. I found it from a productivity/wellness influencer on YouTube and I'm so glad I downloaded it. It really motivates me to want to complete my habits, you wouldn't believe how satisfying a tick of a button is when you complete it. This simple design is much better for developing habits than a game app is like Fabulous because it's all on you to develop the habit, which I prefer!",5
bc85b5d1-e669-4e49-82e9-c8fa1762b638,"I'm really happy with the functionality and the design of this app and it's user interface, definitely helps to be able to share my progress with friends and vice versa.",5
a9e3743d-48e4-4008-ba53-5d0ada70823a,Really really easy to use tracker of multiple things,5
25c0449c-b5b7-4a47-8e0e-e0a6127566bf,great to share with friends,5
b03e18a4-804c-4db8-a7d7-13e7b6752a3a,"Simple to set up, super easy to use. Love that you can an invite friends to see your commiments.",5
418cbd99-51b4-40b6-b2e5-50ef742974b3,Amazing. New favorite app,5
f697244e-59ef-4895-a9e3-31bb359401b8,Best,5
28e0511d-f6b2-41cd-adae-663a1ca2cefb,"Can't say enough good things about this app. It's free, it's easy to use, there is an integrated messenger that allows you to communicate with your accountability partner. Thank you to team behind this project and for making it available for us all. God bless you.",5
381d26ab-4c01-4a6d-bb6a-41244db745bd,Awesome to use for consistency,5
e795b59d-c67b-4338-99a5-b44fffeff50e,Great app.. thanks,5
093d6c6d-90e4-40c1-94aa-7c7d8b3d504f,Works great for me :thumbs_up:,5
cb01817f-810c-4c49-b050-8c8246ffd0e0,Great app with interactive section,5
1b07cd2c-6bbf-471e-9e33-120dfc8ac493,So helpful!,5
7fb9b658-00c5-4d1b-8a7d-f62e11cc8794,Love this app because it has dramatically helped me improve my habits,5
fe94292a-97a3-4131-9d4a-ac7498e1ca7b,Awesome this far,5
be3859cb-49c5-433e-b1a2-f605e342fe1c,"Love it! No ads. No extra fees. No limit (well im at 10 now) to habits. You can edit past days. You can set daily, weekly, or monthly goals. Its amazing! *Reordering apps is still a little buggy, it feezes* I wish it had a condensed view and maybe a night view but otherwise great!",5
3f38ccbc-e111-4aab-8356-3088d11b9ee5,Love this app.. very user friendly... great for team challenges... love that you can send messages to each other .... being able to add your own specific habits is great so everyone can start where they are and not have to try and meet a generic goal... GREAT app,5
bd392ab5-f2cf-4492-93b7-803576dd11c5,Great! Simple yet highly effective. My partner and I have been using this for close to a month and have found it very useful to keep track of our progress and quickly view how on track each other is.,5
c43845f2-5c33-44ab-8d61-d474688529c7,App matches description. Want description to mention widgets. Thanks for sharing this ad-free!,5
a529a1b7-a879-4d59-a85b-4ddd97c232f8,i need this easy ro use app to count my sober days,5
3cfc51dd-b5c0-44d3-8063-0a4059acadd4,This app has exceeded my expectations. It's very easy and intuitive to use and I love the ability to set multiple reminders for each habit. It's handy to be able to ignore a day for a habit when it doesn't apply so that instance is factored out of calculations and percent achieved is accurate. Thank you to the app team!,5
87bce5fc-10c8-45d7-998f-c065264bf506,"Clean, simple, and easy to use!",5
b531a89d-5771-44d4-a6ef-341dadd4bff9,The best habit app ever!!!,5
2bfcb872-8198-4c57-af10-9eb9818ba818,just what I need,5
8024684f-0877-4596-962f-e700c83c274b,very nice ui & good performance,5
29f52add-a829-4655-b8bd-9bc5b7965ea7,Melhor app para manter hábitos!,5
1f68bca1-7daa-4ac3-af36-f7e5fe7afac8,excellent app!!! getting a team of friends to use it for some major accountability!,5
b5232dee-1dff-4163-9d8e-48a31ba19d14,Love love this app! It's the only one that I can think of ever to improve my life. I am telling everyone I can to download it. I'm like 1 for 20. Lol. I only have one bug on my app. I can't see when I type on the app. The message line doesn't scootch up enough so I type blind and check what I wrote when I shut the keyboard. Best app ever. I need to send you money. Jorge..... Calendar export would be cool.... Play store asked me if it had it. Thanks again for making this app!,5
53a0f10f-c218-494b-8cb0-7d0d2d216cac,changed my life,5
59d255e1-9937-43a7-adf0-6caefe82da11,It is a very valuable tool in tryinvg to take care of myself. I have developed a habt of and checking in this app many times per day.,5
b2cee6f7-c912-47c5-bb66-5e3df013a3f7,"Truly motivating, and not overly complicated and fussy.",5
f070f1d6-2d0b-4651-a294-71a19cc1530a,I have only been using this app a day and it's brilliant!,5
71793eae-e8db-4732-84d5-229d7e5789a7,Amazing.,5
97df1326-7a1a-477f-9e30-843820fb87f7,"best app for self improvement and tracking, thank you so much",5
b636c2e9-59af-4d34-836d-5678fc0137dc,The Best Among the best.... I wish it were possible to give you a 1000 stars :sparkles:.... Very excited about your app.. Extremely helpful... You are the best. God bless you all.,5
b1a683e9-9e09-4052-8cf8-6ca45f74dd6a,fantastic features and design. minimal but still powerful.,5
080397d9-93d0-4f40-9b29-f7be573d6cd0,very helpfull app,5
911d3944-8461-44de-8dfa-c888d4a91e4c,excelent application,5
90b1ad07-c183-49bb-8ecf-4fc9514bc4a2,I love the friend feature. It is very well integrated into the system. I also like the way comments are implemented and are easily viewable from the main screen. Thanks for a really solid app.,5
d36fa28f-a0f8-4170-9523-8d7fb5c9fec7,A simple yet powerful way to track your habits and stay on task. I love it!,5
677bb4f8-ddef-4bef-92bd-7e20843dc09d,really like this app and I reccomend it to people can be used in all sort of ways,5
838eb217-2fb2-40d6-9625-5da5cf93b34a,awesome. worth using,5
763b6e4d-8af4-45f1-b6c8-38816798b823,Cool,5
d5ecbb73-7e5e-4398-bc70-af105f7ebec7,Help me alot,5
ec44acaa-eb26-41f2-887e-316ba4ef2585,Amazingly helpful so far. Thanks A Lot to devs!,5
3d700924-deb4-4529-8a4f-03d376259882,"Brilliant, a great way to share and be accountable with my friends.",5
c00e8b0c-d4a5-4c28-809a-ffbb248afaa8,Simplicity is just right,5
e3ececaa-edf6-4d1d-a172-6a2f36e7406a,Need feature to follow strangers from around the world!,5
3aa49065-eb6f-4925-834d-8f268ddb702e,Great app!,5
7bcbf36e-0cdd-46d8-9bff-b3a80b318e88,"Definitely can keep better track of what's going on with a busy schedule. I really like how friends can see your progress so they can push you. I love how there's a streak system. Maybe you could implement a longest streak option. Also, could you fix the messaging? The longer I type my messages, the longer it takes for the keyboard to type. Thanks! Awesome app!",5
4ee49006-123a-4a91-b862-90c074824c63,This app is amazing. I've shared goals with my sons and the progress has been nothing short of incredible.,5
146f09ff-302c-4128-be64-92b10c7ac850,यह बहुत ही अच्छा एप्लीकेशन है,5
bf375c86-00c8-4617-8ecd-490a20c64f7a,Does this app provide widget? Thankyou,5
2378e5b8-6e3d-4cef-b87f-fb80e1e56d16,Thanks for your application. Nice in use.,5
3c2fcad2-276f-4d93-a6ed-92b9762839a9,Love this app it's great for sharing my habits with my best friends. Would be cool if you could add in a group chat and a section where your friends can comment and motivate you.,5
0e4e4904-6d32-4acc-8ed2-668711bfdc85,Fantastic. I am recommending it to others,5
40c190fa-ad42-4a25-a372-9076dc767598,"Very good apps, its really useful, very clean and best ui...good job team",5
eff2c827-8740-4f03-9109-071fba4f4122,Finally a habit-tracking app that brings accountability into the equation!,5
e07df961-88dc-4844-a42c-648f92909808,My favorite habit app! Only one that I could easily find to share habits with others. Also love that you can mark days as Skip and that the overall view shows the last 7 days and not just the current week.,5
4e893b3e-6226-4e5e-9935-88aa1eee2b4a,"Works seamlessly. Nice surprise: when you make comments, you can easily scroll through a month's worth of comments for a particular habit. Highly recommend to use on your own and with friends!",5
6b928122-583e-4db4-b561-7f1883cf2c13,Just what I was looking for....Thank you,5
ecc474de-d50e-430e-bd07-af6a7bb2c3a5,"Awesome! I love the organization of this app. Best Habit Tracker ever. Easy to set up, use, and share results.",5
83c6fe22-ee37-484d-b28b-01a058add21d,I love the group accountability in this app and how we can check up on each other. Really well designed. Thank you!,5
aca85a9c-f102-4588-8e06-0a108b8924ba,"This is an amazing app. Congratulations! I have just a few suggestions of improvement: what about having a ""News feed"" to catch up with friends activities easily? And what about a web version just so we can log our habits even when phone's not around? I also think it'd be very nice to have some visual incentives, e.g. charts that show the progress over time. Anyway, these are just suggestions. I'll keep using this app everyday. Thanks!",5
63a43653-fdde-4ce0-bd43-73a25483d4e5,It's great,5
c324158a-bb85-4c2f-8aaf-2c1cee976ec6,"I love the personal acceptability. I have goals set in every major area of life. Cannot wait to see how much better I do working towards my goals. Seeing this keeps me accountable, and motivates me to see my progress as well as where i can improve.",5
9fdad529-e740-4923-a624-456a44c8d94d,Great app for accountability against porn and for other disciplines!,5
231bd8d7-9862-446f-8be5-5dc66739d964,Awesome app. Perfect to keep each other accountable.,5
0e16f1e1-c9d1-435e-b2d9-0f7eaa6caf0e,Powerful,5
68011797-886e-41e3-bbcf-b967e0088851,Thanks for this,5
3ec7a267-c6cb-4dc0-a757-1d6585b4d02d,Great app. Best among similar apps. Should be a feature to have active habits and paused habits,5
f23c9856-5841-497b-9dfe-f3e9bdacd10f,Es ist sehr gut und praktisch.,5
a6793986-f196-40e8-bfff-df41891357db,This app is simple yet efficient. Thank you so much !,5
e96bf81a-f6b4-44cc-911e-df56cc0c7452,Awesome,5
5d6757f8-3f39-4c17-a5b3-f33623661bdd,Very helpful and good,5
bf8b5fcf-5066-41fe-97d8-e3cebf53407a,"Simple, clean, and super easy to share with friends.",5
e61362d6-34af-451c-9ac8-11e4018995ce,After lots of searching I finally found it! An app with sharable trackable habits- where you can follow streaks and success/fails with friends. thankyou Luke Bickston!,5
9876dd73-b7a7-46ce-8f71-09e740ab35d5,Incredible accountability app. Does exactly what i want.,5
c24574b6-8442-45a3-9ee1-32be3ab7e287,"I like this app, helps me much",5
41f1c9b4-e342-4271-b8dd-11757c30079a,Great tool for sharing habits,5
d532e3c9-5f95-43f8-b659-17fc99636236,Excellent app,5
44d00a3f-a30c-4b71-b523-d955fe70c88e,Very helpful app,5
6a02f312-975a-457a-9710-7d1595584bc1,The simplicity of this app serves it's purpose perfectly. The buddy system is really helpful for accountability and encouragement.,5
fb3416b2-c581-4d82-b558-60d74f6b8728,I've been looking for something like this for awhile. A friend and I make deals with each other to stay on track with doing things that we know are ultimately good for us but are hard to stay motivated to do on a daily basis. This app supports our efforts perfectly and it's hugely helpful that it's available for both IPhone and Android systems. Kudos to the developer(s)! Nicely done!,5
809995ae-fd36-40fc-b8a3-04aa16e9844e,Simple and effective,5
ce8039f1-7f29-4c57-b5af-e60ce85be350,Awesome App,5
9d426911-2641-484f-bf2a-a62431064fc6,"I've been using what I felt was the best habit app out there. The share feature is huge. One of the books I read told if we share a goal, there is a 76% success rate verses about a 36% success rate going it alone.... This app takes advantage of accountability without a call... I also noticed seeing my friends hitting their goals is making it easier to hit my goals.",5
524be14b-fe38-4fa4-aec2-1f7763cee788,Awesome app! Couldn't be happier with it!,5
cd12c99d-b1e7-4e10-bfce-bff147646a57,Love it!! Helps me stay accountable for my habits.,5
acdcbd69-877d-41c6-af27-c009c99df392,Love the guys I am challenging to grow can share with me their goals and I can check in on what they are learning!,5
2d2c3d25-5f6f-4988-9260-58981b3b270a,"Fantastic app. It is very useful to have an app to track my progress and keep me motivated on tasks I would normally get lazy on. I love how you can share with friends to help you maintain that extra accountability. Most importantly, the app works well. It is very smooth, user intuitive, and bug free, which plagues so many apps out there. A must download!",5
faf4b854-d1a7-4c9f-836f-2d781926e06d,It makes tracking my swim work outs so much easier.,5
dd7cc990-084c-43cf-b78b-65ebff5e81af,Changed my life,5
