reviewId,content,sentimentScore
d46e9511-7ef5-4a6d-813e-ce176266a321,"So simple, private yet social, easy to use. Love it.",5
06a16e5c-4226-42d2-9ca1-c3dad4d44cde,Exceeded my expectations,5
291a3458-c482-41ce-85d4-c0013ac9764c,"Adfree, simple, fast, no cost at all, thank you guys and only this options will make this app super amazing : 1- dark mode - Amoled mode 2- Option to change Email 3- Widgets for the app 4- app for windows & mac",5
712b89de-eb46-4171-bfb6-ad66ff1d74c8,Easy to navigate! Very motivating to stay on track!,5
a9847015-b0fa-4e8a-a945-70e9195dedca,"Love this app! No fuss, all the basics needed for daily data collection on habits, easy to track and share w friends who r down. Looove. Would even more love if it had dark mode too for night habits ie bedtime routine/Journaling etc so I dont get blinded when I go to track lol",5
d2b98541-a6c6-4449-8902-0747e70ca073,Great to track daily routines.,5
f2ad2be4-dee7-43be-9ce3-9de956da2c95,"I love it! Exactly what I needed to do with my best friend. I have found better apps in terms of user interface but the chatting and sharing facility is the uniqueness of this one. Also, Zero ads! Grateful for that one! Simplicity is its strength and yet I suggest making it more interesting, giving more dopamine to users when they are on track and are maintaining a good streak. More themes, graphics and buttons would help. Useful otherwise.",5
a7eb965c-483d-42bb-ac66-e58e6292e104,Super simple app. It does exactly what it says and no extra frills or gimmicks. Love it,5
ca4e2592-8ff6-4ba2-9601-28df0cee390c,"Super simple, no frills or widgets but all features are available FREE, great for sharing with friends and for accountability.",5
531bfa3c-dfd9-41bc-9734-e8449696d988,The App is awesome and I recommend it,5
44048248-a18c-4459-b90d-085b8ff08121,Love how simple and easy this app is to use! Sharing my habits with friends helps hold me accountable every single day.,5
a29ea246-fc54-415c-b9f0-bc81c531b5ff,Amazing app. Would love dark mode and single click habit checkoffs,5
02a2ea65-41da-4968-aae0-ebcdd69dafd8,This thing has been incredibly powerful for me. Actually science based accountability-- doubles as a time tracker if you want to use it that way.,5
b79c3e88-8525-4df4-b0b3-84b22c132747,Great simple app for tracking and sharing habits with friends.,5
e7f7dfeb-81c1-450f-85ca-d6e23931003d,this is the first ever app which i have rated 5/5 from bottom of my heart using it since one year no complain hates off to creaters thankyou so much your skill knowledge and selfless desire to impact the humanity will pay you off soon god bless you and thankyou very very very much for creating such an application!,5
8ee19b7c-748e-4b7e-a94f-ac3a4abbcfc6,"I love this app. It motivates me to complete my goals, giving me a real sense of satisfaction, even if I only complete one. However, I have been far more committed to a greater number of accomplishments because I can see my progress or lack of it. I wish there was a way to see entire past weeks in review, but no matter. Great to show your doctor what you've been doing, as well. Great tracker.",5
a5b45182-b9eb-49d4-bc1e-375afc418bf5,Way better and safer then obedience app,5
46a8e323-ef11-4264-a59b-8691dea8b15e,Love this app! Very easy to use,5
84e4971d-23ef-4349-b5dd-d46ae27677dd,Great for holding yourself accountable. I use it daily!,5
9402accf-2737-4490-bb40-e96ac55c98e3,This is literally the best app ever. Exactly what I wanted.,5
9d5f3182-21ae-4d1b-a7b0-5c4ea1066aba,Great Application,5
4bb22755-9629-4b5f-b108-9901b7ab055f,It's free. No catch. I love it,5
a1b6a60f-3067-4900-8ed2-b26202a2ec31,"I have fallen in love with this app! 10/10 Recently me and my girlfriend started using this appplication in order to build and maintain new habits, in short it has been extremely effective. Very simple and straight to the point, marking off tasks is super quick and we are able to hold each other accountable through the instant messaging feature. I would highly recommend to any family, couple, or group of friends that would like to boost their productivity.",5
02768e8f-cd55-4036-b68d-5f5059ed6a67,"Great and simple app, does exactly what it says. Bonus points that it's cross platform and the UI is clean and easy to use and understand. Share what you want and keep private what you want.",5
882c7f33-e8eb-414a-b5cd-33c3bcd107a7,"It's so simple and yet so effective. It's sharpened me and the bond I have with my God, and most of my close friends I share my habits with, I highly recommend it lol",5
8040039a-6fa4-4b24-873f-3324ddcf8787,"This app is great for habit tracking and accountability. Great UI, no problems with the app. Well designed.",5
073b9f6d-0708-42fb-ba6e-b2df11badd1c,Love this app!! I love the simplicity of it. I just wish there was a dark mode. (or amoled mode). Also better messaging features.,5
29238596-8bd1-41a8-9b4f-735be0dd40ee,"Excellent App, so easy to use. Great to track your habits and share some, or all, of them with your friends.",5
13470c07-03c6-45d4-b9df-2d034e319051,Works really well. I love the sharing of calendars and in app messaging. I do wish I could see a monthly calendar to track all my habits,5
609ef906-d686-4c21-95e7-0d49895ef467,Excellent App,5
d52bdcb5-5bb5-433e-9ee3-19b5f36bacb0,Best app that too with no ads or in app purchases,5
6ff4b36b-51a4-4b85-972e-7015b2643745,Great for getting a bird's-eye view of habits,5
c37a36b0-2da2-403e-86d0-3b8a4f4428ad,Amazing. I use it with my clients to help keep track of their progress.,5
f1416502-37d2-4691-bf31-72719a2aeeac,Just what I needed. Simple and clean UI.,5
6c5fdaf3-dda2-4233-88b7-e13ff04c2799,Amazing app. Simple and good.,5
1eea0d39-efc1-4283-95c7-24ccefb0a02f,"Simple lightweight app, great way to gain accountability for you goals with your group.",5
6a65d7af-628a-4fd0-aa70-a552672d3c8b,"Great app, keep it up.",5
214690f8-8ab8-4669-a0f3-ed621773b59a,Excellent,5
5815e315-03a7-4991-a674-6f5167675529,Great,5
0cefd73e-9e35-41f1-8a05-3bd336b05fb8,This app is good . I had it before and uninstalled it November 2022. Re installed it April 1st 2020 . I use it to record every time I masterbate. I set a goal of 10 masterbations per day. I can now see that I successfully completed my goals most days sometimes 2 times that amount . .I recommend this app,5
cd78a60d-7863-4a13-931c-754bf9a686ed,"Love the overall straightforward experience with this app. Gives me all the features I need without any extra nonsense. Add dark mode support, and this is a five star.",5
435ade21-a353-4917-9c82-0dc91a866675,Hi l just downloaded your app l need options for dark mode as soon as possible thanks,5
0c5111a9-27a2-4310-8414-8d28c471f082,Very nice app and i like that i can share with people,5
771d2c77-d9a6-4ed8-b801-f33b9e7eeaa2,Highly recommend this app. I've tried a lot of habit trackers. This one is easy to configure and use. You can even share habits with your friend or coach for accountability. No ads and no bloat. Thank you for creating such a clean and useful tool.,5
08b376c7-05ed-4e80-970b-52b467fc50a1,Perfect. Just what I needed,5
15fcf20a-9a06-424c-a9a8-71b3e140ab53,"I love this app! Not only does it do a great job of helping you keep track of your habits, you can access your habits across devices without losing data. I did an update on my phone that went wrong and had to delete all my phone's data and start over. Just logged in and all my habits are still there. I have some habits that go back to 2020. Would have sucked to lose that progress. Thanks so much for this app!",5
42ba2ea8-6e4c-47dc-9c38-1aed43c25461,"Amazing app. Please add the option to donate to the Developer, as I'd love to buy them a cup of coffee. This app has changed my life.",5
a960c351-dff0-4108-ba74-a62e087e182b,"HabitShare is awesome. Some may complain there is nothing new or no development but that's what I love about it. It doesn't need to spam unnecessary features, it is perfect as it is now! I lost streak one day though after 20+ :confused_face:, it just happened. I wish there was widget I can keep at home screen so I can be always reminded as I unlock the phone.",5
9c55f553-eb8e-400a-a603-2e5e249b1187,"Productive game changer , really love to use it . Simple yet Powerful",5
2fb38d52-69be-42a2-beca-196c197ee62e,Sexy :heart_on_fire:,5
23a33631-b4c6-4e65-bd80-ebf20764a08b,"I love this app. It keeps me and my team accountable with our habit and it has been really helpful. That each day has a place to comment and you can journal a highlight. The only challenge is that when you put a comment while you're offline when the Internet is back on the data disappears but it serves me well. Thank you so much, God bless you :fire:",5
e437a62f-2a4f-4c3e-b364-046c1fed89ec,Fantastic! Simple to use with lots of features.,5
97f53fe5-93d7-4168-8fc6-bb432610fe6c,This app is amazing. I failed to find simple habit trackers that got the work done until I found this app. I love the friends feature because I can build habits with friends. I just wish this alo had some sort of chart to represent my habits. Overall the all is extremely easy to use and I have no issues.,5
637a0a89-f4bd-4f6e-bc15-af324c2f5d76,I love this app. My family and I have used this for two years. We share our exercise habits with each other keeping everyone accountable.,5
9559b1b3-0c21-4d0e-a12c-54dad1cad78d,Simple and easy to use:thumbs_up::thumbs_up:,5
ad2cded7-f22e-411e-b0ac-112c331d69b2,Amazing! Does everything I want it to!,5
5034619e-c0a4-45ef-a368-5cb706d384b1,Best app to track habits with friends,5
0a92ca10-49b2-4a3e-b957-fdec3df1deda,I love this app. I just wish it sorted itself by name.,5
7388ed62-99e4-4616-bb2c-11f4775fbbc5,ɢʀᴇᴀᴛ ᴀᴘᴘ! ᴘʟᴇᴀsᴇ ᴀᴅᴅ ᴅᴀʀᴋ ᴍᴏᴅᴇ ᴛʜᴏ,5
81717dd2-5427-4bf0-adb8-2767ff9d1ad9,"This is my favorite habit tracking app. I have used all the most recommended ones. Percentage tracking, streak counter, account sync across devices, and confirmation to change habit status... Beautiful. Very well though out.",5
913c42a3-2ea5-4f36-92a9-580045a969aa,The app is so organized and I enjoy sharing my habits with my friends :red_heart:,5
e25cf418-7ea7-466d-8950-2518e29b70c5,"So far so good. Very easy, intuitive and nice. Thank you!",5
e452d0af-a644-4a89-8fd9-c34228e7da28,Amazing app yo keep track of your habits and make someone holding you accountable,5
63c6f3a9-d36d-4b2b-86ff-e2f138197f33,Awesome,5
5aa4dc36-68aa-4800-af8f-5865451b1457,Clean and intuitive user interface. Does everything I need. Ability to share individual habits with friends is great. Can export your data so that you can process or archive it on the PC.,5
5c2c1ca7-37ca-4a0f-953a-78b45326c766,This is what I was looking for! Is this secure???,5
0d777043-fe8d-4706-a568-a55e56082843,Awesome,5
7a0c1efb-c691-4b68-a64d-ca75def50ea9,Superb app and the concept of adding friends is amazing!!! A must download!!!,5
cbe6260a-4b1a-47ba-8ca2-ba3978eb81fe,Wonderful application to start a habit. Must try!! 10/10 to the developer(s) & all supportive team :OK_hand_light_skin_tone::thumbs_up_light_skin_tone:,5
43599b20-0758-4c7e-8b7f-00261fb47f0d,"I used to journal and track my habits using Samsung notes and iNotes. Well, that's changed. I love that I can reflect back on a habit's previous tracked days on a calendar view. The reminders are also clean and persistent. I've now started using this app to track my reoccurring reminders too. This app is a great tool for Journaling, tracking habits, and tracking reoccurring reminders! I say if you need to keep track of reoccurring events this is an excellent tool.",5
d9d3f7b5-9c61-44a6-9115-02b28350f935,"Enjoying the accountability of sharing with friends, also the percent is an effective way to measure goal progress. I have my phone set to greyscale to encourage less useage and it is more difficult to tell green days vs grey days, would be nice if able to tell without color. Besides that love it",5
ca02e28e-29c0-45bc-8bf0-78fd86467f48,"Nice one! I'm super enjoying it, thank you :) It would be nice to have a comment section to share details about my today's experience with habit followers. Thanks! upd Since 02/03/22 I can't log in, and get no email when request to change password",5
8f876c71-ef83-414b-8f48-341368b8face,Great and simple! Very good,5
16bcfc1f-92e4-4a7d-8518-8f00d8c8e6e0,Great way to track habits in a social way!,5
5c70776d-ba68-4a79-b9f3-54027263236d,Was recommended this app by Uncommon RD on yt. Not just great nutritional information but great life advice as well. Love this app!,5
443d959b-b8a2-4aef-bff1-f5178425b14c,Helpful,5
6cf07a35-0be8-481a-a268-e613be08f39b,Super easy to use. Love the skip day option as well. Holds me accountable for my actions. 10/10.,5
a906655c-f5cc-44fd-bf5b-75404622cb12,Excellent app,5
1ccb103c-9885-4fc1-ab19-e44812ded268,"Simple, free, well designed. A great tool for tracking habits and sharing accountability with your peers.",5
79a89ce2-518a-41bd-a1e4-6f13704a1ccc,"Awesome app, stay consistent with it and you will develop the habits you are looking for.",5
a5c9c22c-23b1-4a14-812d-8a65c548ca56,Perfect functional wise but Could have added a dark theme or theme color customisation. 5 stars still,5
8d82c9e3-2d97-47b1-b9e4-248840987019,"100% recommend, helps alot if you do it with sincere friends who want to better themselves as well. Definitely helps to build a habit.",5
278e02b9-93e8-440d-807d-e32cdb006602,Nice one,5
e4b5d6e4-707b-4f5e-b915-9d2de289644e,"This app turns out 2 b d best habit tracking app ever. I wrote a bad review b4; saying no backup features But I didn't have a data connection at the time, thats why it didn't backup. Trust me bro, its d BEST Period!!!",5
6abe7781-2df1-42bb-b324-7486f4f533f4,Great tool! Simple and effective.,5
357d57d8-dbd3-4c31-8fa4-c5b1ef2665d8,Thank you so much sir,5
d509087f-2656-4359-a402-f5724d59dfdd,"Very good for keeping track of habits, having the option to add friends is good too as it can be a nice accountability way of tracking your friends progress and on top, it gives your friend notifications if you have lost/haven't done your habit. Deserves 5 stars all around.",5
fa3977d9-af0b-4417-a51f-90544cc6a204,"Love, love, LOVE this app! Luke! Brother! What about: 1. An import function to upload all the habits onto another device? 2. Sync to Gdrive? 3. Select multiple habits at once to share with the same person(s)? 4. Option to force the screen down to showing the first incomplete task at the top when opening the app and completing a task, yet can easily still scroll up to see previously completed tasks? 5. Password/finger:unlocked: 6. Paid version with additionaly added features and keep this 1 ad free?",5
69037a1d-b315-4615-876b-30422bfb455f,Simple and it works!,5
822a5745-42c8-4715-9bb6-0a3b9fb69c3f,"Super easy to organize habits, check them off and keep track..",5
de460d82-1a90-4dae-808b-a0df8f3955d1,"Simple and efficient, it's perfect ! It has everything I need without being overwhelming. Plus it's one of the only ones I found where I can set a #times per week/month I want to do one habit, without having to set specific days. The sharing option is flawless too. Thank you for your work, it has everything I was looking for !",5
0017bd95-5fff-4a96-a140-6ce5d20dae80,Amazing. Simple. Quick to work with.,5
611fa766-41d9-40c2-952f-b4e4fa881eea,"Great app. Can you delete friends, when I go to delete it says that something went wrong.",5
d4ecb937-2a11-4c67-92df-47c33cdb1005,Simple and effective! Has been really helpful in helping build new habits.,5
b563858d-3d55-457b-bf4d-99ba0f8fb763,"Tracking my habits is an evolution. HabitShare is great app! At each step in my journey, it's proven adaptable. It’s the best app I've tried so far!",5
bbf4f2c6-c621-44e2-913d-e9d83183106d,"Wow, I love this app. It's so encouraging to have friends build habits with you ^-^.",5
83ac2aab-0c6f-4cfb-a5e2-45acc9f9a58a,Exactly what I want. Thank you.,5
64cca711-486c-4f92-8e33-f106d945b9f8,"Simple, effective app. I now consider it a necessity for building new habits or forcing me to recognize my own lack of discipline. Changing one's own behaviour is hard, building new habits is the key to long lasting significant changes. Starting small and keeping track of your progress allows you to stay true to your intentions. This app helps you with the process of keeping track and you can even share your progress with other friends using the app so they can help you be more accountable.",5
ea7f87f0-42b5-4c3e-92be-66496280a7f9,"By far my new favorite app! It allows you to not only track your habits, but to make notes and review as time goes on. This is what you need, just download it and see :grinning_face_with_smiling_eyes:",5
6ee8c121-547a-4f7e-b0d0-d47a81f369be,"Awesome, simple app. Track goals, set notification times, see percentage for different goals... AND ABLE TO SHARE AND SEE FRIEND'S GOALS. Awesome way to keep friends accountable",5
0fd43342-7fa2-4be9-8898-ec6898036336,Super easy to use. Super streamline,5
be028835-99f5-44a2-b26e-fe2f17af327b,Easy to use,5
09bbef7b-b551-4d55-b8af-ed473a688a35,Awesome.. This is the exact thing I have been looking for,5
ffca1cdb-e8d0-4623-80b1-0db665c1a306,I can't speak highly enough about this app; it is exactly what I was looking for! I love how lite and simple it is! Perfect for sharing with friends and co-workers.,5
42e38e94-f523-48c3-8ed8-431d97c3d8a7,"You guys have reached this perfect user interface, and it's so perfect. Psychological rewarding with a good overview view, the lack of unnecessary bloated features like the others - man - you guys have made the perfect tracker app. Thank you for changing my life in a meaningful way :red_heart:",5
a16e8f5b-b49c-4112-8d62-5448b3c22675,Wonderful :thumbs_up::thumbs_up::thumbs_up:,5
6cba9d83-3a09-4cac-a7e6-6f0bf76681a6,"Love the app! If you could add the feature to join a group or see your friend's other friends on the app, that would be awesome. For teams who are holding each other accountable using this app, it would make adding them alot less of a hassle!",5
cd423d4c-caea-4342-b883-1a75084e27d0,I don't usually write reviews but I actually love this app! It really does keep me on track with my habits and productive towards my goals. It's oddly rewarding giving myself those green check marks. You can even adjust the frequency of a habit instead of it being daily if you want. The fact that you can share with friends to add that extra accountibility is awesome! There's even a chat feature which works great. I'd recommend this to everyone.,5
ba9fe9fa-2666-42c0-897b-5cbbb1a5fb6d,Exactly what I was looking for. Helping me a lot.,5
bb43aeb4-ecc7-475d-a385-edbdd31f4918,Life changer!,5
34b9807a-ab50-4014-b71c-0815cc469ea3,Love it! Keeps me motivated,5
ebcf35e8-d20b-468c-b175-b7bc6a9cf69d,The best part is... You can share your habits with your friends and family. You can make habits together and grow along.,5
8ca6d27f-e70e-41f4-8bbf-ae39ae81d268,"Very good app, simple and easy to use!!",5
55d9822b-aa82-4210-b63d-6f1e751bae3e,Use it everyday with my sister. Great way to have that social pressure to keep our habits on track.,5
27f0807e-ff97-4af9-beb4-1ea81698f44a,Lovedddd the app! Can add many habits!,5
af9a1140-7bfb-473f-af0a-505a61cb144d,Best app I ever used,5
5d322e6c-5207-4017-a2bd-f19f2e93fbc1,"I've tried several habit trackers, and this one is by far the easiest to stick with. Sharing habits with a friend definitely helps build a sustainable sense of accountability.",5
529a149a-3dc5-437c-aef5-a551da148356,amazing,5
ccf9f08c-c23d-495a-988b-8dd8955a8bb0,Great app i had ever used in my life.,5
57aa5c19-5284-494e-a08a-4e37de777b28,It did not limit me on the number of habits that I could track! I am so thankful!!!!,5
33701678-3989-4803-9f57-b447e220d7c4,Easy to work with and super helpful in keeping track of daily tasks,5
724d9e07-a276-4f50-a434-5b38e1a85083,This app is simple and it works exactly how I needed it.,5
17d4604d-bc43-43fe-9af2-38b03884f92a,Amazing! Beautiful app,5
ced97be4-7471-4056-9d06-cf149a6dafc2,Simple yet effective.,5
5938f2ba-2d11-4f70-b9c8-e31afbd588da,Very nice.I have some addictions.I am tracking them everyday and trying to prohibit them with it's help.Even we can lock the app and keep it personal.I am loving this app.It has been really helpful.Thank you.,5
7355a5ee-b8e7-4f70-b161-12a6986c532a,Love this! Kept me so accountable,5
27eda3fb-06cd-4d28-b50f-5b2a7872c01f,Perfect for its purpose,5
90e87a7a-860e-47af-9856-590517337c37,Great way to share be accountable and cheer for others. It's simple and useful.,5
b03a86ae-4669-458e-a44e-1b37a93eb90e,"Using this app with friends and family to track workouts, used it to help our kids track habits, so many great ways/things to track! It is great being able to see how others are doing with their habits as well. Highly recommend!",5
9a2e4eb5-e68c-4301-8c01-d19bbab1c212,Love it! Would love to be able to like and comment on friend's daily achievements.,5
ddf8e952-5c52-4b41-bd34-406d638bb603,"Really liking this app. Clean look and easy to navigate, exactly what I want in a habit tracker.",5
c7ad4ac3-c619-4b9f-a772-a542b14d44a5,Love it. Wife and I share habits we want to do and it makes us work harder knowing the other person is doing it.,5
e415bbe7-7610-4fa8-898b-905e40428a69,Works well and simple to use.,5
18532edb-9037-472c-9ce9-87aab7145bbc,I love this app. Easy to use can trace myself and can form accountability group to share,5
103a09d2-939a-4af0-b141-5468429e0404,Best,5
c49cf568-5ca0-4b3d-aa91-07746831f66e,Great app,5
bc0b9349-d84f-42ea-9777-59375b3250b8,Really easy to use and helpful to track and do habits,5
d80da0d5-969d-4a89-af66-f1c85438aba7,"Easy, minimalist and accountability from a friend or co-worker. Just what I wanted. Thanks.",5
c7485a24-a864-4e9e-81c7-696c7dd07ff4,Habit Share is amazing. Not sure why people give it average reviews for little things. Overall its one of the best apps for holding yourself and friends accountable. Some people will find a problem with everything. This app is amazing,5
ea31610b-117e-4e82-90ba-65a7877dde48,Very Exellant,5
98d9803f-f4a9-4d82-8126-e86c3f8b6d43,Must have,5
d7ae629d-13f8-4a71-b122-8623efc08461,Easy to use and a great way to keep each other accountable!,5
7aeefa5e-9f34-47e9-a269-921673228a7e,"Even without the social aspect, the UX of this app is great. Simple but effective. Love that you can designate days as not applicable, too. Thanks to the developer for making it free.",5
dc04f0c9-b193-47a8-aed3-5b07c726a20e,"One of the best tracking app of my activities, definitely recommend this app to my friends",5
04a37140-5cf8-4a16-b6ce-b732cb877057,Easy to use. Love that it syncs across devices. Wish I could color code habits. And big wish that it had a widget. I'd donate to the dev for a widget!,5
936ab7d5-14e0-49b3-8bbd-05b3db461c67,Very useful app. Easy to use.,5
887390a6-a0be-4711-a5ad-34eb199c1496,"Love this app! It's simple and basic, not confusing or complicated. My girlfriend and I were looking for an app where we could track our progress and share it with each other to hold ourselves accountable. This is the perfect app for us.",5
a00dfa74-0f2d-4c4e-a419-f44afb5cea00,Awesome simple aap with friend share feature for accountability. Super! No frills!,5
5e2fad74-996f-49f2-9c76-eece84ade51c,"UNDERRATED APP. I've recommended this app to over 10 friends, no lie, check the statistics from Russian Federation. I will continue promoting it for sure. Also, I am a type of person who relies on external motivation. Once again, I see future in this app and thanks to developer its free! Love every aspect of it. Thank you!",5
a60fa495-2391-4041-9fa3-212adb80ab4d,Absolutely brilliant App. Love how I can share and keep myself accountable to someone. And they can see my bad habits that I am trying to overcome,5
c05f3e40-36d2-48f4-999a-b6520d9cae7f,You are god.,5
b6747e94-82aa-40d5-8ac4-d0f60313c9bc,I like this,5
8555b162-b844-433a-a67d-3b1e56b1e5c1,Great app,5
6d479139-d6c5-426a-b1cc-ad9004133ce9,Everyone should download it. Works exactly as described. Nothing like it available. Simple + accountability via family and friends tracking your progress. :),5
c4e0480e-a6ca-4a79-af31-bba11c5b92d0,This app is one of the best ones I have found for habit tracking! It is so simple and easy to use. The only thing that I think would make it better was if you could change the colors of each habit.,5
c7251461-d36b-466d-bef8-123e6d40fa93,Very usefull,5
93487458-75b5-4c2c-bff5-135766e14b21,Love the app...the user interface is so simple n easy to use...,5
4ae46abc-d75d-4d13-82f9-2732cea852f0,Very user friendly! Thank you for making this!,5
fff18cd2-c1f8-48c8-b1b5-608e9e52447d,"Fantastic. I share habits with friends inside the app. It's been extremely helpful keeping me on track. Love that you can archive habits. It's a wonderful app and it's FREE!! Thank you, HabitShare people xxx",5
696fe6c4-a7cd-449c-a1bf-a7bc29be40bd,"This is a simple app with a simple interface. If you're trying to keep track of habits and have friends encourage you, then this is everything you want. A huge thanks to the developers!",5
25361bb1-3fb8-48d6-b5a9-e04e2624a1bb,Simple. Easy to use. No nonsense. Love it,5
66e87c85-784d-4f55-9dc2-2f181507ed17,Love the app. Helped me be consistent with my habits,5
f242ad92-b7ab-4b35-b8db-b1ac568b4f2e,Please you will add arlarm ringtone for most useful Allover very helpful aap created Thank you very much.,5
da0d660a-d66c-4318-b543-32b45c007358,Easy to use for a first time user. Just exactly what I need.,5
d8ad54d7-fafc-4669-958a-d6d090038d2a,Amazing habit tracker in play store one can find.,5
2fb9f649-95fd-4be5-b353-55cbdf09aed1,Best app,5
67e154af-24be-47e9-9293-f69b8b3cd6bb,"I have tried many apps but this one is the best. Obviously, it is worth 5 stars. Your wonderful has made more organised. I would rate it 10 stars, if possible. Thanks for this app.",5
3e9dbe01-6860-4cf1-b823-7c400fa928eb,Awesome app.. loving it,5
