reviewId,content,sentimentScore
896cb511-7c62-4150-9975-a4ea96a597f4,"I just downloaded it and after starting it up I was so excited about this app. I felt hope and inspiration right off the bat, it didn't last long... When I got to the pay options my heart dropped. I just started crying. All that hope and inspiration got yanked out of my hands and spat right into my face. I uninstalled the app immediately. I was going to leave it as that and try my luck at righting down my planner but I just feel so much worse afterwards. There are apps that are free, go there.",1
2ae7612d-ddf7-41dd-822d-2ad81881a907,Only 1 custom task without buying premium? Ridiculous,1
dfdaba0c-59ad-47e1-b76c-975577e9561e,Stupid and useless thing,1
41c2bf74-eb05-4843-9203-1f5ed195568c,This sht forces you to spend money if you actually want to do more than just two things istg,1
fc08a28a-ec66-49b7-96a0-17e923a58f68,Only just downloaded it,1
7340e38b-84f3-405f-820d-03ef2fdde619,I hate it :unamused_face: I just made 1 habit an tried to make to habits but when I was trying to add it it was Telling me to subscribe and pay like what I only made 1 habit I couldn't make two habits please don't install this app its a disappointment it only wants money I'm trying to make habits not pay money just be careful about these apps everyone,1
32aabda1-d68f-4ed4-9a8c-61dc6c9e21b2,"Got charged within minutes while says 7 days trial. I'm looking for an adhd friendly app, this isn't it for me. So now I'm charged 21 dollars and I don't want to use the app. I'll change the rating when I received my money back v_v",1
cae92faf-424f-4cb3-a1db-8d90c982e1cd,"Uninstal sorry.. this app need subsribe to add new routine and i dont like it, just give an ads than subscribe to add new routine...",1
9bbac0b8-7631-412e-8153-101df6e3ba60,This app wasted our precious time in life This app is useless If you want to list your work then take pen and paper and for reminder set timer in your mobile clock,1
0768a4ad-7d03-417d-8bec-ac232922b600,"As soon as you download the app it will bombard you with endless facts about what makes this app great. You just have to helplessly press ""Continue"". Then they'll ask you endless questions like how much you sleep, how energetic you feel, what you'd like to change about yourself, are you anxious, etc. It's simply collecting data. Then this app will return to endless facts about other people's personal problems and you gotta keep pressing ""Continue"". Then they'll ask you to make a payment. -.-",1
09d6df3a-e337-4d9d-8eab-e3ba828f5ae4,"I absolutely hate this app you have to PAY to make your LIFE BETTER, please make it so you don't have to PAY to make your life better. Please I am begging you don't make it so you have to PAY to do anything on ME+",1
24ccabd1-d6e7-4f4c-8aad-e2e6c1145305,Do not download !!! Says a 7 day free trial yet charged me for a years subscription! Not happy !,1
e96e4ab5-f199-45f0-a7db-a61d1e1d17bc,It's bad :face_with_symbols_on_mouth::thumbs_down:,1
be7c33cf-b382-47cf-8fa4-c7eb55326e70,the app cannot be used without a subscription,1
424a1881-ab9b-4fcc-bebd-eb50b41cd3c7,"I can't add my own task,,! Premium user",1
84d36d0a-4f0f-473c-9105-c9197122ed64,you can't barely use the app. it needs subscription :<,1
0185bb04-9411-4d04-a6bd-3e60849ef7d4,"I tried this app, didn't like it, found a different one that I liked. I payed 12 hrs ago, it said i get 7 day free trial. So I just canceled it 12 hrs after getting it and it says it'll be canceled in a year, and I have to pay for the year. Not right!!!!!",1
db2d44f2-3f8d-469a-bd83-b15613cf7b43,you have to pay money when you could get an app just as good for free,1
1f80f612-d548-4247-9555-4d91e0f40227,"5minutes to setup just to find out its a subscription base model... Lol... No thanks. If I knew that before Install, it would not have been downloaded.",1
ac6b2ba7-745e-4327-868c-8079f624262a,Dreadful didn't find this app easy to use and very hard to cancel subscription,1
e4cdaf6e-3df5-45c4-8177-54de58021cb7,The task notifications does not alert at the set time.,1
a9d18c75-fd7c-4786-9b70-ac068c07cd8a,"Really, I can have 2 free tasks before I have to pay?! Pathetic.",1
65ed9bbe-ed1d-47ac-88a7-170f0f5ada92,Wouldn't let me add more than 2 items before spamming me with subscription ads,1
2b61babe-9644-45a7-8056-69204f368f6e,"21 day thing isn't scientifically proved,maybe it's good app,but it spreads misinformation for people struggling with lack of motivation,not good",1
6a4a5e5b-b155-4f40-9219-7a33fd29e791,Not free at all! Have to get a subscription to continue! Please read reviews! Update: I get it covers cost. Shpuld probably put that somewhere. The way you are going about it is scandalous.,1
c20b4e6f-f20f-472e-847c-1ca59541e9fc,"Literally can't do anything without needing to pay. Would be such a helpful app, but I literally can't even set a notification timer without needing to pay Edit: You could just make the app cost. i dont see the point in needing to make the whole app an inapp purchase. When i saw ads of the app, i was given the expectation that it would be free with some extra premium features",1
f132fc08-4ae9-4293-adda-f2fc83461cf5,Disgusting app. It take 3000₹ for only a simple daily routine planner. Then what should I do without money on your app. We indian thought 100 times when purchasing Netflix subscription and you want to sell me a daily routine planner plan for 3000₹ yearly. What is it ? Disgusting :face_with_symbols_on_mouth::enraged_face::thumbs_down:,1
b0e264c9-8375-401c-90f5-573facfa1f87,"7 day free trial is not free, do not get this app unless you want charged for something you want to take a look at. Was not what I expected. Only used it for 10 minutes before I realized this was not what I was looking for. Would like to be refunded my money!",1
028c695d-507c-4e50-bd94-e24525045556,I want to cancel it,1
b4c073a9-fa18-47ad-96ec-7f3c60096bdd,"Do not download this application. They charge you £18 which i paid as i thought its exercise videos app. Unfortunately, without paying money, it wasn't proceding, and when i paid, i did not even start using it, and it started asking me to give reviews first before even checking the application ..well after knowing this is not the application which i want i unsubscribe it and ask my money back but no response from the application ..they are scammer do not trust on reviews as well",1
2574b31c-e549-43af-be2a-7c3f4d05aa5f,Waste of time and money. They offer you a free trial but you are duped into buying a subscription. No notifications to remind you of your to-do-list. My outlook calendar is more useful than this app. I cannot understand how there can be such good reviews if my complaint is similar to many other reviewers .,1
cf4c908e-4adf-47f9-9522-2a5482b694d1,Pretty useless. Really disappointed that I paid $20 for absolutely nothing,1
0e5c88b3-1c0b-4097-9bf8-5cfe7a770578,I am extremely upset by the way you give a free trial for 7 days and then take the money right away. There is no way to cancel or reverse this on your app. I find your app difficult to use and would like a refund.,1
651774f8-2bf0-4838-80ee-1cf514fdc7ff,:collision::thumbs_up_light_skin_tone::loudly_crying_face::loudly_crying_face:,1
344a5866-f981-4092-ab8d-cfb60dccc085,I've been scammed out my money doesn't really work the reminders don't actually notify you so for someone who is Very good at forgetting things this app is the worst thing you could get Also the help service isn't really a thing and I haven't heard back so I assume it doesn't matter The only thing I can do is ask for a refund which I don't want I want the app to workkk,1
2d7fc396-00b3-4da2-b9be-4a457087e0b0,Didn't let me finish routeenand got me mad,1
7fe608fa-d23f-46fd-9b78-90d11a4893e2,"Not worth it have to pay, and the free trial... just it's not worth paying for. unorganized.",1
496fe9b0-f419-417e-97c3-914a84348cb4,"Had it on my previous phone (broken two weeks ago) used it all the time and was able to add as many tasks as I wanted for each day. Upon buying a new phone I downloaded the app, only to find I can now only have two tasks per day, and when trying to add another I'm forced into a purchasing screen for the ridiculous plans. Literally just download any other app, this one's useless :yawning_face:",1
900b0217-b419-4e57-bf7c-7cebb549ef65,"I believed it was a monthly subscription, allowing me to assess and decide whether to continue each month. However, I was charged 3900 Rs even after canceling the subscription. I haven't used the app for just one day, and I am seeking a refund. Could you please guide me on the process for obtaining the refund?it was very worst experience on the google pay",1
45c2bb52-e109-41d3-a1c9-671bb17cae6d,Unfortunately you have to pay a subscription,1
16d57cc7-ae20-4bb0-8255-9315446f6236,The CTA button are not responding anymore,1
e4137aa2-1cb0-4a13-a1b0-1b5a866e1018,"On free version you can only add 2 dayly routines and that it. Useless app if you need to pay for it, to use it.",1
a980fdf4-bb6d-4e7f-9e73-23056afffb50,Don't install. Next you know they are taking your money,1
50e463c8-ad57-49d3-9a3a-833aca4c0cdf,Non free app disguised as free app. Wasted my time.,1
bb01a6ca-bd18-4a85-a703-3d175777d7fa,HORRIBLE APP When ever I tried to add something to my plan an advertisement came that asked me to spend money dude srsly!? If you had me set up only 1 goal before having me pay don't MAKE A FREE VERSION,1
0993ad6f-911d-4bac-bc1b-9629b8ec558d,I did not sign up for the yearly plan but was charged $20. This app is nothing at all special I'm deleting it and it's a scam.,1
6449083d-bfb5-41c1-8014-d5967e5fd2d6,It not free you cant do anything total bs,1
de63f21d-d154-4954-83c1-f659fd0cdc5d,No things are free all are paid,1
d3d88529-8943-4747-b2f4-81800da63416,Can't do anything other than add 2 tasks without subscribing to the premium version. Very useless.,1
395f6144-b32e-4086-9cb0-91e1db082e84,"Waste of time, I'm broke and this app has done the opposite of its mission to help me organize my day",1
2122fdef-f93c-4294-a83a-e2c6ce8b2402,I refuse to use anything that forces me to subscribe before a trial. I'm not paying bc I don't even know if it's going to actually be helpful.,1
df449bd3-5e98-49b1-a36e-296969b4a979,Offered me a 7 day trial and charged me right away. Ended up playing with the app for 30 mins before deciding it's not for me. Now I'm unsubbed and out $30 - thanks for nothing,1
234d581b-3935-441e-a122-45dc69099427,"there was a 7-day free trial. I was charged on the 7th day. Understood, but there was no alert! so i can have a chance to cancel it before i get charged. Now, i paid $40 to remind me to drink water.",1
407cdeb1-a599-4f65-bcc2-ac26fef7d21f,Horrible,1
3121e641-cc0e-4aa4-9213-8460fe71dfb7,Not free Need a subscription :tired_face:,1
015c623f-413b-48e7-8047-2dc6aa9493a2,This app is pathetic after adding 2 things it started asking for subscription.... Weird app don't go for it,1
9aae763b-750f-4176-9f88-75d13aa84e8d,You have to pay to do the app the worst expiring of my life,1
24644143-af8f-4d17-8853-f838c2af5695,The amount of adds is so annoying g I hate it because e of that and that only,1
8fc075ea-88fd-43e5-bde7-0e0f2b4c5d22,i wish i could pay it,1
ec233ed6-03ec-4a20-9f5b-617f4e2b3e98,ya no worst app dont get it its a waste of time i litterly have to by to get more things all i can do is set my bed room and i cant eaven press drink water or medataite its just by this by that just dont get this app its a waist of time :enraged_face::face_vomiting:,1
f4308637-1b6c-4676-8aea-dfa6405e0f0a,The English is wrong. Some words are spelled wrong How did this App win awards? This is a joke.,1
a76f9195-7d4c-49de-ad44-b73a02b41e1d,I just wanted somewhere to write my to dos and they tried to sell me a bunch of stuff,1
aa1fd072-cd43-43a1-943a-bcde0e2577e6,Useless,1
7415f27c-6eec-489a-9010-02b8936dc424,You can only make 2 tasks yourself on the free version making this app nearly useless for me. They get very in your face about self care & wanting better for yourself while also pushing you to spend more money. It's manipulative. The 7 day free trial attempted to charge my card. Very disappointing to use after the long introduction. DONT BE FOOLED BY ALL THE 5 STAR REVIEWS! They make you select it before you even use the app. It won't let you back out it. I closed it out & it returned.,1
1115c1a0-cae9-45bf-9b64-d9d2081eb6b5,I had canceled this app prior to them charging me for another 3 months. Yet they still charged my account!,1
05d7647e-ac1b-4d28-adf6-f95be452e066,It was said 7 days free trial but it was a lie,1
0c6aaebc-d67b-41fd-8637-761752b970d9,Should have been free,1
b9a7c5d9-d252-4859-8c47-fba69b1a0d72,"Yeah NOT happening! I am not at all pleased with wasting my time going through the quiz thinking. ""Yes! This is just what I have been looking for!"" Only to see that I can't even use the app without paying. I don't even know what I'm paying for. I don't know enough about the app to put in my card information for a ""free trial"" that ( judging by other reviews they didn't even get without being charged.) I don't like that I been set up to pay for an app before even getting to see if it's worth it",1
6523ca27-d8f9-4f54-a17a-2d32c3ad1c2c,It won't let me try it without giving my credit card info.,1
f60a76d7-d52b-4beb-8356-b3dcb6b015d9,"I bought it by mistake and i filed for a refund but didn't get approved, so i figured i might as well make use of it, but it doesn't work at all. I just paid for NOTHING! The reminders dont work, and no notifs at all to remind me to do some task or show my progress. NOTHING!! It doesn't serve its purpose at all. That's why i give a One star. Just plain disappointed. I want my money back.:loudly_crying_face:",1
b6a7e61f-48a4-445c-a78d-233de486fe28,Its junk Don't do what it says get conned into buying it fortunately I managed to get a refund because the 7 days were not up but not from the app company I made that through Google play save yourself the headache just don't purchase,1
06db991a-d3cf-44bd-a69c-0dfed8bd5ec0,As notificações não funcionam. Elas só aparecem quando abro o app. De que adianta um app com o propósito de criar hábitos se ele não notifica. Fiz a assinatura da versão paga e estou totalmente arrependida,1
17f4acc7-b5ae-4e93-bede-af28b6d7a133,"Every time you add task, your subscription offer pops up. So annoying!",1
0b676e89-79db-4223-87ae-51023be030a0,It says it has 7 days free trial but then it charge me for a year. It's not even what I expect. I tried to contact the developer for a refund but I didn't get a response. Please refund. I am and will not able to use it.,1
0cacf8a3-08f3-4a68-844a-e631521d2366,"Its horrible. I thought at first that it was going to ne good and actually help me but if u want more than 1 Reminder than u have to pay a subscription. I tried everything but u just have to pay otherwise u can't get pretty mutch enything. The ads don't tell h about the subscription or eny money, so I think its a scam. AND IT COSTS £20 A MONTH",1
665db339-6a72-4df0-b033-f0169348e3aa,This app charge my credit card without asking me. I don't even know this app.,1
7bc37640-70cc-451e-9442-7e2a2965c7f3,Qont let me add any things on my routine im sooo pissed :face_with_steam_from_nose: today i woke up a 830am and my school starts at 840am do not get waist of time!!!,1
c046e248-0c82-4457-b1a4-2566b6cd67a7,"I got this cuz I needed an app to help me set reminders for stuff but this is really bad for that. You can only set yourself two tasks before you gotta pay to use the app, and reminders don't work at all. I haven't gotten a single reminder since using this app. Maybe I need to open it to get the reminders? But what's the point of SETTING REMINDERS if i have to go out of my way to get them anyway?? I'm really disappointed. This app really looked promising...",1
9f6edc03-a676-4fe6-81ce-7d58e8826a5c,very bad app please dont danllowd it,1
028bcd93-06d8-4d02-b3c3-69f757fd506b,Waste of money!!!,1
f0d1051c-f1a1-49c3-8047-3fde912eb26c,Awful app,1
0a9b16cb-79ef-47fc-8e59-7afb7441e906,They Charge! Tell me RIGHT UP FRONT that the app cost money BEFORE I go through a big sign in. If I knew the price UP FRONT I might try the free trial and pay later. But If You Let Me Go Through A Long Sign In THEN want To Charge Me NO!!! Uninstalled.,1
ae06968a-c0bc-40e9-8ecb-1fe3619ee6a7,Kollam poli sanam,1
b424a3da-16ee-4a45-83bd-e2bcf37273cb,"If you plan to install it just to use the free version, don't. All you can do for free is add two daily tasks, nothing more. Unfortunately wasted 15 minutes of my day with it (:",1
25baa591-0fe7-4785-9ea9-ff6e866737d7,Delete after watching the ad with bass,1
b3350b36-0eec-4a86-aaf9-1fc22f8e7fe0,I tried this app but it just wasn't for me. I cancelled the subscription well before the free trial ended but was still charged the annual fee. Not happy!,1
d0a5b69a-25c6-4ed6-a8f4-f93ed26cceb9,Am I missing something? I click on mind game on my daily routine and it's just a timer??,1
fa8bda99-a351-4129-aab1-bbca368198c5,It's a cute app at first I loved it but then when I was adding stuff to my morning routine I added two things and then the add popped up to buy the extra pack or wtv. And I clicked x so I could add my thing to the list and it wouldn't let me add it like at all. Any time I would click done it would just have the add pop up and it wouldn't add it. So no don't get this app it's a waste of time.,1
7e0d68ed-99c7-45e2-abff-be598469ce9a,"The app looked friendly but after using it a couple of days I find myself frustrated with the fact that you cannot edit the entries, schedule them in advance without being a cyclical habit. Also, and this is actually infuriating, the reminders don't work. Tried them a couple of times, no reminder, no notification, nothing :expressionless_face:",1
9fb8000c-b57f-4779-b01d-a53e83e88db8,This app asks for your thumb print. Don't do it!!! With your thumb print they can access your personal information!!,1
8f5594aa-dcb0-486d-9528-646e8efc3226,My 7 day free trial cost me 31.03......:enraged_face:,1
43b01b72-5c40-4a61-b98a-7284f0c41d1d,"Not at all what it appears from advertising. Basically you can set a list of tasks per day, no week view and no set times. Can only edit tasks for the current day. It's essentially a list which I might as well add to my normal calendar",1
489c33a6-0946-4c45-b70a-cc77ecda56b1,Didn't like at all,1
cfbd26dd-228d-4e94-bb31-4462cf77aa8f,There is no free 7-day trial. It deducts money as soon as you sign up. What they are doing is so uncool and dodgey,1
6165c41e-c98a-4242-be43-77f56152833d,"Honestly this app is a scam by advertising,at first it said for ""free"" I downloaded and asked to pay like please",1
fe501588-9d29-4e28-a998-64494018db2d,Too much rubbish and advertising. Want me to provide credit details and subscribe witthout even seeing what the app does. Uninstalling.,1
ad8ed621-91a3-4e99-853e-02decb8ec869,It asks you all these questions in the beginning just to turn them into a dumb slaes pitch. $20 for a routine app? Whoever came up with this bs is out of their mind.,1
f330a821-aafa-4c7b-b690-e85f4be55f60,"Paid for subscription, and the notifications don't work. That was supposed to be the whole point of the app. I do not recommend it.",1
f0d9607b-5e0a-410b-978d-07ad4a9639c7,Tryed the app can't add more then one thing to do a day unless you pay for it,1
3557352b-0456-4693-b460-33e01bf877e1,"It says 7-day free trail but you will be charged. Money will deduct & these people will say process to cancel it but it cancels only renewal not the current year. It's a bait to get money. Customer support option is not there in app. No direct way to contact. So if you are facing any issues with payment, subscriptions then it's hard to address these concerns. I personally feel it's not worthy to pay 999/- per month for this app. Oh ya & you get subscription failed message after money deducts.",1
82c947b2-f463-4de8-9289-62356d1f3ea8,"This app. has absolutely nothing more than a calendar with no tutorial on how to use the it. The only thing I could find was articles about ADD which you could just find on Pinterest... *** Oh, & my bank thought it was fraud so there's that! *** Wasted time & money. How this has such a high rater, I do not understand.",1
72daf457-4b2c-49a4-8a4e-3e3b75caf011,"Super long start and then ""pay now , 7 days free"" did not even see the app. BS!",1
7605f52e-a4c6-476c-b207-9317fd96376d,This is clunky and awkward to use. I have paid and it's almost all ads. I was very disappointed. The one week free trial doesn't exist. I requested refund 4 days in and was refused. Robbed.,1
1e271a1b-9f42-4217-b1e1-73beb9af3f72,sorry bad,1
e653f6b4-3da1-49a0-886f-c7f97f3fcc24,You have to pay to use. Or put in a cc for a free 7 day trial. Nope,1
7afb9ae4-c20f-467b-8a3f-faa0db82c3d2,The notification does not work... it never reminds me. Edit: thank you for replying to my review but it's still not sending a notification and I have the latest update.,1
2badc7cb-7f7d-4b0a-9f1b-a6c45d67ddd4,I apparently subscribed to this app accidentally ... I didn't even know it was charging me till I deleted the app and Google warned me that I was subscribed,1
0d014796-a8f3-4123-a971-f5763f3b9c6c,The app does not notify me about my tasks... I was hoping to get this feature upon subscription. It's unfortunate that it does not serve this use. I hope the team responds promptly to this issue. Thank you.,1
6944f93e-02f3-4910-aba5-f573c06fce9c,This app changed me in 7 days :star::star::star::star::star:,1
5f1d9d11-3a13-4fa4-b014-5369f193174e,Says it has a 7 day free trial period but it automatically charged me the first day,1
17a08650-aced-42f9-9a60-3295b6aa3bfc,"It's a glorified to do list, not worth the subscription and pushes ypu into buying for the year, way better organisation apps out there",1
20c6145d-1b1f-481b-a36a-355695702721,free for only 7 days,1
0dee0d62-aa8f-40fc-85c5-584c678d5c26,"Had to pay for yearly subscription before I could do the trial. Money went off my bank account and after I canceled my subscription, I have not received a refund. So did I pay for something I won't use. This is not on.",1
69be1e14-fe23-4ed0-8807-9b526de471e1,This app provides service only paid customers.,1
239d2233-55c3-4b50-97a3-1603ad26ba75,"We can only add 2 plans for free. To use the app you have get the subscribtion which is nearly 500₹ per month, waste app, to just use it regularly you have to pay for it",1
e89ad45d-bdb9-4ef3-a586-3880557d3394,I bought it 45euros but it does not work each time I try to open it on my phone it closes directly this is very strange. So I would like to get refund please because I'm ok for paying if it works but if it doesn't it is just a scam.,1
239c6747-aa99-46b1-ba1d-3c5544284397,Application asks obvious questions to set up.... just feels like marketing instead of actually helping....,1
083515a5-56c6-4fd6-8254-6824a7a1ef32,"Accidently downloaded and paid for 1 year. Less then 10 minutes been teying to cancel, no way to get refund..alsonwasnt provided with my 7 daybtrial",1
74e201dd-cec1-466a-ab83-8a245104ae97,Please return my money. My free trial ends tomorrow,1
85501a2e-6d16-49da-baf5-ed2b4d1f0f20,You can only put two things then u have to pay for everything,1
29504f64-6d96-4eb8-836d-d8cb37400411,"Paid, not done! Costs too high",1
627085a5-3508-467b-ada3-942d4c53cc20,Only being able to add two goals without paying it makes the app useless,1
9d0278ab-15c6-4646-adb6-40ad0f4b0671,The free version is practically useless unless you only have 2 routines in life.,1
b023816c-533d-4639-b4eb-70d108c79d52,Very very bad,1
91c5fc6c-ea81-452d-a469-9b7c495105f4,You shold pay to add some habit. So bad,1
95359263-1701-4948-badd-26065bc3e474,Waste if time,1
0bb976bc-3c82-4f3e-a707-f451237b417f,It won't let you add anything I hate it me+ change it,1
f472ea10-bf40-4813-87ff-b9e82a0528cf,Everything comes under subscription only,1
3e746fa8-8adb-482f-b127-0e04ec8f9bb2,"TOTAL SCAM DO NOT GIVE THESE PEOPLE AUTH FOR THE FRES TRIAL, YOU WIL GET CHARGED IMMEDIATELY AND THEY WIL NOT REFUND YOUR MONEY!!! SCAM SCAM SCAM",1
7f4fee11-834c-4e89-8edb-48acb34ec2e9,DO NOT BELIEVE THE 7 DAY FREE TRIAL. I accepted the 7 day free trial and it asks for credit card info. I am thinking I will be charged after 7 days but I am immediately charged for the year. Very unsophisticated app. No refunds 10 min later. :(,1
122d4690-0b51-40dc-8bd7-203dd6254fd6,Money laundering just wanted money from you no value.,1
2e1cde5b-2157-424d-8671-a9baa8ff6408,No free features,1
93bbcbb0-8f77-4302-a6ba-ced37e5031aa,would've been a good and helpful app if you didnt have to pay for basically every feature. goofy and deserves even less than one star. disappointing,1
afd589f8-f4bc-4e5a-819b-a3c538b97ab7,Was charged a years subscription when signing up for a free week trial.,1
0c3de3a9-7fe2-4a01-8220-f729da7f09e9,I wanted to try this app during the free trial and then within the trial I cancelled it. I still didn't get my refund. I don't care for this app. Just wasn't for me and my ADHD.,1
870adc5e-4cb2-4911-944e-79c43071ce77,Not able to opt yes or no from Samsung z fold device from ' do u relate to..... Page,1
a86fa021-c6a8-4ea0-94b6-8dcd69e241d6,Wastes your time with quizzes just to find out you have to pay,1
bf56db26-8db8-4bf8-86c6-9e1762c0b866,"im starting using this app, i'll update after the rezults",1
e7f690b3-9622-4845-a0ab-1d0e00ed6d97,Can't add any tasks :loudly_crying_face:,1
2edefd3a-3e47-432c-9e43-11c24321543e,Trying to get a refund. This app doesn't meet my expectations. I have had less than 24 hours. I should get a refund.,1
0a48ec16-de97-4df7-a462-38e52698aaac,Can only set myself one task without paying the subscription. Ridiculous.,1
a5da6eba-5d66-4175-a5f2-56d6d817697e,Got halfway through questions & screen has no where to press to go forward.....????? from Do you relate to the statement below?,1
0e29f8e8-59cf-49e8-b947-9530b1d1e233,"hi, how to cancel the subscription?",1
