reviewId,content,sentimentScore
5d6593f0-3161-4a0a-9306-74db649018d3,"I tried to get the free trial, signed up thinking the charge would go through after the trial ended. Nope, I was charged immediately. I have tried to get a refund and have been refused. Don't get this ap, it's a rip off. Don't believe when they say FREE trial.",1
de6f0f73-92e2-488f-9193-6d56c82ec8f7,Free for 1 week,1
44ae514b-3d6a-4647-920d-8424a1500a62,:enraged_face::enraged_face::enraged_face:,1
c8fdb691-f36b-47c4-a80e-d4aaf68594c6,"Advertised as ""free"" but you can't do anything within the app unless you pay for a subscription.",1
c3116adf-f8c9-440d-bfdb-2925d66dcc00,Not receiving any notifications for the app. App does not show up in notification settings for Samsung S23. What you get vs. What you pay is definitely not equivalent. Find another app.,1
9668894f-1624-48db-93a7-6f9afdc52f7d,"Notifications don't work and help desk don't respond, no way to get a refund",1
689a6b24-385a-49d6-900f-11c14cedfaa1,"Very misleading free trial as it charged my son the full 3 month fee. The app states that refunds will be given if such mistakes are made, yet no response to any contact made, and even Google doesn't assist.",1
16588026-6b39-4919-b092-d16db828c176,"MUST SUBSCRIBE TO USE: $9.99/month (billed monthly), 12months at $3.33/monthly (billed annually)*7 day free trial, 3months at $6.66/monthly (billed quarterly) just some info for those who don't want to waste their time.",1
b04a5a67-d9c7-4d7e-92b9-80fbae5b99be,Says get 80% off for 1.66 a month and then says that's around 39$ but it should be 19.92 plus tax. Lies.,1
39f3d163-53f6-418b-971f-cb0fede62760,I was supposed to get a seven day free trial before being charged for the app.. and it charged me as soon as I started using the app. I'm very unhappy with the product as well it doesn't do the things it claimed to in the ads I have reviewed for it as well. If I could give 0 stars I would.,1
fc753fe6-9179-4992-9d49-39dd45dd84e7,"Just hated this app. Non stop pushing for starting the paid. Have to wade through so much pointless confetti and colours saying how great you're doing before you've started. And then, I don't have a weekly schedule, and this is only (potentially) convenient for those that do. Absolute waste of time.",1
8c2adfaf-3808-408f-ab79-5ff9c440b786,"I am editing my feedback. Thank you for getting back my refund. Please note, that there's an issue with a Free Trial function within your app. It doesn't leave a good impression to your potential future Customers. Please look into this. Regards to You and Your Team. **** I wrote twice to get my refunds. Your Helpdesk is not helping in anyway. Please get the payment back to my Google Play account card.****",1
255cd4fa-c2bd-4474-a544-3469e36a3f68,"The application does not work wellif you don't upgrade to Premium. No trial period, so you stuck with a plan. If there was a trial period, then I wouldn't mind purchasing.",1
9f3801a0-5c24-4ecc-a1da-952d24d5dcb3,"Scam - They tell you it is a 7 day free trial, but if you input your credit card information, it charges you immediately.",1
6a61f6b3-eaba-49f1-9dcd-c7fde57000ba,Garbage,1
c015ff71-a42f-4d74-9381-cdb419d8c380,Dumbest app way to expensive,1
9313c941-a5eb-44e0-bfa6-7180a8962914,They took out my money before my 7 days trial what's up with no warning? Aren't they supposed to tell you when they're going to take out your money? It was an okay app but there are many more free ones just like it out there. Don't waste your money.,1
9aec99c1-c614-4963-af3e-21e6439ecf94,The stars can't be trusted. It wouldn't let me do a trial and charged me for a year automatically. I've requested a refund as I spent all of 10 minutes browsing to realize it's nothing like the ad. I really want my $20 back. What a waste.,1
99aea2d7-3c2c-4ed0-b920-cb1013fa9888,Unable to reach customer service. Feel like this is a scam.,1
dcef52b0-d406-4c63-9b09-7ed9cadc278d,"Such a pain to use! Can't edit activities for other days. Only able to change for today. I learned something about my habits, and want to change some routine accordingly for rest of the week, but can't do that! What's the point of such a planner if you can't adjust the plan? Also there's no option of turning off the annoying sound when you mark a task complete.",1
a00ab54e-e7db-4d96-9510-16dc0588f909,"Charged me the 1st day of my ""Free Trial""",1
f09aacd3-30d4-4c5f-b5b7-ae647095ada0,"Horrible. I just wanted to try it for one day, but for me to even try it that day, I had to put in my card info. After that day was over, I got really busy, so I never used it. I totally forgot about the app. But after a couple of weeks, I got charged $40+ after the free trial was done with no notice or update it. However, I found out that my bank updated me saying my card was charged +40 from this app. I tried reaching out to customer service, but I've never got a response.",1
67fc9ceb-1e50-4079-b29d-41b0b1dc3e25,"I signed up for this a month ago attempting to do the free trial. When doing it I got a pop up saying it would actually be cheaper which I thought was great. An hour later I saw that they charged me immediately instead of having a free trial like I signed up for. I submitted a request for a refund explaining what happened, got a quick reply asking for my order number, I provided it, they replied again saying that it was being processed. I have sent 2 follow up emails with no reply and no refund.",1
d6260a50-d941-4072-8bc9-63a2bab80e09,"Constant pop ups for paid content. I accidently pocket dial purchased a sub with google pay. Their contact form leads no where. I've submitted several support requests for help. No confirmation of receipt, no reply, no nothing. May as well mail a letter to them without an address lol. Really soured ny experience with an app I was just getting started with.",1
57e9d17d-0d8a-4ad6-bf99-9eef2df72835,"1000 offers, promo, sales, actions. Impossible to just use. Sooo annoying application :face_vomiting:",1
c709e1e2-234b-4165-a443-974ec2d45c7c,You need to pay for this app.,1
d1e954af-e761-41dd-b6a4-5d2795ff6345,I paid for what I thought would be a daily planner that I could easily edit and add/remove things to.. But it's essentially a glorified to do list.. Not user friendly.. I paid over $44 CAD for a year.. which showed up as *ENERJOY on my bank statement.. For what? The app gives you options for reminders but hasn't sent me a single notification once. I made sure all permissions were turned on for notifications. It hasn't worked and I will be requesting a refund. Do not waste your money!,1
4539e46c-e655-4330-9e87-f2bae8005ced,"I've been asking for a refund of a charge made to my account of $40 that I didn't want, I've reached out several times 2 weeks ago and only get the same auto response. Never got my money back",1
aaca58d1-bfdb-49d3-b045-3b67371176b9,Total scam. Money down the drain.,1
7720233c-e3c7-41d8-823f-ac313c72b316,fake,1
6f4ab67b-fa12-42ba-9f27-41236cae03f5,"So I've set several requests for a refund, as it's not set up as advertised, no reply back for almost a week. Horrible! I didn't want to purchase, I just wanted the trial, and it tricked me and charged me any way. Scam! I don't know how Google is allowing this.",1
27fa85e9-47ab-4d5b-a347-e8bbb9cc71cb,DO NOT USE THIS! I downloaded for the 7 day free trail and clicked year subscription so if I liked it I didn't have to go back and resubscribe. HOWEVER I did NOT get the free trail period. They changed me the full year immediately!! I contacted them less then 12 hours later for a refund (app was also not useful to me) Although they responded quickly with an automated response it has been over a month now and no resolution. And they no longer respond to emails. DON'T TRUST THIS APP! CRIMINALS!!!,1
4e87193e-61be-4e5c-ad8c-2d4530705ab7,"This app is useless. I have to remind myself to look at the app to check things off! I will just stick with Google task. There are no graphics, but at least the reminder alerts work, and that is what i really need.",1
bb6e0731-f625-4d02-990e-86f87ec36ab9,This piece if garbage keeps popping up in my duolingo ads. Hate it.,1
12eed5b0-f48b-4471-95bd-8fce88bb066f,Tried reaching out via email multiple times but no one responds,1
6d0afa9e-ef6e-4185-9d82-44f9fb9fb9ce,"Total scam, it's advertised as a 7 day trial if you go with the yearly subscription but it charged you directly without a trial period. The app is complex to add task but tracking and functionality are very basic in nature. Just a basic to do list. There is no customisation. They lead you on by pretending to ask a few questions about you, ask for your subscription then you got to make your own tasks. No real customised tasks based on your answer. Avoid app.",1
21b3b6bc-de7a-41f4-ad79-fd035f645246,Paid for it and immediately regretted it. Not easy to organize or change details on tasks. Super unhappy,1
384d41dc-d405-4ef7-8760-53c72ebce2a7,I tried free trial and didn't like it and was surprised that money was deducted,1
3daedd10-cbff-4993-b04a-3a93acab7e8b,I really do wish they say you have to pay before you download,1
4a2dc034-5bf5-4974-bf04-7dadca1e4260,"Picked out a plan that said it had a discount to it, they charge the full amount and won't give refunds. Don't waste you're time on this.",1
24cfc247-de15-4d9f-b795-61110f1ac94c,Can't edit tasks after I set them. No notifications. Can't make custom tasks and can't get it to work across two devices without paying again and manually adding tasks since you don't have an account. This was a total rip off. Don't waste your money.,1
fbcbc5ff-7156-47c6-8867-1365ca7ff01d,"It's basically a calendar. Nothing really sets up for you, no value to the app what so ever.",1
f93a0c7d-63eb-47b2-8f8e-a13dbda33c59,"Can't move past the page ""Do you relate to the statement below? "". There isn't an answer to choose. I cannot complete the startup questions. I have a Samsung z fold 4...I read someone with the same type of phone had the same issue. Update: when I closed my z fold 4 and opened the app...I was able to see the answer choices to the startup questions.",1
acf73216-40be-40e3-8f97-4c7eed9ae990,Said it would charge £1.66 per month as an introductory offer for 12 months then charged £28+ which is over £10 more. Don't trust a company that can't bill correctly,1
62905f82-d560-49bf-a290-5fadc77a1f31,You can only edit the tasks on the day the task are set for! So stupid,1
01cd5084-fcb0-4df5-9e14-2cb6681f7728,Fake. Just a stupid way to give people hope and then demotivating them more.,1
09ea2275-4513-43d0-b2e5-04d9ab8c930a,Pay in for a planner? 20$ for one month? No thanks.,1
967ce8ba-9f03-4551-bba0-22501132a0c1,I signed up for (what I thought) a free trial. Wasn't until I uninstalled not 20 minutes later that I find out I paid for the year plan. I feel scammed. I'm sure this app works for some but don't advertise a free 7 day trial and then charge me for the year. I should have read the reviews more carefully then maybe I would have avoided wasting money on an app that won't work for me. SAVE YOUR MONEY AND STAY AWAY FROM THIS APP!!!,1
efa5c4f6-207b-4713-acc8-c55959b32033,"Can't even use the app without subscribing to a free trial that turns into a paid plan. Also, ads right off the bat. Really? I have to subscribe and I'm still gonna be subjected to constant ads? No thanks. Also, a LOT of spelling errors that are unprofessional and hard to overlook, especially for something I'm going to be paying for.",1
ca4c8426-0604-49d8-a201-5c06c9740cf1,Please return my money back!!! I've sent you an email and no reply. I cancelled subscription 2 days later and I had time free days trial. And still you guys deducted from my card money!!! Need my money back. I haven't used your App even 1 day.,1
dd87ebec-0157-47da-91f0-f6756da885a9,Totally off putting once installed and opened. Constant bombardment to spend a ridiculous amount on a glorified to do list. Took far too long to even navigate past the sales pitch for premium. Didn't even get to any functionality before I'd had enough. Once I was hit with money grabbing waffle I checked the real reviews and they are terrible.,1
b64c881b-6d8c-4697-83f5-cdb5131e504f,"I downloaded this app and had to accept a 7 days trial to try it. I immediately understood it was not what I was looking for and tried to cancel the subscription before the end of the trial. I wrote twice on the app support and never got any answer. The subscription doesn't appear in the play store... I don't like the app but it's personal, but what I hate the most is the impossibility to reach someone. I hope it will be solve soon.",1
6b003c97-486c-4351-97c5-740b4265eeb1,very expensive,1
47124c4a-268f-45dc-b350-5e81d880c6a3,"Costs $20. You can download it to your phone and tablet, but the info won't transfer to either. It will only show up on one you entered it on. Unable to edit something you add. Makes you work on today only. Prefer to have money back, waste of money.",1
3d15edc3-3db5-4bd7-ab50-47a582d13389,Paid for fees. App doesn't work. No refund. :face_with_rolling_eyes:,1
7821a7c3-8387-4095-a990-7f40d407c07f,hadn't been on the app 1 minute before it's trying to get me to pay a subscription.,1
d9e5f5bb-9d3b-4ada-a005-9c4998f83c82,Very bad,1
718e5c3d-74a6-4139-8049-77a35b954e4b,Tried for a few days. Took my personality info and will not load any further,1
af221145-a5e7-4c71-96b6-cca70765fe92,just opened Let's see the performance of this app without premium,1
089c243a-d637-4b05-bfd5-48361838f366,"I honestly hate when you start using an app and after a whole song and dance, the ""now you pay thing"" pops up. You pay for this app. Is it so hard to just advertise it as such? It looks awesome, but I am not paying that much money after trialing it for just a week.",1
90f9ef69-412f-4999-81f4-b9504c3d7149,Worst app for habit building as it doesn't provide notifications on my phone... don't waste your money,1
ee8ba2b7-3007-44d1-962a-83134b2c6d64,Needs money [̲̅$̲̅(̲̅ιοο̲̅)̲̅$̲̅] for nothing,1
bd087dd7-5872-4a7b-bad1-40cff9301e35,You have to pay to play,1
826b9de3-0460-4695-9237-d269ed334de1,"not free, have to pay",1
ff48b062-20ae-4475-b431-c15f97949f08,"It's a SCAM! They give no free trial and charge right away! I signed up for afree trial, but they charged me right away. I messaged to the support, they said they would issue the refund but I haven't received it. It's been 3 weeks! I keep messaging them but they are ghosting me. I get no response at all anymore. Really really disappointed. DON'T GET THIS APP EVER!",1
b5948269-43c7-42e0-b97a-c451d9ffd9db,Wow you can PAY this app to get better. No money. Wow. So helpful of an app just to tell you could do stuff if you PAY them,1
24d059cd-97e3-4c3b-8961-713151469ad4,Literally I can't see a thing. The screen is mostly white and the letters are white too... In the settings there's no option in changing appearance. Pitty...,1
2e613e4b-faa7-4a2e-b151-54e459d0bfde,"I saw this app on a Facebook ad that showed a really awesome decluttering plan that set up tasks one weekly. Then as everyone else said, as soon as they offer the discount, the 7 day trial is gone. Once I actually got into the app, that awesome decluttering planner is nowhere to be found. What a waste. It honestly makes me curious at why this app has such a high rating when all the comments are about how limited the app actually is...",1
8b7301f4-2b3e-4060-8963-c7a5c0356f38,WARNING DO NOT INSTALL....they charge your account right away. Requested a refund as soon as I seen the charge and can't get a refund. 7 day trial is not the case with this app.,1
57f5e3eb-3707-4670-9255-2354bcf7b23b,Glorified pintrest board. Not like ads,1
e26d3e44-5bc2-4f10-9d40-ea40528c81fa,SCAM!!! STAY AWAY FROM THIS APP!!! they charge your credit card but doesn't appear on the Google play recept and subscription canceled and till charges your credit card.,1
0e987139-6fa3-49ee-a7f5-0e25c7cd67e4,"Difficult to alter and remove tasks. Even when you set reminders, the app doesn't give you any kind of reminder. A waste of money.",1
b91021df-af4d-433e-b319-fa3942c09649,"Vraiment déçue par cette application. J'ai fait l'erreur, et comme beaucoup de monde au vue des commentaires, de prendre tout de suite l'abonnement à l'année qui était peu cher (21.99€) avant même d'avoir testé l'app. Les fonctionnalités avaient l'air vraiment biens et je me suis laissée tenter. Malheureusement très déçue par la partie routine, où il est tout simplement impossible d'organiser quoi que se soit. Les tâches ne bougent pas et tout est en désordre. Je regrette sincèrement.",1
32776fb4-b814-4eea-8c54-a85c564239c2,Im not paying,1
8161f849-ad5b-4daa-b2c0-aafa8549ea8f,It asked you a lot of questions first then when you get to this thing you have to pay money every month and I told my friend and she was like I hate apps like this which I agree with her. So I wouldn't really download this game. Have a good day :smiling_face_with_smiling_eyes:.,1
3ae35200-76e9-403a-936b-ae06d3017859,I just downloaded the App. Says 7 day free trial to cancel before. I was charged today for the App. Tried to cancel it and it won't let me shows $21.34 to my account and it hasn't even been 6 hours. I requested a refund. I assume this is how you make your money by cheating people. I should have read the reviews first.,1
f2e2493f-ce66-4e46-94e4-a9f02ee5c8c2,Don't bother! I fell foul of the 'once you pay you lose the free trial' scam! This is a glorified to-do list. I manages to get a refund via Google Play,1
3b201133-6c1e-46a3-af8e-4f60b04b0627,They fraudulently charged my card last night.,1
0d6022cc-2599-428c-b6af-1192a6a905cb,"No refund, they don't even reply back. Be very careful immediately got charged eventho my try out period wasn't over yet.",1
5b28c9a9-0902-4429-91d5-3e43f8448c7a,"Can't open the app without it screaming at me about some deal on the premium price. What's worse is that the daily reminders I set don't actually work - the entire reason I tried this app. If it's a permissions issue, the app should be asking me to change the permissions.",1
859c0d85-fc2e-465c-8b9c-ab7af5967313,Suppose to have a seven day trail However to even try it you have to subscribe and despite canceling an hour later( once looking through it wouldn't help me) I was charged,1
2de2a3d6-b5b2-485a-96ca-f8761da607ad,Reminders do not work and I have tried to go through every possible setting on my phone. I paid $20 for a subscription that does not work and I can't get a refund. Beware.,1
dd80d483-507e-44d7-8d15-40f28c2b5ec7,"I signed up for it, did the trial, and canceled within a few days due to it not fitting my needs. However they still charged my card, despite canceling in Google play store and emailing company.",1
331b357b-bdc2-491b-addf-09aefc0abd28,Advertising in paid app is a nuisance.,1
b2303310-92f0-4336-b743-c3830fa06ea6,"There's so many issues on android. I can't order the tasks correctly (drag and drop doesn't work), and sometimes I'll create a task and it disappears, but I can't recreate it because it says it already exists. The tasks are also ordered randomly and moves to the bottom when it's completed, it's terrible for my ADHD brain because there's no predictable order of my lists and it keeps changing as you add more tasks!! When you open up your to do, it's a total mess and looks different everyday.",1
c1b5bee1-b526-4cd6-aeab-1383a3feda98,Not working in dark mode devices,1
a69ef50f-3c9e-44e3-ab97-574d73be6321,Don't install! I wanted to cancel my subscription after the 7day free trial because I think the prices are too high for the purposes of the app. I couldn't find the app under subscriptions on my Google play and when trying twice to contact the support they didn't respond. I had to contact Google support to get help with the cancellation.,1
08199a20-d8d6-4b29-b3bc-a8b85257640f,"why do i have to pay for every single thing? there are not even free stuff , so disappointing i was excited to use the app",1
a0a9d028-dc95-43ff-8b78-42ab53abe075,Notifications are not working and I paid for this stupid app at once :person_facepalming::person_facepalming:,1
63bc167e-9d84-4036-81d0-cf924b8491af,"PAY ATTENTION TO ALL THE RECENT 1-STAR REVIEWS I subscribed thinking an annual subscription came with a 7-day trial like they advertised in the app. It didn't apparently. I don't like the app. It is very buggy and doesn't send notifications. I requested a refund four days ago through the developers website and haven't heard back. The app also advertises that it is ""free"" and has ""in-app purchases"" but you can only use the app if you purchase a subscription.",1
9c130d4b-2cfc-4116-bc33-e4cfbb2a0a3b,"The app doesn't give notifications. Contacted customer support and 3 days later, still no response. Don't bother with this app.",1
abf18234-18a8-47ff-9eec-08440dddc11e,pay to be organized is not my path way..,1
cb44080a-a04e-4d5b-930c-91cc625e54b6,No notifications,1
7300970b-1726-4b10-8313-a6720db7071b,The text it's there. only pictures. Is this supposed to be this way?,1
a53bcc66-33ee-48c6-b054-74e278ba683e,Does not give you the option to cancel in the app. Gives instructions on how to cancel through Google Play but the instructions don't work. Still waiting to hear back after messaging them asking for them to cancel my subscription.,1
385b24cf-ee15-4aba-b3c2-0647d219c499,It is the waste of time it ask you about 20 questins and when you answer it ... It ask you about money ...... Please dont install it . It is the waste of phone charging ... Hate this app:face_with_symbols_on_mouth::face_with_symbols_on_mouth::face_with_symbols_on_mouth:,1
e6ee486f-1c9e-4c4f-89b9-0330cbc5e8f7,DO NOT USE THIS APP. It's not what is advertised. It's a basic planning app which offers no support for people with ADHD. Offers an immediate reduced subscription which ignores the 7 day free trial period so you will get charged regardless if you accept that option. Total disgusted with this.,1
40eb05e0-549b-440e-a04d-4adbe65fe836,Do NOT DO it! charged for year 1st day in trial .. scammed!,1
964053ba-1b86-468f-ad9e-38a099174e4c,They took a full year subscription before I started my 7 day free trial. Idk how to get my money back I unsubscribed after the first day,1
acda27e5-05fd-4b6f-ba2e-0f0d55e83639,Trash. I wish I would have done the 7 day trial instead of clicking on a year subscription. So dumb.,1
61f89839-0598-4439-b430-59bb34e887bd,Uninstalled after 10 minutes. They tried to trick me into clicking on one of their offers... about 10 times in those 10 minutes. Nope. Either let me try it or don't. I didn't accomplish anything at all. Moving on,1
7dd366b1-3248-492e-853d-6364d476b04f,Doesn't work good,1
642a0817-bde6-453f-b4b6-f03223429e57,"Waste of money, I saw 4.8 rating and jumped in to pay $30 for a year. I have been trying to use this app for a few days, and it doesn't make sense. I can't change the plan or task ahead for the next day. The Help & tips section has only 3 simple tasks that people can just figured it out easy. Instead of being a useful app, this app makes my day worse. I submitted a request for a refund, but I have never heard anything back.",1
7c8533b4-8de2-4266-aa0e-cba60bc6037d,Doesn't notify you of anything. So you set a schedule and have to go in there and read what you put. Doesn't even show times you had put it for when adding it to calendar. Pretty pointless app,1
11d3a2e3-7001-4b4a-9e92-eae4ada007ac,so excited to try this app out,1
00612865-2415-4d53-84ff-801341bfa0a3,PLEASE READ. They Charged me for a yearly subscription (€45.99) that I didn't subscribe to.,1
221c2d24-26e1-42b1-81d7-e06706776b5f,It did not give me my 7 day free trial and charged my card I would like a refund please,1
e7133385-16c0-4f5c-bdc3-a0d53bb2ec1d,Please check for my refund follow up. Was very sad to hear automatically deducted the 1 year payment from g cash account. Hope for a result from your company. Please see my email.,1
f79102de-005b-40d3-824e-a09bcd45dbde,:beaming_face_with_smiling_eyes::beaming_face_with_smiling_eyes:,1
07c8fd2b-ce8d-422a-b7f7-a5600b14a99b,Thanks I almost kill my self:pager:,1
3c1b05fe-4737-4110-a214-12d77d68aa38,Hard to use. Accidentally paid for year instead of getting 7 day trial.,1
f9efb0f9-1c70-4eb6-a8e5-1f2edb63932b,Asked me a bunch of questions then said it's a paid app. Wasted my time. :angry_face:,1
ec3c7a15-3f56-480a-94bb-86d148970159,Predatory like all the other self help apps. Can't just make a good product with one time purchase can you?,1
5ef3b724-ecef-4e33-919e-2152c2657153,It cost money i dont have,1
6daad59e-ea5e-46b8-819b-f176ff02b5a4,It said 7 day free trial but billed me immediately and when I tried to unsubscribe after only a couple hours it still charged me,1
ff96f387-fbfa-40ab-9bc7-41f289cd38dc,"Useless waste of money. It markets itself as something more than just a basic to do list, with focus on getting your life and happiness in order. It's just a basic to do list, with some ridiculous options for routines, which I already can do with a pen and paper. It recommends routines which are all labeled ""TikTok Influencer"" or something equally out of touch. It wouldn't let me select the free trial and said it declined my ""charge"", but it did take my money when I selected a year. Scam.",1
601ea64d-ceea-49a5-8593-2498aa87774f,"Feels like a scam. After I answered a few questions it asked for my fingerprint as a ""contract"" that I was going to make changes in my life. Did they just steal my fingerprint and can they use that against me? I uninstalled right after that because as soon as I did the fingerprint (should have run away before then) it came up with a page to setup a payment plan. I'll be watching my bank accounts and will dispute any charges. I did NOT authorize any charges.",1
