reviewId,content,sentimentScore
a1c768e0-9b1a-4adb-bc5f-53bfce15997c,"It says a week trial. But u all charged me for a year. Why is that? And i only used it for 3 days just to test the apps 1st. This app is cool with the motivations, task tracking and all. But to charged directly even i unsubscribe before a week trial is so unfair. U stole those ""a week trial privilages"" from your customer. And stop asking us to contact your admin when u suppose to fix this and be honest with your apps.",1
d66c4a0a-fed4-4ef8-96cf-454d127aed5c,"I need to contact with client services to help get my money back, i made a mistake please",1
1fa30fa1-44d3-41e5-b042-efd5400e9fc0,"Bloated, impossible to do simple things without being bombarded with payment plans and prompts",1
130ccfd4-e69b-4847-a27e-05e29c1f6111,It automatically charged my card $21.86 when there was supposed to be a free trial for a week screw that.,1
d707d101-e4fb-4514-802a-1de17d6be2ee,The app harass you constantly to buy buy buy buy buy their yearly plan. It doesn't have a dark mode. So many free resources available online makes this app a scam. Do not pay for greedy overpriced content. Collects your personal information and sells it to 3rd parties. So many fake reviews.,1
788a12cf-d761-4d12-8c84-a5bc5c03a4c6,I don t wish to put my finger print into your app,1
83503cdf-bc6e-423a-9b66-c989bcb593e6,Has you do a 15 minute questionare before asking you for card details. Deleted straight away,1
7ca783e3-14ed-49b8-9529-c19a5a073878,"Same situation from other user. I only wanted to test if it really works for me, I tried to subscribe 7days trial but after hitting subscribe, it charges me right away? Misleading info. It says after trial will charge. How can I process my refund?",1
fd9bfa9f-ca81-4cf1-876c-b8b254db4b21,I've only been able to ad 2 tasks. Every other combo I've tried to utilize on this app but it has not worked and I paid a significant amount of money on this app for it to work :pensive_face:,1
6ab9ec7f-cd8b-4dda-8f47-c6f78ddb72cf,Not possible to review of previous week/months. No analysis of tasks done.,1
20c1a6dc-6ccd-41f7-b3cb-4069efc9ef44,"They want you to subscribe (and rate!) essentially without trying the app. Tons of redirects to subscribe. Lists look silly, like ""influencer to do list""... Really? And the other ""self care lists"" are as cliche as it gets. Nothing new, just a money grab.",1
6b0724e3-b28a-44f6-832f-93b51ecc3bb1,DONT TRUST THE 7 DAYS TRIAL!!!!!!! I used the app for about 15 minutes and decided the app is not for me and now I cannot cancel it anymore and had to pay the full year,1
8464ab9a-3870-4ceb-9706-5f3aa5207f10,One million questions before starting app. Really :disappointed_face:,1
930f2bba-923c-4c8e-9f3a-89579a17d458,"DO NOT USE THIS APP. Their trial charges you for the year subscription and does not allow you to get a refund through the app. Unlike other apps they give you free trial, this app charges you and no option of cancelling subscription within 7 days (which is standard with a lot of apps). I was able to get a refund by notifying Google apps, you have to do within 24 hours to get a refund.",1
389dd324-6124-4834-9621-28b3097abc35,"Insane amount of ads, how the hell am I supposed to be productive if I can't even CREATE a to-do list without watching 10 minutes of ads? So many better apps out there, honestly even a pen and paper is better. Do not recommend.",1
3caa7555-c5a1-49b3-a6d3-1859bba03bd5,The app gets stuck while completing initial profile questions. I contacted app creator. Nothing fixed.,1
b8d9b323-6ff5-46f3-a8bd-5da7165dbefc,This is a really bad app and a scam. They say you have a trial period but charge you immediately. It's literally just a calender and nothing more. Plain old google calendar has much more features than this. I'm convinced most of these positive reviews are made by bots.,1
8bd36c73-3242-445e-9d10-ecce52736f8f,"I purchased this because it showed that it would give reminders. I set the reminders by hand, put the exact times on when I wanted to do things, and I received absolutely nothing! So far, this is a waste of money.",1
1a2daabc-286e-44e1-932f-1c9a52eae66f,Worst app . It does not give any personalized regimen,1
77748943-0f1f-4459-9546-e705fb55ec60,You have to pay for a subscription if you actually want any of the perks for this app.,1
f9a16456-bc13-43e0-a25e-e04f7ea2e565,"Don't waste your money. I have used it for the last 4 days and have only 1 day where it gave me reminders. I set all the tasks up the same and had them repeat daily with reminders turned on. First 2 days, I had to remind myself, 3 rd day, all reminders went off and then today back to nothing.",1
e0deaffd-c167-4dbd-9cf5-4175c36fb6c4,"WILL NEVER USE AGAIN! Scam. Minimal Utility. All about TikTok ""Influencers"". Nothing to do w/ legitimate wellness. Subscription too expensive for what is offered. Barely functional as a planner. Doing those cute little ""quizzes/tests"" are incredibly inaccurate; did the abuse/PTSD one & said I was fine when I've been clinically diagnosed with severe PTSD from various forms of abuse. Google Play isnt letting me write the actual review part, just this ""title,"" so trying to warn you as best I can.",1
b507dc72-ce8b-41d7-989d-ca98edb366c3,"Waste of time. I installed it as advertisement stated FREE, did NOT say free TRIAL for 7 days, I despise false advertising. I'm not spending money where I feel it's not long enough to give me an idea of what I'll be getting myself in to, 7 days is not enough. Plus, the questionnaire at the beginning with a slam in the face of ""purchase"" is really off putting, so uninstallng without the 7 days, I don't feel it's worth it, especially at the price.",1
15ef1ab5-a3a7-4e73-ac70-a07433810699,"If you cancel your subscription and want your money back (even if you do it the same day the subscription was created), you have to know THEY WON'T TAKE RESPONSIBILITY AT ALL. I subscribed and like 20 minutes after I cancelled and requested a refund (i wanted to try the app first) I reached out by email like twice and they simply stop responding and don't proceed with the refund. This was a big waste of money because now I don't even want to try the app, and I feel robbed. Don't recommend.",1
6b6486dc-ffc2-4cd2-a56d-8bb7f8e64eb6,go ood,1
a1acc25c-30b7-4ad1-a8fe-b403b570e53e,You cannot reorder your sub tasks and every time you edit them it reorders them so even if you put them in the right order to begin with OR say realized that it was being stupid and then spent 45 minutes redoing the entire thing to Perfection and then you edit one minor tiny thing and it's all broken and out of order,1
d94b4d56-49ca-48e7-9930-7fc58a992de4,"Why isn't anything free.... like ever? This app is supposed to help improve your life but then now, you've gotta worry about the cost of using it. As if we haven't got enough bills to worry about these days. No thanks. I'll find something else.",1
f9d04eee-501a-4ed2-a5f2-466809d858c5,Overall not satisfied. Don't waste your time or money,1
6a91d9f5-351d-45ff-845f-2d5435709ee8,BEWARE! Doesn't notify You. Checked my phone settings and it doesn't work still.. cant believe how many people downloaded it. They must have a lot of money to advertise this product hence probably why,1
e6052457-ceaf-4460-9c66-4c3ee77cc54a,It was free to install. Took me through all the prompts. Then wanted to pay. Just 7 day free trial. Also wanted a signature never put the real one out there to be forged.,1
9342c6d6-779f-4447-ae24-11b525d50c46,"Don't waste your money. This app was advertised as having pre-made schedules and says it is scientifically based. The few schedules that would apply to me were very basic 10 tasks or less total. There is an overabundance of tik tok, influencer schedules which are meaningless to me. Not sure why they say scientifically proven as there is nothing that indicates any relationship to a scientific based schedule. Less than 10 hours and looking how to get my money back.",1
dcb42887-389b-4c93-82a8-43de77592f09,Why isn't this darn app sending notifications. Like that just looses it's whole purpose,1
9b3b4fd2-febc-4ae6-8bd8-551cc7f600b6,Do we pay for this app?,1
5bd6ac4e-b65f-45d3-83ca-29439e55549d,"This is an app that said it was free but charged my bankcard though it promised 7 days free. Talk about false advertising, my advice is to stay away from this app :face_with_symbols_on_mouth: because it's false lead in .",1
e3d42a12-4175-4ec6-8908-56831df66415,Why is every app in place of helping stressed students trying to get money as much as possible... Is there any good app that can really help me without getting my pocket money off... !??,1
0277b5d3-a318-4b00-bb31-f1cd612a5353,How do I cancel.,1
5a9fd368-ffa6-456f-a0da-8ccfa1728253,"I read some reviews, and one caught my attention. same problem as mine. i was just trying for a 7days trial and it charged me for a year! I unsubscribed already but no refund. Please do something about it",1
30122893-8810-4d11-8fc6-533677c12e2f,Signed up for 7 day free trial and was billed right away! Canceled and was informed no refund. This app is just a list maker. Nothing special. We can do this in our daily calendar or on paper. Return the money you took in the 1st day of free trial!,1
5d864c1a-3a52-4823-ae39-7280df1b0b07,stop making us pay it should be free,1
c499d0c2-c5a5-4a12-9e2e-b3dd821ea0fb,In app purchases is misleading. You can't use the app without paying a subscription of $12 a month or $30+ a year. All you get us a questionnaire you fill out about yourself..then says it's perfect for you.. now pay $$$ if you want to see beyond the app trailer. This should not be in free app category!!!!!!! Even if they gave a free trial to try at least.,1
8590205c-0e91-492d-9316-011e72b0f749,Many typos I noticed. Becuase of thatI do not trust this app. Please refund my subscription. I have sent you inquiry about that through your app. I will delete once you have confirmed account deletion and refund. Thank you.,1
e7c4128e-ada9-40a3-b243-27764e466a19,I don't have money,1
97b2092c-a4a6-4439-b123-543e4aabd09f,"I wish I'd done the free trial before paying for a year subscription. I falsely assumed that paying for a sub would offer pre-made lists for household cleaning tasks and basic self care reminders. Instead I found lists of ""influencer"" days and unrealistic cleaning schedules that were VERY difficult to edit. I knew within 10 minutes that I would never be using this app again and canceled my subscription. I haven't bothered asking for a refund based on other reviews.",1
415a6f59-6e4e-43ed-82d9-a548052c8a53,"SCAM! They offer nothing more than pre-maid to-do lists and DO NOT HONOR THEIR FREE TRIAL PERIOD. Instead, they will charge you the full amount at the time of signing up for a free trial and WILL NOT OFFER A REFUND if you cancel subscription within the free trial period. Be aware!!",1
b65981e5-0cfd-4e62-ac95-b2fb9e0735d0,"DONT DOWNLOAD THIS APP. ..WASTE OF TIME. Not happy at all.....DONT DOWNLOAD IT. It looks fantastic on all the adds but sheesh its just terrible. You can do a better job using a notepad and pen. Now im going to use ""Fabulous"" ...its full of so many better things. It also takes money from you before the 7 day trial has happened. SCAMMERS!!!.",1
1482f9d6-08dc-4c52-84f5-7894700ebd91,I downloaded this app to try it out during the free trial period and like many others in the review section was charged for a yearly subscription that I did not sign up for. Have emailed to try and get a refund and as yet have no heard anything back.,1
b965cf65-f6e6-4174-bb50-b606e3578680,Trash app asked me to do a bunch of useless customization just to try out the app. Who thought this was a good idea for for an app that target ADHD people. Looks nice though. And no I'm not interested in paying or rating the app when it's the first time that I opened the app and haven't even gottent to know what the apps do yet. Braindead,1
1628c001-09fa-449b-9a80-e18a0c45cdec,"7 day trial, yet I was charged right away. I haven’t even been able to set up a schedule and y'all already took my money. :face_with_symbols_on_mouth:",1
a5445894-ce88-496b-9741-42852ed354c5,You can't make numerous tasks without paying or watching a million ads.,1
56a68fce-2c45-4d4c-b5da-34121952603e,Conned out of £18.99 stated 7 days free trial unsubscribe any time!! Lies!! I cancelled immediately I saw how useless it was going to be for me but NO refund given!! Avoid!!,1
c7eb9e7f-e6ae-4815-8856-04f8e5640e19,"Filled in all my info, only to be offered a seven day free trial. No thanks.",1
9e4c9f25-fe39-47ec-96a0-0dedd878eea7,U have to pay,1
17c09507-290f-4568-81fd-9297e57233ac,":collision:AVOID LIKE THE PLAGUE:collision: The app looked good and I subbed thinking it would be of some use. It is extremely basic and provides very low value for money. For instance, there isn't even a widget and the notifications rarely work. I find it hard to believe that so many have downloaded this app. I have heard of apps using review / download farms to increase their stats. If you intentionally subscribe, Google only gives you 2 hours to unsub and get your money back (I thought I had more time).",1
27a1d407-1595-4afd-9938-e4dfebfd8fd4,круто,1
a3143264-a7f5-43a0-adf4-e39f81f8641b,I was trying to set this up and one of the pages would not let me continue...waste of time,1
f8acd2ec-9a2e-4f4e-9c61-fdb82e4434be,"You don't have to pay for a subscription, but once you make two daily tasks, it asks for you to pay or watch a bunch of videos every time. It's not worth it. Just write it in your phone notes, lol.",1
db9f3c1a-42fd-41bb-8a1c-fd8ba8a91347,Not working for foldable devices. Hidden subscription in the app after long answering.,1
a7176190-8ae9-4863-8813-8f1ded0bec58,This is the first time using the app. Will get back to rate it after a couple of months.,1
2b806b12-82e0-4a26-b0f3-7d9355fa2a23,Too expensive. Doesn't buy. Most of us with ADHD aren't great with money and don't have it in the first place. :confused_face:,1
c5dc076b-8c28-4b7e-8a5a-804b044a51cb,"I hate that a subscription was charged to my PayPal under the name of Google payment. I unsubscribed and removed the app, yet it is still charging me monthly since September. How do I cancel this and remove it for good? I would prefer to give 0 start rating!!!",1
1db462c7-87e1-49c9-b968-f7b514bd17a8,"Unreliable app and no way to cancel the trial without emailing, they finally canceled my subscription bur refuse to refund",1
bb99c48c-6c9b-49f8-9396-67798735618c,Was charged full amount on the first day of 7 day trial. I have been trying to get a refund all morning but all I get is an automated message saying I need to provide information of payment. Which I have provided. It is infuriating. :face_with_symbols_on_mouth:,1
c86b2bde-18f9-475b-a9c0-b3cd5a89b0e5,You can't click 3 buttons without am ad coming up. Trial requires a credit card. The app wastes your time advertising itself and others instead of just letting you try it for even a few minutes. If they believed in the product they wouldn't try so hard upfront or hide the actual software behind ads and set up screens.,1
e27c512d-d747-4516-809c-08768dd5a214,:face_blowing_a_kiss::face_blowing_a_kiss: j,1
43f33ab9-0fbd-419a-9986-d6002be37a02,Awful it said free trial then charged my card I would have never bought it not what I wanted,1
69accca6-9f95-41a9-b108-2a28f900e53a,Doesn't work. Can't figure out how to cancel.,1
be930f57-d9ee-41b3-bb70-f1c8cdc9b1a0,"Misleading ads. Mentioned that 7-day free trial, but they charged me already for the whole year! Canceled my subscription from the 1st hour of trial as I don't like it. But the payment wasn't refunded. Please refund. It's been 3 days since I subscribed and canceled it.",1
93b9a14f-60a9-446b-9fcb-6d7aa78d8828,Scam,1
22618cf5-db28-4c80-b06c-453ce56f8999,no free trial,1
e08a50ed-d6c7-41e7-b8f0-986a6b04cfdb,"Desde que la instalé, solo pedirme que me suscribiera aprovechando una promoción, y no me dejaba hacer anda más. Solo les interesaba que uno pagara, así que mejor la desinstalé. Y unos días después me estaban haciendo el cobro de la suscripción si haer acpetado nunca. Es un robo al descaro",1
28432303-2c41-44ca-8beb-2faeb5739fd8,Very limited access unless you pay for the premium version.,1
429f14f6-9b60-475c-b13a-57364d10bea5,"Paid for the app, and so not worth it... pay money to make basic lists and try to aspire to be a ""tiktok influencer""? Yuck. Some people are real humans and not obsessed with being internet famous. Waste of money I didn't really have to begin with.",1
415c8652-10e0-41a0-a7cc-68c6322d0866,"I bought a new phone two weeks ago. I was a month into my yearly subscription. Me+ did not transfer to my new phone. I installed it again. There is absolutely no place to ""log in."" ""Join"" is the only option. I did exactly what their responses were after I reached out to them. I keep getting the same cookie cutter response. I have missed important appointments, and my life is once again disorganized!",1
313552b7-8963-41e9-a571-8b992801a42c,They make you watch ADs for everything. Do not download.,1
da09616a-5f31-41fd-8517-b0fd8d4c6411,Terrible ....l paid in full before free trial and l find the app so stinking confusing...l can't even input a single day agenda! How can l cancel? I will be protesting with my cc company. Patricia now my review won't post!!! All the circle does is spin and spin... This whole site stinks.,1
a6da2083-28f7-48b0-b5fc-62f1a9bcb407,"This app does not allow you to set tasks for longer than 3 hrs, it seems. I'm a nurse and want to set my work day from 9am to 5pm, but it only lets me set it from 9-11am. That's just one thing I hate about it. I wish I could get my money back. This app seems more of an aesthetic type app for people who don't have important schedules. Do not recommend at all.",1
0fd5e14c-9e5b-40d9-9548-7af02a665aff,It's a trap it is impossible to cancel the subscription.,1
8d20b95f-7707-4e6f-85b6-9ef27bf0ac55,They deleted everything I wrote after I saved it,1
c4e9496b-7ec5-41a1-b6d9-bb9424070112,"So disappointed. Bought one year subscription and had an unexpected issue with my phone that required multiple replacements. Lo and behold when I attempted to log back in I found that my subscription expires if uninstalled! Hidden deep within the redeem page on the app. Ironically though, my subscription is still active in the Play store and ""renews"" in November. With no way to log in, I see no way to continue my subscription. Biggest waste of money ever.",1
a55fe217-a5f6-40e2-b935-a8541316b4ad,Not receiving alerts on time,1
bf8ab9cf-551d-4404-a352-b9433f84a8a6,Awful!!!! Got charges $65 during the trial period. Now the bank wants proof that I cancelled!! How can I prove when I was charged during the 'trial' period!!!!!!,1
2779931e-f653-49d1-83a5-4969de60cc4a,I was supposed to get a free week before they charged me. I canceled ahead of time. (4 days in.) I could not get refunded. Doesn't make sense. Now I'm stuck with it.,1
329ead9a-5b28-4194-b6ce-cf1dd550db59,I wish I had read the reviews before as I've had the same issue. Wanted to use the 7 day free trial and it's charged me for the year and now overdrawn (downloaded todah) Can't see how to get a refund on this - fuming! Never had this issue before with an app and I've used the free trial period many a time. Even if I like the app this experience has put my right off!,1
0a217e24-1eed-4ada-a09c-ec7f6664464e,I want to use this App so badly but it won't accept that I'm in the UK! Is this correct? Says its not supported in my region,1
ab9c08d9-b0dd-4bbf-9387-7039e001a203,"Notifications don't work , that was the only reason I even wanted the app , I paid for something that doesn't even work",1
4ae5ed78-5a6e-4fb6-8991-435b4b876c3f,glorified to-do-list where you can't even edit the start date of the habits etc etc. definitely not worth the money!,1
d3e25348-bdf2-440c-944c-258dccb62ad0,"This app was really useful. Easy to restructure your tasks, set up reminders, enter subtasks (affirmations). It has a daily goal tracker and visualization star/moid chart that kept me feeling motivated. Why 1 star, you might ask? I had to restore my Android from a backup. The app doesn't back up your tasks, and the great coaching tutorial you go through doesn't actually establish an actual profile so months of creating the perfect routine are gone. Not worth the time/effort is starting over",1
f82ad51a-e515-48e5-a9b6-6ff036147746,"It isn't what I expected AFTER I installed it and paid for it. Now I don't want it and want my $ back. Emailed customer service, but no reply yet. I'm going to have to go through my credit card company now. Extremely sorry and disappointed.",1
67321a20-bc9e-4906-9693-df07a831744a,"It's terrible, paid version slightly better, but still not worth it",1
38ac9596-7629-4fce-9282-9c205359edc4,Immediately demanding money,1
e0906b2c-db67-4172-9211-17cc848d9999,Really lame app. And was meant have a 7 day trial but was charged straight away never have had that happen at the beginning of a trial before. I hope they refund my money,1
9f9b64ea-c170-44b7-a19a-c9d992cb2b4c,I JUST started using Me+. I will return in a week to say how I like it.....or not like it.,1
2aa037ea-6d6a-424d-be75-585e5442408c,I should have to pay for it... this should just be hey I got just the thing for you...,1
bb647634-d404-41ba-885d-99cda643b73b,"It's only Pinterest-basic lists, and not even good ones. Use it for a couple days before making a fast purchase like I did. Refund request didn't even go though. Edit: so, I emailed per their request below, and they haven't answered for almost a month. It's not even a real email. That's thievery.",1
f99b2473-e96b-4f6a-933f-a6bafd3723ba,"I downloaded this app, thinking I needed to try something about my lifestyle. I paid $20/year to get the ads to go away. I thought it was worth it. It wasn't. I wasn't getting notifications at all. I reset my phone, cleared the cache, and then did the NUCLEAR option to uninstall and reinstall the app. BAD IDEA. If you pay right now, delete this app your 'account' on the app will be gone. Such a bad flaw in an app ever. Please get accounts linked with emails. What a disaster waiting to happen.",1
c381386a-15c5-42b4-8140-845e677b6932,"Do NOT buy, not even near as good as advertised. No monthly payments are available, takes you straight to annual payment.",1
20faaaaa-3e54-4d44-b6ac-2b7d11820934,I want my money back. It's literally just a calendar and some vague misspelled lists,1
20c2697e-9583-46fc-ae31-e739993f273a,Comes up as free but you have to pay for a subscription to use. Absolutely not.,1
b95663f2-7d56-4f7b-a175-1b1dba779e09,"Downloaded this app to see if it'd help me get into a routine, tried to do a 7 day free trial & get a feel of it, charged me for the year & can't get it refunded. Used the app for about 10 minutes total & decided it wasn't for me. If you're signing up for the free trial, make sure you don't put a backup payment option or it'll just charge you right away. :) App wasn't very user friendly, added a workout plan, only half the words came over & can't remove it for some reason. I wouldn't reccomend.",1
f08b1fb7-270b-4f97-b708-dc9662cb5263,Couldn't do free trial as rudely intruded by the stupid deal wasted time just doing the questions thanks for nothing,1
aad1cd2a-34dd-43fb-b7f1-2f6e0e5c64ad,This app is not what I was hoping for and are deceiving users into thinking that you get 1 month free for their Premium edition. Not happy at all.,1
5aa9d046-754a-40c0-88a4-87637134fc72,Never sends notifications. I've checked permissions and contacted support with no response.,1
e63c88b4-bc7a-465d-a551-8ac176fbe6f3,"I normally read reviews before installing and wish I'd done this time! Installed the 7 day free trial. Opened app & answered some basic questions expecting to be given a range of plans to suit... Nope. Looked at others ideas in the community, chose one, worked out how to edit it (there are NO tutorials), tried to add it to my planner so I could test it for the week but it would not let me do so without making a payment starting today! Rip-off. Uninstalled. How is this a 4.9 out of 5! Scammers",1
1fc22010-d65d-4711-b2ac-9994e27ebcd4,How do I get a refund? I paid for the discounted year subscription and it seemed like a waste almost immediately. Nothing like I expected and really disappointed.,1
50e23021-9da0-4269-a2ca-656d88fa5f66,It sucks so not buy it,1
ccf60473-4e80-46e6-9628-015a3aac8e57,I have this app and I wanted to do the trial and it forced me to get a yearly subscription. £18.99. I'm not happy at all. Also I found the sub tasks don't work. I am looking for a refund.,1
d2751917-9326-4497-9f8d-ae7712bd246f,I did not even subscribe for the app but it charged me £0 first then suddenly £37 is leaving my account. I want a full refund and have reported the issue . I was so surprised at this and disappointed too. To my amusement everyone else thinks along the same lines in the reviews but you still have the app in the play store . So please may you kindly refund me and do away with this scam . I'm extremely disappointed and I never even used the app. What an incident . refund me.,1
de50ebab-ef67-4423-a443-22ab60e20e31,"Nothing like adverts, a lot of work to set up, no templates that are useful in real world. The 7 day free trial doesn't exist they take full payment and no option to cancel before being charged. Very disappointed",1
c6be54d2-846a-4db5-a4c0-dde29a46bebe,every single routine plan is paid. no chance/option for free users to experience if these plans do work and develop better routines themselves. I'd rather have a chance to look if i see improvements in myself before paying rather than have to pay upfront right away and not see any results.,1
78e9f4f5-0f06-4e07-bab5-4fa44085f8e0,"Lasted 2 mins, and I deleted. No free trial. Want to grab your money instantly",1
