reviewId,content,sentimentScore
3436ca22-4556-49ef-9e63-77cd187f6b52,"since I last used it, this app has so MANY ADS. I'm so tired, I can't concentrate and just use it.",1
32a04ac9-0190-48d8-9687-a2aa18494eeb,Tudo tem que pagar,1
ff2cb069-d776-4ce4-98af-79fd8915816c,Bad,1
f5d0166f-14ae-4804-836d-887b4af68e42,"I thoughg there was a free trial But I was charged, so I cancelled it roght away :thinking_face::pensive_face:",1
f8c70ce5-c45f-4e08-b731-3ca498675b8c,Charged me when it was supposed to be a seven day trial and still haven't received a refund that I have requested twice now. I have never used this app before and they charged me and haven't responded to the two emails I have sent regarding a refund.,1
5a999828-8c29-4592-8cf3-f49030db23ed,"When I first logged into this app and when it gave me options to purchase I was offered 19.99 @ year. Then it kicked me back to the 7 day free trial and 39.99 @ year. . .what happend ? I would rather have the 19.99 @ year than the free Trial !! If I can't get this for the 19.99 I was first offered, I will uninstall at the 7 day. Before I get charged 39.99",1
e567db65-4884-435f-988d-b96747744340,"Why would you automatically subscribe when I didn't request for it. N20,500 was deducted now without my consent. Please refund it right away.",1
5d4c1ee6-8558-4009-8690-f7523f69690f,Very bad....glti se subscribtion ho gya h..aur do din s try kr ri hu ...mail kr ri h but koi response ni aa rha ..I need my refund but they didn't respond,1
27649834-88db-4b6a-8e10-cd4883933e12,So bad Using after a long time but now it has so many adds u can use rabit instead(another planner but lesser ads,1
ab850326-e09f-4769-ab01-5f5012b06d78,I installed and opened then closed and uninstalled the app. Already feel overwhelmed. I have a newborn i dont have the time for anything. My baby dont let me out of her sight for more than 10sec. She constantly needs my attention. Maybe this app will be helpful to someone. This just make me feel more overwhelm.,1
793e46ef-36df-4829-96b0-d33308245eb1,I never signed up for this subscription!!!!,1
68ba6630-7f9d-46ba-b7cf-bc52a5dae206,"Gostei do app, mas toda hora tem anúncio, não dá pra fazer nada, qualquer coisa tu tem que assistir um anúncio que nem sempre é curtinho, e na maioria das vezes são 2 ou 3 de vez.",1
a23166cc-aa45-45d9-9464-2731366c66f3,Not worth it,1
dae89986-3642-430d-8a8f-70ce307a6eee,It isn't free,1
889c411a-4e15-4970-a842-517a13e7ac1d,Impossible to use without paying money,1
8b7143c8-a889-44d8-8f08-782414720315,Never used or download please uninstall,1
9fbe83f8-ba55-40b6-80ec-162b2af7736f,Ads.. uninstalled,1
d720d3d1-d55d-4f5f-a73b-17b8db72bcda,"Before I had said ""I deleted it 2 days after I got it. Absolutely terrible! Hate it! In so many ways I can't even describe."" Now I say, it's amazing g and it really changed my life since they updated the app!",1
89210c2a-9d7a-4e70-b520-9c64dfb6f2e4,Very upset! It said one free month and it charged me $ 21.,1
66429d5f-eac2-4dbc-88cf-a8bb3e6bbe35,:red_heart::red_heart::red_heart:,1
3addbaa2-e6bc-41d2-b323-f29df1073d2d,I've deleted my account but they still charged me!!!!,1
8848d516-63ab-4f15-a7ad-f6abdc6380b4,"Ads, ads, ads, seriously I got discouraged in the first few minutes of using it. I'm not upgrading to Premium or buying your other apps...",1
ff454bc7-3065-46b6-ac3e-2e10163d6f5d,"Plans shown in the advertisements do not exist or atleast not in that quality shown. So you have to create your own plans. The app itself advertises a lot of other apps from the same company. I don't want any annoying popups when i pay for the app. Also the subscription was offered with ""2 weeks testing and then you will pay"". The subscription started immediately, so i paid 22€ for this app with fake advertising. Also important the app says i have depression to sell another app of them. Scam",1
7f519efe-35b0-423a-9e26-200ae6899fb7,"They sell your data to undisclosed 3rd parties (feel free to look at their privacy policy) Also, their use of English is really poor throughout the app (I guess it's an Asian developer). Not worth it.",1
7cd1c825-306b-46c7-a899-a762d518dd73,paid the $20 subscription and decided in 5 minutes this is useless to me. wants me to start entering tasks. would take forever I already have a to do list. didn't motivate me at all. will Uninstall after this review. and the pop ups asking about therapy was more than annoying.,1
1f6fac4e-18a9-42b2-a88e-75e2ef9a1124,"Don't understand the 5* reviews. Nothing new you can't get for free or with some online searches. Went thru the initial questionnaire, greeted with multiple payment plans, and pop-ups to remind you to pay. Past that, immediately asked for a review. Didn't even get to explore the app and I'm asked to pay and review for what turns out to be nothing special. Immediately uninstalled. Save money, get a bullet journal or notebook. It's basically a colourful spreadsheet app.",1
15321df8-7921-4431-b998-3c46f65eb90c,Charged my card right away! I wanted the 7 day free trial and a screen pulled up for 50% off the subscription so I tapped it and it bypassed the trial period and just took a full year out of my bank acct! This is false advertising and theft!,1
c1260343-5450-4137-91f9-7b2ccd3ae8b8,They took my money even i cancelled subscription,1
c5ac3c56-86b8-49e0-9ffe-3ef5cbde7381,:red_heart::red_heart::red_heart:,1
1875d516-dbab-4f79-986e-6ee65449f6c4,its so health and lm waking up 6am for it thanks for Me+ app if u were not on the app lm unhealthy,1
29bdc8e1-7d00-4532-af35-1e92165d2727,"Was looking for a reminder app and tracker app to help with my health journey and from the advertising I thought it had a food tracker... it dosnt, and now i can't get my money back there's not an option to click for a refund! I just paid for a year subscription that I wont use. I'd like someone to reach out to help me solve this issue. I'll update this review if that happens.",1
d92acc56-854c-4414-b12f-1501caccc108,Nothing is free just a 7 day trial,1
b34f00c7-f0b4-46ce-8cd3-338bb3f5556b,I canceled way before the trial was up and still got charged.,1
8e7fca6e-6874-4367-a5c7-3c86de8954e4,DONT INSTALL!! Charged me money even when I cancelled within trial period,1
54912fe3-9e43-42ee-8e02-ae5eacbe5db0,"I downloaded not knowing it was a pay app... Thought there would be a free version, but nope.",1
7d3a3341-cf40-4636-8544-72e9d7da7841,naicc,1
4941e8f8-85c2-49de-afe3-f2ae07b1c61f,Bildirim gelmiyor asla uygulamada da telefonda da her ayarı kontrol ettim. Verdiğim para için hayal kırıklığı yaşıyorum şuan. Not defterinden bir farkı yok bildirim olmadığı için çok üzdü :persevering_face:,1
46219d3d-4324-468f-a735-1e95f78bf9e9,I hate these apps that don't tell the subscription price until after you invest 5 min installing the app answering all the questions...,1
8643cf66-bf38-4c48-bf28-afa6b8c40f33,VERYYYYYY DEMUREEEE APPP:smiling_cat_with_heart-eyes::sparkles:,1
3966284c-39f2-4ac1-ae9b-8d350c8cf752,"This app doesn't work with an alarm, you could be engrossed with your work and miss a task. The reminder feature doesn't sound an alarm to notify you. That's bad, I don't like it!",1
9b8b6a35-7110-44ee-bcd2-0ce08b88b7a3,Not free as described,1
d78238f3-87de-4ee3-b6e8-8bbfd80cf836,:red_heart::red_heart:,1
57a2ff2d-230d-4df3-9f50-ef098fa3820e,"I'm really upset now I'm from Iran, and because of that, there is no way to pay",1
f58f8b13-b961-40b9-989b-08abce7c1483,"I signed up for an account, and as advertised, I was supposed to have a 7-day free trial. However, as soon as I clicked 'Subscribe,' the money in my account was immediately deducted, and the official subscription package began to be activated. So where is my 7-day free trial?",1
0dc706ed-4733-4cdf-ac1c-d19e72aa250d,Punishment review. The UX is taking every opportunity to ask me to subscribe or leave a review within the first 5 minutes of using the app. It's annoying and poor form. Give the User a chance to actually use your app before asking them to pay and review the app.,1
86b13deb-7f9f-4553-b0bb-83d2cd25185d,Not free,1
59c00fd2-587c-4eed-b053-85bf15266a23,پولیه و ما هم تحریمیم به کارمون نمیاد,1
4b5a31b9-f5e1-438a-a45f-3ff408a790ae,Didn't know I had to pay.,1
17c374b1-5ba5-4c2f-bdce-e12c5978bf82,"Please make sure it's free , i just signed up and I don't want any problem that it's just for 7 days otherwise i can't use it anymore , may premiums be available but if I don't want premium, it should be free",1
1de28740-3894-4579-9ef1-5ae09e10c8fa,Sucks you have to pay for it,1
96598bed-c2ff-4c8d-9c36-07d1e9193e5b,Unreliable recurrence of tasks. Tried to contact vendor through their form in the app but received no reply. Uninstalling.,1
4e562eb8-e706-425d-85a9-8ec39532c599,"This app sells all your personal information to a lot of companies. Sorry, but I don't want Amazon to know every little thing about me, without me getting anything in return. I had to deselect these companies for like 10 minutes before I attempted to use the app. For some reason you cannot deselect everything at once.",1
3f06600e-0e94-4c46-a59d-74f3d49b3325,:red_heart::red_heart::red_heart::red_heart:,1
fde5a1af-b6e6-4cf6-9ce2-7fb4adb34689,Leaving a review to hopefully help other people attracted to their shiny marketing. This is not personalized in any way. It asks you a bunch of questions up front and says you'll use your MBTI to make a plan. You will not. You will be able to download some daily/weekly plans that look like Canva templates. And you can make lists. The end.,1
e8e7a855-7f90-40e4-a8db-b2dcc49e95ae,20 minutes of collecting data and then a free trial! Really! Had I known this I wouldn't have downloaded such an app.,1
380cb286-7668-46dd-801c-d9b5e074fbb6,about to try,1
bc65299d-8419-40e7-9835-26fc4a4528b2,"Scam - Be Very Careful! I signed up for the 7-day free trial, and they charged me immediately! This was very misleading. The app itself is not good at all — it doesn’t live up to expectations. I highly recommend being cautious if you’re considering trying this service.",1
852b1066-2f87-45e2-8d58-7b8d2c03bf30,Cancelled my subscription via Google Pay & they continue to charge me. You have to email them directly in order to cancel.,1
e84869c9-b940-4bff-a6e6-0857e290b978,I don't want to say anything,1
b493a669-fe65-4e74-ba9e-7cf6976d9cb3,I keep getting billed 42.69 from google Enerjy and do not remember getting the subcription. Im look for it in my subscription and it is showing up but i cant cancel it.,1
9f09a392-5f60-4f65-8200-859fa0b6f131,"I subscribed to this app thinking I would get a 7 day free trial, but instead I ended up paying for 12 months! How can I get a refund????",1
650c9539-d11f-4777-acea-b328e7af3430,:red_heart::red_heart::red_heart::red_heart:,1
97990dc3-b490-468a-ab92-845ac7b3e66b,"Doesn't give me any alerts and it won't stop annoying me to pay for it. Does paying for it turn on notifications or alerts when I set them to go off? Why doesn't the app having notification settings? Guess the hype is a lie, this thing is worse than Google Calendar, the very thing it was to replace.",1
7fae55f8-eb30-4bc7-a862-6cb2a4199da4,Pedophile Flags & Pregnant Men Emoji's. I won't support any of your idiocy. Every MAP should be put on a watch list for life.,1
0abebe5c-53fe-417e-8ef9-c826d62e9db8,:folded_hands::frog::smiling_face_with_halo:,1
3327e01d-e739-4645-b403-12f8a88897a9,lurve it,1
30f2d0a3-8832-4536-82ac-739516dd90fd,Required subscription. Might reinstall if there were adds until I want to sign-up for subscription . Not able to comment on app itself. Never made it past the pay wall.,1
1c438f38-9def-4115-a356-a647189ebc90,Horrible app. Basically just a list with reminders. Nothing you couldn't do with your own calendar. Wish I could get my $19.99 back.,1
e0fcb7c6-c923-4dc1-a139-036069b3488f,not free,1
755c7942-02e6-4d61-a3b0-75466e7cb634,Not free to use,1
25a5d39a-2cda-40d4-9810-b0322a1e8123,time waste. ask to many questions to take money without doing anything,1
46e3ffe4-f340-4ce7-a1d5-26406b694898,Exspensive,1
97737484-f1fb-451f-b32b-2e501fd9818a,:smiling_face_with_sunglasses:,1
82822046-4b3c-4b48-909a-2cd4b35398a3,This app does nothing more than the calendar on your phone. All it does is try to get you to download more of their apps to add useless features. Total scam.,1
e1acdfd8-28d3-4308-bcd1-32cb38341755,Free version is useless.. It is distracting. Ads and offers are annoying,1
516f2554-5d08-468c-bbce-a90f89c3a255,kapot goeie Ap,1
fdb6a8b8-5f1c-42ff-81c3-c9f9cb386595,I CAN'T MAKE ANY TASK WITHOUT GETTING A AD?,1
feb199f4-4867-4783-8824-527d99127dec,wooooow,1
1c984299-511a-4ead-84f9-048b06897606,Asking to buy premium even for just a notification is crazy.,1
98fa4489-cd28-4637-9817-831f15054464,"This app is terrible. Answered all the questions to get started, got to one section and good not write the answer. Could not go forward to the next section. Never got started with the actual planner. Was looking forward to using it.",1
30b30a85-0f76-48d6-8802-a3325625a3dc,Another app you have to pay to use. Dont waste your time trying it if its not in your budget.,1
dd93f7a6-948f-46b3-8701-8c7f638c35ae,idk it forced me to give a 5 star rating ngl,1
ac315c75-7a05-4712-ad51-0244fa397c5d,"Too many ads, impossible to use.",1
7b967817-bf3f-4149-aa5a-a88296869abe,"I can't believe... App not allowing you to add more then one tasks if you are not premium user. Come on, the worst app ever.",1
b3eb5fa5-6df7-481e-8dd3-8a0e4204cdc6,I think you made a huge mistake to make this app,1
c272a34a-ce11-4a1c-bf93-b631af194863,"BEWARE! They processed my payment and now they tell me that I have no account with them, so I can't access the paid version. I emailed a copy of the payment receipt and now they are ignoring me. Next stop credit card company to request reversal of payment. Absolute scam artists. BEWARE!!",1
93af675d-b610-4304-bfe0-8801e968a4da,Went through it all. Then to be told free 7 day trial and then a price list. Shouldn't the price be shown before you go through all the faf. I uninstalled the app as soon as I saw that.,1
dee8093c-288f-4ab2-9fe3-d43cca13a201,I don't even subscribe this app for one year but they deducted my money from my account without my consent. I tried to request the refund but they denied it.,1
945ddf48-41fb-4ec4-8d50-fbd699710d01,There are way too many ads. I un-installed before I even got to use the app. Disappointed,1
1ba67e08-4caf-4007-b5a2-68f543c23daf,Hate it cannot figure out how to cancel subscription ive emailed several times . There is no menu icon on the page and 3 dots ? Why won't anyone email me back and cancel the sunscription ?,1
db35ab80-4d69-43ca-ab1a-a177018a7927,"The app doesn't open. When I press the icon, it just goes blank. I can't find a way to contact the developer. I'm requesting for a refund here. So if the developer could kindly contact me please. Thank you.",1
48ab6e92-06cb-4fc9-848e-12ac3ccd9ad4,"You cannot ask me ""How do you want yourself to be a better life?"" (Yes, they literally worded the question just like that) And expect me to take you seriously or use your app.",1
20edb8e5-1642-4054-95f3-c50a0f9a8892,slaying tbh so get it girl,1
cf1338c8-f72f-467f-95f2-c2dae1f3892c,:red_heart::red_heart::smiling_face_with_heart-eyes:,1
bae72816-a4b7-4c9f-8eb1-9223158abf74,Disappointed. Answered all the survey questions and could go no farther without paying. Mot even a 30-day free trial.,1
52c7fca4-2bea-4243-950f-6df8ff08c5d0,Hello ENERGY PTD. LTD. I just want to say that someone using your ad video on their ads on yt.,1
158ee2cc-fb29-4420-b0df-bd962ba43433,Well considering that I can't get it to take any of my payment forms I guess I'll never know if it's good or not. Extremely disappointed.,1
d7271a1f-f954-418b-9f75-a8b761d75d2a,Pushed into 7 day free trial and expensive sub. Waste of time to get that far.,1
3e3f8c3c-9925-4df3-9299-69be633f4a4d,I hadn't made an account and cancelled the free trial midway through starting it and got a yearly bill of £37.99 and I Didn't get any of the premium stuff.,1
7b43db9e-9e6d-47ff-9e6a-1e01e5a24ade,"App is unusable. During setup the option to continue isn't visible on the ""DO you relate to the statement below?"" Page. I'm using a Z Fold 5",1
494c0c93-6d35-4a8e-ab1a-cf8959c478b3,"Barely used it, Uninstalled it soon after downloading it, got no money back. Can't get anyone to answer me. They contacted me and want some number I can't find to issue a refund. They sure didn't mind taking my money but can't get any back. They have all the info, but still they won't give a refund. Never again.",1
8f14417a-556e-4d9c-a8d9-25e90fbdfd2c,"This app is a scam, was supposed to trial but it took the yearly subscription from my account instantly.",1
104f5f9e-190b-42e5-a594-f78bef4aaf1d,ATE DOWNNNN,1
fbe3000b-c5f3-4f61-8620-d825592963ca,made me productive in less then 5 days :star-struck::star-struck:,1
deab4a61-dcca-4e03-9ce9-adbbaf6cba14,Beware. This is not a free app. Please remove from the free section.,1
3c3a2480-5e00-4d10-8bd7-bc6c32e94d25,:white_heart::white_heart::pinched_fingers:,1
28dce43d-52f3-447e-b1fa-86310814d154,TOO MANY ADS! :enraged_face:,1
ce8fa2f8-5d95-46a1-9bd0-910bcaed68a9,:smiling_face:,1
92a77f1c-e764-458b-89e4-9b9065b890fa,:enraged_face:,1
3df0bf3d-b09f-4c53-938a-1fc3531db84b,I'm sorry but I would give app five star but bug makes me so angry .when I am planning to do something bug came and I can't do anything so I'm leaving this app or please fix this,1
9b3c8380-cdc9-48c4-8c4c-6ffcff8a9c93,V.gooood,1
25994d16-3f37-4800-b447-027b49d45743,"Super buggy, loaded with ads and interruptions. Half the time this app won't even save changes you make to your tasks, the other half of the time, there is a pop up selling a game or trying to get you to ""upgrade"" the app.",1
88d8a0a9-8f2b-4af4-96f5-6f43d3e82192,Worst app ever ..to many adds ..don't waste your time,1
c370e62a-6e47-42f6-a830-74a7785f0904,:red_heart:,1
0dbcc8fd-d1f1-483a-a37c-4de7fe1282d9,"Filled with ads, impossible tu use. Every habit tracking app is better",1
b243e96c-c412-4acf-9b78-7d778d19a739,:red_heart:,1
3a805056-ae98-4aff-a92a-b58b84c4809b,Kys I'm nor paying,1
a8e1d51e-6f8d-41bb-99ce-ffc5134056d6,Wasted 5 mins of my time doing the intro quiz for them to pop up the pay to use screen. Girl bye,1
2511b88d-4da9-4860-a7bb-0966ef27a0e5,Why do I have to pay to get my life together,1
f1a21850-22dd-4617-95d4-60630bc42e6b,"Do not like it at all. Led me to believe it's a planner, where you can easily set up weekly routines, make better habits etc... After sitting through their presentation, then paying my way through the pay wall... I spent 20 mins trying to figure out how the hell I can set up a plan for anything. Nothing makes sense on where it should be, and you have to create tasks for every individual day you plan to do them. Awful. Spend your money elsewhere.",1
c1ba950c-3c07-47c7-b406-f2d4498fc269,It looked like a great app but after I answered the survey I had to pay... I hate apps that look free but then make you pay... very disappointing:pensive_face:,1
fddc65be-4a08-4b9b-98fa-3eceec18b150,The worst app. It says making a schedule is a premium feature. Tries making you watch loong adds. It's not free. Why making one single schedule needs premium membership?,1
e4ec92e2-1ec9-4ca2-82f3-56216482d2ac,"i just downloaded this app I'm really excited to see what improvements I will get until the end of the year, I will definitely update my review in 2025!! see you guys next year ^^",1
e3ee4f43-f9fd-4df1-8b71-1db650eb7e92,I don't like it is not free,1
956104d5-9ee0-40e7-be57-317019e28b79,Guys it's asking money there are so many apps for free,1
f965847e-19f7-413c-89e9-7376692a88bb,"It's a scam, no real free trial, glorified checklist and now it won't allow me to leave review in the (tell us more) section. Read the reviews! I have no idea how this has a high rating?? most likely faking 5 and 4 star reviews. I wish I knew a good alternative habit tracking planner app because this one is so disappointing. If it did what it claims then this would be a good idea and would actually be helpful. I found the mood stats (not user friendly to find or use) and cannot read the notes :pensive_face:",1
04728307-d133-4d81-9d5f-82b50c17f316,Don't want it on,1
4d1a52c4-e7c8-4a36-ba85-9a177cf0800a,wanted a 7 day trail got charged for it. can't find contact details. app is not as advertised. boarding and easier to use a pen and paper to prevent constant looking at phone then getting distracted. had it for one day. return my money.,1
5791f08a-a5c6-460c-9ab8-e65a4643e0e7,So excited about this resource. Plus...the app is just so cute :smiling_face_with_heart-eyes:,1
e1f4ebb2-a028-469f-91d0-4eb094347daa,:red_heart::red_heart:,1
b3891f6c-ae89-4b9d-ab42-4c44c8755ab3,I really loooooooooooooooooove it:red_heart::red_heart::red_heart::red_heart::red_heart::red_heart::red_heart::face_blowing_a_kiss:,1
aa95fb1b-1adf-419e-b70c-b2344256df0e,Just a dumb app,1
2fd4917b-27f3-4828-b712-0c08f94b6a9f,"just downloaded the app! it's giving very demure, very mindful, very un-toxic&self-caring. however, it immediately catches my eye that on the ""Discover"" page, there are workout/eating routines that nourish on distorted body image, promising ""flatter stomach"", ""your ideal hourglass body"", advising how to ""suppress hunger"" etc. eating disorders and struggling with body image is common enough in young females and I wish that ""self-care"" apps wouldn't fuel that by repeating messages from ozempic ads",1
f2c46d5d-7354-4a04-8e42-9d8cff9ffd54,"I downloaded as it appeared free. Go through the questions.... then it's like ""free 7 day trial"" NOPE! Instead of helping it's made me feel more helpless. Un-installed.",1
4395e1de-dbd0-42ba-875b-7d3f276d0dab,Wasted by time on surveys without disclosing the price first,1
85516297-956c-4edd-8fcb-0df333db6b0a,"It won't let me get a routine and is just advertising on and on, not allowing me to get my routine:smiling_face_with_tear:",1
0deb064b-fa87-4441-8e60-450eb270a86c,Just life changing :heart_exclamation:,1
689157c1-93cd-4895-9de8-9f6e0b899caf,:hyacinth::hyacinth::hyacinth:,1
ebf0a545-ff0f-4743-9b51-cdf88f3b185e,"Charged me within minutes, when I had a 7-day free trial. Wish I didn’t try it out.",1
a474b9ba-f8f9-42d5-9de3-6566525b2181,"Stop asking if I want a paid version. 10 times, before I even looked at what it's about. Going back to Fabulous.",1
b17aae16-a91e-4355-a42f-59c6789e733a,"Signed up for the free 7 day trial, decided it wasn't for me, cancelled (via play store) after 1 day and was still charged for an entire year? What a joke.",1
bb56a962-96fa-409e-9238-57f33256938d,I'll edit my review if no ads annoyed me:smiling_face_with_smiling_eyes:,1
1855dd16-f541-492c-9e36-8c83bd963a61,I tried to make a routine pot is instead of disappear :dotted_line_face::dotted_line_face::dotted_line_face:,1
fa0a8e82-e627-4ef9-adfb-55a41493f4f4,It didn't even work I tried watching a video but it said it dus not work..... Waste of wifi,1
a036c162-8fd0-45d3-b590-2cedd1c768fa,Wouldn't let me in cos I didn't get the password right,1
06f86857-ab36-422d-846f-486d7b66f8aa,You can not pay if you want just press the X,1
c6b8bc83-ca8f-4555-9fca-aa459b0cb858,You get one star because you not only bothered me for a subscription before I've ever used the app but you also asked my to rate the app within seconds of using it. So here's your rating. 1 star. Bother me some more. I wanted to give your app a chance but I can already tell you only care about subscriptions and ratings so no thanks.,1
ca0554dd-a807-48eb-8d0a-4736488ce723,Too many ads and doesn't work properly,1
857291bf-f029-48ff-babd-3cf975781749,Don't advertise you're free if you're not,1
f1d5478d-0344-4758-8f1c-f3d663774e7a,Why is app telling me to pay I thought it was free,1
cf80d450-9fce-41f2-9285-c57cccebbea5,just wanted you to know that I have less credit my phone number than I have less credit my phone is in Watch and not working on night on,1
606a702b-7f7c-4ebe-98b4-6de2333a723e,:smiling_face_with_smiling_eyes::smiling_face_with_smiling_eyes::smiling_face_with_smiling_eyes:,1
32546b62-bd6b-45ef-9cf9-0a4789fbe9f2,"Not helpful at all. Actually I wast of time. You can just use Google calendar, which has more customised options than this app. I spent 2 hours planning yesterday, and today, there is none of the to-do list task. All disappeared. Then, it is trying to collect all my data for more than 700 vendor's, when I rejected it, I was not allowed in an app I paid for. I will be uninstalling",1
cf1e3e47-f253-4f91-90de-e9579d3fe86f,"This app is not for me, so I cancelled and uninstalled this app within minutes. But a payment has been taken from my account. How do I get a refund?",1
ba3196af-1b24-41a0-b88a-96cdb7f302b0,"just started the app, of course it's $10 a month but I haven't subscribed just trying I'll let y'all know after a few days if I feel any better or it's worth it!",1
c11e1f02-30f7-4d76-8aa9-cca202628c4c,download this app.... NOOOOOOW!,1
2a7fd26e-735c-4115-ac63-48f68532ca00,"Signed up for a 7 day free trial and was charged the first day. when I went to cancel, it still kept my money and just cancelled the NEXT annual payment. Why advertise free trial if you do not actually offer?",1
2e28f6dc-79ee-4434-8982-ca86324d9b48,خوبه اگه پولی نباشه,1
a452fc49-2282-4ae4-a1a3-6d56dbb9a908,Thanks for your support and sorry i only download this now:grinning_face_with_sweat::grinning_squinting_face::grinning_face_with_sweat:,1
