reviewId,content,sentimentScore
4c5f0210-7719-491d-98c6-e85e5458ae60,I like the interface but the web and mobile don't sync correctly or immediately. Also it keeps telling me I didn't complete something last time when I did which is disheartening and not what someone needs to create habits. The UI is great though,3
d34a5be3-679e-4088-9fcc-c05a07df8fb5,"Only allows three free habits, then you have to buy premium",3
2b91c12e-e259-4953-b11d-145e726a3eea,"No widget customization; widgets ""to complete"" and ""single habit"" are solid white blocks that stick. For $39, I'd like more customization. The release notes are creative.",3
83db2d4f-91a5-4b92-b98d-486bbaee07f9,"It works, it looks nice but it would be nice to be able to use your own notification sound",3
eeb9c620-090b-4abb-9b8b-3940cc8e5ebc,You can only add three habits before you have to pay.,3
bd3ee349-fbc5-4f38-8982-9e4f17812173,"Beautiful design, but so expensive, please add 5 free habit",3
13957874-d0df-48cf-8be2-a10a7d7a81c5,do we get cross platform syncing and cloud backup feature?,3
07361e36-b6eb-46a3-b0c0-e5c21ed89dc5,"App is nicely done. However, monthly subscription for an habit app is too much for me.",3
eedb2ae2-5062-409c-a296-ea3289098821,"The UI is beautiful and I got excited about forming some new healthy habits in the new year, but 3 habits is way too few for the free version. How am I supposed to get a feel for if the app works for me if I can only track 3 things a day? The popup asking for money felt rude. I'd barely started using the app and already I'd done all I could do. There should be at least 10 free habits.",3
