reviewId,content,sentimentScore
bbe552f1-3fc6-4dcd-8cc5-bf2b8a38d0c5,it makes my morning much better,3
b011388c-8708-4a01-864b-aeb0eb29b1e9,Morning practice much easier,3
87169968-bec4-4f17-86d1-2f0f9145574f,"Hi. This app is great, but since the new update, although the option to show streak count after every entry is turned on, streak count doesn't appear after every entry. Please fix it asap as it was a confidence booster and increased my will to maintain streaks.",3
9722ed1c-7b26-4d6d-958a-f072f97c6685,more prompts would be grea,3
64329f22-f730-4b3d-8936-0aed3b190e4f,some options seem free,3
f062ac51-2679-41b1-8a77-4f7d4496ac78,"the app was good, but i didnt realize we need to pay. i thought it was free apps. there are some content that i still dont understand how to use it",3
41725735-68e9-47b1-941f-ef19bed98d61,"Since update: Should have left it alone, it was fine before :woman_shrugging_light_skin_tone:",3
a83b0dec-7060-4c47-8758-98da010f0d82,Not sure. But why is this app's subscription price too expensive? :unamused_face:,3
a520d3ed-e1cd-40bd-8a33-d3fddc8dfe02,It is better then a paper journal,3
52c783f5-07bf-4ff0-be6d-b40febcf05a4,"I've given it a 3 Star rating, because I believe an app like this should be free since it generates so much positivity. I cannot back my stuff up because I cannot afford a monthly fee. However, other than that I am enjoying the app.",3
753f62f1-6490-42d9-832c-b02c688cdcda,:nazar_amulet::sun:,3
74a50518-c91e-442a-b0c8-d3383a965d5d,:heart_hands_medium-light_skin_tone::smiling_face_with_heart-eyes:,3
b4b00824-5855-4b3b-a616-28c09897a75d,:thumbs_up::thumbs_up:,3
0d59cdd5-0f9a-4ad5-a754-a76166327281,please make it a free app it could be more helpful,3
86107cd1-3044-41c2-97b4-262ad09536b3,I think it has more power if it works with the ideal person.,3
c80b7a45-7e43-4a09-904f-2d932810dec7,I am facing an issue I have paid the subscription fee for year but my subscription isn't activated and nor I am getting any reply through mail from u. It's great I wasn't sure about writing the gratitude journal I felt I boring and would stop after few days. So I never consistently have written it but with this app it gets better with the feature of adding photos and different colour background so it feels really good writing it. I have been writing it since past 8 months. It's wounderfull.,3
3b990513-849e-45fe-a48d-0c4d68355a13,App works good and I'm grateful for that but I'm disappointed because I have to pay for the subscription in order to back up my journal entries to Google Drive. If I knew this upfront I would've chosen a different app.,3
a75ada88-fbe0-4a5c-8cad-4052d7dfad0f,Edgard Sara Antonio lacayo,3
6fefe1e4-b100-4cb6-8a91-b1d08fba8f81,.io,3
f7d5c394-49f0-41b4-a42c-9472245bafb4,"I am loving the positive notifications, for reflection and Journalling; I would give 5star however notifications seem to be gone cannot find in the app to do so after a couple of days. I am using free version at present. Are past notifications kept somewhere in the app for future reference, reflection, use?",3
94e62ca2-65e1-4ab9-aeec-dd3e9b1544a9,"I've been using this app for a several years now and I really like it. BUT, over the last year I've noticed the quotes are repeating... a lot! Out of all the positive quotes and people engaging in positivity in this world we live in, really shouldn't see the same quotes repeating at all.",3
1137b806-3bb6-46e5-8d84-2e8a1e6f6687,if you want to spend time for yourself then it's good,3
d875a46b-712f-442f-a1c8-aae0ee0d034f,I would love to use this app but there is no free app version.,3
6e52c2a1-7ddc-4617-b1d9-cb646e598b7b,I have paid subscription Yesterday but not got updated pro features,3
722a2848-efbe-4ffd-a7a4-ac126456ecc6,It only works if you put in the time and attention to yourself.,3
bd0041c1-6dbd-4daf-984c-da3be8e86619,I m okay with u.. iff possible ...plz give everything or most of things free of cost.. bcz...I m not able to afford,3
71f582a4-ef17-4a6d-8d8f-53ea47196bf6,I liked it but everything is basically a free trial then u got to pay,3
ce1e0d98-adc9-4fcc-ad55-a8e6eaf06b64,"I wish to change from gratitude to achieve goals , how can I switch ?",3
0489f72a-505a-49fd-8a3d-2dc9f311cd8c,Am giving this a 3 star because the app is good but it isn't fair that I have to pay to get the other things.. I understand that y'all worked hard to make this but y'all should have made atleast a few things free... Am kind of disappointed.. however the app is good..,3
2288adb7-6b9f-40b2-88f3-45ceb528e871,"Seems nice, but it should be mentioned somewhere that this is a 7 day trial version, and not a free app. It's a good thing that the app does tell that soon after installing, but ideally it should be mentioned here itself so I don't download it.",3
de4a1d6a-9007-4cc8-aff3-a751deaeb114,hmnn should hav more features..lock systm,3
1de09708-07b5-45fd-a962-b80e4a0ca76a,:rose::crown:THANKS SIO VVERY VARY MUCH:trophy::kiss_mark: THEE GRATEFUL APP IS EXQUISITE NO WHERE ELSE HAVE I FOUNDE AN MORE POSITIVE INTERNET FORUM TIO SHARE MY HEART WITHOUT AN NEGATIVE HAUNTE:deaf_person::crown:HAPPY HALLOWEEN :U.S._Outlying_Islands::jack-o-lantern::cherry_blossom::kiss_mark:,3
4f9c165d-9daf-4c20-acb1-22d4849d0942,It's a nice app I guess but almost everything requires premium. If your looking to pay money every month to use the app then safe to say no other problems :woman_shrugging_light_skin_tone:,3
a3260b23-9681-43c6-8e0b-03ef8efac94a,You should try this.,3
d227c273-682b-483f-9683-c20165643fae,"It is an amazing app but it is asking to pay for opening rest of the affirmations. This app is good for mental health but shouldn't ask for money bcs this creates a problem for the users. First pay for internet package, then install apps and then again pay to use those apps. Nice strategy!",3
7a2df63a-4cff-481c-a631-1b526f38dba5,It's just AmaJIN app...:slightly_smiling_face::purple_heart::backhand_index_pointing_right::backhand_index_pointing_left:,3
d44db3c9-6e6e-4bda-8815-818613014836,It's okay,3
6b8f4f9d-a3d0-4168-be8a-2a35463156c4,:smiling_face_with_heart-eyes:,3
2af07159-bffa-436e-8c50-91a768dd9f81,it makes me better,3
28f8f923-42d0-4e86-a0a8-dff402eb9c38,Describing my experience using app may be important for my self dependent living :evergreen_tree::smiling_face_with_sunglasses::leaf_fluttering_in_wind:,3
aab7ac20-647c-41d2-9bd6-9e2dfacd054d,I wish if alomst everything was free of cost.,3
4b9faa8f-d62a-49d1-8b7c-1b922a7217d9,It's making me stronger I,3
a4e6834a-f135-467d-b105-f8874c0ec73a,Find,3
30776a70-8259-47e2-8fa7-2aad0e47e573,Only a 7 day free trial.,3
99cf0a0c-16da-4ac6-a0ae-d7db421c6e39,"Dear, This is a great app. However, I need your help. I need to get refunded. I cant afford this at the moment. It hasnt been 48hrs yet since the trial ended. Please help. :(",3
9b9912c4-45b9-4cb5-bace-725ca41fc26c,I like it but then the price it sucks you have to pay for it.. really for it to work and help you. you have no choice but to pay for it..,3
23ec1f80-e282-45eb-82fb-3525e576549e,"Editing my review to downgrade to 3 stars. They removed some features from the free version. The affirmations are super limited now, whereas before there were more categories to choose from. Now all are locked, except for one. Feels like they got greedy and are trying to force you to pay for the subscription. The app doesn't have the same valye anymore, and I found myself opening it only to be disappointed with the available content. I ended up uninstalling it.",3
7a416c76-9aad-4eb8-bfab-017a0910a0d3,I appreciate being able to write down my feelings I have trouble keeping them in tact.,3
83dc27b8-e1dd-4a4c-99ae-e1e1dd5956f1,It needs data sadly,3
3793b3de-c867-4b22-a7b6-aaca4aed8006,The app was helpful but I do not want to pay for a subscription,3
39a24a31-7c7d-4c51-ad1f-48b7b9d3ad10,Its an good app but it do not remind you daily that gratitude is important so we could write our thoughts by time!,3
fe1180b0-b3c4-4783-80d4-7d85e9ef5a82,Do download it,3
b5d2bb63-da70-423a-9aa7-5b84d2927cff,"It's good. But for one part, the part that is like you can write things and change the color of it you can only put 2 and I find it bad cuz I was putting the season and writing what I like about it and I could only do 2 so please try and change that thank you:smiling_face_with_smiling_eyes:.",3
7c1b50e0-1656-4fb0-bc6f-2e771d8ea487,It's only a free trial,3
7ec73a4b-b9a7-4333-b30f-bffb5934f7bb,"It asks for sleep pattern, but I work nights. I just can't get help.",3
86a75bf4-b7f7-4a09-978d-665a9db4043d,Perceptions change.,3
bcadacc0-d718-4482-80c4-ad18c26d2e7e,it should be free,3
185ea2fa-fc2e-41cc-8b6b-05139ef8a6ab,"simple but not free if you want to save the ""progress""",3
ed506555-6e68-4afc-9f56-5b855a194959,so many features paid but otherwise good and maybe formoney it's worth to spend,3
dd5ffbbc-b4bc-4b55-9aed-a15b67ae9b73,"I :heart_suit: the app but l wish it could also have a security system in its setting , would the developer of this app create a security system in order for the person to have privacy so that other people wouldn't be able to get in",3
d4666613-0c44-476f-bd9c-cc34b6298623,I'm not sure. I'm still in the process of uploading.,3
2f9322f0-5cbc-41c2-bcbc-fbbbb74b30f3,its good but I'd like it more if we could save the progress to a google account or sth,3
b97aaccc-70bb-442f-8715-4c1dd70ca3f8,It cost money. Lead with that in your description.,3
26d44a29-9a46-4669-a3fd-36c1bab25ae3,Vision board not showing photos overall good app,3
ed46d8de-38a2-42d6-8730-58704a0459ec,I subscribe this app but I have a doubt what if I uninstall it can I continue my subscription? Because it doesn't have any signup feature in beginning that track my subscription.,3
107a862d-48c9-4a0c-a751-f65cc934c174,"I have had significant losses during the past year and needed something that would help me process and reset. I got to a point where I didn't really care a out any obligations. I only wanted to focus on my family and nothing more. I struggled to stay positive. The prompted journal in this app has helped me come back from a dark place. I had to feel the sadness, but I didn't need to stay there. I knew I had a ton of things to be grateful for, but something about saying it changes it.",3
f43667b5-307d-481f-bad3-6eba21e287f5,I was enjoying the app it's very simple and easy to use. however I was a bit disappointed when all the free affirmation became locked suddenly.,3
8e1691ed-1c1f-40ed-876a-d23edf1bd0c8,:purple_heart:,3
30782f40-5ba0-46fb-9e85-65cf969cdebf,"It's an incredible app but I only reccomend if you don't care about whether its saves your data. Personally I'm okay with starting over, I kinda just wanna have some improvement in myself, overall I think it's a good app but it should be able to save the data so you can transfer it to another device!",3
96fb137d-3d9e-40d1-ba65-552047906261,"Slowly learning ""in app purchases"" means subscription required. I wish it would just say the price somewhere in the description rather than make me install it and get thru some of it before it tells me I have to pay. Looks like a great app, can't afford a paid app & would appreciate knowing it's paid up front.",3
4d830ec9-e4ce-4241-b617-567d99781f2d,kinda really definitely digging this app:red_heart::thinking_face::smiling_face_with_heart-eyes::index_pointing_up::folded_hands:,3
c3e6b2a1-5b6a-4b8e-9531-7ad44b0b0a3e,That's Grüßart,3
5bb7563d-9894-4624-bfee-cfc23681930b,"Problem amended :beaming_face_with_smiling_eyes:.. defiantly 5* This is a great app but since app up date I cannot read stories in daily zen as it just links back to my journal instead, hopefully you can amend the issue. I have just taken the 7 day free trial and I don't think.i will be getting the full experience. Apart from this new issue it was 5 star app",3
1a6db924-f670-4e1b-8863-9805fa5df616,The affirmations and gratitude was good. The price is HIGH. I am a person who prefers fairly low to free prices. If this app is supposed to help people then don't charge after a week. It takes 21 days to form a habit. The vision board only allows 1 subject. People can get Canva app and do a complete vision board. That was disappointing.,3
d910230b-45fd-4ead-ae41-f6e9817568a9,"I am loving this app. However, I enrolled in the 7 day self love course. In the course when it gets to the prompt for the day, It says ""Tap here to write with this prompt in your Gratitude journal."" However when I click on the click it takes me back to the page that asks me to download the app,which I already have. How do I save the course prompts into the app along with my responses please?",3
66308839-f4c0-41ef-9f10-97041a724239,"I love the app most especially the interface and user experience. Very seemless. BUT it so limited...in that I can't backup data except in .csv format which is so much not useful. I mean, there should be limitations but not too much of it. For example, if I change my smartphone and reinstall the app...I fear I will lose all my data, which is so NOT NICE. Can you please ease the limitations? I really love this app, but I'm barely getting enough value due to limitations Please respond to this",3
7f7814ff-6e85-48d1-b2a2-839a3c1e308c,"I have started using this app not too long but after using it......I really love this. But there is a problem, the problem is......that I can't crop up the pictures which I am using. so if there is some update on this picture issue will be better and everyone will love it.",3
4452d956-f7f8-41b4-82fc-a0760e16bf1b,I have given more stars if there were more visionary boards section and some more boards without being paid,3
35822296-7cc7-4b41-acf3-b9b274ae477d,:two_hearts::two_hearts::two_hearts:,3
699a68e1-93d9-4915-9831-f1518f836778,:purple_heart:,3
8c2dff83-052d-45c7-ac9e-9d3771cc37b9,"I paid for the pro, payment is complete, but I don't have the pro membership yet. There is no help section on app for customer support",3
9b63898c-d332-4681-8ef5-9b649e98afe6,"3 star, bcoz I thought it was free app , it had paid subscription plan, so i can't afford ,otherwise it was good",3
7c75f46f-30ff-4389-8986-22b48c1ca20f,awsome... sauce..,3
4337be5e-4e5a-458e-af59-2bc2a1ad038a,How I can use it in Spanish?,3
db54280c-be35-4ec7-a6a1-c16d2a7e577a,ok,3
dac81bd1-63c8-4969-b829-cb77544d9024,this app is nice ....but would be great if it includes alarm as reminder.,3
b8bff17e-c8c4-465d-b399-af797bb724e4,gof,3
d08980e4-e442-495d-b548-d9d0416d8ea9,just can't explain how much it helps to sort things out....in the world of busy people all we need is someone who can hear us out....so this app is playing a great role to not listen but actually write down read them and tadaaaa u r there with ur satisfaction,3
be4cf597-95ca-4e55-a5b0-f9b652a341d1,Can we try 369 &55×5 & other manifestation techniques in this app? Will this still work ?,3
02918f52-3026-4166-9493-6501c26fb052,Okay. I was hoping for widgets ghT I could add to my phone do I could access affirmations throughout the day - it looks like these are on I phone only.,3
246bbc7c-2015-4b91-89cb-77473ec9c75c,Everything is fine. Except the affirmation part of the app. The recording keeps on looping even when I am done with affirmations. Also please allow the user to fix the duration of recording. Please fix this.,3
89dbd42a-80a9-4f53-95ae-79a6b81381fc,It tells me to pick things but screen is frozen,3
16354a12-e7c5-4099-a3db-177e32ffdac8,would be better if you didn't have to pay for making extra boards,3
a6de8497-69fa-4c97-9956-24997bcb9c40,"I like the app, but the keyboard consistently doesn't pull up in the journal. I often have to close out several times and come back to it before it comes up. For a journal app, a way to write entries is pretty crucial! I thought it was just my old Samsung, but I just picked up a new Motorola and noticed it's still happening, so it must be the app. I do love the daily zen, though.",3
732f6f1d-e937-4e7b-bda1-e1fb55bee968,I've only had the app for about a minute but it's been okay since,3
4a948d4c-3438-43a5-bc91-f562ab085031,Everything is great but from past few days I am not able to add picture in my journal :expressionless_face::expressionless_face:,3
ef74d51e-16a1-4fe0-897e-8cf1a4a80981,It is way to costly,3
f78c3cac-e9d6-4910-92c4-d2a9834493bc,"It's a great apps for better mental state.. But,,it needs more variation of questions.. Because now this apps starting to give the same question over and over again..",3
b90d3646-a2fc-4b20-b664-74462d6dd156,Ok,3
eeb50c3d-7b54-483b-8992-3c619be3851d,Still trying to figure out things,3
d340389b-30d2-4ef2-a3ba-afed50c09cea,"The app is very nice to use. However I wasn't in a space to keep up with it, so I deleted it until I was ready to use it and start fresh. My problem is that somehow the notifications I had set for affirmations didn't delete when uninstalled the app. Now I have notifications at 9am and 7pm that just ding on the phone. I can't find a way to get rid of them and they don't show up anywhere in the phone that I can find.",3
f9618e22-7fae-4363-aea3-4a989c3ea9a9,"The app was great but the affirmations i needed the most were locked and its kinda upsetting. But i do recomend the journal, its cool",3
a846b41b-9124-4b6b-97ff-8c58b381e343,it's great but the rub is you have to pay if you want to use the great great features so I probably won't continue to use it thank you!,3
9fa986d2-b95d-4e03-b5d7-50a0a21a152c,it does help you enter into a better set of mind,3
14254cf6-0237-4437-8959-f154a22062e2,This app is awesome so far but I don't have the money to pay for the pro version right now... too bad. But I'm also not really sure if I'd be willing to pay what they're asking!,3
eb2df12f-b2ad-47a1-8c51-aeed3a852273,"I would like the pro, but I'd rather pay the R42 per month as I'm not in a position to pay the full yearly amount is this possible please",3
1732718a-0585-4b06-ac07-4f8f55a4151d,"I wish that when you get a notification with an idea of what to write about, that if the notification is cleared you can still access that question later because sometimes I need an idea of what to write about. I don't always get a chance to write at the time my notifications go off.",3
dc0cb80c-9a81-41fc-ab93-725b57b0610c,A good start if you are a biggie in Journaling. May be too easy for advanced writers,3
4f726012-c5ff-421e-94f5-2f1d25f7e3a0,It still needs a lot of improvements.,3
ebcb91b0-73fc-4468-9704-02e1eb936eb0,wish I could do more without upgrading to pro,3
99f1ac3f-f758-4728-a80f-11375448413e,grwat,3
4f62199a-7c2d-4697-a0b7-85a8194c98b8,"Loved it, but I've stopped receiving notifications and reminders from the app. Don't know why",3
576a1382-d196-4fee-be20-6ca4e9c18159,does this app available for windows10 (pc) version?,3
d08c98b9-7c95-485f-9a17-44a629846e69,i would like it more if i can rearrange my affirmations,3
01bc5c29-1fb5-4a1c-84f7-3c24adf825e8,Would be cool to trial the full app for 2-3 weeks. so I can see how much it helps before paying for it.,3
9b035bfc-15c0-4eee-a8a9-84e2712b1b8f,it would help to think more positive though life is not so well.,3
a7329cae-11b8-43f7-add0-466b1ea50db2,I like only the section of fulfilling career,3
2f7b9e06-a395-42b8-9ff4-d7b0fe463700,Motivation for Greater*!!!,3
dc6926c4-f8e0-43ba-a0d9-ba14c7b6c960,Possitive,3
48bf7f3f-73e0-451a-9273-2a3f8cee4042,Positive vibes onlyyy,3
3cadc348-c03f-4e18-85a3-f15d36eed34f,it requires more features,3
1d08ea52-8403-4224-a156-49ba24202215,"I am ready to pay for this app, but only if I can restore purchases on iOS. If the developer can make that happen, it'd be great.",3
15faa78b-f84a-4e3e-a5c3-a43fc517aadd,"the app is alright I kinda forgot about it for a little bit, but once you actually start making a list it gets better. it's simple and you have it with you to write whatever you want down.",3
0ee44a0a-57f6-42ae-a7ba-0e7d18b3f553,I am not getting any Notifications at all. Please help. Otherwise it is a good app.,3
d91b975d-f3df-4394-8212-2247ccb03cc7,ok,3
ce189e95-9a77-47f8-aed7-60a65771d24f,"No ads, free - although you can pay to upgrade (if all goes well I probably will)",3
ea292e8c-e3ac-4382-b031-b904993756b9,im still exploring the app but it is really whta i want for a long time in a app,3
344b109a-c505-4c6f-97ec-ea7cad815317,"It's pretty good, not worth $5 a month though.",3
9542ea92-cd02-44d8-917f-a824a7d65b1a,Would be better without premium requirements.,3
ec57cdf4-a75a-4dea-aeb2-3bc82ecb3db3,"The app is great but font is not clearly visible because of light background colors which is really annoying. Make the background darker and fonts lighter or maybe appropriate dark mode. At the moment, dark mode is not helping. Would change my rating to 5* once resolved.",3
21e7b68b-bc47-4059-99e7-732fb401211d,The free version only allows for 1 photo on 1 visionboard.,3
d724a4f6-c004-4c11-b11c-4716a263a292,pops up with encouraging tips when I least expect it but need it.x,3
3a189bb9-cb1b-476a-8d0c-bf945286326b,Its good until you need to pay for more than 5 pictures on vision board and you need to pay to see more positive affirmations,3
da0fd6dc-3e23-4470-8560-c3e9c17f3798,I feel better :heart_suit:,3
54cc049c-4283-43e9-8eb2-cf46290feca2,I love it but it always keeps crashing and I dont like it,3
8836b081-1119-4b31-b424-be5c19b5030c,:OK_hand:,3
4e87ec1c-394a-4aa9-be40-fa02789500c0,I have been using the app for nearly a year. I preferred it before the recent changes and it is not helping me as much now.,3
4541e603-9824-4ec2-bc3b-14836ae89aea,My reminder is on. I like it but I don't get daily reminders to write something,3
15aa3f22-aee6-4658-8798-e3f756f5b1c0,wo,3
636e027a-da85-40f6-b088-e95c1556f1f3,"Takes the focus of you but, then, never really took your focus away.",3
02f74065-71cc-49d7-9095-995f94a199eb,Good vibes only.....,3
9512ac35-50e2-49dd-bfe1-d9f8b9cb18bb,may go to five in the near future.,3
c51398a9-026c-4b98-8002-d2747a7ad8d0,just wish it was free lol,3
6f5c7000-c116-432f-baf1-b4dec3b3b68b,"I enjoy the app a lot as it gives me daily goals and tasks at hand, BUT I DON'T KNOW THE REASON WHY THIS APP DOES NOT OPEN OFFLINE. I SAVED IMPORTANT DETAILS ON THE APP, WHENEVER I NEED THE DETAILS ASAP, IT BRINGS A BLANK SCREEN. PLEASE CAN THIS BE CORRECTED?",3
021a7fb5-ba9b-48ef-bb44-4da249dff443,:smiling_face_with_heart-eyes::smiling_face_with_heart-eyes::smiling_face_with_heart-eyes:,3
915f32c4-2a4b-4ca2-8dfc-98651df81906,Me gustaría que agreguen más frases en español. :winking_face:,3
4ad5d529-4834-430f-9357-2203a0e4304b,I like the app except everytime I try to take a picture it closes the app.,3
64f59657-da3a-4a63-9dc1-c4e074e5a7bc,on day 3 its ik but basic. gives you a taste but have to pay if you want to add more stuff x,3
12bb21f9-05d9-4b6c-8f70-ac2108b41b5e,"I think its annoying that you have to pay to make more than one vision board and add pictures. Without the ""Pro"" version this app is basically a notes app with some challenges.",3
605b460a-a4a9-48cf-9153-a55d8b8b5ebc,It seems hard to get focused on self again even with this app. The things that should have been in my life today are.,3
e7eae701-4cb1-49fa-808c-86297cdedf8f,I liked the concept. here are my suggestions..the affirmations can be made editable or removable. I couldn't change them or even the topics I want to see further once I chose them. I couldn't here the affirmations even though there is a play mode.,3
cfb3a482-82e4-4da2-abba-d804be54e70d,I find the app very helpful but most times I can't access it on my mobile phone.,3
76a589b2-175a-4f2a-a47d-3e05b020e654,:OK_hand::OK_hand::thumbs_up:,3
120cd45e-5545-487b-84bf-ea2bb828218f,Be very careful of their policies...,3
d2b8a0c3-9c62-4bcf-a4a8-b751c1d6b912,I like the app but it does look a bit plain.,3
4743ea9e-5dbe-4b69-957a-d58b29d37f56,"I've never used an app like this, but I'm enjoying ight.. not sure it's working... pretty simple tip use.. it's not complex. So im good with that",3
cf8066f9-f71f-48f5-b85c-f43baac3d08b,"Please fix the photo adding section for Android phones. I'm trying to take screenshots of positive emails or interactions that I see, to put into the app, but recent screenshots do not seem to be recognized and don't come up as an option to be selected.",3
a5bec4c7-e7b3-4101-8140-4ae84846600f,Better read about gratitude before use this. The Magic by Rhonda Byrne.,3
24ce7c2c-36cd-4c2f-bba8-bf9a6f319b26,"It is very nice, however, it would be cool if you made for appealing notifications. After a while my mind habituates to the look of them and I ignore them without giving them another thought. It would be nice if you made cuter-looking notifications and made it so that they look different each day, and maybe change the style every few months so that the brain can reset and feel just as happy about clicking on the notifications as at the start.",3
d549e3be-24fd-410c-a39d-1349c9c5f3fb,"Journaling is an overwhelming task for me. This, I can manage & keep up",3
236cbdc4-e07b-4ffe-8f43-744f65fb454f,Please add the option to make reminders SILENT. I love the 8am reminder but half the time it is disruptive.,3
9be09dc7-0e86-45d6-b951-8f5a0bdbb6ed,"The app is great... however, I can't restore to my android without purchasing pro. Installed app in 2018, maybe 2017 and now I don't have access to my journal because I changed phones :slightly_frowning_face:",3
ba8c7ed3-4026-4c05-8ad5-bfd8cab16790,I hope the app is completely free,3
876dd5c0-df43-418e-9a53-278634f87a3d,It's good. Still expecting some good features.,3
1e83ec67-45e0-465a-ac7c-6e7816245347,The reminders are great. But u are suppose to write only positive item in here.,3
f6685905-9554-4ff1-bb21-967a7fdcaa77,A kind of positive vibe is created whenever you note down a gratitude or say note of thanks,3
12b93d00-f6b9-450c-8322-e43226dc00bb,"I think the ""affirmations"" bit could be explained better, I'm never sure what to write",3
c8e16056-94fd-450f-98fa-6192ebdbd18f,"Helppokäyttöinen, ilmainen versio on riittävä, eikä ole mitään turhaa ylimääräistä.",3
