reviewId,content,sentimentScore
4829fda4-1814-4c4f-b547-f8fc7d078de9,I accidentally paid for this so I've been using it. it makes me feel a little better. Though I'm not sure if it was worth $32 as an unemployed homeless person lol,3
1c57514c-6be4-40af-9da3-bee668369772,"Most of the Gifts of life are free , such as Air, Water, our Plant, The Nature but we never realise that we need to thank our Creator for the same .",3
e2e6ca35-8afc-4eb6-9942-9eb91d72da39,only just got ap so not to sure about it yet,3
cb7a4c85-7389-4b75-a2e6-10d9b72d3062,Because I don't quite understand what you mean,3
a785b544-342f-49f0-a53a-853c8baaf80a,It would be better if you didn't have to go premium to unlock better features,3
1234f818-b555-4793-b49b-cf72a6329a41,I may not be great at gratitude but this helps get me started.,3
2d8c002d-66fe-4dc1-b3d8-9b0510dc26d9,soooo gooodddddd,3
bd244879-637f-40ee-925c-d23d3b1dbdad,It is making me stronger,3
5f0c28d7-079a-4c2f-ba03-b49bbb9bc6a4,I have not used it I will update later,3
7d5c9c60-2c63-478b-9e77-946b32fde45f,So far so :thumbs_up::smiling_face_with_smiling_eyes:,3
33602713-09d0-4adb-8d1f-3feeccd8b983,:butterfly::pleading_face::bouquet:,3
eb040e31-40bf-4279-b235-56a5b089709b,keeps my anxiety level down,3
f44be765-820b-4d1f-b4e8-9d9a1599c62a,I've only had this app for 3 days and I already feel some difference in myself :smiling_face:. pace and quiet even when it's not :oncoming_fist_medium-dark_skin_tone::smiling_face_with_open_hands:,3
39242b68-a572-4f2e-9d2e-a8decaa96836,it ok just ok,3
89fc4a28-42a7-48c2-bbc0-aa496aa3a59a,Some of the prompts are really interesting and some of them are not. Some of them don't even seem to deal with gratitude. Luckily you can cancel the prompt and just free write whatever you want. Sometimes it bugs me getting multiple notifications in 1 day.,3
156e9307-9166-4d3a-a8a2-4b810d98d3cf,More powerful motivation :face_with_hand_over_mouth::red_heart::heart_hands::heart_hands:,3
9b26de59-5f05-41f9-b543-6edad78e42c5,XOXO :orange_heart::sunflower: Grateful :sunflower::orange_heart: XOXO,3
72370f39-3d68-4e20-bda5-93a210069770,Why it's chargeable,3
2bc99327-53d8-4379-9095-6440b313329c,"I liked the look of the app and also journal prompts. What I didn't like and the reason I have uninstalled is, as I was going through the affirmations I had to stop and restart, this was registered as me going through the affirmations twice.",3
84c4b889-4937-44d4-97c7-d6e7d6b56910,:red_heart::two_hearts::two_hearts:,3
d2512153-3df5-4ecf-b7ba-f8da7b38e944,It doesn't count as a free trial if you're billed immediately. It's a free week to start.,3
cc691c96-5994-45e1-97e5-f1ba14cb9542,انا سعيد أنني بدأت اكتسب عادة التدوين اليومي,3
7d086e97-4008-407e-912d-643f403e325b,"I think the app should be free, someone like me I can't go for therapy but this is my therapy",3
03f17bd1-29a7-49db-8299-fa3122d97d80,There's always something,3
2538f6eb-4b6e-47ad-9dea-816ddbc88a86,"App parece boa, no entanto é um pouco lenta",3
2769cb10-6e99-4815-8548-e9e18543ea9c,nice app for journal but sometings are missing in this app and the pro mode I great but it costs money,3
ef9b45f3-7fcd-4cbd-bfc4-ec63f75b857c,reallyyyyy reallyyyyy good app :smiling_face_with_smiling_eyes:,3
44941e94-0776-4d64-beb6-271e0e21fcbe,Full Marks :OK_hand::OK_hand::OK_hand:,3
9156fc2f-1394-45e3-9e34-6d32c487c96d,"Nice app, but to go premium the monthly subscription is just too high and can't afford yearly either.",3
c150584c-513a-463a-af58-782590bf6ca9,"Nice App, but wish it allowed more pictures to be uploaded to the journal as it allows around 5 max.",3
890669ac-6b1b-4ed7-8340-f9179effb06e,am loving this app but the subscription fee. it's hard for me,3
6a73d660-4b3c-450e-9760-623d87108f40,it's cool the only problem I have is that I'm so thirsty for more positive affirmations but I can't afford them:downcast_face_with_sweat:,3
00078e45-0b6b-47b9-9b0b-5ad65fe005c1,:white_heart:,3
2eca15f2-e740-4b88-95a6-e8f8ad8916d6,Bomb app. There is adds but they are not overwhelming.,3
861e5c22-3e09-49e6-acf4-dd571e9477ac,some feautures are off limits as you need to use the paid version for it.,3
3138a34a-318f-44d2-b658-71718248f7f6,"It has been a useful app. I enjoy journaling and like the motivational quotes. However, I don't like that some prompts ASSUME too much. I got a promt to write about how grateful I am for my friends. Well, I don't have any friends...at all. Often people seeking gratitude apps, etc. feel they don't have much to be grateful for and are trying to find silver linings. Please be more considerate, some prompts make me feel worse.",3
bf1a181b-db28-4cfb-90bd-cd5d23a4f17e,"ok it's great. how long did my baby sister know about this app before she shared with her oldest brother? I'm not gonna tell my friends about it, so if you have a brother, you better tell him. it's great.",3
a501f0e8-cde4-4a2a-97a3-8e1ac8fc7995,So practical thoughts,3
f559ea28-b36f-413d-a97f-df49b2a064fc,Why do an app to help people going through tough times but only give a free 7 day trial?,3
351a7a3d-44d0-479d-8984-6c569a1286f1,"subscription model, of course",3
90dc9d89-4a9f-4086-bad9-f48fb34669cf,it's ok I'm trying to understand the pay process that was shockingly unexpected,3
d47f217b-5ab7-41eb-a463-1844a9ea3b1b,:white_heart:,3
3c7da79a-df7f-4cb3-8687-b80a32d0dc59,you have time to trial to do anyrthing,3
83c9c697-5fbf-472d-8ae4-d2330d0eedfc,Good app! Helps in finding the small things in ourselves. But the only drawback the prompts repeat! They should update more prompts! Giving them a three for that reason!,3
04534d98-4f78-4425-85e2-a39251534710,"It's a paid app , it may be suitable if it's free , coz many can then access it",3
2c9331d6-0afb-43e8-bc0b-e7835025eee2,"I think it's an amazing app that really helps you to analyze who you are and where you're headed but everything seems to be about subscription and that's something that kind of disappoints me. I mean, I get why they do it but it is sad that their app suffers from it because the potential is so big.",3
1adab534-8aae-42b3-9075-c04b9f9ddf7c,Alright journaling app with alright prompts. I only rate it at 3 stars because you cannot back up your data unless you purchase the premium and that's just wrong. There are better journaling apps with free data back up to your Drive or Cloud and that should be the norm. Kindly fix that.,3
a77dfb04-3b91-40ba-bd49-78d987ae0370,this is a great app but unfortunately I just don't have the money to be paying,3
9458261c-98e2-495f-94dd-964e2c8e9645,not bad:smiling_face_with_smiling_eyes:,3
d012cb8f-d1fa-4275-8c37-c17f10bcdbbd,"I need some help locating my account, please?",3
d942d3b6-0100-4341-9da9-49b8ac9e076a,The app is very great. The features and everything. But I have a problem with my app currently. It stopped working suddenly.,3
f895b6ea-969c-4e6e-9d15-a4748ac263ec,"Helpful if you struggle achieving mindfulness, quelling anxiety, or having negative thoughts. The free version is good enough for my needs, but you can get access to more affirmations and content if you pay.",3
447fef69-fe5d-4cb6-a9a9-724b8a5ba331,it honestly was a pretty good app but you have to pay a lot of money just to have things the app should give:grinning_face_with_sweat:,3
1ee72222-2bce-489d-be7d-9e7efd105c52,I didn't expect to like this app as much as I do. the daily prompts to write something really get me thinking about gratitude and that then gives you a more positive attitude towards the day,3
11ccbfce-fc0d-410c-995d-603090ae5aba,Its ok,3
cdfd39d1-3199-44b3-b5ea-ba8d406749ab,it feels like am taking a counseling session with this app...I think yourl should really try it out..I get to express my feelings by writing them down,3
eae86706-d3a4-4785-8065-70410f8b6eef,I'm hoping I eventually find healing:smiling_face_with_smiling_eyes:,3
206f8216-dd96-4a04-a134-03536c34e6ac,luv it so cewt :ribbon:,3
8273ca2d-7941-47f8-a53f-b50f5d8f4542,"It's very stress reliving, and it's very therapeutic to be able to write based off the prompts.",3
8026dd99-e259-44f4-b0fa-cb6250f0c23b,it is very empowering and gives you some serious things to think about and to be grateful for. I think I'd live this app so much more if I could afford to purchase it. it seems to have so many more empowering features when u pay for the app. The only reason for 3 stars is because I wish they'd consider making all features free just to help those in need of this type of thing in their lives.,3
1c9cf343-d7cc-432f-9b70-cbdde6498e58,It made me focus more on my positive side,3
5152c709-bbd9-4901-b454-a29f334f4701,I just wish you could add music for :FREE_button:,3
d8b3692e-71ce-40f7-bf48-143668ffd9f5,"I love the app but I'll have to unistall. The journal background colors are so bright that I just can't use it, especially if your Journaling before bed.",3
bd6f4d33-5330-4ed1-bc57-c8729b1e935d,I love the app but cannot pay 60 bucks per year,3
ad6c2ded-b790-4bae-9344-47dac42f1898,I love this app. But I think there is a bug. After every journal entry there is an aggressive warning that your notes are not backed up and it uses language like I'll take the risk. It's basically an attempt to try and get you to purchase the premium version of the app. Even after I close it immediately pops up again. It's quite stress inducing and kind of ruins the whole point of the app. :(,3
d6010c3a-a4dc-44e7-8816-b30cea73f78f,wasn't to into the whole idea at first but kept pushing myself to get the words out,3
91e851c4-2740-4147-bc85-5daaa5a0c54f,Better,3
ab599812-7970-41bc-9387-6534e1fbe931,wish there were more options to organize and or delete the affirmations once they were already in the folders versus having to make a new folder,3
471fbbb1-9f54-48cf-8682-c8a34ab30774,This is actually a good app. However RI did not realize that I would have to pay to access all of the features.,3
9abc2a9d-2be5-410e-967e-7c8122c56fd7,"At first I've always been a little skeptical about these things. However, not that I'm actually working through it, having a guide for positive self care. I can feel and see the difference in which I treat myself.",3
b286ba39-20ef-4fdc-9557-93a08cac4cb5,first time trying im going to explore more about it,3
98159cc5-1f22-416e-a76d-b74a7cbdb0a9,it is very great app but most of the things in this app needs premium. If you don't have premium this app is not for u.,3
1e7ff752-13e0-4c6d-a3bd-c84f36c9a00d,It's heartwarming,3
4257cc6c-0182-4d89-bbc2-8bb65fc70ef2,kinda nice if you just want to be happy sometimes,3
c9e45f12-2cb3-4f78-bb4a-9b36d9ffa7ad,I have been having a greater mindset over the last few days,3
1957b454-2030-44c7-9c5c-dbb4dbfc5f56,siuuui,3
e9802c26-7040-43cd-ba67-62b42b40fad8,I wish I found this sooner,3
79078f62-d1dd-4f70-83fe-42237b673202,well it's only my 1st entry y' all,3
f0eca94d-69a5-4dbd-a2bd-3922ebda761c,I'll try to download again at another time.,3
3eda83cd-b4ec-4049-b080-a2f4eabb6447,Gratitude is good but I thought it would give you motivating sentences everyday. I didn't think you would write entries everyday.,3
1a8697e9-8349-4492-88a1-e5c5a816c52d,:purple_heart:,3
f406f773-c703-4757-a123-38e0b5fba1a2,it's good but the upgrade is expensive and is difficult to use without it. best free journaling app I have used so far though,3
fbf0993f-b713-49f1-aae3-dbba426bc72c,:red_heart::clinking_glasses:,3
9c00b7c8-5a7c-4def-8f8b-971cfa191812,"A bit pricey, but I decided to pay it. I like the app and am actually completing short prompts throughout the day. Feeling better overall due to focusing on the positive and letting go of what's negative and/or not in my control.",3
5ee99730-b4f8-447d-ac13-92f9caf4d367,it's a KIND app. it makes a difference :winking_face:,3
e3828537-ded6-4b57-b992-eef5f54dac03,Definitely but some contents should be free of Affirmations,3
884428a2-9f54-45a1-9631-f74694eac3f3,This app really helped but I don't want to continue here any longer.I want to cancel my subscription now. How can I do it?,3
33bb793d-e4fd-4fbf-a653-7df51957a779,"Engaging enough to be effective, but not overbearing or pushy enough to be annoying. I have trouble keeping up with these usually because it's difficult for me to commit, and I feel too much pressure to be perfect.",3
fd1204e1-d66d-4266-baeb-0ce8459dedc9,A little bit better,3
e264260d-0c47-4754-9545-2b99843057af,hopefully good but I'm new,3
c0241269-cbdc-4c8a-8295-143e3c0d7d93,a good app but alot of the fun stuff is with premium but that is acceptable ofcourse.,3
e10a4d25-a6bf-4b70-a676-c4f71443c52f,I need to know if everything is right :thumbs_up:,3
5ece44f2-993a-4bc6-9214-e6af76e3629e,Amazing app but my vision board wont play can you please help,3
cad08921-8555-4ada-96f2-3820c7a5897d,I just started using this app but it is working so I'm going to keep trying.,3
16f590ba-f066-437f-b3ac-6d5df15086ea,that's a great app but it was better if it's free because I can't afford it and it can help me to get rid of my anxiety and everything. thanks :folded_hands:,3
40fdaa03-2b69-4351-b8ff-ff3ad1b21617,"Love the app, but wish there was no paywall. I understand that paywall=income for them but it's hard when so many features are limited due to this. love the app though",3
1a4d05a4-c24d-44d2-8c15-6977527b7e63,mauj,3
9e4a18cb-cb6e-4e08-86e4-ac61a35421ed,"testing app, so far its alright, some festures are behind a paywall",3
f0958d96-ea05-45f8-85c3-d0ab57fce4a3,"so far so good, however the music for the vision board needs to change, it's quite an annoying tune, maybe have an option to choose music/sounds for that section?",3
47fb9d89-433c-445c-9525-a5b712dd7137,This app is awesome but I don't like how you can only make one vision bored and if you wanted to make two of them you have to pay for it! Otherwise it's good,3
cd74ac11-0dec-4320-9b1f-75327ba195ef,It is good but there is no option to write any manifestation or affirmation on our own.. it's all that u can select but u can't have your own writings and any reminders kind of options.,3
c0f45a14-7ab4-4bb8-a8ba-5b5cf7d5b694,"It's a great app to help me get my mind off things, but I wish it gave me more incentive to actually write entries. It gas a streak system, which gives you a reminder to write more entries, but at that point, it feels like a chore...",3
db5efd88-feed-46a4-8a88-1eb0734317a7,Good except the notification come as random times I should set that up,3
f69a7c50-0aae-4f35-8506-0d31576a7172,"I gave 3 stars because we have to pay money. I actually like gratitude, they could give you very good Journal practices and keep your mind set productive.",3
a23abb1b-d819-4cca-8a7f-eaf4e14ca53e,amazing app in my opinion. It has different categories to write about and there's even a shuffle button if your struggling with the question. All of your entries save if you want to read them later or continue them at different times. The questions can range from deep to surface level wich I love. Also if you download this app go into it with the thought of just writing something down express something its better than nothing. n it feels so much better afterwards. •3 xoxo me,3
a304eb3f-ed8c-4d5e-8901-d1a294553e07,NAKO PO,3
b71faaec-1bda-4931-ba5b-e6785e8584a5,Only a 7 day free trail and want cards details from the start smiling mind app is free,3
6f69c386-8b66-4f73-b5f4-1aaeec33a00d,I love this app so much. But unfortunately I can't backup my progress unless I pay for it.,3
b3c35deb-2e37-4d05-9d50-b9c37c1b69c1,only just got it but it's good :thumbs_up:,3
5f160413-e544-4863-bd1a-bf5334294258,"This is a good app, but it was SO MUCH better when we would get animations for each completion. I was much more motivated. Now, I am not as consistent. Please bring it back and I will rate as 5 big stars.",3
7d7395cd-70a3-4177-9ba3-1350d507f6ba,its a realy good app but you have to pay for most of the affeemations and im not a fan of that,3
8b41da54-733e-433c-a7b5-2f3d44cacca2,:dove::heart_suit::sparkles:,3
3972c776-8f09-408c-9768-c131a7a3ec09,Its pretty chill. Clean and simple layout. Though the aesthetic you could argue it's only towards the female gender but oh well.,3
af4105db-9ed5-4791-aef2-fde95664db19,I like it but I expect it to let me write about bad things that people do to me,3
b4e4aca3-3882-472c-8b75-1943707010dc,it's only a free trial then sub,3
9e66cedb-42f9-4ffe-b97a-7184ce698f36,"it's was really too good & I really like you, that helps keep positive...:star-struck::beaming_face_with_smiling_eyes::smiling_face_with_hearts:",3
4ecf9bfc-3216-4714-b6b2-d0eb6d460eb7,"Okay, so apparently the developer email goes to multiple people, and I was only getting an undeliverable from a previous support person. The developer helped me with a workaround to be able to choose the Gmail account I wanted and it worked! 5 stars for this alone! Google Play expected me to delete all other Gmail accounts from my device to sign up for the trial as a workaround to their glitch rather than fix it. I don't know how the app works yet, but I'm excited to dig in!!! Thanks, Dev!",3
8d4fce3c-0fbf-455a-b4b8-0c5ec95fa4ac,giid,3
defd91ba-3ebb-4de2-a01a-25c56d2ec34a,good for expressing butttt....... too many things are locked maby its bc im on a three day streak only but idk,3
4f58792a-eda5-4b8a-a8b6-10a1068771f3,"it's a really nice app, I get random affirmations throughout the day, which I do appreciate. however, most of what I'm looking for is blocked for premier users. personally I cannot afford another subscription.",3
54a9adad-6d42-41d8-8cbc-e4545798bbc6,Been only a couple of days but i feel the positive energy already :smiling_face_with_heart-eyes:,3
faafa40f-87c9-48dc-a457-6180011b9b91,It's okay,3
caec5666-6026-4b25-b67b-f86fe8c02507,I have found more self confidence,3
0d6650e1-9de0-446b-99d2-2ea774e0554e,"Ás with any app, I can only rate it for what I've seen in the short time I've had it on my phone. So far I like it but, I can't afford the subscription right now so my use is limited. I'll keep you updated.",3
5132751a-6c6e-4655-bf1e-6cb14930058b,I just wish I could add more on the vision board without the subscription,3
f12dbb3d-5a95-423b-8188-be7b9d0193ec,"i would want to say that some of the features in this app are not available for free , we should pay for it and that is a major draw back in my opinion",3
ee77d564-fdd6-483c-94cc-07bfa7b72a7a,Meh.,3
4924ee93-53f7-499e-b36c-3875eb805ff4,I do really like this app but the notifications don't work!!,3
c1d7bbf1-d3e6-4ef9-b612-b7a7b013ea05,"Membership costs should be transparent before download, a 7 day trial is not long enough go experience the full potential of the app. The feedback is generally good so I downloaded based on that but I don't feel I will get the full experience in 7 days, needs to be 30 days min for me to subscribe for a year",3
54a794ab-93fd-4ef7-8102-a846ab2d66c2,Too good. You can add pics with your memories (number of pics depends on the subscription).. overall a cool app to open up your emotions Recommendable :thumbs_up::thumbs_up:,3
5bf9a39f-adf4-4714-b6db-62ac4f09d33b,it doesn't tell me how I have to write or how much I do it.,3
41b3ce92-5fdb-4517-8c67-3f41e9d2af23,this is a really good app but it's missing something,3
0c5ecd5b-3d7c-4aee-853c-3d357826e115,"It's not the most fun, but it is good. I could stand it to have a little more fun.",3
ab95dd1b-667f-4e8c-9c22-47cef80e27a0,"Innovative! I am enjoying it, but try to turn on the storage backup, and it doesn't work if you don't purchase a plan. That feels kind of scammy to me. Bummer!",3
680858ff-a840-468f-923f-d964e705f62f,برنامج جيد للامتنانات والتوكيدات ، لكن دي شخصيا لا افضل استخدام تطبيق لهذه الاشياء انما هناك طرق عديدة.,3
d228c872-44d8-4e8a-b109-cfbc29773bd0,"The app is good. But if daily backup is going to my Google account, it should be free. Now if a free user looses phone or switchs device everything is lost. The UI is nice and smooth, overall a perfect app:sparkles:",3
5a123fdf-eec5-47ed-9ffb-a24b082d544c,Good but u have to pay for it,3
c71a8a79-bc58-4d45-a805-a60a02ed74bf,it's soul soothing at some point kinda like having someone to listen to you at any time,3
c581b916-350b-4fea-b15b-6f877f5b1941,its ncaa:OK_hand:,3
01129d22-c57a-4946-851c-2394021ce869,"Really liked the simplicity, but it's seedy method of getting you to give it your data by saying your data isn't backed up and then not telling you that you need to pay until AFTER you agree to a long list of (permissions) has earned a 1 star from me. I'll bump it to 3 for the response. Shouldn't ask for permissions until you explain that it's a pay feature",3
2bacdee1-4acd-4a0f-8c3c-1a2f41378cfe,For some reason I can't start the new year challange it just keeps taking me back to play store. Does anyone else have this problem?,3
6d8db334-f37c-4c16-99dd-9e0b4c820fe7,"Honestly, this app is great. The problem is they try to make you pay for so many things. I am a minor. I am not able to pay for absolutely everything. I was going to make vision boards for future goals and my sports, but then it said I have to pay for it. I was honestly really enjoying the app, and now I am kinda disappointed everything I log on.",3
0127af99-f656-4b02-9fd5-d17b8a20f107,I'm just getting into it. I'll be back with a more in-depth review later,3
1c147c86-1538-40e6-8d8b-5d1c31ce4f24,Over all it's good to use if your bored or you like spacing out,3
e167238b-4a49-4746-924a-66ca67874dbe,it alright and also helps with my anxiety and vocabulary. but the subscription part isn't working perfectly,3
5222c201-a398-46ca-aa8a-7de3aaf2322d,it's okayyy. it's pretty helpful and relaxing you should def get it if you want to help yourself grow,3
3e2329d8-d2e7-40f7-9ce0-11feadfc67eb,"Backup your journal FYI lol. I just got a new phone and logged into my account, but apparently, all the journal logs and entries made were only saved on the old device and wasn't backed up via a cloud service. You have to toggle that setting up. Overall though. The app has been good. Has been a struggle to do some of the challenges daily, but it's been good",3
0bc9f3bf-dd04-4b01-bb0b-ecb21c03cf4d,"I'm a huge fan of this app and happily paid for the premium version however I wish the Daily Louise Affirmations would update to add different affirmations each day, they have been the same since I Downloaded the app",3
10e0eb75-71bb-4a84-aa8c-da54b321e45c,Hmph it's nice if it's feel nice app made my mental health better,3
d26d6f7a-ed6e-4729-8a2d-86a09d5a8995,i would give it 5 if it was free,3
9a204974-8ea8-465a-a1da-0dcc8764233f,It's good in a nutshell...but still there's a scope of improvement in terms of the variety of topics it offers to write!,3
68bb256c-6ef6-4c29-aae2-423af4123f5d,It cheers me up to look back at my answers.,3
dfc1d475-e6f3-4efc-b887-66c29cef153a,awsome application,3
eee75959-d801-4067-8159-640b9a7d47a8,Paid but okkk!,3
34c5561f-3cb2-45d9-866b-59c342ca8587,I'm starting to like it though I just downloaded it 3 days ago.,3
30653ee2-ed1b-466d-9a7c-5e9979ca1134,"Hi! I really love this app a lot. But, I mostly do it on my tablet so and this app wont rotate to landscape. I'd really appreciate it if you could work on this. Thank you.",3
ce0ae021-660c-43a7-bc94-2af080ac92ce,"Annoying to now have monthly payment plans. I bought this app when it was a one off payment to purchase. I used it daily and really helped me through the lockeown. However, the new monthly payment plans are a bit cheeky considering some of us already paid for the app a few years ago...",3
0b6acb33-e4c2-4ce5-9c90-59afaaae6636,In vision boards I can't add description or any captions please fix this,3
d8a45a91-a175-4db0-a407-060231ea5cb2,It is a good app but if you want more out of it you should upgrade.,3
7555aa7f-2f58-46b4-b508-0e1e088cae1e,"I love the app, however I have upgraded but the app sometimes shows I have upgraded and other times it doesn't, meaning I can't access everything I have paid for. I have emailed the developer and I am waiting for a response from them.",3
ac6a98b1-4399-40ee-856e-126501187e81,I prefer this app.,3
8eaa37c3-c963-4067-8b54-06c6225efc38,"I really this app, but it doesn't let me make a back-up of my notes if I do not have the premium version.",3
696bd63b-5e29-416c-aac9-ac4103c3c79c,Well here's hoping it went aswell as the first day,3
5f6cf916-e087-41c4-b1fa-fb1230d92c05,Cette application est super mais je la croyais être en français. Devoir traduire a chaque fois perd un peu le côté bien être,3
0077dcb0-89bc-4802-a66f-a61315c903e1,I've an issue I upgraded to pro version but while upgrading I mistakenly closed the app after paying nd now it's showing me to upgrade again but I already paid the ammount is there any way to fix it,3
e7ec49bf-8532-41aa-91e5-3afc7a31ef8c,"Ok app. Challenges do not work - they're constantly stuck on day 1. Very frustrating when trying to practice more positive thinking. Trialled this app and another at the same time, and this wasn't as good for that reason.",3
a226c660-5daa-4efe-a6fb-75d2c1533ba5,Wish I could do more without paying,3
66dafea1-5d56-403e-ac79-2cdc0d7d2e39,it pretty Kool.,3
dd56d395-1bfc-454a-8b0a-8edfc3bc10fe,I am starting to like the app. What bothers me is that it's not free.....,3
c938d30b-9276-4a79-8e9f-4aec8bdcedbd,Just start it. Don't think,3
251fbd33-9f41-4039-8a3d-425531aa5bda,makes me feel better,3
db2263de-c4e6-4f7e-b335-19f3b99da581,I really like this app a lot but I don't like the premium feature. I feel like this app already has so much to offer for free that they shouldn't even need to make you pay for things.,3
cebf6943-015e-42ef-ac8d-1bd20fc23e97,I give three stars because I don't like the new prompt. In the old version it gave me thumbs up for my entry and it kept me motivated to do the entry daily now it seems plain...something is feeling off.,3
fb7a0a20-d357-456b-b5ab-7df010548442,give it a try :smiling_face:,3
28356c09-4db6-4b66-82bc-28f595354cf4,just wish it was free. would help so many out there if it was,3
