reviewId,content,sentimentScore
8f5e99cd-2dde-4203-a133-693c8a9070e4,I'm a little disappointed with the update of the app as I don't get the daily Zen messages that I used to.. they just don't show up ...the page is blank.. can someone pls get back to me on this and how I can sort it !?,3
1495f509-a052-42f8-9a7f-7eb5e2c75728,"Great app, but transferring from phone to phone doesn't work.",3
d7a3aa87-863e-4c02-b871-f8d4a4ee4a59,"I love the software, but the pro version is an insane price in my opinion. Could be cheaper and have more people in pro version.",3
303a3308-a323-4b7b-a2e2-58368a9f7695,Fed up with having streaks reset. It's more punishing than it is motivational. Wish streaks were optional.,3
3ebb2c73-4df4-4b48-87ff-bf675aabc93f,Why is it that for an iOS user the daily reminders to write what a person is grateful for doesn't change but for android users there are alot of different types of reminders on different things they can write about ?,3
11d45003-9b3f-4b00-80b8-23d17dd4caa8,:thumbs_up::thumbs_up::thumbs_up:,3
bac1b1c4-50cd-4b47-a6ab-f4faec37979e,Would live to have some image inspiration and stories of other people,3
597b50db-3ceb-47a7-9b18-ae81a9990b4c,I love the app but should include features. Such as gratitude meditations. With audio tutorials..,3
72702a4d-f2ad-45e8-8fec-6ecf1236af06,i love this app but I can't restore my data from another phone. I'm trying to see what pro has to offer and it's cost but the app keeps shutting down.,3
e3ff6fb6-1866-48dc-abb5-875b997efd6f,"Was working fine then suddenly stopped. Cannot post to instagram anymore . Okay thanks for replying so quickly, will do as you suggest. If it works you deserve 5 I know it must be hard to get these apps working well all the time Thanks.",3
390e9cb5-e04d-4366-af0e-6520f8c21154,I didn't realize how my I am grateful for.,3
0d896c71-0798-450c-895d-aa9c5e07dd0f,"Basic app but helps remind me to do a simple yet important thing, be more grateful and positive about life.",3
5716bba4-edf7-4457-b4ab-a9efb4e7e8c7,Have not used it yet,3
89d27f6e-9337-46f1-b591-f519dfa61514,Lobe the quotes anf graphics,3
8319c684-b2b9-4b00-a27e-2b930722489b,Fine. I just get alittle annoyed when it nags me to write every day.,3
aac64cca-aec9-41a8-bd73-37616dfe141d,It's really changed my attitude towards life,3
c3ab5617-358f-4589-a76d-4eff2b74004a,It is okay.,3
7f0c973d-61da-4ca1-bbb8-38a2a1254239,Still sends the daily quote but my reminders haven't popped up in months. Please fix this,3
3dd9f373-6ab3-41be-a97f-e777c913fd2f,"Great App, but notifications don't work.",3
41cd57f1-0b9a-4755-a43d-60de990a183b,Really simple concept but on a bad day it's nice seeing all the things I was grateful for in a list like this.,3
97f31d36-eda9-4443-8d07-ba0b102d95df,It's ok not to bad,3
98f9e483-056b-4a9a-a475-2f492b71f3b9,"It's a nice idea, just the reminders are a bit much after a while.",3
33f2e53d-c087-4421-9edf-85568f4c0434,:blue_heart:,3
13ad7f27-54ce-417e-b4c9-7c540d14618d,This is good. Just not what I expected,3
3a4e0956-fee2-4f25-b38d-4d19f88d8ad0,:two_hearts:,3
659ec700-20e3-45e0-967b-d0b1d46c4f0f,I like the app overall. I just wish the pro version was cheaper. I'm not buying.,3
88e07236-045b-4b36-8d83-c7bc4ffba411,Can include positive quotes and affirmatioms.,3
d215da2b-9638-456c-ad62-5c9bdd5a9884,Feeling better,3
ba322d2c-2c58-4ce2-93d9-de55e44aae70,I don't know why this app keeps asking me to link to my Google account. I don't want a gratitude app to have access to my Google account. Frankly I don't think it's that important for me to expose myself to a potential security risk.,3
4af1b1d3-08c5-49f6-aee0-eac384c01eca,"I needed something simple, that could be a companion step by step...",3
ad198d96-5e66-45b0-82e6-8cbba21006c1,It's okay,3
8373cdf5-c426-4f01-9c5c-36865a5b9487,Thank you for your reply. Unfortunately I want to like and enjoy this app. The problem is that I get notifications that I can read only as limited to display of notification but when I open it whatever was in the notification is gone. I'd like to be able to launch the notification and have the prompt there to respond to. I hope this makes sense! Thank you! You can't change font so your stuck with the one built in and the only backup option is to Google cloud vs local device or sim.,3
10cda067-871f-497c-9a11-28d73de3424d,It makes me think hard about the good things!,3
7d8d472f-6513-464b-90ea-451ca5ab9494,I like the app but I can't get the icon to show up on my home screen. Any suggestions? .,3
2ff2bf5e-d31e-4ccd-b3d6-efbd83f389a1,Better gratitude journal app,3
381049ed-4512-47f9-ae1f-faf354805428,I wish the pop-up reminders would show the whole sentence instead of only part of it.,3
b15cfdaa-5e07-45e0-b3ab-22fbd540ceb6,Uplifting :slightly_smiling_face::seedling:,3
77fe751f-f847-48fb-8088-df6343de2277,:two_hearts::two_hearts::two_hearts:,3
d25fd1d3-3c65-4eb2-a0cf-749f8822063c,I like the fact you can write your own stuff . But could have affirmations to choose from as well. That would be even better .,3
22b5226c-d826-49d9-b18d-06145250556c,"I would give it 5 stars but it didn't back up my data a few times... not sure if that's cuz lack of update, google or what but if it backed up my data properly I would give it 5 stars.",3
28e503e4-1afc-4f70-a6ac-70921b750008,Could be better,3
5254aa00-ea0b-425d-9a7d-2f5d7eac2f21,"The only reason this app isn't getting a higher rating is because i feel there is something missing, that i can't put me finger on yet. I'm sure they will figure it out.",3
66b2fc84-8ef0-49b5-907d-d8bb12ae211a,Good app. But PRO version costs toi much for the features given.,3
7af2d6d3-ae8b-4975-bebb-68c8bfb8bd23,"The app is great, but I lost all the data from my old phone..",3
014ea1f4-80bb-4f42-be08-cca348f5fb94,The journal helps me to become happier when IAM not happy.,3
46f300b4-44c2-42d9-ad23-e52efb3370bf,"It's annoying and hard to make yourself look for positivity but you have to try. I mostly just use this as a journal to work through my feelings but I also try to force the good out of the day. One night, I had an anxiety attack and all I could do was journal and affirm my way through the tears and pain. Just try. Do it for yourself and the people around you.",3
3036e532-5831-4558-989a-f7f1c3b39a34,:thumbs_up::thumbs_up::thumbs_up:,3
5037d646-e808-4fbe-9052-b4e39a80350b,Small positive reflection every day,3
19419b44-2025-403d-8e80-4dfbac1cab61,It's nice to have something to remind u to jot down ur day. Especially when its not that great of a day but u have to think about what u are grateful for anyway. And it doesnt feel as bad anymore.,3
041704e9-911b-4062-aa2e-fc2068bd2373,Useful short exercise. The quotes are thought provoking not puke inducing.,3
378d1eef-0651-4545-82c8-a1481e60e222,I seem to be a little grounded useing this app,3
d5656733-9fb3-4885-8533-cf56c6523e78,I am happier. My head is clear.,3
ad80ed19-eca9-410d-97e9-8dcff2dade88,It is awesome but the only thing is that I don't know how can I use backed up data to get previous hournals back after uninstalling and reinstalling the app. I can't get my mobile cleared because I will lose the journals.... :disappointed_face:,3
42689305-9bcf-4d6c-b172-68d194034ec9,Changed my world view There are milkions of things to be grateful about and few things to morn about choose your option now,3
62fe9bcc-bfcb-4b5f-bdac-aac1d319640d,The app is sooo helful,3
ecc939b2-2418-4a91-aa68-925b4e52f085,"It's straightforward. You are reminded why you're grateful, you write it. Rinse and repeat. Though on my side I keep getting the same prompt more often than others and it's annoying",3
48cac976-a5e9-43d7-b166-e0f4d953f8cb,I think it's good to have something like Gratitude to help us pause and reflect on what we do have rather than what we don't.,3
7136d969-28d4-48c6-ae36-ae47acd448d8,:smiling_face_with_heart-eyes:,3
a68495c4-317c-4f0f-b118-fef4b3345cad,"When i try to share the quote for the day, it cuts it off partially so the whole quote doesnt show. Not sure if this should happen. But thank you for a great app nonetheless!",3
e5c3c2af-c8f5-40db-be2a-c31c78bc86b5,I'm going through a crappy time. So this I needed.,3
881875d6-7a67-4aa7-9221-0b7060a24865,Some of the quotes don't work for me. I really like the morning affirmations. I don't like the evening reminders. I haven't checked to see if I can change them.,3
d9df2b14-1312-47aa-a9cb-5de3fec586e7,:smiling_face_with_heart-eyes: :smiling_face_with_heart-eyes: :smiling_face_with_heart-eyes:,3
8889cc94-187c-45fe-a37b-b84cd2792f31,Find it very grounding it focuses you on the act of being grateful which is a very useful tool in self care.The little quotes each are also useful.,3
af696f71-f92a-4120-b2ab-6589cc78b35d,I am unable to change the dates of my required choice. It gives only 3date choices. Otherwise the app is good.,3
b1bae134-f9f1-4242-946e-eace84997058,I like the app. One problem. When I changed phones the app moved across but I no longer received my daily quotes as a notification on my phone. Not sure how to turn the daily quotes back on. Because the settings say I'm receiving them but I'm not. Please help,3
e63a46b9-a7e1-487d-9873-8bc6875782c5,:OK_hand_medium-dark_skin_tone::OK_hand_medium-dark_skin_tone::OK_hand_medium-dark_skin_tone:,3
cc33df91-c1ff-430d-8fa4-f71ab01119cd,I'm mostly satisfied.,3
00042d19-761b-49bc-acda-0caeb57ef328,"Great except did not like the featured dumb, unscientific law of attraction quote from The Secret.",3
69f9ab07-0628-4264-81f3-d9a66154d77b,It has changed challenging times for me.,3
b76e2b3a-7fa2-44ee-b04b-186517514175,:green_heart::green_heart::green_heart:,3
7ed66707-69aa-41c5-b577-1bff054f80e8,Good but I couldn't commit and it was relentless,3
ef5d81f3-7c00-4017-af71-56491c2bcc6b,:oncoming_fist::oncoming_fist::oncoming_fist:,3
b573d149-cfa8-435d-a415-d2737a67cad2,i wish i could download it again,3
7a198654-8efd-41ed-9a48-60db9cdb94d4,it grows on you and is a great start for change but keep on it,3
87023758-db52-4db1-8847-4f51ae3d2e23,"I just started the app, suggested by a really good friend, I think it will be useful to me. For now I give 3 stars but probably I'll change my opinion. I hope. Thank you for this app.",3
4794ff23-f0cd-4006-a940-8a6ffd687cd0,"""If you are grateful I will increase for you""- Quraan",3
b8b15362-00b8-4fb8-80aa-97fb298a4814,:thumbs_up::thumbs_up::thumbs_up:,3
ef9e9a1c-de99-4682-9796-f2e4c28e12b2,I didn't have to create an account like other gratitude journals. But I do have the option to back it up,3
b8523618-702e-46cc-ba94-06f4c4e03cb0,i think its great but we should be able to give a like 2 the other participant to show support for there postage gratuity,3
5f29555f-f2f7-4102-a2a9-75224827ecb9,"This app is pretty simple, but thats what I like about it. I really enjoy the daily quotes, so much I copy and paste them, but it stinks when I miss the midnight cut-off. A swipe for the previous days quote would be a great addition!",3
fe2aa086-086a-4fb2-86ac-f1ebbc92b44a,I really love the app but having answering the same old questions after 4 months has gotten extremely monotonous. It would be amazing if you could add new prompts periodically or at least let us add them for ourselves. Thanks! Update : New prompts have been added and the app feels amazing to use again. :) Thank you!,3
7cb9aebf-0fc6-48f4-9845-c6441a66224d,simple. no ads.,3
4178c3f9-c9c7-41a5-8299-e45aef0d3cda,not bad l would like to see some type of search function though,3
9ef080b1-570c-4c2c-901b-0b6c844ea6c4,Just like a journal to write happy or gratitude thoughts. Not really that special. You can also read quotes from famous people.,3
6eb94842-8bba-4ed2-802b-d465a686464a,i like this app alot.... THEN my days got messed up somehow. There should be a way to fix the dates if u mess them up. I would be Grateful for that :beaming_face_with_smiling_eyes::thumbs_up: Thanks,3
a9dfb057-73a6-4905-b7cc-0948b7519e63,"I loved this app but the last update deleted all the photos I had uploaded, which sometimes were what I wrote about. and having switched phones, nothing transferred over.",3
c7412c91-76df-47dc-a3ef-7192f0f0460a,баярлалаа,3
e0dd051c-6766-4c67-a762-f6b8ed40d609,its good wish there was more to the app.,3
9a0d6384-7164-4ef7-8598-7df6fb3dc39d,"I've been using the app almost 3 wks. I expected it to have more features. Like pretty illustrations, page numbers. there is a camera that I have no use for. But, it's all so plain.",3
63f1f6e9-4aa1-47bf-9b15-934d79094390,wish that the daily quotes were able to be read later on throughout the week instead of disappearing daily,3
2f9ce452-0723-4952-8ecd-bfc4d3d31841,"i like the app, but photos wont upload to affirmations or gratitude.",3
791abb03-d1e3-4503-bf66-37faa0400b15,"The idea of this app is great, nice, easy and simple. It really helps. The functionality is a bit problematic. Previously it couldn't be exported manually. The backup to Google Drive only worked sporadically. I figured that by turning off ""Automatic restore (of the last settings and data on this device)"". All the data from a replacement device could be restored!!",3
33adcbb1-696f-4840-8896-e80ed686508a,can some one help me to understand is my daily updates are out for others to view ? I see in one section the affirmation are all displayed in public ? how come ? how it works there is no clarity about it ? why the the data of others are seen ?,3
6ee14637-6908-400c-aaa5-e4e6eb8f1116,"It's good but it could be better :) please add more beautiful colors , thank you :folded_hands::growing_heart:",3
cd7dd318-be22-4199-bf87-83a32129107e,it was working really well until this week when the update put the app in another language. how do I get to settings to change it if don't understand the language the app is in anymore? help!,3
89cf2653-d632-44d5-a005-dae34d2b72c6,just gpt ot,3
bf7439c1-bda7-45d6-9135-7f281e613093,lo e it,3
15704af6-fae1-4361-ae36-e9856f56d8ee,this app could be better by keeping God out of it. Spirituality does not have to be religious,3
fc454690-068a-47d8-a794-ca8551b21f8d,:two_hearts:,3
cf424fa0-935a-4912-b231-1598a22ec24a,Not to bad,3
3db8cbeb-16d1-4657-8792-996a25dea52f,its ok,3
ea14c6ea-db3f-4092-b54d-4b186064820a,ok,3
7e06f0ff-3b80-4171-a4a1-f735e5ded053,"This app slowly but surely changed my attitude. The morning quotes are a great start to every day. The features are helpful, yet minimal. They stay out of the way and let you write.",3
9b2090ab-d262-4a2d-bc62-7f42ef2e860a,The reminders have changed the way I view my life. One thing I'd like is for the long reminder titles to be easily seen. Right now they're cut off.,3
4fbf390a-ed6c-4a5e-a125-24b8c0ea8ccd,Would like more of a variety of prompts to ask me what I'm grateful for.,3
4e83594f-aac7-42bf-b1dc-2e162af36a36,This was the application I was looking for .....:OK_hand::OK_hand::OK_hand:,3
38e45034-be76-464d-aa2a-42602a5c1fed,it would be better if i could have the app in my computer aswell.,3
b5539ffe-c85a-4b02-94fd-05f092c26ccd,"Update: This app just got better! You can now add personalised affirmations! You can This is the simplest and the best gratitue journal I have ever come across. It has a cute interface. I can easily type all the things I am grateful for each day and add a picture to it! I am truly grateful this app. Till now I have not come across ay ads either. Moreover, this app doesn't provide too many unnecessary choices (like fonts, etc) and keeps things simple so it's a plus point for minimalists like me.",3
63c80f9a-b8f1-45f1-8257-3e1bfcae34fb,"The quotes each day is helpful with motivation. It is easy to use, and you can set up reminders. it is helpful to slow down, and remind yourself why you are grateful. Unfortunately, the app does not help with the disciplibe to write.",3
c7b267b2-411a-4959-a40b-443d762835e5,"It is an attractive and easy interface. Unless I am missing some amazing features, it really is just a glorified app for storing sticky notes. I really liked the many suggestions to start me off with writing when I first downloaded the app, but now I don't really get those prompts anymore and it's difficult to find something to write about.",3
690c52d9-d316-4d05-bff0-c726ef98bf70,I'm starting to love this ap...but if it went away...i would be really bummed if I lost all my content,3
2860d6ee-a7b3-43c3-8386-b8f4fc6c607e,"havent opened it yet giving a 3 cause of the 1st review I saw. cause we cant respond to others reviews, CONGRATS ON RECOVERY and i hope this app gives me the opportunity and relief it did you. will update in due time",3
af0d543f-8c0f-4ce7-affa-174def586ccc,"For prompts or inspiration hit the ""?"" That's what stood out to me about this app compared to the others.",3
145ace41-bf0c-46b3-80f4-a05441a21c0e,Would be complete if you could allow for past entries.,3
1fefa94f-21d9-41c7-825f-3de5ffd26bb2,need hourly reminder,3
efd1b088-63c1-47e7-9b5b-7a106c5e14cf,"12/2018 Galaxy Note 8: :star::star::star:Enjoying app, easy to use, simple to do. However hoped it'd have more to it: music, rate your mood, brighter colors, background themes?? & edit back more than 1 day. I leave with a dull, blah feeling instead of upbeat.Maybe its pastel colors, needs some pop, zazzle, to it.",3
4181aa2f-1116-429c-8247-4bd87cdfb9cd,"just updated and yet despite notifications being turned off, they're occurring. please reevaluate.",3
a0cae529-2e98-420d-bb44-b9c68925b05d,"I feel happier already, thank you :slightly_smiling_face:",3
ca865edd-56bf-49b9-bb01-7e803cfeb234,I loovveee it,3
67f24d26-6e04-4a58-a6b6-087fd24d654a,I like it Except for sharing!! :enraged_face: They have some really great quotes however when you go to share: It Cuts The Quote OFF!!! :angry_face::angry_face:,3
724c5734-0197-4e12-aac1-cc270553b384,"It was a nice app. My slowly dying Note 3 started fritzing after I installed it, though, so I took it back off to see if it's causing a conflict.",3
d3d3d5c3-a64d-4e0e-83d5-26a5cca6e52b,"To bad only backs up to the cloud. For security-mind folks who want to only back up locally, no accommodation for. It seems great, otherwise. Buy uninstalling. Good efforts, though.",3
f7f8a9d2-1ecd-4361-acc8-4713e73f0d9e,Uthank you,3
f86bc6b0-f3ef-4bd8-81e4-0c705b285388,Not sure,3
b9f628da-39bb-4377-8dd4-484bccf44ee1,Just starred,3
b0fab37f-0c25-453f-8034-1a4ec71ed981,I would have liked it more if you could add more than one photo to a post and customize the entries a little more .,3
a69aaa91-5838-4124-adc3-aba2b2357079,It's going to make a massive part of why I have a phone.,3
53cdddc3-81f1-448a-b053-301a65bf0c3e,"Great app, but daily quotes are cheesy and unnecessary.",3
329d41e8-d21b-4d05-9c33-c30e2799dd95,Its overall a good app. But I see a flaw here and that's an in-built app lock. Please add it soon. Then it'll be prefect!,3
6ad9ada7-866f-4ca4-b11c-e49cfb8e0578,"It's a really nice app, but a real shame that you can't register for an account if you want to. I'm to worried about losing my entries to use it properly.",3
a4f909e0-30fa-42cc-ac19-05601534baef,Best to beleive,3
92431a9f-2e74-461e-a544-4530f59df8e9,Thinking about rate of privacy of app,3
