reviewId,content,sentimentScore
39cfb32c-6f69-4a20-9031-d7a7cbd59bce,tooo gooo,3
bf319fec-d18f-4745-872a-8af3c1508848,I'm feeling better when I think of a lot about being grateful,3
3bfd8697-d39f-4fbb-9589-3f934139727d,Make in this app habit tracker and daily notes with reminder plus school notes otherwise this app is beutiful,3
894d3662-f3d5-4a8d-8058-0b4bc4dd2ff6,"it's ok, it's help me.",3
18013df9-6999-4ff3-a8a7-c524d8cba802,"I liked the app, but it just isn't in my price range right now.",3
5ce6d254-fcf1-4830-b4a1-d74b427f9870,I'd like it if it was a continuous set of questions. like a therapist or a manager which reminds you of your last thoughts and with questions helps you form new ones. other than that I like it.,3
e091e532-e920-44f2-98ae-f4aadee117dc,I think you should improve your star quality,3
6df9fd9f-a9a6-4507-97a6-9df3d777df79,ossum,3
8ca046e3-2d78-48b5-bc42-3fb370d67a8d,"i have been wanting to to a daily gratitude journal for a while now. however, the busy life means i always forget it. i was reluctant at first to introduce another tech in my life, but this really helps to be more mindful, with twice daily reminders. it is not for free, smth like 3-4eur/month which is ok, i think. you get a free trial week anyway.",3
78738fc7-38de-4ca6-a33d-c0a35f66c0ea,I have a question.. Should one have to pay while using this app..?? Or is it free to use...?? Thank You soo much developer for your reply I will review again after using this app In Sha ALLAH. By the way I am giving 3 stars for your quick reply. Thank you once again..,3
e0c492d5-536a-4b68-80b0-40b1288bf006,Wish there were more to offer without having to purchase in app store,3
c93c8be5-30a0-46c0-a2ad-8828270e0579,Had a variety of prompts and had nice journal font but was very busy visually and not really the calm type of journal I'm looking for.,3
e28301ab-875a-4801-8ce6-2232cd18a93c,Wouldn't have asked for a better app. I am safe here:upside-down_face:,3
5b223c38-7a33-4eb8-9d8e-70bbbe3da9fe,"the free version is alright, allowing daily entries and gives some affirmations and quotes. I can't do the paid version at this point, but I'll get to it eventually.",3
0b4ae714-4446-4e45-86a1-90b375000e9a,This app is too good. i enjoyy it.:tulip:,3
6327b56e-843c-41e1-956d-bd05af845830,just :astonished_face:,3
fc168da4-76a4-4d48-8a26-0d4a6914a137,:flexed_biceps_medium-dark_skin_tone:,3
b53534e6-5b87-427c-87e2-3f0d06200568,"I actually reallt like Gratitude, but I would like it more ifbit was only free, with all the affirmations and so",3
8795c5e1-c6d2-4a1c-80a1-9ee098ca353f,it so me,3
dbdd5172-7ebc-4376-9a78-bd1058062140,"The app is good and I love writing in it. But one thing I don't like is having to PAY to make a backup, like???? why? I think at least this should be free. It doesn't stop me from enjoying the app, journaling is great for mental health and since I love writing, it has helped me a lot. There isn't a day that I don't write there <3 I'm always reading the quotes and my affirmations on the app.",3
4b1c4979-c81b-43dc-a601-9ee10c3a206f,Good. But not all features are free.,3
cb15e7ed-8a59-44c2-bccb-acd605ba8ca4,This isn't a review review but more like a question I've uninstalled it as I don't know if it's free or not could you tell me please,3
2903897e-86cf-4be6-89be-87704776db28,No! But It is better!!!....,3
aad54db2-3ac9-4f12-aabe-d4c84ba643cd,"Before I take time to answer questions, please tell me if this is another app that will charge me.",3
aacc0bfc-f9de-4e48-bb56-d4bfba78ea93,"The app is amazing,I recommend it but it's so sad I can't get all the affirmations because they're expensive :pensive_face: But I still recommend the app regardless:red_heart:",3
eb650d55-b49b-43a5-8c5d-f36fc2678886,but I think that gratitude aap was give some affirmation for free please,3
43ab2c56-9e0e-4552-b12f-7563c8a21505,okay okay,3
c55f8d64-ede4-4100-9917-448ac47c7e5a,"Its a good app in my opinion.i can write down my feelings and read them everyday to feel gratitude which helps for our mental health and self care. But all the good features for this app is for premium users,many cant really get the premium one.Young kids like me,we cant just get a premium of a app easily. So i hope there is more facilities for people who dont have premium of it. But overall,just writing isnt also that bad.But theres many other features that i wanna use but i cant.",3
c24a02fd-5e6a-470e-a26d-3c58acb263db,i'm feeling better by each day,3
fecce2fc-3dc8-4d5a-9e96-4598c44941b8,Its weird,3
749d6ff4-a4f3-432b-aaff-de6cb2ca72aa,:nazar_amulet:,3
3d80de02-c19f-488e-aebe-89424eb8672d,I just feel better when writing here,3
8014366a-e584-4969-890f-2311826393f0,"it may deserve 5 stars and i would like too but the fact that makes me gave it a three is, it is paid:confused_face:",3
89d924e2-8e36-4365-9c69-2549abf3a7a8,I am using it it's so good but can you please tell me that if I purchase it then my backup will turn on this is not please help me,3
8318722e-c260-4816-96ed-2f4183694f52,"I like this app, but with every update the free contents been reduced. Now there is only 1 affirmation available. If i was using the journal or moodboard it might be a usefull app but i was using it for the Affirmations and daily zen. I guess i still can still use the daily zen until that too gets put behind the paywall. Shame because i recommended this app all the time and actually need to remove my recommendation video of this app as i no longer recommend.",3
3f17a593-6dcd-4c15-9e89-abaee624536b,:heart_hands_medium_skin_tone::red_heart::heart_hands_medium_skin_tone:,3
861b83dd-5d26-4e6e-965d-7c06c946170b,"too many restrictions... but I get it, at the same time..... really cool other than that though ت",3
443e9a7d-35ab-4cdb-b7a3-bb843dadc43a,It's absolutely the best but please can you change the new streak update? Doesn't make it fun and exciting anymore. It feels very basic...and not lively enough.,3
e718736d-3ef7-4e84-b5d8-abadc9f32fe0,it's sooooo good :ribbon::butterfly:,3
11cd6a8b-6310-439f-ae1b-cf64d31c9e2b,I couldn't have asked for a better app to help me on this journey :orange_heart:,3
d95b8d34-4279-456c-a07d-830c6184ad0b,I would say best app fr healing through ur mental problems,3
b4e9c166-8dcf-4ae9-94d3-50ef826f12c6,"it's a good app , I hope it will make me feel ok",3
8dc2b764-a0f4-4391-8eec-802ea6e69c74,I don't really get it But it help me out :grinning_squinting_face:,3
85c50497-4a6e-4ef9-985f-28632384666e,really jice app simple and doesn't have any fee.,3
832e61c2-d74a-484a-b7c1-53d5fde99f34,"Nice aesthetic, could be good. I'll never know because most of the features are locked behind a severely overpriced yearly subscription fee that I'm insulted you even asked me for like you think I'm a moron or something.",3
9affa078-f05e-44e7-afa0-81c6b1c5130c,it's charge is much,3
51f89e8c-9d51-4d43-a4c0-6c0b3be4994b,they know they stuff.,3
74f0c615-83f0-4488-8a6e-d54ca1a8dd2e,it's good but I don't think you should put affirmations for anxiety behind a paywall,3
e89ea99f-c582-4a71-a678-d2a95f3d9f7e,I am using so far the week free trial but I am positive I might keep doing it.,3
3125179a-e404-4fae-a295-2d2a22c69af8,"It seems like an amazing app and all, but it blocks off a bunch of stuff that u have to pay for, which doesn't seem like it would be helpful in a ""relaxing and helpful"" app. And it doesn't let u change the sounds and it only keeps one sound that isn't relaxing, which is stressful to listen to, bc it's not calming. It also won't let u add a password to the app like stated in the description. And it doesn't have pics shown in the app. all and all, would find another app to find a better experience",3
2f69efa5-54aa-4499-bd3e-d9222407c19b,:growing_heart::heart_hands_light_skin_tone:,3
54a8bb45-17ca-4fd4-93b4-555f0adb666b,I just wish the free version allows me to post more than one photo per entry.,3
4b062cf7-dc43-48ad-9eee-72205d9e06dc,wish there were more free features but it is a good place to journal,3
73e7f3e7-9c8d-4d4c-ac78-b110fe22e34a,mantap,3
01279293-57e9-41d6-88e8-14155d89afe4,alternative psychologist,3
19ab85fa-323b-4e07-b942-d78438c74877,Useful for self-discipline :OK_hand_medium_skin_tone:,3
8d697e9a-d8c5-4348-8c67-9ec2c5b44b72,loe the daily quote and board considering paying yearly for extra,3
435f760c-a96f-46d0-890b-bda8c9c1f264,:waving_hand_medium-light_skin_tone::upside-down_face::pleading_face::unamused_face::shushing_face::face_without_mouth::OK_button::COOL_button::yin_yang::trade_mark::face_in_clouds:,3
1bc18265-a72d-45dd-84bc-74c30e503e26,It's better written and shared with Gratitude app :relieved_face::relieved_face:,3
0555c1af-20fd-4bed-bad4-974c54386b7c,"I kinda enjoy the ride as it comes daily, don't know what else to expect as this is my 3rd day of using the app.",3
bd32b5b0-41bf-4432-b336-1be9fa99824f,Its great if you like expressing your thoughts..the qns are good,3
acd7139b-8e51-468c-be30-16895fc1d1bf,It's a great app. But there is one thing. It should be locked :locked_with_key: Rest is fine,3
9337d6c7-4974-411a-9685-75188f075477,"Generally great, but the option to tap on the date and select a previous year would be great. Currently, I have to scroll back one month at a time.",3
25ebc05d-2534-482a-bcb8-7dbdc5b9481f,"6/6/24 - still love the app, but not a fan of the color change outside of the dark mode. Uninviting. 6/20/23 still love this app and recommend it to all my therapy patients, but there is glitch in the system. Keeps showing ""today"" for the day prior and you have to change the date and then put back on the right one for it to save coreectly. I adore this app and have recommended it to many of my therapy patients with great reviews and results!",3
86baa02c-1bbe-42b1-a888-a269f72ef66e,so far I like the app you can use the free option it does come with ads but that's okay this app helps you to see your self and your surrounding differently.,3
b8cc86c7-cf55-484c-84cf-4f1feff08b90,The overall app is good but I just want a little bit more evaluation based questions on different topics not on the same one type topic .,3
e96f4d0a-6224-492c-9f98-000808627a75,Good app but premium for cloud save ?,3
88d5d10f-8e79-425a-9e62-572dd8b89651,:OK_hand_medium-dark_skin_tone:,3
8f0e0d3a-f3ba-4d97-878a-5b6a5ee6a9e0,Good :thumbs_up: no ads,3
b5061779-14e4-4dd7-854d-7c15ad0a547b,I have always wanted to journal but it had been hard to be consistent until the Gratitude app.,3
7baca36c-5773-4973-a810-0f9b648b4aec,:OK_hand: :clapping_hands: :smiling_face_with_heart-eyes:,3
1f1ecd7c-a834-405d-8649-118474193126,It'll make your day better.,3
0837f3f8-ee3a-4b80-9ba2-32162661a29a,the app should have a section for videos like spotlight,3
ad99385f-bf82-4f28-a619-e590e1a3748d,I'm a recent subscriber and I wish I had done it earlier.,3
7cfaf402-6329-41c7-acc1-7f4e5e0cc20f,"I am just staring out using this app, so far so good. its definitely disappointing when everyone is trying to make money off of trying to help others develop/discover their own self worth. Not that is app costs an arm and a leg but today the way society is, pretty much have to split the cost of bread.",3
3e15d24c-ba60-42f3-8be2-a76d116a49a5,it's ok but it dose work nicly,3
c2602175-386b-4fb0-acae-8bfaf696d969,It needs some new quotes. It seems as though they are repeating.,3
2aded517-f28d-4474-8a8e-ce6797ef79bd,without subscription I'm only getting few options it's disappointing otherwise the app experience is good,3
62d0b374-18b8-4495-844f-c2351887c1ad,it's not bad. Try it out.,3
e824ead2-c635-4b3e-abc6-5b149238481d,feeling better with this app,3
d4202898-89b0-4172-982e-491ae28194d9,It's best to improve once daily habit of showing gratitude,3
4b2a5b00-df52-40ab-9aa3-cb756f2991c0,you get a lot out of the free version. I am considering purchasing the premium,3
eec51293-2653-40c1-9662-53e6d782ebb1,I feel there should be a free version :woman_shrugging_medium-dark_skin_tone:,3
2ea717e1-e3f0-4413-b315-c705ae120afb,It is okay,3
cd34f84d-8858-4fe8-be82-3c7cd2021212,"Its a good app but the trick you by making you pay to get all the things. Not great for your mental health, and u cant take care of yourself right if u have to pay.",3
4c44752b-4e92-4788-95e3-1c1c0d87cba4,I enjoy this app but it cost way too much,3
34fd1f98-d955-4e63-b0a0-d17bdd5f6abb,The free version is quite limited but at least the subscription is not ridiculously expensive. Still wish the free version had a little bit more available though.,3
af65532a-a23d-4f18-bd0a-7c2da392a95d,love the app but am confused because I am winging it.,3
4dbf2bf0-1c36-4f98-8e94-62971fc1ed1d,"it's a very good app , but it is very stingy with a free user",3
ddaef2eb-4cae-4314-966e-93086e4b57cd,This would be great app but you have to pay for a subscription,3
635ca69b-04b5-4c43-a298-33d490e51d5d,I actually do enjoy this app but the letters get jumbled.,3
5277104e-b1ec-4462-8296-ab424b8f5929,It's okay I guess if you need an alarm to be set so you can look at your phone and then remember to be grateful then this is the app for you! For me it's redundant and I lost interest the second I paid the $40. I do enjoy the vision board but everything else is readily available in a multitude of other apps that serve my needs better. I really don't need an alarm to bug to write something It's big on streaks which mean nothing to me. I'm about authenticity and quality not mindless chatter,3
685682bc-a7d2-4c15-896f-41111a6280b7,ok I love the free part of this app but I think more needs to be free. I am actually 14 years old and I wont spend my parents money on these so its partially a waste of hard work for who made this app because iw.anted my friends to use this but its sucha. small amount of freedom. otherwise this app is completely great I love it,3
1e41cadb-f81c-4acc-928f-6e093fe1dd59,"feel ok. I hope for better after starting using this app, particularly .",3
a7b90d2c-769a-4b05-8634-cf30b59a5fb6,I love the app but the issue is with the premium package some of us can't afford it and end up missing alot. The charge is high for me.,3
50a4e427-1193-4d0a-8ff7-ea1642f7f914,okay :sparkles::dizzy:i love this app,3
a5ecc3d6-bab0-4846-9030-503e53a40f99,seems ok for now.,3
a79bbdca-0281-4c44-ac25-b3fb1ee7e1f3,"i gave 3 stars because this app did have good prompts, it's journal type but 8 am ""cup of positivity :teacup_without_handle:"" was very offensive it said: ""Paradise is not a place; it's a state of consciousness."" I'm going to be honest, if you don't stop saying it on reminders/notifications of app I and many other religious people who previously didn't assume anything about you or offend you are going to uninstall because of your lack of diversity and hate speech. From app what encourages positivity is unacceptable.",3
fd17b7db-4430-4b36-8889-7ca56b871690,most things have to be paid for when it comes to affirmations,3
004873b4-bb1c-4e89-8ec8-cb872da3b856,Not bad just it's that I can't put a picture in it anymore I have to pay please change it:pensive_face:,3
5bb1fbe3-2d89-40ae-9439-7de223120665,i just started writing on it today and it seems too good i think its free i hope you will keep going free thank you,3
349926a4-b4ae-4dfb-81e7-a51243860acc,"Honestly, it is a great app but I just have an issue with paying for certain features. Other than that, it's good.",3
0125880b-dc43-4351-b0d8-d8ff9c8963a2,Okay I take back the 5 stars. It's a great app but it says that I can also use many of the features in the free version but I do not see a free version anywhere. $30 a year is not pricey but I'd like to try the free version and yet cannot find any such thing.,3
fef97623-8b89-4828-83da-b72e4a2e736b,pretty cool if u ask me,3
cba325a8-064f-4f31-bc7c-ce4f6d32d915,my mental health is kinda cured.,3
980ec41d-51a5-4bcd-8fc0-bc18afe7f073,i take the basic only and see from there but the questions i kinda like..,3
cafd857f-2b91-46d3-949d-c9b258aad806,ossum app... :sparkles::gem_stone::eyes:,3
99d30f7a-c647-400f-b7fb-c06d62b87458,it feels like therapy,3
0df8f66d-a099-4344-bd51-1392409298d3,I would enjoy it more if they would add a motivational lifestyle ideas or soothing music too,3
bc08d0a1-477f-458c-bb30-107a18adc069,"A bit TOO positive, bordering on toxic positivity, but it works, especially if you don't mind all that. The UI is nice.",3
93d3f467-f268-4f04-80d8-5225a470c22d,:growing_heart:,3
08a5b25a-7ee6-4032-8fc8-f314ac11b5bd,I'll give more stars later because I'm a beginner and I've a question...we need to pay or start a free trial only when we wanna update this app to pro right? Without these we can use the app for free too or not?,3
f2de9f85-2cd2-4d89-afb2-a63eab3c8c12,Love the app but the affirmation folder is not great. I accidentally looped them and added a pause now I can't undo it. It seems like a big UX issue that there isn't an option to undo that.,3
e337b61c-3ec7-4336-88b3-105607dc62da,"App is fine, my resentment goes to being unable to make a backup unless I pay for the app. And I got a new phone and lost everything.",3
a234ae3d-25e4-47f9-ac18-ab16c6d65184,It's exactly the app which is best for journal entry but why we have to buy their plan just for backing up my entries this is not fair!!,3
aecbd489-0eb0-4230-97ed-66c91eafdea6,sure why not. a person with few words. mean what I say and say what I mean.,3
c84c2481-19de-44ac-a06b-e536eca8b35d,But it's quite pricey for me,3
0408d554-0238-425b-ad74-acb53bb1614f,I think the app should be free to help people with daily depression,3
24456e0b-3866-4aaa-85f2-216f64197c37,it's not free :confused_face: when it's free I'll give 5 stars,3
bcb65a0c-7e17-447b-9c2d-20517e996e59,supeeerrrrrbbbbb,3
491654c0-e053-482f-b28e-d9c3e9f41342,It's a good app I will recommend but it was not what I was looking for,3
6190c3b6-12f4-4cd8-bf71-30c4ca6a4d4d,"I liked it right up to the point where they won't let you take your data with you unless you pay for a premium. Not even gonna let me export it as a file? That's really weak. You can have my data, I'll just uninstall",3
373c3528-52d9-48a0-b573-f7a1668076bc,"It's like attitude has somehow taken over Gratitude. My precious grandma would say, ""Kill em' with kindness!!"" probably not stated too well, but the mere truth is surely within the stament!",3
9a6cd5dc-ef10-4a6f-ad63-86fa4e4247ad,This is probably self-care gratitude journals out there.,3
c2935e10-4cba-43f2-be31-8a8235911bf1,I really think gratitude is a good app for Expressing feelings but one thing is that you have to subscribe to do all the cool things :loudly_crying_face::loudly_crying_face:,3
f12a905a-3830-4179-8f7c-ed799e8f5c1c,there's a feeling in pouring out you pain and stress into writing.,3
fd623223-1771-4c28-95f8-30307e7c406c,"It's such a shame that the only way you can back up your data is by buying premium, that seemed shady to me. I've never seen such a core item under a paywall ever. Otherwise, I like the app.",3
c1e26116-3f11-4422-8e4e-75f498e5bd0d,it's okay actually :people_hugging::purple_heart:,3
9dea4c3c-0fc1-4174-babb-f7f3e9908a5c,one less for paid services,3
14d6226c-151f-4ef6-841b-45d0b5cfc454,it seems good. the thing I don't like about it is why do you have to pay for something like this to get feeling better,3
5109985f-626a-400c-b7a0-3074fab35fd5,short meditation,3
b9053edd-89c2-4830-b9f8-531fa5867113,Price could be lower considering how everything now is so high$$$$,3
d09afa51-47b6-4bd6-b01f-5dcd3de05552,I really enjoy this app and what it has to offer & I use the free version. I haven't subscribed because it's just not in my budget at the moment. The reason for not giving 5 stars is because I can't back up my entries etc to my Google drive without subscribing. 3 stars,3
2a32dc1e-243a-41b9-8892-7883f23f2e4f,it is health having someone who looks after you,3
ebfdb294-85a0-4e37-a2ac-a5dcab918f85,"If the language medium of this app is Nepali, all the content can be understood well. If possible, make the language medium of this app Nepali.",3
83f3abce-a6c6-4b82-a4f6-47b57dcd8ed0,useful messaging but feels dated. it helps and thats the plus.,3
6cfa4805-ef02-451f-9bef-16b0aefde26f,Free trial only :thumbs_down:I'm not paying for this app.,3
62a90f12-a3d1-424e-8b5e-a445e2eb5d5d,"Its pretty cool, for me personally I don't know what to write in my journal, but the random prompts really help but when I write there's a annoying glitch where it keeps moving to a different spot it's hard to type, and you can only make one vision board which also kind of disappointed me, and you can't even add pictures to your journal entry's unless you pay....",3
972171e2-1fdf-4ec0-bf0d-7ff00924eea2,Got the journal but don't know where it is owned by house previously Byford am waiting for WA housing to get a disabled home for me + my fur babies now living in a house in east Perth waiting for WA housing to find us a new home?,3
7e0605ef-ed3c-48c5-b794-8c7be57b7cdd,A ten plus ten minus nothing app:smiling_face_with_heart-eyes:nice features,3
f29f95bb-bdd9-48af-ac67-d2abab99d1df,i am really not ok but gratitude is keeping me calm and happy :red_heart:I love it,3
b1aba172-5c43-4dc2-bdb3-154265e78cad,You Should Try It Out.,3
c71d7af1-2e68-47e6-8f0d-0b7ff2293671,I just want to express my feelings but unfortunately I can't be able to write English language,3
bc17884c-3861-4fa1-88fa-9229de0ebc29,I feel like it would be better with a place where u can write a topicu yourself,3
35c5be8a-4142-48f7-81ab-cd0f99a19b31,the app is good if u want to practice gratitude,3
e8a868c9-e7ef-45ce-9daa-f5cf78d9953a,"Love the app, I just wish you could personalise it. I don't personally like the cartoon images and colour choice.",3
a48ed43d-f338-46d4-8a81-7470ee919d2e,It good but work on the glitches,3
cdbb1d5a-527b-4119-960a-00b9350e793e,It's way better than getting a therapist :red_heart:,3
5601eb93-8447-4de5-9be9-236f834bd0b3,guys try it,3
300c7784-7edd-4865-b6d8-15be503f1a39,I am feeling a lot more positive. It is great as a personal journal.,3
e23cee3f-a15e-452c-a551-f638e80a0a81,it requires introspection and Hibbert with the self to actualize the concepts. be true to be successful,3
326a9803-115c-4210-868a-88b4cdff2d97,"it's sad that the trial is only 7 days. doesn't give you that much time to really get into it. it's easy to miss days with life's hectic schedule, so the fact that you are given such little days to try it out kind of defeats the purpose. but the idea to get one to focus in the positive is a good thing. also can we add others on our subscription? I'd like to add my daughter without having to pay twice.",3
4bab5d1e-2797-4a72-904b-9ac8f46f5d6c,"This would be a great app to use, but I thought it was free.:sad_but_relieved_face::sad_but_relieved_face:",3
06e7550b-8273-4e69-a57d-8907adcd4e16,I like the journal prompts that are positive minded. I wish the paid version had more to itm I just don't see the point to pay to journal.,3
93a156fc-a17a-4f21-b190-9bb89ea83b0a,More variety of different questions would be nice.. But otherwise great.,3
79084e7e-37d1-44df-aa24-855b0f9c6f38,The app is a very usual,3
9c24d6d9-3b82-497c-a5e1-d0d699105077,It's okay very great,3
b2853ee1-5411-4510-ae02-b2c5b12d9789,I believe I had to pay for a subscription... When I could just simply download journal prompts on whatever topics or discussions. So it's why it has a ★,3
e1088b5b-b85a-495b-bfbb-42ee369ea27f,seems good only 3 stars because I'm still trialing,3
feb6d3ee-a2da-4c49-994c-ee72abde7b96,I love the app but find the daily Zen mostly unrelatable. Challenges aren't linked to the widget so if adding an entry on the widget you still need to open the app to add an entry to the challenge. I wish there was a way to share my vision boards with my friends/husband.,3
aeb339aa-3734-4a23-9920-3c63992e380d,:OK_hand::OK_hand:,3
70cc6ecf-3e8f-4319-9d19-4221ae918946,Good app but why are some of the challenges outdated? The team can't be this lazy. I'm being asked what I'm looking forward to for the year 2023. Not renewing for next year. This put me off. There are too many apps that offer the same thing. #NotFeelingGrateful,3
9c90693f-175d-42ab-a309-7178b11d8637,i love how it makes feel okay to talk about how i am feel about everything,3
c6ada59a-398e-42b0-9745-6181e99b9eb9,It's only day one using the app...and I already feel like I can conquer the world :flexed_biceps:.....I didn't give it a five star review coz .... it suddenly can't allow me to view some plans:person_shrugging:but it's :OK_hand:,3
58231f9a-ac68-43c2-9bdc-5c1ab3803e35,Good app but very expensive as an Indian.,3
9928998d-1da6-4e6a-9744-8ac6ec17369e,not totally free but what u get is good,3
0550ccf2-3b72-4390-8821-b8aec796bf21,"It's an okay app. But not worth 30 bucks a month to me. It has some cool things you can do, but it's really limited unless you want to pay. In this economy, I can think of a thousand better ways to spend 30 dollars.",3
6c2a28e4-312b-48ff-acf0-a3255284e99e,"I HAVE A OPPTIMISTIC POSSITIVE . GRATITUDE, ATTITUDE.",3
a92187aa-3ebe-479d-af9a-c03b236d736f,This app is gr8 honestly but for back up we need to get a PRO gratitude which is soo senseless please correct it ASAP,3
14669e7d-f4d1-4cf6-b51d-5271023e9dd7,"It's a nice app for what it is. Unfortunately, I can't afford a subscription, no matter how small, and all of the really nice stuff I want access to is locked without paying. Hell, I can't even make a second vision board without paying. :woman_shrugging_light_skin_tone: Will continue my search for something similar but completely free.",3
fab75822-e2cb-477a-acc8-50a6b3d3c5fc,Pretty basic & a lot of the material is repeated throughout the internet for free.,3
9c74bf7e-767d-45b7-8757-70e1e7f4b5e5,It's ok not bad,3
6e590c21-a2e0-44c0-a930-05edd7377d48,it make me feel better on those day when i feeling it.,3
7d91f312-a0d7-42ec-8a3d-2a6acfd5a715,"so far, it's alright. haven't subscribed where you pay yest, just test driving it first.",3
