reviewId,content,sentimentScore
495a1d86-3487-445a-ac35-51687db09b4d,"7 day trial isn't enough to see if I wanna pay $30 for the year or subscribe to $7 a month. Didn't even get further than the download, smh. It's shameful and def NOT FREE",1
1fe34457-417a-4e10-939f-d478527a45c7,Have to pay to trial Deleted. I can just track habits for free on paper. Whats the point if tracking in my phone ??,1
7c3b7034-ea7e-4b48-a7d6-f6baf2b35967,Not free. Free trial/monthly sub,1
2ecb47c7-47d6-4d45-b2ff-cc1d31bacad9,Completely paid app.,1
e3be6d41-2492-4799-9df2-1b2ae0a59453,"A reminder app that doesn't send you reminder notifications... Sick and tired of apps that list themselves as free on the store then try to bait and switch you into purchasing a subscription. No thanks, deceptive marketing.",1
55390a0b-8c6d-4217-9429-002353292aae,Pay only,1
37f58458-2085-4014-99b9-1249e9aa5c23,Do ads come every 3 clicks?? I did not know it is a paid app,1
946fd7bc-52e7-4f2e-ab11-9040249d493b,$30 a year.... Or $7 a month...,1
7f024c7f-c84f-40a5-a758-5e96cc3081a5,Bad,1
ced52247-451b-457a-ac7c-8b19e0c75e51,Not free,1
ba925c90-0ef6-45ab-bda2-697bb846781e,Not worth the money they charge,1
aae3384a-6620-47b6-aa61-8a6fe0dc5b15,"Good Ui, but literally every click theres a pop up about subscription, which makes it impossible to use the app even the free version. 1 star for that, not cool. Free version only allows to track 4 habits, but i get that. Subscription is too expensive for my taste. Better get back to the old days and use a journal instead.",1
d602232d-3c87-4120-8d44-958feaf673d4,Didn't work correctly it was going back to square one every time.,1
e258cce8-c9b8-4978-a0ba-ae87b0281af7,"I would pay a dollar or two for this app, no problem. Making it a subscription just feels like a cash grab by the developer.",1
125bad73-5241-41a6-b691-e5fa46b8483c,"Hate not being able to REALLY try it for FREE, you're directly bound to a subscription. I don't care you can directly turn off auto-renew in Google Play, I hate te pushy behaviour. If you're really sure your app will work, then people will automatically start to pay.",1
c6ba42fa-648f-454c-8648-874102fd950c,"I feel like I am the world's worst procrastinator, I'm 19 living with my soulmate and our little Pug, and I find it so hard to escape and study when I could be having the time of my life with both of them. This app is a necessity for me, thank god!",1
7a2314f5-33f2-4aa1-a163-62b60938a31c,Can't add routines because there is no done or next button,1
42e9d770-935a-4e2b-9638-f5fe36202110,I cannot recommend it. Be careful with fishy payments!,1
3c7506a2-91ba-49f1-99a4-c476b8837e2a,Really €25 a year??,1
de329cf2-dea5-45e3-bc49-d576afb92a91,Tried it on my Samsung. Couldn't properly enter information. It kept bouncing me back to the starting point every time I opened it.,1
c02b1978-a5b2-4efe-980b-8df285ba98f4,"Expensive monthly cost and restricts you if you don't pay, also constantly remind you to buy it with pop-ups ads which gets annoying. I wouldn't waste my time downloading this app",1
1eea854c-7796-4b39-8746-97acb00d7b10,"Help please, I had used trial of this app ages ago and I had took out a trial and forgot to realise I had... It had then took a full yearly subscription without me realising as payment had been declined twice. I didn't realise I had a payment method active with Google. Please if possible can you contact me regarding a refund. Its a purchase I do not want. Would be much appreciated. Thank you",1
aebfb763-a174-4778-8623-7a2f181b9494,Way too $$$,1
dc0357da-4320-4b6d-8c9d-1065876f8a5f,Bad application... After I had downloaded the app it wanted money :slightly_frowning_face:,1
f6ef3141-c9bc-469e-949a-2440430c083e,"No te deja nisiquiera guardar tus planes, a menos de que tengas el Premium :) el picas palabras no puedes hacer NADA sino pagas",1
32e8c90d-ffbf-4460-a93c-2953039c2272,Faul...total money,1
6bcdee52-65fb-424b-908d-acb7f3df7e4c,Initially loved this app but the cost is too high and vacation mode got stuck and now the app and data is useless. Such a bummer,1
988fab39-0bfc-4c4e-921c-8f1ee5c69b92,No Real free trial. The app ask for payment information before give you any look or trial. update: i don't feel good with that answer. i will keep my 1 star for this app. Disgusting support for this app.,1
fc8215b2-ed08-4e00-addd-8b4c0a48f588,"the price is to much. even $15 for the full year is ridiculous. and it doesn't allow me to do any other option! it's just offering the $15 for the year. I don't want that price! is there a coupon code or something. I am out of work because of Covid, I cannot spend $30-$15 on a app. and the free version doesn't offer much.",1
3244d42f-0f4e-4bd4-b56e-52503476cb51,super overpriced man,1
a95bdd93-f613-4063-a261-d15ace49a4a1,Thia stay literally 3 min in my cellphone xD,1
f38d9185-bd3a-4d42-a108-f6966e6dfc39,"Cant be accessed unless you put credentials, uninstalled quickly, sorry",1
cc723bf5-b033-4705-89bb-dff035b4c99e,It is really annoying to force people to subscribe. I wish I could use the app for a week before paying anything and then maybe receive a notification for subscription. If this attitude continues like this no one give it a chance. I'll uninstall right now.,1
2b0ca6d5-77af-4901-8ef5-a93240d101aa,"Google , please reconsider the existence of these type of Mal adjusted aps on playstore.simply made to grab money from users buy Invalid forced subscriptions.",1
6383c1b7-97cd-4e97-a4ba-11e42116df69,"Everytime you click on a feature, it asks you to subscribe. If you x it out, you don't get to see what you want/your changes don't get saved",1
fbdcdc12-3325-4f16-8f72-362615e30eab,The free version is a trial subscription of 7 days that automatically subscribes you for 1 year afterwards. How about no?,1
c28b1f20-d7d3-4eff-a6ea-49f7270863f9,Can only have 5 goals without paying money...,1
8c6bc576-0b1e-4580-b6d4-3e87d8ac501a,"Before you can even try out the app you are forced into a ""free trial"" that renews into an insanely expensive annual plan. Not worth it, there are plenty of other alternatives that let you try them out before committing to any sort of premium version. Edit: there is indeed a tiny exit button at the top of the trial screen. If you press it you can continue to the app with a subscription notice popping up frequently. Still obnoxious, but less so.",1
0c638942-63a2-41e9-a783-6b0fb7bbd5ba,"Solo se puede usar si pagas. Me hicieron hacer todo el recorrido para customizar la cuenta y cuando te sales de la app, no guarda la información. No voy a pagar por una app sin probarla antes. Una lástima!",1
d46d87e2-d8ec-468b-b5a2-587562cab1d6,how can i save my habits I'm not able ta do that right now,1
ce2dc8e6-e2e7-4233-8e53-138ee83d93b4,The free version is bad,1
799a0ca1-b7f4-43a6-8071-d5f0debfa57d,They just want my money haha,1
56ae572b-4900-4c15-a4d6-44c03b2b4c8c,I downloaded it only to discover that you cant try the free version without giving ur credit card info. No thanks. I wud b very willing to pay for the app if it is valuable to me but it doesnt give the chance to ind out if it is valuable.,1
ff94e790-deb6-42da-bd31-2a7d4e3f1b99,Obnoxious subscription begging. Scheduled just a few tasks and was limited on the free portion of the app.,1
f0067baf-edb4-40c6-b1a2-6377cc24f19f,"Trying to get someone to accept a subscription (even with a free trial) on the third screen of the app will get 99% of people to uninstall your app instantly. Either make it a paid app, or have a premium version with basic free features. Also, the subscription is insanely expensive for a better UX on something there are 100s of free alternatives for.",1
6a97ae1a-dd75-49bb-8a38-9417cfbb2fcd,There isn't a free version?!! I would even be happy with a free version with ads. Having no option but to pay 8.99 a month for this is ridiculous.,1
fcab56cb-875a-4770-b9ed-46428b94c4a2,85 kr för en checklista. Ni är ju inte netflix direkt,1
73afc17e-2b36-49d3-b7de-96421eb64752,"too overwhelming to set up. The app is also missing the flexibility needed for me to set it up for my specific needs (calorie counting to gain weight). Lastly, the subscription nagging is awful; it makes the app unusable. There's a free app similar to this called LifeRPG which was easier for me to setup and doesn't subscription nag. Though, I'll be sticking to my excel tracking sheets.. *EDIT* lol the company responded asking for ideas on how to improve when I already gave them. This is trash",1
8ac19144-0c61-4b28-b87d-9bc3c98592fe,"It's not working for me. Each time I close the app and reopen, it starts all over again and I can only put 1 habit on it. Help!",1
583a73af-8270-4adf-8b0b-27004f59b2a0,The reason im giving 1 star is for the sole fact that i've spend more time looking at the discounted premium offer being shoved in my face than the actual app within the first few minutes. No idea after that cause i already deleted the app,1
1f4ec957-98dc-4cab-a36a-8f66b502e1ba,You will make only 4 daily habits after that you wont be able to make other habits ...till you subscribe,1
aa9430dd-dae8-49e6-be2b-749a5053f21a,"Dreadful Customer Support. Overpriced BUGGY app! UPDATE: I have been reporting these bugs to you for 4 MONTHS. You never provide fixes, only empty promises. This proves your utter incompetence. You've mastered the art of the form letter.",1
d6df5bde-d842-4cca-b6b9-161429bc7734,This app says I don't have a Google account on my phone (I do) and therefore won't let m buy premium please fix this!,1
d22ee7b5-760f-4752-97e8-2e83c2f80dec,"a) they have charged me before the trial period is up b) it does not work; i have run through the set-up procedure (wake-up time/ reflection time, habits to form) 4 times. each time i restart the app it has lost all settings and asks the same questions. so it is useless from my POV",1
a5e149b5-a531-46ec-b013-751c441ef3be,Never sent one reminder,1
fafd0583-e8a6-4eed-a5f6-211428520d7d,The buttons and function are so buggy. Options are and descriptions are unclear. Labels and titles overlap becoming impossible to read. All this and they want me to subscribe?,1
df60bee5-0ae9-4867-9f6e-9f5ba44891b8,App is crashing everytine when trying to open. I have subscription of this. Please look in to this asap.,1
e27b38ee-5b42-4793-82f8-32b4a6ddd007,Not worth it - I agree with the other comments about subscription model and it being fishy...,1
a09503c3-374b-4ecb-86e1-0cbda0937411,Lol you aint getting no $ from me,1
7c1c0df3-0868-4f90-a327-e463dc732e0a,Bad,1
4df3e23b-18ff-456f-9e90-1fd269740457,"Would like to cancel, doesn't work well. How can I do that? There is no option to cancel. How can I get a refund? I don't want the service.",1
f0c3bb13-c7de-43e1-90b4-7e724700d712,"Waaaay too expensive, this app is not worth more than half a Netflix account",1
3b9a7368-654f-44be-9563-f726be0df74a,"It demands you pay £6.99 just to use the app every single month...its literally a reminder app, why would I do that?",1
6a10e2ce-9caf-4abc-bad7-83d8287a2afc,"Every time I click it tries to sell me no matter what I do.. this app is marked in app purchases but total lie, unusable unless you pay for their subscription. With a many options as there are in this type of app this one is not great or even good.",1
21e4f82a-7f30-4687-a504-5b19de731e4a,Wanted to try it until I saw 7€ per month for a subscription...that has be either the biggest ripoff I've ever seen in the Playstore or simply a joke. Apparently the creators suck at pricing or are just delusional. Deinstalled.,1
04153b50-6f6b-4db0-a97e-8fe0842d9065,"If you bought app and lost phone or decided to use other all, or decided to start use apple, your purchase will be just vanished. No sync. No backups. No log in personalisation. New app == new payment",1
3e5a17d6-3e3f-4f3f-98ac-abe747ba6235,Зробіть все безкоштовно!Я хочу щоб все було безкоштовно!!!! І я не хочу користуватися обмеженою версією,1
1dd3150c-a138-4a43-9723-71b87b276bc5,Just want money,1
b74aff63-165f-4963-b721-54c7bd62d6ed,Isn't clear that this is a subscription only app which is misleading.,1
266b9ff3-0723-42db-ac75-4b09a58b090d,"Be careful with the fishy interface, you can accidentally subscribe to this thing when you only want to explore the interface, and then your bank will surprise you with a payment for a 1year subscription. Few days after I deleted the app I thought to reinstall it, but after I realized how fishy the interface is - never. Bollocks.",1
65cacf58-1c35-44f1-aaca-a04d56c1a2d5,The problem of this app is not Free.,1
1a7f1eda-7543-431c-829b-75442da4b5c9,Not a fan of the hard sell built into the app. Avoid,1
06d1f8c8-44f4-4569-9e89-1639d7951888,"Was charged for the app after 7 days which it said ild be charged after 1 month, scam! App did not help one bit try and get productive definitely a terrible app which scams you money. Don't download!!!",1
56a5a179-968c-483e-91e1-aca33330b345,"Downloaded the app and it entered me in to an automatic subscription costing £11 if I didn't cancel within 40 minutes. As I had only just downloaded it, it was showing on playstore. I sent an email to google informing them of the the issue and an email to the app. As I have no payment method on google play store it can not charge me. Those that download this app be careful it will automatically charge you within 40 minutes it not cancelled through Google subscriptions.",1
6788d4a0-452f-467b-9461-9ad7f9753ecf,Unecpededly charged for using it. I didn't have the money for that in my budget so now I will be short on my Bill's so thanks but no thanks app is deleted.,1
3d8ec345-37c3-499f-aa72-eb5e37966132,It only tells you that it costs £24 a year after you get into the app. Waste of time downloading this,1
eabf5b5b-d1de-4554-b413-a8753646944c,I was not notified to update my subscription as it was mentioned in the app but i unsubscribed on the day my subscription end which is today why did i got money charge for a year?,1
1d34ac78-8833-4a3b-adc0-a772afcfb2c5,"Don't download this app, 1st its useless and second it automatically subscribe you on the year program, i didn't even give them my card details, they just somehow used automatically my details from the app store, and you've no choice but you can't cancel, you could onlu unsubscribe, so that they don't charge you again in a year time.",1
73ba66f5-64f7-4cc4-ae02-8702c81ead1d,Not enough features in free version,1
a6a63ce1-57c2-4bb9-93d7-62530911e0de,Horrible customer service. I have contacted the customer service and tried to explain the issue with the trial version but they haven't seemed to find a solution over the past 3 weeks. Very disappointed.,1
1bbdc5f8-a8cd-4236-98ec-c82d4e2ba0e5,"In free Version, Reminder & Notification not works properly, Dev should solve this bugs, Thanks.",1
9f2a2342-a0fb-4046-806d-4ca684fdc1ad,Reconsider your upgrade strategy... I've had the app all of five minutes and have been asked to upgrade THREE times and asked to rate the app once. I've barely had time to check out the features. Why would I want to upgrade or rate an app I've never used? Not best practice. Far too annoying to keep trying to use. Please go through your first time user flow and refine it. It's not a positive experience. I'm uninstalling now.,1
d67dab0a-0853-4034-92b5-ef71bc023e0a,"Don't do ""free"" trials with auto renewal... :man_facepalming:",1
eaae938c-73d5-4e5d-b69e-c251236a0aa6,How did I sign up for a years subscription? I'm only 16 years old and I need a refund as I didn't realise that downloading the app was going to cost me money. I cant afford this :(,1
5332eeee-31fd-4d14-9921-1faccf458378,Money stealer,1
6256a1a5-be5e-4ec7-8f43-8a0be687d98e,Misleading Not free,1
481965f5-0e8b-4ee1-9e19-9532c27928e1,"Installed for 1 day and canceled exact day, even though they charged me with yearly subscription cost aka 29euros :zipper-mouth_face::persevering_face:spechless",1
1d4f8f1d-ec80-4f9e-b3ef-023b6ab38363,"Can't even try out the app, must start a ""trial"" subscription on first app launch.",1
9b8bbfc9-5a53-4e0f-ba15-c494544b2eb1,This app feels completely useless for anyone who has a hard time forming good habits. Here's my thought flow: Do you procrastinate? Yes. Do you know how to dismiss a push notification? Yes. Then this app will be completely useless as you will just dismiss the notifications that come in the a basic notification sound. If this app had a push notification you couldn't dismiss unless you were in the app and was not subscription based (the least of its problem) then maybe I'd rate it a little higher.,1
c3e6b275-f303-4d3a-8732-2a71273241dc,"I cant use this app anymore after trying to make more then 4 tasks. After I tried that, there now allways comes a pop up that I cant remove.",1
c85ec9df-e41c-4d0d-b50a-89ca142644b0,"Ridiculous monthly price, would pay for this app on a one off payment at a reasonable price",1
2773e325-5232-41a1-9d53-3adcc806206f,Its terrible,1
884a7874-941c-4984-8198-03cc86e289b6,"First thing you get slapped in the face with $8 per month?! For a reminder app that tracks and display like a diagram in XL? Everybody wants to charge monthly without providing much. Take a look at 9email. That's an app that I actually do work on, for hours a day. At times I prefer that over Outlook on desktop. I would be happy to pay upwards $50/month. But it's only $15 ONE TIME FEE. Smart concept, because there is no free version. Use it? Pay. We all pay, and price gets low.",1
e6fcf281-0120-4814-80d5-1e4a0d41a02e,"Before being able to even use the app, you are given the choice to make an account, or try the app for free, if you give your payment card. After 7 days, it will start a yearly(!) subscription. I thought okay. When I opened the app again, a button on the top was saying ""Try for Free"". No mention that I already have a subscription. When I click on Try for Free, it asks if I want to try it and then have a monthly subscription. Very sly and sneaky, instantly lost trust. Don't trust them.",1
d6efd824-2bed-42f6-9c16-f0bd73076530,"Unfortunately, broken",1
ca6126eb-9267-4367-9868-0be3f694ec1f,It's not free. You only get a free trial for a month.,1
17cb9170-5b19-4496-a7f0-c1f9bcbcd707,"Hi, I'm not able to sign up for a free trial version. Can you please help with the same. There is no place to lodge problems/ issues/ bugs. Please let me know.",1
c1b3efc6-9e08-4352-b860-110e1bdb3efe,Não é oque eu procuro,1
a1150a1c-e8df-4e8b-b16d-c55ed3ba32db,MAJOR PROBLEM its not free :( atleast have an ad infested version,1
45948904-d9a1-4ab2-859e-44999268d828,"They got greedy. I used to own an iPhone and Productive offered two versions - free and paid. The free version offered 6 habits and a gazillion of icons, icon colors, and other customization tools. The paid version was a flat rate but it was worth it. Now, Android version sucks! The free version includes only 4 habits, some icons, and 6 colors! Instead of paying a flat rate to upgrade, they want you to subscribe and pay $7 monthly. I'd pay a flat rate, but to subscribe? Never! P. S. No widgets!",1
4be0c469-7b04-4afd-bf00-caae3cbcd06e,"Far too aggressive with forcing subscription and far too expensive. I'd added about 5 things to my calendar before it started forcing a ""sign up now and get a discount"" pop up. I'd signed up for a 7 day trial but never had the opportunity to actually use the app. Shame because it seemed like a nice app.",1
55868064-fbb9-4572-98db-cdaf3b219c0d,"Mỗi thao tác trong app lại nhảy cửa sổ đánh giá app, bắt buộc ngưòi dùng đánh giá app. Chuyện gì vậy ????",1
a2557766-7c8a-4ab5-9cd2-14449d9ac1d6,Every time i open Its all data lost.,1
b18bce64-0ee4-49a6-93fe-57ec68796a3d,Don't try this app. I cancelled my subscription and asked my money. But after 3 weeks they just sent an email to nform me that that the refund has been processed but it'll take another 2 weeks to refund my money. Disappointing!,1
5e340f88-705e-41a5-b28c-e528e18a26ed,"Every time I close the app,my data get removed and when open the app I should do basically setting.",1
4c91e281-b750-470a-b763-e1a1ee45c1b3,Not able to uninstall.,1
ad475e96-307a-4bfc-a060-e61a51d038ab,"Just use a free app, this app is ridiculously expensive",1
3b479fc8-8b83-437c-9fbb-2038b2575ff0,Very wrost... Refund my 2100 rs,1
772ad69f-c73f-433b-8302-f3c0d7f484c5,Garbage app too many cost refund my cash very bad totally waste of money also a lot of bugs no productivity ...,1
7bdbf011-68b4-47dc-acdc-7906c5b1d9f2,As soon as I logged on it told me you have a certain length of time and then you have to pay like £20 a month ..... not worth that amount of money,1
f5a131c0-feb3-4419-8abb-46572093bf3d,bad App:thumbs_down::thumbs_down::thumbs_down::thumbs_down::thumbs_down:,1
9c9eeb9e-3bf7-40f4-bee2-3c1c48f900d1,"Why do they put such apps on play store which are free but when u download it, you have to subscribe to it? Instead directly put it as a paid app only",1
43d9bb04-d584-480f-896e-abb30e14e733,"As the same with most of the bad comments. I got charged the $44.99 and im pissed about it. I deleted the app because i didnt like the way it was set out and still got charged, im young and that's alot of money out of my account. When i had the app they didnt even ask for my bank details which is werid. I have emailed and fingers crossed i get a refund, not on. Bit annoyed!",1
224576ec-1ed9-4c17-b00a-236cf87254c1,:red_heart::red_heart::red_heart::red_heart:,1
d3a850c0-f780-4157-a1cf-1c07c925fdde,When I installed this app I was offered 2 options - pay for the full version or trial it for 3 days. I selected the trial option and at NO POINT did I have to put in my payment details. 3 days later I expected to receive a prompt to buy the full version but received nothing - instead I found that the subscription fee had automatically been taken out of my Paypal account. I did not authorize this. I've emailed the support team and have had no response. Terrible way to treat potential customers,1
bb6ca77f-d274-45c9-8e17-345cfcbbec10,The worst,1
893a20b8-ca30-4f67-8763-2086a1d85e7b,No true free trial just to experience the app before we paid for it.,1
68988809-9c5c-47e8-b1a1-d6459ee9055e,:face_blowing_a_kiss::face_blowing_a_kiss::face_blowing_a_kiss::face_blowing_a_kiss::face_blowing_a_kiss::face_blowing_a_kiss:,1
4abc019b-4b8c-4857-85d7-a6bf7a1be64a,Doesn't work at all. Deleted,1
b3b69dd6-8d08-4a0d-bab3-5a63d88072f7,Just started the app and its already need subscription. How can i subscribe when i haven't seen the app,1
1340fe8f-b802-4bb2-b6e6-077f87cf7b0f,I just installed it and unless I pay it wont let me put more than 4 habits. I have been looking for an app like this but this is not what expected from this :(,1
7b4b2c87-2f77-4b58-a83e-6ff4723e5bbe,Money after a minute. Disgusting.,1
2d4dbda5-88a9-46ed-af38-cf2945edd3cc,Not workable,1
b130440e-c99c-47db-afa1-13352a46290d,Doesn't sync across devices. What am I paying a monthly fee for?,1
83f6aad0-ae84-460b-aeec-2d67c344c791,"After creating a task there no ""done ""button",1
5ea81109-20e9-4ec0-b9c3-6f35c771b30a,you have to pay,1
af17dae0-d8a7-4e5a-a367-821a6fd6d437,If asks for payment straight away why don't you change it from free to paid app??,1
0a0552e6-8d70-4291-94df-d3b3bb48d4df,Not free,1
3949ce9e-6b92-4604-8530-1d39ca736add,Hate the subscription,1
f7dca93d-379e-4b4e-b42d-2afc0ff67262,Non sense. Don't waste your 9mb. It asks for bank details right in first page and says subscription renews without any notice. Moneymindeed people can't add value to your life.,1
8ea3616b-e3d9-417a-80f9-cacc10d157d4,Habit limit 4?!? Why? It's terrible! this is also a greedy app..,1
8a8e50e2-6986-402c-89d5-69822a903c19,It is not free app!,1
75fc1134-7313-44aa-b645-626ea8036574,6.99 a month for the same as free apps :face_with_tears_of_joy:,1
4f3c24a2-4f48-4d36-9143-85e798abdb23,It is truly not worth what they want to charge you,1
7ce06192-c0e5-4dda-b8e8-60cabdeab280,Install it and you'll see yourself why did I give it the whorst rating.,1
f5673e11-89f3-4741-8e08-371fe327dd6b,it's not free. it's only 7 days free trial,1
b0d6c062-ed23-46a5-ad84-8abb85f3afc8,This app is not worth the whole load of money it says....you just need some memory power to remember things...if you are not willing to do something.... even an app can't help you do it..,1
ca70c997-9e41-472b-8036-7eb0ff5b639b,I did never accept a subscription for premium and out of nothing I was charged 24€. So please be careful installing this app!,1
456b7a35-39e0-4500-9b3f-5c73dc82fdc0,":confused_face:. Thats so unfair, a great app with great features and design. Why it is so limited for free users.************edit**************** Thanks for replying. How can I Access to Portfolio,?",1
7a850791-9b99-4369-bd2e-1bc520498e23,Too expensive,1
ac27612d-72f8-4bd1-82c1-4cea93c6dff2,I absolutely hate apps that require credit card details for the damn free trial. 25€ for yearly use of an app that is in no shape or form different than 100 other apps is ridiculous. You should be ashamed of that trashy practice.,1
fdedfd33-68d7-44d7-8af9-50b5619b28d4,One time purchase instead of subscription please.,1
9769f4ba-0617-4c9d-ba15-1850da0c7b72,"Highly not impressed by this app - it's really just a task list with habit-related items included. So under ""Better sleep"" there are subitems like ""go to bed at 10pm"". Picking any gives you a reminder to set at a given time, customize colors and icons, recurrence, etc. You can create your own categories and that's pretty much it. Finding this out requires agreeing to a free trial before the subscription model kicks in, at nearly $7 a month. I canceled via Play same day and I expect no charges.",1
bde3a1de-a9cc-471a-9361-7c0a7066c376,Not worth the money,1
6d7ba74d-47a8-47b9-99a5-c6731bd4bd7e,Bad,1
