reviewId,content,sentimentScore
9927e8b9-c739-47dc-b6ed-4d2133c5810d,No widget in free version.,1
b8cfd383-ed3f-4f79-91d6-4d602a793008,Too expensive,1
40d688dc-45d3-4828-8e80-20bfee0a5772,Cant add more things to do. Ad keeps popping up. Waste of time,1
ee969419-d799-40ca-9577-83bacd0bb6de,Everytime it starts me over. Doesn't save my info or have a way to create a log in on my phone,1
c7344e8c-9a47-4aab-a7ea-aed7a8f22fb5,Why do I need to sign in?,1
573707d6-b25a-459c-95a1-5480ceb71f7a,"Terrible app, do not recommend it",1
0ac19ce6-2892-4f54-9601-c4fba82e53ec,Great at first then it wants you to pay to create new habits :rolling_on_the_floor_laughing: horrible app,1
23c75501-5eaa-4f32-aa8d-1d14ce8abf27,Spammy,1
d3a5bedc-abce-482d-ab19-f1af2c99e535,Every time I tried to generate a 4th reminder it would pop up with the subscription ad. I would exit out of it and the app would not allow me to add any other tasks. Just mark it as a paid app if that's what this is supposed to be please.,1
683b7654-2a91-40d8-97b5-2b9f0cc5e170,May change my rating as I go but right now when I close the app it doesn't save my information! And even though I signed up for free trial I have no access to creating any kind of account...weird. Wanted something simple and so far not so simple,1
a418dd9f-26ad-4fd1-84b8-20d3fdd31827,"Dont make me pay to get a healthier schedule, eat my a$$",1
a642aa01-0bd0-4fac-b713-70b03065dfbc,Not good app,1
0cde1d1f-8094-4780-b6ae-f376ecbb3585,Terrible user experience,1
2f3d590d-6d7b-4d5e-9c3f-e1d52b5c6658,"Trying productivity apps. This one was the quickest uninstall. Way too expensive when there are endless free options out there, plus got hit with an annoying notification before I even got to set anything up",1
7b341305-7e69-4154-9d8f-35fe9a3eaab7,Expecting people to pay to use the app is absurd.,1
32e9492a-9cb3-4cec-973c-7b4f81192e05,No data sync,1
8c50c6ad-c070-4223-876e-21a22d783f92,"Why no lifetime payment? Instead of annual payment, prefer lifetime payment",1
c60ac276-5817-4294-921d-a7cae0fed319,Why does anyone who installs this app Automatically access our mobile? For example: :red_circle:control vibration :red_circle: run at startup :red_circle: have full network access :red_circle:view network connections :red_circle:prevent phone from sleeping :red_circle: read Google service :red_circle:configuration :red_circle: run foreground service :red_circle: receive data from Internet :red_circle: Play Install Referrer API :red_circle:Google Play billing service Why should this program have access to these?!,1
6e47ca39-9e04-4955-96d7-3ee7cdbf9031,7 day fre3 trail bs then you have to pay,1
3f74feb6-f7e6-468b-a690-1a7d96df265b,:smiling_face::smiling_face:,1
57904479-f14d-48e6-a2c9-dd1f40878c83,"There is no reason to ever pay money for this. Its just a checklist. I thought it was ""learn to be productive"" so there would be some type of system to help teach you how to slowly build a habit but no. Its just a checklist that costs money. My dalio app can check off all my goals AND track my mood and be a diary and it's free. Just use google tasks even if you just want this exact app but for free",1
1ab9312c-2f8d-479a-a433-e0183b7c96f8,Bad,1
ce62d468-580a-48fe-97fc-08fd5e2bfc1a,I m not satisfied at all. I got the one year premium. How can you charge so much without the ability to sync between devices :O What would happen when i change my phone which i do regulary and how come u cannot save to tje cloud as advertised when the Premium was offered to me. I m looking for an alternative despite having like 11 months left as premium,1
3e774960-7144-42af-a41d-558fe0ff6f55,"Stop begging people to buy the ""premium"" version of your app. For an app that's supposed to help you stay focused this is quite a distraction. Uninstalled.",1
5d1cf831-f433-4f83-bd77-fab99e14a641,"Can only make four habits without paying. Very disappointed, going to download another app. :unamused_face:",1
4b32545a-f751-490a-99b4-2cd3071919be,Waste all options are paid you can set only 4 habits,1
2d34e71d-11f7-44a6-a1b9-3475bf443957,"I can't figure out how to mark my habit as done so the app is pretty worthless. No help button, no way to mark as done. I'll cancel my subscription if it doesn't get any better than this.",1
bbba54ad-ef38-47ba-813b-54135bfe6d07,Is there web version?,1
c1f8569d-0b48-4820-aa7a-c19b8b71bdd8,Why the hell do I have to pay to add a few more habits? Just make the app paid then!,1
927e2402-f4bb-4ebc-a643-96c7be7d0c68,Can't use without payment info,1
503b137a-74c5-45c0-9399-c74c657bbf5e,"App requires a recurring subscription - $30/year. Upon installation and setup, none of my daily reminders actually pushed notifications to my phone, so the app doesn't even work properly.",1
ec4ddef4-0be2-40b5-b724-a292fd573d45,This app was great until it stopped working. Will not respond for emails not workable at all. Hopefully this gets their attention. I wish I could get a full refund.,1
eaa8d0f7-0f0e-4e89-84cc-5313a7e4ecfd,Not possible to save progress when you reinstall the app on the same device or want to use it on a second device like tablet. What a bummer.,1
a299b98d-23e0-4f51-a392-12381e32ea8c,Not well supported. I've sent numerous emails to reset my password and none of them arrived. (Confirmed beforehand that email was working and had full connectivity).,1
64637b64-df74-441b-a5a5-b557f41f07fd,"I pay for one year but my acc not avalible on web, total disaster",1
5eaac66a-b933-4409-82da-856a73024f53,Waste of time. Free version can't Add Habbits.,1
9857f0d3-7805-4909-baa7-d2a1b03fb033,:red_heart::red_heart:,1
beba7505-1990-40c9-b7d2-e725c55e26e9,"Hey, I just installed the Productive app. I loved the app & its premade habit templates. But as soon as I gave my consent for 7 day free trial, my credit card got debited of 2500Rs., didn't even bother to ask me what plan I would prefer monthly or annually. I think it's the biggest Scam I have come across in 2021. Please pay my full amount and I will subscribe only after 7 day free trial, if I found the app useful. 17 Jun: Issue not resolved yet 25 Jun: Didn't get refund yet",1
cc104060-7e2b-46cd-82b2-04f947cd692c,Unhelpful c'mon it's confusing and didn't even remind me at all.,1
c096e99f-ac84-4224-9d14-e0371f690b53,:red_heart:,1
01dcc32b-646e-4511-8392-efb80bff2024,Awsome,1
11763ccf-676a-438f-923c-194376da82d9,"I selected the 7 day free trial, but app ended up charging the first year full fee of INR 2500 upfront. When I am using it, every time I log in, I need to start filling my details again and again. I registered using Google credentials but now I can't find a way to log in. If I log using already a member and forgot password, the reset instructions never get mailed.. I am already chrged the full fee and I can't even use the app. It's really frustrating and cheating. App team resolve or refund!",1
d72826fc-8000-4827-92e4-8a2a564d8d1b,"If you want to do anything with the app you have to subscribe. The ""free"" Version is a sham",1
50782744-719a-4b30-a37a-e077cbe5eac1,"It says 7 day free trial. But still charges you for the 1st month. App asks for inputs every time it launches. Whatever I entered the last time gets lost. Does this even work? Why is there no way to Register, but there is Sign in? How will someone sign in if they can't register?",1
85f911a4-db56-49c1-9133-13e58b074bc0,"Where do I begin? If you subscribe via the app using Google Play, you're unable to log in via the web. Appearantly there's an order for account creation that should have been made clear. I've canceled my subscription because of the web app which continually took me to an unsubscribe page. I went so far as to create a new web account with a separate email address, logged into the web app after clearing my cache and even used another PC, but saw the same results. Total disaster.",1
1c7e5327-ff7f-4fa8-8ff8-08381d8bfcd0,Me cannot make habits if we will not buy the subscription,1
c7911e8f-ff45-4edd-a696-0e6475b5d728,The app said 7 day free trial and charged my card instantly without any way to cancel the subscription.,1
938e61e8-7a74-472b-b908-9cf0f5cfa4c7,Reminder is not working,1
add721d4-83e3-4f43-abf2-ab87192eb2a2,"This app is a SCAM. I downloaded it like most people did to try and build new habits. The ""notifications"" never worked, and so when I tried to end my trial, I had no email confirmed I'd ever signed up, nor was it listed in my Google play subscriptions, and when I tried to log onto their website, it only took me to an email unsubscribe page & wouldn't let me navigate anywhere else. So I foolishly assumed I hadn't signed up for the trial, since there was zero evidence. Got a $30 charge today...",1
74fa5182-6959-42b5-8ca9-b8cd0f99a581,"I paid in full and purchased this app on iOS and then I moved to android, but I have no way now to login or use this here. I don't remember the web login they are asking me now..what should I do?",1
ba0b929e-42ab-47a6-9700-7351cba678c5,Very confusing got in there to find my account information to cancel my trial and didn't see anywhere to cancel but read somewhere that I could write an email in to the support team and I did that and they took my money anyway I don't think that anyone should subscribe to this and unless you definitely want to buy it because it's hard to get out of I give it actually a negative five stars for the fact that I wrote them three emails so that I wish to unsubscribe and I couldn't find my account inf 5/15/2021 IT WASNT LISTED IN MY GOOGLE PLAY SUBSCRIPTIONS! IT HAS SINCE BEEN RESOLVED AND I AM THANKFUL FOR THAT.,1
1333c7fd-94f3-4dce-bd46-8afaeebd7050,I tried this app and decided it was not something I wanted so I deleted it. They still charged me $30.,1
b0f390b9-0706-460e-b2c4-9a0a06589d1a,"J'ai annulé l'abonnement dans le délai de 14 jours mais il n'a pas été remboursé. Point négatif : aucune synchronisation des taches, si on change de téléphone on doit recommencer à zéro et tt réécrire . Le service client est réactif mais ne résout pas les problèmes. Je déconseille.",1
500501ef-ac8a-42b8-b29f-34bb76d467ca,Wants you to pay for the app first thing without letting you see the app in full.,1
c54e624e-7fdd-4b03-bcf4-52d7428907e0,They took 29.99 even after I canceled it,1
ec08e1fd-b230-4748-bbf2-a44173239602,Mmm not going to pay for this. Uninstall.,1
dc4b458f-8b5e-478a-a3be-00d1dc7f83ed,Quit trying to sell me something before I even know what you do...1,1
f279a9e7-911a-46cc-a890-4f7bd54e931e,:red_heart:,1
5352d48d-d18f-4e12-ab42-6263064e4617,Disappointed that you can't even trial the app without subscribing.,1
4eff7e79-a40b-4aae-bf42-3399ffdff9ca,This app is extremely expensive. What is the monthly charge for? This is a productivity app. What service do you think you're providing that makes one month of your app equal to lifetime access to every other app that does the same thing?,1
e9050ec5-0f5c-422c-9e95-2aa16d04b973,"You have taken $50 from me very sneakily while trying out your app for? 5 seconds, then you subscribe me for three years??? I want my money back, the app is just a glorified calendar. Highway robbery. Do not download, they will shaft you of your money quick smart.",1
1fd4d74e-ae14-409b-9340-ae0d002bf2fd,Are you kidding me? I have to setup an habit plan everytime i open the app? Seriously?? This should be a one time thing imo. A total waste of money! I demand a refund :face_with_steam_from_nose:,1
3e52adf6-4e62-4fe1-8ac2-f79410de3e46,WARNING DO NOT SUBSCRIBE TO THIS SERVICE. I unsubscribed to the app just after downloading it because of technical issues and it still tried to take money out of my account. Why are the developers trying to take money out of my account when it shows that I'm not even subscribed to it? Sketchy.,1
415529fe-0752-4138-a909-eb0740a397bb,"Spent hour trying to navigate app , procrastination in itself . Cant work out how to complete a habit which did allow me to swipe but now says not complete. Frustrating And now what's even more frustrating that having cancelled prior to the end of the free trial. Still got charged",1
d95044bc-6088-42ab-92ee-7361ae9317d3,worthless,1
92de2066-a3c7-4687-b1d1-c77095d57c45,Im learning ill get there yet mahalo,1
c4462e4e-b018-47b7-a0d9-36cde2f7d404,Not a free app despite what they say beware .The only way to set it up is to sign up for a free 7 day free trial then you have to pay. No other option to set up a free account on the app.,1
ea01499e-c224-4fd7-aae3-9c73223e5add,:red_heart:,1
587b9f45-aa7f-4c32-8d5e-5d3ddf0e4786,I got charged for a year and I had canceled in Play Store before the free trial ended. Please reverse the charges,1
e0ef1388-ddba-4c9e-9bf7-5070c5d91545,There is no reason this app should have a subscription service! Are you kidding me! The app really could have been great but because of its scummy tactics I will not be using it.,1
3d6ada1e-9a58-4219-a053-060301d15f4f,Barely started the setup and it was asking me for a method of payment. Ooooops. Bye.,1
9a09e718-f884-4313-a7f1-d60e8fbf176b,"No widget, so absolutely worthless.",1
15f19bd6-3984-427e-8920-4b8955a0a47c,I have tried to cancel since free trail. It is not in my subscriptions in Google play like you explained to cancel. Now ive been charges 29.99 and emailed 3 times. Its still not canceled and I cant get a number to call,1
ddd7d4dd-8adb-44bd-97de-8f21a4742e4b,"Terrible App, it makes it sound like you can just cancel anytime but the instructions to cancel are incorrect and won't work. The subscription option never showed up on my Google play account and I was charged the $30 and unable to cancel.",1
60ca0ee7-fe8e-4152-a4e6-aa8d5ac3d4fc,I canceled before the end of the free trial and was still billed $30.,1
11bbcc7b-3452-4cd6-93cf-627edc6d3c2c,Purchased app but unable to create or log into account :enraged_face:,1
45269ea7-e9a8-4a40-a7f4-90031a942e5d,Its not free,1
8707e978-3a1a-43ad-9645-84d00acc3e32,Shut,1
5391e5f9-72dc-4685-9faa-093a70250ec6,Can't open the app I've been charged for,1
0e76338c-e106-45c2-844e-029a475271c7,Subscription based app don't recommended :thumbs_down::thumbs_down::thumbs_down::thumbs_down:,1
039a1cf9-7d61-4f53-b6a4-966b9de7d29c,Complete waste of money. Not worth it.,1
e30db239-3ee3-4b6b-b387-f50388525705,Worked great until about 2 weeks ago. Now whenever I open the app none of my habits show up and it's just blank. Nothing ever loads so the app is now useless. Waste of my money!,1
610df070-60c1-4ed4-809f-ee1d276aa128,"I CACELED THE 1ST DAY AND WAS STILL CHARGED. I found that this app was not what I needed as most of this stuff i do already on my own. I followed the instructions, went to the site as it said you can not just uninstall the app to cancel the subscription. I canceled it on the first day as I was setting up goals. This is when I realized this app was not what I was looking for. I'm checking my email now only to find that I've been charged for the year now. I want my money back. I canceled the sub.",1
26d8add2-aaef-4eb3-9166-2e73dd3e3291,You have to pay or you can't use this app. I agree to have upgrades if someone wants too but being forced to pay is a no go for me :thumbs_down:,1
20bddb38-915a-49ab-8bca-2ccd8f39606a,"Why can't I check off completed habits????? I want to love this app, but there are no help screens or FAQ menus......just at a loss.....and I already paid for the subscription.",1
87972185-1571-4e0d-9264-fb3e63fe7ccf,"Worthless app. I unfortunately bought the premium version for ""50% off"" for $14.99. It's not even worth a penny. The only thing the paid version let's you do is create unlimited routines and check them off as complete or skip. Doesn't even notify you when you have a set time for notifications. Everything you can do with this app you can do for free via checklist or calendar.",1
374c21d6-9b20-4955-b59b-7d4d6838f04e,"Very misleading. I thought this would be for free, but turns out you have to pay. Atleast write it in the app description. Uninstalling this app right now.",1
c4bb178e-821d-4ca4-b49e-479614cd6b21,Where is lock app option? I'ts far from the IOS,1
cf78d473-0456-4e0c-86a0-1fb1074541d0,Can't even use a lite version,1
a6e0f859-863a-489b-9b17-657b7f3ae639,NOT FREE,1
847bca71-e904-43be-8277-fa465a15a9af,The app consistently resets it's because it never gave me the option to create a log in or password. So I am stuck in a loop that makes the app completely pointless unless I want to rebuild my entire profile every time I want to use it. Thanks for stealing my money.,1
c653beb8-95b6-4809-97ef-c8456db64252,"Fake, Fake, Fake. When you are charging for the application after 7 day, why you mentioned it as free.",1
34466de5-8c0f-4f73-a94b-c4f0c5e42026,At first this app was very good then suddenly it was showing blank I have opened this app again and again . :face_with_crossed-out_eyes::face_with_crossed-out_eyes::disappointed_face::disappointed_face:What can I do now,1
ef444bb1-b4bd-4ec2-a55a-de202bfedfdd,Wish these apps would make it clear its only a free 1 week trial,1
0251d09a-06c7-4994-a068-25f610444d38,"Saying ""you have have four habits in the free version"" is very misleading because it implied that you can always have 4. When in fact you can only have 4 for all time... I had to delete my fourth habit after only a few day because the tally was not cumulative, so I thought I might have set it up wrong and was going to re-enter. Well I can't now. If I try to save the habit it brings me to a pay wall, and closing it takes me back to the edit screen where I once again can not save.",1
5efe0c5e-6d11-480c-8040-f22c686fb4d4,"Frustration, how can I create an account? I have been charged over 30 dlls for an app that I can't use!",1
2a6d7dc6-7970-403f-a67c-ab57342bef1d,"You can not add more than 4 habits without being forced to sign up for premium. And while the button at the top says try for free, there is no way to see whethet you have 7 or 30 days to cancal before money is being stolen from you",1
c16a97db-5fde-450f-9c7e-4449ed82652d,"No way to even try out the app for free. If the entire app is paid, be upfront about it and don't put it in the app store for 'free'",1
58d3ee99-9b4c-4724-bebe-e6c683f3e5b3,Can't set more than 2 goles in the free version,1
61644658-3fc0-4e05-934b-0b23b2de278d,"I fail to see what the added value is to a subscription model vs a full paid version (non-existent). You charge as if it was a service yet it is not. Regulations should be applied upon this ""service model"" misleading apps.",1
1466fb33-07f5-42fa-8c7d-665ce543b8bc,Google must create notification for apps requiring payment before we download them,1
32b9bca7-4c37-48b3-a79a-8b59ec9cd698,Can't even peek at the app without putting in a credit card = immediate uninstall,1
47a835be-411b-4f47-a29a-1f20664138f6,"Ridiculous pricing, dark pattern ""free"" subscription trial. $8.99 / month is -crazy- to prompt users with, $38.99 a year should flat out purchase the app period. It's unfortunate to see this subscription model applied to an app like this, please reconsider how you're offering value.",1
8387b874-c953-4254-b5a2-b3904711bb98,"An gimmicky and ultimately useless app. Edit: I'm not a developer, I have no idea how this app could be fixed aside from taking it back to the drawing board. It's conceptionally flawed.",1
e1533ac6-03d1-4dbb-837a-23dc7e459811,Tried to set up then straight away asked for my cc details for a free version. Just advertise it as a cost app dont be deceptive please.,1
61511efe-c156-4549-bede-e05f98652cf6,You can't use the free version bc the ad for the paid version keeps coming up and even if you close it you cant use the app bc it takes you back and once you click and option its the same ad again ad nauseum,1
c008a61a-28fe-4b82-95fd-3f663e8ed5b1,Just too darn expensive. Very very annoying premium upgrade banner that just wont stop popping up right from the get go.,1
09f09a01-767d-4cb4-b121-140c52c798c3,You have to pay if you want to make a list???,1
fc3ba093-98a9-420f-982e-3717e3044556,Paid for premium version and notifications do not work at all please fix,1
248db7de-dae7-4c3d-8894-d6a5df6330d4,Not worth to pay,1
f3916eaf-f831-4e70-a0ce-48fda981e222,"It's impossible to just use the free version. A popup for the paid version will come up every time you try to add a new habit and you can't get past it. You can X out of the ad and it takes you back to the editing section of your new habit, click save, the same ad will appear.",1
33056b64-597d-4a3a-88d6-cdd2ef289986,"I downloaded this once just to see i didn't add any of my bank details,yet i have subscription I never pay for my apps as it's a waste of money why are you taking money out monthly?",1
519e3a2e-26b4-41f9-889b-a6d9357bd3a8,PAID FOR IT BUT NO ACCESS...and NO SUPPORT. I paid for the app through Google Play but it won't give me a password and there is no place to access support to get them to fix it. So they have the money and I don't have access to the app. Scam,1
63425b65-4298-4d0e-aca0-7429727f90a6,Where is the widget option? It's not showing up on my galaxy note 10,1
f56667cd-e6d8-465a-8976-e027948a78c2,Cant even use app without it forcing your card info,1
3612f6fd-f6a9-48bb-913b-f1127ae3701a,Reminders don't work No clear way to check off finished habits? It just goes to edit screen only Intrusive ads Otherwise would be a good app.,1
fceda811-7eae-4456-a648-90741d947365,My son bought it by mastake what do l havevto do to get my refund!,1
945da93c-ac13-4b1b-8dd6-d427a42c424e,"After setting 3 habits, it literally wouldn't let me set anymore, just brought up an ad for the paid version every time I tried.",1
7f781346-f0bc-467b-b1f5-3bcffff349fe,WAY too expensive,1
e83fa4b7-7c3f-4878-9462-dc7ec8366423,Lousy,1
770c745e-dc52-4389-92c8-179890a1dce1,The amount of pop up beging you to pay $30 for the paid version is outrageously intrusive and can't make you focus on your goals! I won't pay anything for this kind of dodgie UX/business model. I rather recommend FOSS alternative than this scheme. :microphone: Edit to reply to the developer : Kindly note your are using your UI to confuse/trick the user to pay for the premium version. Couldn't use it freely as I was always reminded to take a subscription... It even shows up on the corner of the screen.,1
7c2b1d5c-46b1-451d-9ed5-be929d2ee1e7,"Although I am in the free subscription period, from the beginning of the period 4 USD was withdrawn, this is a shame",1
f6a8d301-816f-4e7e-9839-ce2bbe6f1f05,No local backup restore option,1
fa057bde-33bf-4fe5-9f8a-1a782afe8f95,"This app has a nice UI but the free version is completely useless. Also quit answering complaints with copy paste messages, it just shows how much you don't care.",1
1c876223-c775-4256-8cc3-d83f33f3b53e,"I've tried so many times to get password to log into web account, but I never receive an email to reset password. Please help",1
f7ca4f86-0427-4c2d-aaff-27736743ef01,"I signed up paid the fee, set up my habits, go out, they disappear. I am prompted to set up again???",1
c4460d79-510f-4d47-8fbc-4faec759269f,"Have to pay to really be able to use, its ridiculous",1
f8301aaf-9803-44f7-b28a-74655a4b1899,Totally paid app from start.. if you're looking for free app don't install it. They scam you to install the app then to subscribe.. not a better way to work on your app,1
6bd7194e-d5c7-4769-9db7-d1049ffa83a9,"DO NOT INSTALL! Extremely limited functionality for free version. More upgrade popups than content. Literally allows under half a dozen habits before forcing subscription. One star for a simple interface and small assistance with developing unthought of habits. Not really worth paying monthly for. In addition, developer replies to reviews, dismissing criticism of a clear subscription scam. Check out all the fake five star reviews :rolling_on_the_floor_laughing:. DO NOT INSTALL!",1
3d80798a-0510-46e0-a84c-34fde71df404,"Wish you could specify which days of the week you want to do things rather than just ""so many times a week""",1
298373aa-db64-4fde-8fb1-25b899f39103,"I haven't even been able to try the app to see if it works, and it's already pushed me to sign up for $48/year. There is no proper free trial. Dishonest and unethical marketing.",1
8bf44a07-b378-44f8-af80-f1f2bfadd33f,No local backup restore option,1
2cabbe29-ea6b-4ec0-abcd-5ce623ee9baf,There is no option to tra k the habit once obe done it unless its in a challenge.... My streak is not broken i havent been able to log any of it :face_with_rolling_eyes: every time i try it onpy offeres editing the habit.,1
9581fecf-c615-4513-9076-ebb7d8e5f5a1,"Unable to open this in my Tab S6 Lite, it keeps crashing",1
65395387-e105-4d7d-90ba-f997a2e32b4e,Take 30e one year without a message of warnings !!!! Give my money back !,1
b2e14012-21c3-4360-b497-3be353a4729f,Not good,1
0b425812-9bfc-41db-a64c-a1b9fa6031e0,"This app sucks. The ads are obnoxious and try to get you to pay even before you've actually opened the app. On top of that I haven't once been able to open it without some stupid ""Start a challenge"" or something window coming up without a way to close it. I just want to check off my tasks. Uninstalling.",1
f0905941-3804-4ad1-84e4-1c066f7b4a5c,How do I transfer data from 1 to to another? Its completely reset everything back to square one on the new phone.,1
1261b328-afbd-416e-97c3-67daa20b93e0,Costs money dont install,1
4e3c9e23-7871-47be-89f6-a7f4a716e651,Notifications not working,1
faa68635-769f-4ce1-8006-b96a434f6e21,"Not worth the money. Signed up for the 7 day free trial, forgot to unsubscribe, ended up paying for a full year :expressionless_face: Ended up removing the app because it was overriding the Do Not Disturb setting on my phone and waking me up with notifications at 6am. I tried everything to get it to stop but couldn't find a solution so in the bin it went.",1
b2c59eab-528e-4d18-bcb0-202818c385ca,It's not a free app. Don't advertise for it as a free app when it's not.,1
8738601e-3e84-4761-a2df-4b599f4839f4,Says it's free - it's not. It's subscription-based.,1
