reviewId,content,sentimentScore
954bb76b-538b-43e6-b9ad-50fff5fb7e98,"My yearly subscription is up and I will not be renewing. I LOVE the app, but the alerts/reminders stopped working very early on, and to me that's the whole point! I need an app to help me track things because I can't remember on my own! I reached out to support and they are very slow to reply (like weeks) and all they do is say to uninstall the app, clear cache and data, and check permissions. I've done that and even got a new phone and still nothing. Very disappointed :disappointed_face:.",1
b2d34d92-9ca9-4709-a84a-9f9e64491fdd,Notifications are NOT working at all,1
bcab59b5-c194-4b37-b420-692fc0503bf6,Not free,1
7fbb5987-9ed3-4a7e-ae69-67a4819b8a6c,App doesn't work properly. Customer sevice don't reply to emails.,1
130ad59c-33e0-406c-84f7-b1b88a8a872b,"I have loved this app for years, so finally decided to purchase the yearly subscription a few months ago. I have not received a notification or reminder since. I have reviewed all of the app settings and my device settings, but nothing has worked. I have uninstalled and reinstalled, cleared the cache and the storage and nothing. I attempted to reach out to support weeks ago and have not heard anything back. Very disappointed that I have to make this review, as I used to love the app.",1
c800ef52-4800-4e69-8cb8-45572bd16b89,notification not working,1
5ca18d4f-cbc3-4f01-8276-c07c3f24d997,"canceled my annual subscription through Google Play store in 2021, 3 days after my purchase. Just discovered the renewal has been charged to my card each year since cancellation. they have charged me for 3 years I did not agree to. have done so much work to contact them following all their processes and nobody has gotten back to me. provided proof email from Google about my cancellation... nothing. I'll have to file fraudulent charges with my credit card.",1
497cb5e5-df7f-44f2-bb5d-0e64246c99fe,Asks for credit card right away...,1
5d296cca-a008-429e-8f7b-978241b825e1,:tear-off_calendar::chart_increasing:,1
a08c4c59-8c64-4ff7-93ac-06504eba320f,"Every time I open the app on android it asks me to do the same thing....wake up time, review of day and what habit. That's it! And now I've been charged for a pro account which I did not sign up for.",1
86f38c92-a171-45a7-a7e4-6620aea611d0,So badd it's premium :thumbs_down:,1
41a59016-93f0-450d-a07f-57da03f364d6,No widgets in android,1
99b5815d-45bf-41d7-93b5-65ae3837e572,"FANTASTIC app but horrible, horrible service!! The notifications don't work and won't work and I can't for the life of me fix them. I ended up paying two separate subscriptions and their support is completely ignoring me! Idiots!",1
efff09fe-a288-4a23-b5f5-af527395ca4d,The worst app there can ever be. Fully of dark patterns and oh my god that pricing. Just stay away,1
c9496342-08ec-4a48-b8e8-8fed038d188a,"The description states this is a free app when in actuality it's just a paid app with a free trial. That's not misleading, it's lying. Do not support!",1
474db54c-bbe8-4c83-82c7-7e111d3167d4,"I have the paid version. It doesn't give the notification. I raised the concern to the support team like 3 months ago, still no update. Purchased after positive reviews on YT and other websites, now I doubt the authenticity of those reviews.",1
d57a8a24-9e71-4834-8095-37b1140e1b68,"extremely unusable for free users,",1
f4c6f77e-f52d-44f9-9921-54eae5c7b463,"The app stopped sending notifications. I talked with customer service, did everything they asked and it still didn't work. They told me ""they're working on it"" for two months now. Prior to the app not sending notifications I really loved the app but, the whole.point for me, was that it would remind me to do my tasks. I don't need a list app on my phone. I'm really disappointed and will be cancelling and deleting the app.",1
c02ac98e-aec1-4966-a2fc-c8a51c89f7d0,Not getting notifications,1
88a76d3b-44db-4b02-8dd1-f37ae5f7aa07,Warning - Can't transfer data.,1
c910a06c-8039-4051-97b4-1c384e5e9f04,Paid not free,1
34253d3b-8e15-4402-a2c9-6a3f52a3f3ac,"No reminder not working, you cannot write any comments on your habit why you did or not Short thing . Only you can mark everything here very poor you can get things better than that and for free ! Also I emailed them regarding these issues with no response",1
ee61f572-2372-40c4-88b6-cc7c5fb3c0c2,:white_heart::white_heart::white_heart:,1
2aec6ef0-7f57-4ae8-b297-acfb209e74f2,I have go for the trial and cancel it the night itself as it was not the product I was looking. I still don't get my refund. I will advise anyone to avoid it.,1
6e007b2e-cb27-48dd-a5af-aa4aaa2579d6,Useless,1
3da22a6b-953e-4e13-bc49-3a441f080ca0,WILL NOT TRANSFER TO OTHER DEVICES AND MAKING ME PAY $70 AGAIN. Requesting a refund.,1
9b741037-2152-487f-b378-55063af7fa7b,Not working at all. Refund please,1
df941d87-263b-49ed-8858-1a7cb354f480,"Slow and unintuitive. 1) You can only mark habit complete by sliding it sideways. I tapped multiple times on an item, no reminder, nothing, you have to remember something from the tutorial you glanced over with one eye. 2) I forgot to mark a habit complete and the next day i couldnt mark it for the previous day - streak gone. Why cant i edit? 3) habit completed sound. Why? It's very out of nowhere and since app does not have any other sounds it catches you unaware. App is unusable for me.",1
1d8f2227-fb60-4d4f-a9f8-555a51b35c5b,"Bad application I am not receiving a notification, and cannot write a simple note . Very bad one no need to pay one dollar on it",1
42a5125b-6303-472b-9668-7c30c0c338b8,I bought it because I saw it had a widget. Unfortunately it was only available on iOS. Literally one of the must have things for a habit tracker. So disappointed...,1
24d71f63-896d-40d9-a808-26542353a8d4,You can only have 4 tasks then you have to pay,1
058edf29-c640-47c8-9414-a5f6943b104d,Worthless. Never sent notifications even though set up properly to do so. Tech support is equally worthless. DO NOT BUY!!,1
464fa5e3-6a59-40d8-ab90-bcf5f813b406,no notifications :(,1
9737e78b-07d7-4a3d-9332-db4a9d7f0bf7,Cant stop subscriprion. Difficult user interface,1
ac099562-0aa7-4937-910c-ae82c8e833dd,The app doesn't not give me any reminders even though I turned on notifications in the app settings as well as the notifications in my phone settings. This is is extremely disappointing because I already paid for the subscription,1
1cb462bd-1c09-4ba4-91ad-b01edd06f752,Asking for pay from the beginning is such a red flag. Not recommended. There are plenty of better options,1
bd9dac64-48d7-4881-bbc6-18ba0456bac4,Have to pay to use anything.,1
ae239880-f1ae-4a08-8b6d-bfa92b50c956,"Never sent me a notification, although it has the permission.",1
c3ecaba0-9579-4f97-92b6-d7a6890f0c0b,Such a scam. Really bad app. Its only a checklist,1
0a130861-1bda-462b-b739-937560c91ca3,"""DO NOT INSTALL THIS"" They offer nothing for free Free trial is also a scam",1
73199fef-c0c2-4267-91bc-ab874b637f1f,"You have to pay for everything, you can't even use the app if u don't pay",1
29fd773e-f32a-4df9-814e-e4642ff98877,The notifications just stopped for no apparent reason. I checked my phone and alerts permissions are turned on so it's not my phone.,1
fa206d82-8ef5-4019-b5d0-48896b226c6b,"Didn't even open it. Read reviews and instantly realized how poor the UX is. What about developing a good app, making the user want to pay for extra features? Noo you'd rather ask for money before we could even give it a try, which clearly shows the developers intentions:)",1
16fc15a5-2f8f-4e16-91d8-48ee05f0f596,Notifications not working!,1
19c089fd-9983-466f-95ce-f5b123684131,"Hey guys signed up for a free trial through website, not app, cancelled it the next day, wasn't feeling it, then got a charge on my card for $34.99 emailed to no avail.. please help",1
d1c8082f-0761-4a65-8f30-1c1198b19f07,"I can't do anything on this app theres no free use features, it's always asking to subscribe.",1
0a486c1f-5fe5-49dd-b096-f90864270834,"No matter what i do I can't get notifications. Uninstalled, cleared cache, checked permissions. Very disappointing as I liked the app",1
2f432310-2b0f-495e-b668-5ed95a89872e,Notifications is not working tried all options... in app ther is no option to get a support too.,1
7c9ec01f-d0e8-4db3-9d45-8704a51a50b6,"the remind time isn't working I set it to remind me yet nothing, not even a pop notification on my screen or a sound to let me know . so hats the use of trying to keep up . if I saw previous reviews never would I ever waste my space on this thing",1
f8308e5f-e8ae-47fc-a334-d8e85bc9c3e2,Downloaded it. It asked me 3 questions and then just went to a blue screen. Nothing to click on to move forward. Thought maybe it was my phone restarted it and still the same result,1
a85f3d3e-5b90-4055-bd75-f26d1913451f,Couldn't even make more than 3 habits each time I save it just made me buy the subscription and not let me save,1
07de40bf-f267-4c7f-8e13-fc33163b63e5,"Not a big difference between Google Calendar, pay if you want more than 3 activities at a time. Deleted and back to Google.",1
911f2162-1993-44fa-b27d-21b46e8b60f5,Sick,1
0c273e0a-85e4-413f-93c2-b870b05a284b,"FYI - NOT FREE as listed, free trial.",1
fa1879c7-9d55-4e26-8398-61e2b28fdb81,"I downloaded this app, did not like it and uninstalled again. So I never used it. They tried to charge R500 on my account a month later. A very large amount. Luckily I had a payment limit set up. Ridiculous ethics! Be careful!",1
3783d9d4-0caa-476a-8190-ed1f7fe44b4f,8.99 a month lol this stuff can all be done for free with google or a superior subscription like office.,1
94e42151-6962-43c9-9dc9-a5f8a1051355,"Canceled the free trial in Google play before it ended and was still charged for the subscription TWICE. Don't bother if you're trying the free trial because in the end it's not free. What a joke. How they responded to my email for help. ""At this time, our team won’t be able to prioritize the specific issue you encountered. We apologize for any inconvenience this may cause. If you encounter any other challenges or have questions about the app's functionality, please don't hesitate to contact us""",1
b3b1d8f3-b35b-4f59-bb65-63e00ef4a26b,I bought a subscription i m trying to log in nd every time i restart the app it start from new login....i just paid for the yearly plan & i m feeling being scammed please reply,1
e53b2c13-eea2-49c0-a45e-d224e55c3455,No widget,1
b1e224d3-dfaf-4446-b643-bfb232007f68,"Froze while trying to set up an account. Tried to uninstall and reinstall, didn't help. Here's the thing, though: I shouldn't need to open any kind of account at all in order to use this app. It should just run on my phone without any further fuss.",1
9b7273c8-24e1-4683-947c-e329576741c2,There is no free trial!! They lie. You are paying for a year automatically. It took me five minutes to decide I didn't want the app and unsubscribe. I have still been charged for a year,1
4393d071-e880-4388-8610-e141b8c11930,I can not back up my data. There nothing when I login again,1
0dad3b98-da09-4851-9851-cc72bd2f6078,Full of bugs. Useless app,1
e4f99c49-00f2-42e2-a977-ae784bdc499e,Yuklab olmanglar plastikdan pul yechib olarkan,1
5f4ec9df-1543-4b77-979a-2b4e0ef4691b,Apenas 02 hábitos disponíveis ha versão gratuita.,1
e7506cad-3fa3-4552-a29a-c1a7c6a38b5b,a:face_without_mouth::face_without_mouth::face_blowing_a_kiss:,1
e5682eaf-2229-46af-be48-de931d3b3bf0,Bed reminder not light up up screen when screen is off,1
eb39640f-dee1-465f-90fb-0e44b92b1561,"This is trash!!!! I am frustrated. I subscribed for a premium plan for one year, and my phone got bad, so I decided to switch to my galaxy tab. Unfortunately, I couldn't use my previous account on the new device. There is no option to log in. This means you have to pay different subscriptions for each device.",1
b6c67856-7493-43d9-9606-4dba46f438c7,"Pathetic, keeps hanging all the time. I finally deleted it",1
68fc4470-fb7b-4d84-b93f-1b921329efb1,Installed. Crashed x3. Uninstalled. Never did make it into the app to actually try it.,1
5268aa6e-e76b-4b51-9dc0-4cbe8b080780,Not working on my vivo y35,1
fc32c829-5b49-4884-a393-95bfb7b38af6,"It sucks. The app description showed it having a list to work from. All it does is set reminders. Google calender can do that. I was hoping for list to work from, reminders and a bit more.",1
ccb65d45-4daf-473b-be0c-dcd2c28cb5f0,App crashes when trying to subscribe.,1
e1294b61-785a-4369-952b-b24e044b7e95,How do i get a refund? I only downloaded this app to see what it was about i dont even use it and you have taken £28!! Aload of rubbish app,1
1695a002-f525-4531-a6d8-0ae5e35b9aa0,"Don't do it. There's no way to add habits from the day or week before if you don't log in that exact day, which defeats the purpose of tracking at all. I don't want to touch my phone apps every day, but I still want to keep track. It's not user friendly from the start and adding unique habits wasn't easy. Just straight up look elsewhere.",1
9139945b-21b2-408a-8321-a8d215b87387,"Can't even finish the set-up process , it's just a blue screen.",1
2a25da07-b5d9-4224-8a5c-fd44902e473c,Ads :unamused_face:,1
84c3ffaa-4908-4e17-b163-dfd623a69d2d,Unable to try the app without subscription.,1
28bb7993-2ece-423a-b226-aeab1752f1fd,FEELS LIKE A SCAM!! (It started working again but still cant cancel the subscription) It worked great i bought it for a year. But now it just stopped working. When i uninstalled it sais the subscription is still running and i cant find where to cancel it anywhere. The is app completely bugged out and ive tried uninstalling and installing again. Now it just gives me anxiety that i might be charges again against my will,1
1e533622-fbaf-4e75-a406-55c879946e0c,Very expensive,1
34640b3d-c810-4309-8d2e-3bd00ca29c75,Every single time I try to add a task the subscription pops up and it won't let me add anything... it's stupid you Have to have a subscription to use the app,1
1e12a47c-fa97-43b5-9644-f5ebe921d461,"Too many things nowadays wants a monthly subscription to use, building good daily habits should not cost money, you're greedy developers and would be helping the public with ads instead so you still had an income of revenue or a one off app payment, instant uninstall I can literally use a pen and paper for the same outcome.",1
9ff9e965-b41f-4e3c-91b0-fe07b4cc5b76,Not worth the subscription. Wish I didn't bother and kept looking,1
99f41a3e-8f81-40dc-8b01-ea91d47971e5,When you first install the app it asks you questions. There is no back button if you make a mistake or want to change your answer. I had to Uninstall it and reinstall it to change my answer. I clicked on something again without reading it and again no way to go back. I'm annoyed enough to give up.,1
04371ab9-86b8-45f0-a8e7-e9228ae0e826,:fire:,1
4769c9d9-68cc-43eb-94b9-f742f0915d2e,The last update is laging and so slow,1
45612418-a010-4d00-aa1a-e05f09c17db9,"App crash I subscibt it 1 year and after about 1 month i could not use it. App crashed evey single action, i cant do any thing, already re-install but it still be the same :disappointed_face:",1
200da81d-ed01-4e4e-9a44-6f5af81a3e88,"Paid subscriber since 2020. There's a lot to like about this app, but two things are finally getting me to cancel my subscription; 1. Each update seems to harm performance, which is the opposite of what they're trying to do? Currently it's super glitchy and freezes constantly on both Pixel 7 Pro and Moto G Power 2022, to the point of being unusable. 2. Main reason I'm unsubscribing - it's WAY too expensive. I've spent a couple hundred bucks on what is fundamentally a to-do list. Should be $1/mo.",1
47cee7b1-78b7-46c6-9e3c-0fc2184447f6,It has suddenly stopped working. When I open it and click on a habit it crashes. The app in unusable in this state. It makes no sense to pay for a broken app.,1
bdf1dc7b-03f9-44a3-90dd-09312d288043,Reminder: Do not install again.,1
89b48360-b507-49dc-8513-860e06252a50,Can't run the same account on my smartphone and my ipad. I am not paying for two separate subscriptions. It's frustrating.,1
9105851d-1233-4fe6-9510-29328f833ae4,asking payment and questions at the beginning of app is a big no. I uninstalled after suggesting the payment when start,1
26972239-26e2-4439-b501-a373ad965dac,"Paid and uninstalled. The problem with your app is how hard it is to sync an account. You accidentally uninstalled the app? Then your paid account is now gone. You want to sync it in a web app? There is no option to create one using the app. How hard it is to set up a syncing feature for your app? Also, there are notification issues.",1
05cd145e-04e3-44f7-b6b5-47a9117d8d44,I world not recommend. Customer service is basically non existent! The features with premium are not worth it.,1
c86e32bf-32ec-4df3-8037-82d44a57d210,Ridiculous. I used the app for 4 months and when I switched my phone to another one. My all prgress disappeared. I can't sign in now. Show me how to save cloud settings and I will give you 10 star right now.,1
b6d49f98-5d52-4ab5-a9b2-013568882e6a,Reminders sometimes does not work,1
860511f2-df2a-45cf-a826-85b7b7a0b6fb,:hourglass_not_done::bullseye:,1
8ed9a772-041d-4e04-b247-f44df66e5575,:red_heart:,1
67234808-01a5-4caf-8cb4-3db2e660c501,GoodGame i cant build a habbit bc i have no money,1
a40a7adf-e726-43f3-988a-c1dc8a5280d5,Doesn't let you experience the app without subscribing the premium version.,1
f9ea77f9-7220-4c06-8174-4d3f46ae0f29,begger application !!! every time asks to pay,1
8d62c33b-33aa-4247-a0e6-555c619a3c7a,"Streak is broken. It says 5 day streak even though I just skipped a habit the previousday, funny.",1
0b50d7d1-0122-43e5-851e-ab8145b4d6d1,"I'm assuming one time payment should be enough, this is not netflix. Btw I paid $5 and got a better app than this for lifetime.",1
4d254dd9-6051-465d-bd02-c5afa2c93ef3,Got charged $30 a while after uninstalling and forgetting about it. Did not ask for repeated charges for a non-effective app.,1
c7097b58-2a54-40c7-813a-6b8ffef68ad9,"39mins of ad ,waste of time",1
3a374250-2bd9-4f67-aef2-7abcf1a9ea9f,"When this app was first created, I was an apple user and I bought a lifetime version at the time. Then I switched to android and the didn't have the android version for the longest time. When they finally released the android version, they refused to honor my apple purchase as it's not beneficial for them bc they want to charge me annually. You people offered a lifetime one-time purchase when you first started and you should honor it. Its time to hold developers accountable - it's stealing!",1
6b08ec3a-dde1-421f-952c-3865b937a68c,Extremely disappointed with just 3 habits for free users that's crazy. And subscription is so high and not looks good.,1
9e58dafc-f8b6-44ee-9b59-3fc541e5a21a,Don't make it free if the first thing you see is a paywall,1
3ae43453-f85c-40c4-9244-ca39bcac6fb2,Stupid app. No features in free version. Excessive ads.,1
bf0b4cd5-7b36-472b-a94a-9af6fe3c9693,I can not cancel the free trial (it doesn't show up in my subscriptions tab on Google play),1
8adc152c-bb73-4e57-a39a-dffd77ab46d8,"I paid for premium to manage/track daily habits cuz ADHD & it used to notify & show complete/skip screen but now just lets me set reminders that NEVER notify & complete/skip screen NEVER materializes so I have a bunch of habits I can't mark complete *even* if I remember to check the app throughout the day Support asked for screen shots/video of the error ... there is literally nothing to show Deleted all habits & history, uninstalled & reinstalled 3x, cleared cache, rebooted phone ... no go :face_with_symbols_on_mouth:",1
ca70b824-2faa-4c39-8353-701612176f51,Worst App ever. Suddenly exits on its own.,1
b5e2425a-a658-4e50-bb39-eb6d9abebce1,For free trialalsoasking paydetails. Not recommended. Poor user experience.,1
02376be3-2ada-481b-ad6c-04d2159529da,Useless unless you pay,1
3e4315c3-4fb3-450d-b3dd-60a5b0d72979,"Estupidamente idiota considerar aplicativo como gratuito quando a parte grátis na verdade é só um demo. Gostaria que fosse apenas pago ou as restrições da versão grátis não impedisse de usar o aplicativo, mas sei que isso infelizmente não vai acontecer por causa desse modelo de negócio.",1
1580822e-81fe-4c00-9b7d-77b0217ace03,Why are you charging me money? I don't even have the app..,1
d1614b8c-d205-4288-8b1b-b3d3dfa4cb1e,Please do give me a refund. I don't know about this subscription.,1
dc158a91-09a6-4441-b276-56d4e79fdcf5,"Why does Android version not have feature such as ""Explore"" when compares to iOS?",1
6b0a76b9-aa54-4405-b4d2-94e6eebad958,Got started setting up a few goals. It only let me set up 3 goals before it insisted on charging me. Nope! No thanks. Delete!,1
a0d46d40-352f-4a92-adfd-fc0dd64393e3,"The subscription fee is exploitative @ £72 a year, who wants another bill?",1
33c7f1e0-4d95-4f3c-8d33-6ecdd39a2834,"This app took payment today, no subscription page to manage the account, no warning it was going to take money, no support page or email publicly on the site. When I log in, it just takes me to an unsubscribe page. This subscription is NOT managed in Google. Best of luck to those that are subscribed. Will dispute with PayPal.",1
443050d1-02f8-404b-8d65-0f22ce592ae1,Too expensive,1
e19a6956-624b-4ed1-aafe-94c3e301308a,How do I cancel the subscription?,1
30b9b157-009a-4b09-8245-d6568c515ae1,Not free....,1
ad2eaf22-df91-491a-b15f-5d05c7fc2700,Not worth the money,1
fc8c908d-a904-4c50-80b7-f13066509769,Doesn't open,1
fe61b462-12dd-4ffa-b3d4-c27bfd2a04d0,I love it?? Yep I do plzz download it !!!!!!,1
bf78767f-ffe7-475c-a627-61bb65a1e724,I only looked at app through Instagram and some how i was charged 29.99 ! I want my money back! And to its original form or i will chargeback with my bank! I do not like when i see randomly bated apps on Instagram ... I never installed on my phone... I merely looked app,1
b439a828-8842-4475-ae5e-73700fde5de8,Worst app,1
cced4313-97c6-478e-b158-b4ab0b41f3dd,Useless. Just use any calendar app.,1
cc48fe6f-903a-4232-a0ee-d7845cd184bc,"The UI is (the best) (BEST) but unfortunately, I won't recommend this app at all to anyone! Reasons: 1. It is NOT a free app. Yes, the so called Free version is not free at all. To use at least a core feature, you need to PAY. 2. The Prices are TOO HIGH. 3. If they're charging such HUGE PRICE, they should provide a web app too. But, you'll NOT GET any web app :face_without_mouth: I'll recommend to use any other app (and pay for that app) instead of wasting your hard-earned money on this app.",1
95916064-99aa-4186-aefd-bf8a7a99ff66,"This service is bogus and will repeatedly charge you whether you're using it or not. I canceled during the free trial in 2020 and was still charged for 2021. I emailed and their support service asked me for ""Google Market"" receipt info - which does not exist since their subscription charges aren't completed through Google. Then, this week, I was charged again for another year. Customer support is non-existent and clearly this company is fraudulent. Don't download.",1
fc19de0a-4dc6-4c76-95d1-3ce41329cd4b,I'm unable to transfer my subscription from android to ios,1
9636a6bf-bdec-478b-a4ff-1e4c7b0213b7,This app is a scam. App keeps restarting from scratch every time. Useless,1
80f8294c-2fed-48ce-a66b-be83e20c8cbc,Asking for money before login.,1
ee3f87db-ae86-4dc7-ba9b-858b28c81bf1,Price is a joke. There is no way this app justifies an $11 monthly spend.,1
6884ce34-79e5-485f-8cf6-11eed2b2dce8,Not free,1
6f561391-80c2-4fc8-8185-8e3bd123df2f,Kharab app hai ye,1
6566a7bf-8c7e-429d-83ab-316d2e9d35a6,Why would I pay the premium subscription even though I didn't use this app? Please note that I didn't click the premium subscription yet you still insist that I must pay.,1
59e68039-8e9e-4179-b1c4-995306e976a3,"non mi fa più aggiungere abitudini, perché ogni volta che ne seleziono 1 mi appare la pubblicità",1
fcb7b223-3778-411f-88b9-07b27011c369,"It says ""try free for 7 days and then be charged for a year"", and prompts you for a subscription. Sure, you think, I'll subscribe, and if I don't like it I'll just cancel before the 7 days are done, but no, instead I got charged right away for a whole year, while I didn't find the product suiting my needs at all. Please refund my money. Thanks.",1
3241325f-93be-494f-8a63-ed8a7ccff8ac,:red_heart::red_heart::red_heart:,1
b8a71a27-edc9-4480-af0d-f6a2bcc0928b,Awsome,1
70fd52c0-e85f-4d48-8b3e-dac881b6f3c3,Bought the premium on my ipad and now i can't sync it with my android phone. You expect me to pay for this for every device i want to use it on? :enraged_face:,1
92aaf120-746a-4cb7-b2b3-488a14eff858,Absolutely one of the least useful tools ever. It's a to do list that you pay money for. Google calender serves the same function. Complete with reminders. I regret purchasing a subscription so badly.,1
1ee411e5-bfd6-453a-97d5-2bc3cb080130,It just doesn't work at all,1
17643cab-4761-4144-86ca-1d5506cf75ae,I was really hoping for a better experience with this app. I even purchased the add free option. I wish I had not. I will be deleting the app all together. The graphics are beautiful. This app is not user-friendly to me by any means. I found the option to rate the app and have not been able to straight line to contact so I am leaving a review prior to reaching out to customer service because I have no interest in staying with this app at all. The only reason to reach out would be for a refund.,1
0dcb77ec-23ac-47a7-bf4c-de0ccf15047d,:purple_heart::purple_heart::purple_heart::purple_heart::purple_heart:,1
3cd66388-01cd-45be-b31b-fd4b8d03d1fc,Ye as i read the one review that says you need a premium subscription even tho there's an option of free but still you need to pay for the advance and its hella high market price so i uninstalled the app and bye im out,1
ae6b7c97-f2f8-47b6-b936-61c51d502694,:purple_heart::purple_heart::purple_heart:,1
