reviewId,content,sentimentScore
68580064-a801-4a41-9b9b-b1f640830c8c,"Deleted because you can't go back and log a habit on a day that's already passed. Your streak gets broken if you forget to log one day - that's a huge design flaw, it's frustrating and renders the app useless. It's a very nice app, but I can't really use it :woman_shrugging_medium-light_skin_tone:",2
b37ccdb4-6e75-4d4f-acd6-40999942f4a9,I do not like the idea of having to sign up to a plan to give it a try. Oh well.,2
9af69e15-d976-436f-ae91-9d9c2b72278a,You need to add a more annoying :face_with_rolling_eyes: way of reminding people to do things...this app just falls in the background easily forgotten.,2
82526fb7-aad3-4b99-bd82-0c1fea2f4a57,Too complicated,2
ea7e2709-11d1-4686-9eaa-0fcebfe4acf7,The subscription pop up ruined that app for me. The app seems decent but nearly every button brings a big popup about a trial or subscription. I haven't even had the chance to get a proper feel for the app and I have been bombarded with 5 pop us already. I just checked the 'reasons to upgrade' and it's just a the same pop up with a vague reason why you should subscribe. I will stick to Habitbull.,2
f0f2b30e-b8bd-4846-8e54-e23ce1f986da,"Would work better if it was dragging the attention more visually, honestly the notifications just get lost in the spam of other notifications... The Visual part for me was boring and not motivational, I think the app lacks the more inspirational approach. I have it for 3 months now... It didn't work for me I guess",2
86cd11e3-2b93-444f-b3f8-c5b7a3578011,Idk didn't try it it seems cool but it costs money... :( EDIT: I'm sorry I didn't notice that the app can be used for free. Gonna install it again :),2
9e50dfcd-a7eb-4384-b776-aaf20f31dc03,"Нет возможности отметить привычку, которая была выполнена в другой день; Нет почти никакой статистики; Нельзя добавлять описание к привычкам; Нельзя установить привычку с определенного дня, а не с сегодня; В общем, работы ещё много.",2
83518ebd-ef62-4f90-b761-f6cb53d4084e,"I must admit you really has clean app, good interface and everything but I HATE it why the notifications, sometimes it popup & sometimes it dont. Its hard for me to press on 'Done' and you break my streak. Im done. Im uninstalling. Thank you.",2
1dacc365-db46-4f20-afbc-80114c55fbd4,"Very nice UI elements, but making me pay 7 dollars a month to create more than 4 habits is the most ridiculous thing I've ever seen in app.",2
8239175c-7d4b-4967-b82b-a877e9688d48,"How come there is no light mode, an option to disable dark mode? Why is dark mode on default though?",2
782166d5-5d55-4ead-bf17-be4738b3680e,Annoying - only let's you put in three habits onto your schedule before forcing you to try the premium version. Disappointing,2
deb3422c-c644-4faf-8e7c-77a0c389c86f,"Great app, good execution, bad problems I like the app a lot. Used it a lot up until I got a new phone. The app doesn't save on the cloud nor does it have a way to save the stats or share them with a new phone. I lost my streak of doing 50 push ups and 50 squats every day and I had been doing it for a half year...I was suddenly very defeated in my habit knowing all that app progress had gone.",2
8d88d113-d606-49f8-8aa3-8e2bc771c032,"That want to Premium, without it you cannot create more habits.",2
25e40d8a-e8be-4740-bfb8-a4a19cec88d1,Super Expensive for a habit tracker app.,2
41e45e64-9472-4cfb-8100-9b633109420e,"This app seems well designed with a smooth and beautiful design. But there is no free version and you can't test the app without engaging to pay after a 7 days trial (not free to me if you have to input a credit card which will be debited if you don't resign, especially if the app will automatically bill you a yearly fee!). The cost is really high too (7€/month!!!!), which is for me way too much for such an app. A one time fee of 7€ would still be a very high price compared to other apps...",2
45beb942-6d9a-4dd1-bea3-118e64ce0b58,Nope nope nope....beautifully designed but ballistic...it's covid guys! Too much toooo much....love you guys though. :winking_face:. Like business model wise...straight out the gate B-lining for my pocket book like that...tsk! But you see the trouble you're in right?,2
5c621d6d-357b-4b8e-8c5f-49334b7545e0,To expensive,2
fcaa3f87-25d3-4d69-a6d6-df82fd99b30b,Great and easy to use app... Until I change my phone and it lost all progress. Won't use it anymore.,2
813b6033-fcd8-4a33-8462-01a26b7cf7dc,"Too expensive for a Habit Tracking app, like the basic monthly subscription for netflix is cheaper, come on.",2
dea1debb-f506-496b-b73f-d765ea1b6dfb,Too Costly for a simple app like this. It's costlier than Amazon Prime yearly membership :grinning_squinting_face:,2
ca6247be-dd41-4d22-8572-074640cd2f29,"The app itself is excellent. There's no fault whatsoever, which is why there are two stars. My gripe comes with the price: ZAR119 per month! This is an absurd price to pay for a habit tracker. It's almost as much as Netflix for a month! The app is therefore an utter failure, in my view. I'd be willing to pay R500 for lifetime usage. But not the price of Netflix for one stupid month!",2
cc23c2db-3b55-4e50-b817-8f78c994be92,You know that today you can make apps with restrictions ? Ask people to buy your app before use is not the best marketing method,2
59061866-b81e-49ad-ae30-fd0f2a632dff,"Suprised that they charge 30$ a year, but have no backup feature. Very primitive. Nice UI won't save this one.",2
fa85f13e-1c31-483e-81af-7538c3cee33b,"Its WAY too time sensitive with the challenges. Is there a way to disable the morning/noon/evening times alltogether? For anyone who cannot have a time-bound schedule every day, this would be such an improvement!",2
a2496b19-1a35-4134-849e-0e852e065e74,Didn't help me in anyway,2
28b4cb9a-6456-4193-be65-cc3b9f3af13c,"I cant confirm new habits. I try to complete creating a habit, but there is no ""done"" or ""Confirm"" I love the idea but I can't navigate",2
84763bb0-4981-4feb-b133-2acd046d0cac,"I have been using this app for years, on iPhone, for example I have premium when it was a lifetime access for a one time fee. I was extremely happy to find it on play store when I switched to Android. However I can't transfer any of my years of data, ok I can deal with that. But I can't restore my premium purchase either. I am very sad to not have this app for the first time in years. It was a great run while it lasted.",2
94221397-1293-43fc-960d-c9aaacdb941d,"Too many Premium features..... What's an app without some non premium features. The subscription cannot be justified. I can't have more than 4 tasks...but the whole point of the app is to track tasks. The subscription is absurdly expensive for a productitvity app and the moment I saw so much potential, so much I could have done, I deleted it. I hope you improve on that...I will love to download it again....if I can use it at least to half its purpose without having to buy Premium.",2
b9a9b7a1-a35d-4910-b91b-cf4ef8f8cbff,Gorgeous UI and very nice user experience in general ruined by a absurdly expensive subscription. So sad to see so much wasted potential.,2
3a7a8bef-afda-4431-a8be-327f1b073795,"Does the core job well, clean UI. 2 stars because of the invasive popups to subscribe to pro. You got me to pay for the upgrade, but I didn't do so with a smile. Also, habits don't sync between Android and iOS.",2
dafa4ac9-9ab5-42b5-892e-535db9ddede3,I'm not sure I understand how the app works. Is there no free-to-use feature? I did not start the free trial as at the moment I am pretty sure I don't want to pay even after 7 days or whatever. And so the functionality of the app is basicly NULL...? I can add tasks but I don't see them and I can't mark them as done or undone... Do you think 7 days are enough to convince most people that they can build that habit with your app? It takes much longer and I don't see this going anywhere for me :(,2
78e89538-2ac2-4be6-aa71-476945d5b8f0,£7 a month was way too much for me,2
fc849f4b-4200-4e81-85e6-d6ceccf6b5a7,"I do not understand, I cannot save my habits that I create and I really dislike how you HAVE to walk through the beginning tutorial thing and click on a bunch of habits that you don't even want",2
1cb2efc4-494c-480a-9d36-8de32a898b96,I am a little but disappointed for the fact that you need to pay to use it at all. Why don't just make it so you need to pay from the app store directly? If it would've been like that and then have everything I would've for sure do it. I just wanted to start to have a healthier life with the help of this app.,2
a249ee8d-435b-42a0-a326-32cef619bc9d,Very difficult to understand,2
ebf3ed39-ee4b-4f31-9e25-8ae336163ab9,"Why would I pay for this? Reminders are ineffective and doesn't allow snoozing. I like the idea but if it the reminders don't stay on my in my notifications the way they do in other apps then I'll forget. My phone died overnight but I powered it on minutes after it was meant to notify me of morning habits but because my phone was off it stated I had missed them, because my phone was off when the reminder came in. Needs to have more to it to be worth paying for, nothing to pay for as it is.",2
f91dd89a-06ad-4df2-8c02-1f0ed6cd1d0e,Can't add multiple things to track.,2
12667ddc-294c-404b-960f-aa57b616506b,Ooh! It's better app!,2
07ea0e19-3d1b-42f0-b669-6f6d2c89c754,Once I've used for longer periods n followed program... Better ideas,2
03baa15d-ad36-4296-81b6-bd2dcb7d297d,Seems like a nice app but you cant even add an adequate number of tasks without them FORCING you to pay for a subscription. Its a waste of time folks.,2
bc78ed0c-8d1a-4f98-bab9-1712e32b8acd,Because it's too expensive,2
d12a5323-6b22-4fd0-8b4a-6c2298c02abf,You do get a free trial but £6.99 monthly subscription.it takes looking but other apps do the same for free. I dont even mind paying as a one off for an app like this but that amount monthly is not worth it.,2
8e648d98-355e-4422-8085-772b672e4e89,"This app looks really good, but the tutorial is stuck on 'swipe left to undo' and no matter what screen I'm on, I can see the hand icon gesturing to swipe left. How can you use an app that doesn't even function properly",2
a133e915-fcf1-4926-bdc7-fab464c15c14,"This has been pretty motivating seeing when I'm on a streak. I did have a negative experience when adding a goal. I thought a goal meant that there was an extra notification when I've managed to perform a habit successfully for a predefined streak of days, but it's actually a goal for times within a day. I set a goal of doing 100 pushups/day x 5 days, then realized it was a goal of doing 100x5/day, which I can't. I then tried to turn it off but it cannot turn off once set, so I think it's a bug.",2
30df2ecf-0262-41ef-b9e8-0626f10e5237,Did not work for me. It ended up being more annoying than anything.,2
9803617b-8fd2-463e-bb12-30e7f07b5184,"Brings up subscription dialog when choosing 'try it for free' during FTUE. Any popup of this sort has to be dismissed by the camouflaged 'x' in the top left corner instead. Could not progress through the tutorial, as it failed to register my 'undo' action despite the app allowing me to do it many, many times. Might need more time with your UX team.",2
dd48209f-acf4-4694-b54a-644615b62023,"Was a good app, subscriptions is not the way to go...when will these app devs learn, delete this app, way better ones for a one off payment or free",2
c18336e3-c21e-461f-8186-d54e8d113081,"The app is generally well-designed and has a pleasing visual style (much more so than other habit trackers I've tried). If it worked consistently as intended, then it would be just about perfect for my needs, but unfortunately this version is still full of bugs and inconsistencies. As an example, some habits' names and history can be edited and others' can't, with no clear indication as to which is which or why this limitation exists.",2
7840218c-2bfe-4b6d-b245-2e77b447ecc6,Had the same problem as others when i didn't want to subscribe after the trial. Very disappointed with it as a whole anyway,2
b06c7d7e-0754-4d9d-9f62-85bfaa26c44f,I had to .,2
3624c64a-eba3-4e42-be04-f782e3ee78fc,"Id like to use this app but as a shift worker the times I wake up and get back from work vary heavily. This app, as with all habit trackers I've seen so far, expects me to wake up at a regular time which makes the app useless for me.",2
5c46e284-fdea-43ba-9de7-41806d539b99,"Uninstalling was pretty difficult, it crash the second I'd confirm I wanted uninstall...",2
a77513f1-3e41-46ea-a4a0-bef71c32c69f,Can't seem to create new goals or habit. I want to use this for free without paying,2
47bf20ec-1b0a-42b9-b8d3-3504e59703c8,I don't appreciate an app that hits you with an expensive pay wall before you even see the first screen.,2
0ec22df8-13c2-4d2f-bb4c-5e002a499a04,I wish this app can remind me but it doesn't,2
8d4eb551-d0ca-4cde-9f90-9094a1e9bb0a,"The app wont load. It just lets me choose when i wake up, what time to reflect and its stuck on a blue screen. Anyway i can fix it?",2
b7a61c05-1546-40ed-8da6-723353729a40,Can't add more than 3 4 habits :(,2
8fdd10c8-a868-48c7-aa8d-cf366f415012,"The app is beautiful, but this cost (600 RUB/MONTH) of PREMIUM IS VERY EXPENSIVE. Unfortunately, in free version of app we can access to only 4 habits 600RUB ~ $10",2
60173176-e59e-4442-b9d9-aef572834a48,Too expensive.,2
a49c1746-0e4d-4818-879d-e66db3548423,I'm sad becouse this app need to the upgrade,2
da3a7fe4-8a6f-4b15-96d6-c72273742b70,"Well, i just start using it today , and it looks like there is no reminder , i mean it's not make any sound .",2
69c31018-e310-4f65-bea6-ba58d37aa30a,"Way too expensive. A monthly subscription doesnt work for this app. It should be a fixed cost and be much less limiting to free users. Aside from these horrendous flaws, the app is a bit helpful.",2
14c2c824-fd84-4b00-bbb7-5e60aa7c230c,"I had high hopes for the simplicity of this app but two things have made me decide to cancel the free week before the subscription kicked in: inability to pick which day I want a weekly repeating habit to happen, and inability to edit past days when I've done the habit but forgot to check it off before midnight",2
b01b2ce1-246e-43f0-9cd4-380fc07460b6,"TLDR: try HabitNow instead. It's just as good with all the same features, but for a very reasonable fixed priced. Their customer service is much better. Productive app is good but the price is awful. It used to cost a fixed fee for a lifetime subscription for the amount they are charging per month now, and the app hasn't changed since then! There is no justification for this outrageous price. I asked support to switch over my subscription when I changed from iOS to android and they refused.",2
5925179f-08b5-400d-a609-ca7e0098cebe,I can only make 4 tasks before it asks me to pay. If it wasn't so limited I'd have kept the app.,2
dfcc6778-dd34-43d4-aa7f-e7b0e067cb04,"Has a very nice UI. I'd be very happy to pay a one time purchase, but a subscription, especially one that costs as much as this one, doesn't make any sense for this app. It's a habit tracker, there's no service being provided here, there's no reason I would pay every month to use an app like this one. It's extremely important that developers be able to monetize the things they make, and at the same time, picking a monetization method that's a bad fit for what you're selling can kill interest",2
127f70e8-67fa-4fae-90ae-8927eba8d3b8,Only 4 Habit?nahh that's ain't cool.. We should be able to add more habits. Fair,2
a559a85a-5c8c-4a4c-b74c-a79e9940cb8d,"It's a very well designed app, however its locked behind a monthly pay wall. I would most certainly buy it for a one time purchase of a few dollars, but 25 dollars a year for something this simple is absurd.",2
9dfdc833-e85e-4642-8935-701dfce06167,Overpriced! Twice as expensive as on iOS and that's already too expensive for the provided functions and services.,2
a662d09e-9e68-4e8c-bbf8-82c6c52603de,"I really don't think you should make people pay a monthly subscription for this. A smaller, one time payment could be good. It's a shame because the app looks really good.",2
3a6dd2c0-475f-493d-9d81-8e8b6dfbb81c,Really? People just want to lead productive lives without having to go broke over it,2
406b2639-d820-4f2e-a2db-def2530010b7,"Oke, Nice app but subscriptions is insane. Everyone doing the subscription hype and it's really a shame for the current state of apps in general and this app is 1 of them. I don't mind paying for a app even if it's a high price but I hate renting software that I will never own and specifically if it's so high priced like this one. 2020 where they all think they can be like Adobe lol",2
9cadd696-1244-4be1-80d4-0f2e6fec35e5,It's a very basic app. Loop (open source) has a better interface and functionality than this. Not worth the subscription.,2
678cc162-0822-4d0a-bf49-4906a2be1c5a,App is too expensive,2
2c220f61-49bb-43a1-9c9f-dbec976b5a6d,"I should not have to insert my payment data just for the free trial. They do this so that u start paying as soon as it end probably without giving you any notice Edit: the developers have control over the app not some store. Still, obviously it makes sense to get convertions but it is very lousy to start taking money right after the free trial without a warning. Regarding the limited app its hidden in the UI i have to tap the 'x' twice to get there which is unintuitive. the limited app is ok",2
0119f556-4ee3-49f3-9993-3908bdc31f01,You need to make it free rather than having some routines request for money. And the money is too much,2
09f9b66e-d888-43ac-863e-384168be0fc2,Greedy bustards,2
d4d01071-6240-48d9-aebe-a4e0ee3f02f7,I love the app and the interface but too bad you have to pay for the full version... Not possible for a broke college student :(,2
7f7bd197-cdf0-4ad5-a096-ad920ad94029,Expensive price,2
00e97e6e-35aa-432d-9277-8162225ae996,"I really like the app, and even though there was no warning that the trial period ended and I got charged, I was enjoying it. What I don't understand is, I just switched phone carriers and had to get a new phone, everything but this app transferred so I redownloaded it and it's asking me to pay for it again?? I already unknowingly paid $30 for it for the year subscription, I shouldn't have to pay for it again just because I had to get a new phone. Very frustrated with this.",2
c8d602a0-1ed5-4f76-a5f0-48e6bc42d3d0,"It has potential but.. Too expensive, no widget, less functions than iOS app, no sync between different devices",2
c580e38b-c4a6-4110-8345-c84ea4f427c5,"Ask for card info, I can't even see how is the app, maybe I won't like it .",2
a827009e-6735-482d-96ce-077f27e13a68,Expensive,2
99574107-211c-4646-8ee9-8eaba00c63e5,"Seems cool, but the allerts are not working (I have a galaxy note 8) Multiple times I didn't receive any notification",2
c3364df4-71c5-49c3-aa3c-37400e6694cd,Overpriced,2
1fd783ca-11d9-4df7-9649-05c211a8141d,"Been using it for a few minutes and here is my feedback: What i liked about it: (1) Good app design and animations What i REALLY dislike about it: (1) Greeted with an invite to be a subscriber the moment i launch the application (2) Extremely overpriced for what it offers (3) The application seems to be designed more as habit tracker than a ""Habit tracker & To-Do list"" - there should be a dedicated tab for To-Dos.",2
ed2de835-dd79-4903-9374-5e1572edcc33,you can't try the app without putting in your card details. the fact that they need my card for my 7-day free trial makes me really not want to try it. i would risk it if the prices weren't so sky high. even spotify is cheaper.,2
119cdb0f-002c-48de-ab71-a1da615db84c,Should have been a one time payment. The monthly subscription price is way too high. The app isn't something i would pay more than 2dollars for.,2
e84e566e-49b2-4d04-aeb5-f7c111a8b6f3,"We should be warned that the trial period has ended and we should upgrade the app I just downloaded to test And forgot it After seven days, the surprise!! Charged in 30 dollars (something like that) Many other applications just end they free trial and ask for the premium signature. I don't know if automatically charge after free trial is a thing of google; if it is, in my opinion it's completely wrong. The client should be asked if really want to purchase. However, the app is nice.",2
34439874-d00f-4b44-b691-ff23b8c2e1b2,Premium plan prices are too high... like i can buy a i3 laptop in that amount. Consider you prices once please,2
256bd985-1421-4209-8dcc-d9a25fce271d,"I've been waiting for this app for too long and now I'm disapointed. I use to love the app on my iPhone, but the price on android (Brazilian real) is simple abusive! Please do offer a fair price for Brazilians!",2
68948cb1-512b-49f6-91f2-343c1c9dd0e3,So fokin bad,2
92b66641-b710-49ab-a7e8-f89704da1746,590 rs for monthly subscription too much greedy,2
0a3bb611-8dc2-4629-b59f-242cdfb4fe4e,The app is good but i am a student and can't afford it,2
31a95847-6f43-49db-8a70-37e1702d76d6,I am clicking on habit but it is not working and not completing today habit,2
d42c8286-f3e9-41e2-a71d-6dafcebaa6c1,"It looks decent, good interface and idea but once you find your way around the immediate ads and attempts to sell you a subscription, you are very limited. You can only have around 4 habits before it tells you that you've reached your limit (and to pay to get more). Not worth it at all. Suggestions: allow 10 free habits, lower the subscription price (a lot).",2
2d788593-98a3-4b42-bc34-8dba05820842,Please make it cheap for monthly use,2
94cca843-606f-4312-a510-cf9c33ffb396,It seems good but too expensive. 600rs per month for a habit tracking app is too much I'd say. At least a lifetime purchase option should be there. Nobody likes to subscribe to every single thing they're using.,2
3c164260-d68d-4349-afcd-faa2ee377d7c,Overpriced.,2
36019bd4-4b08-4975-8b11-7e01c07cd350,Too expensive.,2
b2a6b397-c8f8-4d92-b889-4f06241f9f36,Bakvaas,2
ceba31da-3916-403b-a326-ebbd2cfea870,Turns out there is a limit to how many habbits you can have without upgrading. That ruined the app for me. Would not recommend this app,2
d43d02b9-c809-4f58-8f03-4b879175dcb9,Too expensive.,2
0e5b259e-9ad5-4dae-b81a-984045689f6f,Too expensive..,2
