reviewId,content,sentimentScore
6c745a52-ff87-4475-8b61-fcff77852147,"Creating Habits is limited unless you buy the premium (only limited to 5). Just how Greed is that? Ton of better apps in playstore than this app, which has lower storage bits [mb], unlimited routine checklist and doesn't even need to be always online.",2
8c206c50-4d0b-4353-9c09-e6727a69e151,I only list 2 items and it says that I need to buy premium to list more,2
0021c0d1-e49e-4fbd-971f-91c9c895b6b4,I was really looking forward to this app but I am not getting the reminder that I have set. Because of that I can cancelled my subscription with 7 days but my amount is not refunded.,2
2c7e212c-05bd-4cda-82f7-42bedf8f6341,Please fix the notification bug on andorid. I allowed the required settings for them to work but they still don't.,2
c90e352f-91eb-455e-895f-25ff7ec49d8e,doesnt have the ability to mark after the fact not a lot of obvious features here besides just habits to add not what i was looking for,2
76a3ac60-0857-4f54-a1e6-8a2fd29e6e93,Don't know why it always asks me to start challenges. It's annoying.,2
a06c9fee-1605-493c-8a4b-9e2819444711,Good design but hate the fact that I have to pay a subscription to track a habit. There should be a one off payment for people who want a simple habit tracker without all these bells and whistles. I understand the need for a business to generate income but this is insane.,2
90198f65-eea1-4f58-875c-d194980e6561,I've been struggling to get notifications to work. I have them set up in app and in my phone's setting. But I can't get it to work and it is very frustrating. Please can the developers help?,2
8b07bbdc-cba0-4a78-a676-3f60c985eb81,"It's good until it's not, it's unusable if you are not subscribed. So if you want a free habit tracker, this is not for you.",2
eadd9c97-3a26-41d6-87ae-4f171c574cec,"Excellent idea, poor execution. I had high hopes for this app. I have ADHD that affects my daily life, and I was hoping that this would keep me on track. Unfortunately, I could not get the notifications to work. I went into my systems settings and tried to fix it from there, but that didn't work. Without the notifications, I don't remember to do the things. Yes, I set up the notifications on the app as well. If that was working, this would probably be a 5 star app.",2
2be540cb-643b-455e-9843-5504783ddbd3,"There should be a timer option when you want to do habits that require you track time like (e.g, meditating, working out, sleeping), otherwise you're less likely to do it if you just check mark something. There's no accountability. Also there's no way to sync and back up your data. What if I just accidentally delete the app or switch phones? That would mean I would lose all my data.",2
be884840-f210-4440-9c21-d9281914120c,"The UI is really nice, but the alarms don't work. I even tried reaching out to their support email, but got no response.",2
546ac266-6267-446b-9195-a5e6a8ef0eb2,"I love the design of this app but when I want add new habits it will pop up subscription, I just only can add a few habits only.... :crying_cat: Please do something for every free users who have the problem same like me.",2
365038f3-a494-484e-8168-9366f824149d,"I love this app more than any other habit app I tried but notifications don't work, which makes it unusable for habit building :( I triple checked all the settings, everything is allowed, but I only receive notifications in bulk when I open the app myself. Also would be great to have a widget with a couple of upcoming habits on my home screen.",2
396c2c4c-d447-4a02-bd94-ccda34125027,"Everything seems to be nothing, but there is one minus There are no widgets, and with the absence of widgets, you always forget about this application .... But in principle, the application is not bad, but because of such a fat minus two stars ...",2
7b8d2b2c-82de-4d29-9c1c-74e53b8a0571,Expensive,2
02d8580d-71f2-4489-9907-70c684aeb64d,1. Need more icons 2. Light mode 3. It is hard to register an account 4.Sometimes do not show reminders (notification) 5. Week starts on Monday or Sunday option 6. Paid service is not attractive,2
57d3547a-bb7d-46ad-9a1c-af37f857d729,"I actually liked the app but the technical issues have been going on for over 3wks now and I used this app daily! My first email was answered by support but haven't heard from them since! Not happy! Added bit : it's now 5 months on and the technical issues seem to have not, NOT changed! So disappointing as I did really love the lay out of this app.",2
2096e030-5eb6-4f6e-9dcc-d3ac1c153213,Too expensive for whst it is plenty of free of ones,2
e11ccccc-5d3b-4ad4-828d-b9b2eca9feb0,usless. Doesn't give reminders on time. Very rigid. Hard to use. Doesnt play well with others. Only good thing about it is its UI which is so colorful and eye catchy that I fell for it. I strongly advise that other don't make the mistake I did,2
fdc4f68d-3679-4716-8cfe-5e03b170e204,"Bit annoyed, I signed up for the trial and tried unsubscribing after the first day. I thought it had gone through. Nope, yesterday I was charged $48 from my card because the subscription had NOT been cancelled. Extremely annoyed.",2
5e232a86-7869-4ba3-8393-e5e968f04caf,App is not in intuitive manner there notification is not in visible place in app invain payment to this app haven't liked much,2
dad2b1d9-705c-4b60-ae46-d8782cda9643,Too expencive!,2
5457f832-ac25-46a1-b708-187f291f4c3e,Don't know why it's rated so low it's basically a guided calendar for self growth and productivity what isn't there to like,2
22b83679-52da-4983-af59-9ff2fb695f99,"After using this app for years, I've finally switched to another habit tracking app (Habitify). Productive has lots of good aspects, but I cannot move past the fact that it doesn't save your data to the cloud, even when you make an account. I've had bad luck with phones recently, so I've switched phones multiple times and lost my data every time. In the year of our lord 2023, there is NO reason to not have cloud backups. Also, this app is very expensive compared to its competitors.",2
cef46d6e-8de4-4103-b2f1-1d9bb544f7b8,"When it works, this app is very helpful. But right now it freezes completely when you swipe right or complete a task, so it is functionally useless atm.",2
7f62a538-033a-4252-889b-357f41b7d39c,"Limiting functions, no widgets. Nice design graphically but it doesn't allow you to enter specific numbers as you work towards a goal throughout the day. Not as good as other options and the price isn't justified as it is a simple program that openAI could write for free.",2
99aeb0e3-3549-4a57-988a-1ea5385bb362,Asks for money too often can only set 4 goals,2
1e3a55b4-b460-439c-b4da-0e58170bfdea,Functionality missing. I am not able to import my previous habit tracking as it only allows you to start the same date you created the habit in the app.,2
46de474a-b8aa-4808-bd51-366fb66037c1,"So far, not so good. This app doesn't send me reminders for my habit even after enabling notifications for reminders, so it's not really effective to help remind me of my habits. I should have tested it before purchasing. I wouldn't recommend it!",2
29cc9703-7396-4ca3-8e33-747b56043989,App freezes during setup,2
0718eca5-33e9-4855-aa2d-f726eedcdf55,I wanted to set up the days and times I wanted and it didn't allow for that. It was very generic and I need more specificity.,2
49964d88-9eb9-4c58-bef2-74c616c5cd07,"App was working great for months, but now has been freezing when trying to do anything for about a month (Galaxy Note9). Will update review when freezes are fixed.",2
23162dda-7df8-4295-b341-fdda8edf1100,After setting up my goals I was unable to record the habits,2
1d8e2825-1547-4a7f-9bfd-61778020d525,Should have informed about pricing before download,2
b5942012-2ccc-4661-b7f4-2655ee95335a,"It cannot sync. When I tried to create new habits, I could not save them, since the 7 Day Free Plan would always pop up.",2
762504bb-f0a3-46cc-b189-5e73a54bcb46,"Doesn't give you notifications on a regular basis. But a little bit here and there and sometimes, but def not regularly. You have a trial time for 7 days, and the app was supposed to give you a heads up, so you'd have time to cancel it. It didn't do it. So I guess that's how they cash in all the money; from people who forget to cancel the subscription in time. Def not worth it.",2
46207394-e5da-42ec-8c79-aea8ea636c7e,Not great free Is great :grinning_face_with_big_eyes: it not,2
cf588684-5eaa-400e-baed-a6df5d44e15d,i cannot add a description for a habit,2
d6b34c69-1935-45b4-8662-16f3da15bf8b,"Looks nice, however it has very limited functionality. Also, it's relentless with ads for the paid version. Plenty better and free goal apps out there.",2
344678a6-d51f-4f0c-9224-ef3d4757abff,"The app needs a widget. Without it, i often forget i have the app and dont track progress on my gabits at all even tho i paid for this app. Having them on my home screen would be a constant remibder to just swipte them whenever i open my phone for whatever reason as opposed to having to open my phone for the sprcific reason to track them.",2
b49ed099-878a-4213-85fd-56b4f1a38529,Not easy to use. I payed for service and I can't work the habits I create.,2
2c6b30e8-269a-4e57-90ed-f33f96060d04,I added four things without premium and it won't let me add any more,2
145678e7-8b63-4154-8e7a-1d599b70dc11,I'm having a very hard time when I need to edit something. At first it told me to click on the Green to complete my water intake for the day I thought it was just an example. Then I try to edit it. It was hard to figure out then I got it figured out. Then when I tried to actually log a glass of water it had me accidentally skip it. Now I cannot get it in to where I can edit it again. So I am canceling my subscription I need easy things to do because I do not have much time.,2
6bbea41a-9317-4ba3-9598-85569b4e217c,"I like this when on the first day but on the second day i forget about this app and i can't continue using this because i always forget this app and my new habits, So I suggest you to put a widgets so i can remember my habits. I will delete this app anyway if you don't put a widgets feature. I hope that you will notice me. :pleading_face:",2
c7ec7dc7-59ad-452d-ba42-8a1b99e64455,Not getting notification from app poor,2
89714146-c10b-4a5d-8a78-e22f94d61f03,Didn't know you had to PAY. There are many free apps out there. I would rather use those.,2
047f63fc-5e04-486f-aa4e-3fae87f336de,"Too expensive for the app, if it weren't for that then I'd gladly subscribe to premium.",2
847e2b7f-696b-4945-a127-bbf78935400a,"For some reason I have to keep reinstalling the app to get the reminders to work, I even made sure notifications were on and that my settings allowed to app to show notifications I even paid for this and jeez do I regret it. DONT PAY FOR THIS APP, all it has is a nice design but not a functional one!",2
e4793be7-784f-47bc-9a6e-697ac251ef2b,I'm kinda dissapointed after being using and paid for this app because I can't synchronize my premium subscription with the other platform such as iOS. I just downloaded this app on my Android tab but of course it would be good if I could sync with my iPhone to track my habit. I hope I can get my refund for this.,2
362df733-cce8-4b11-8dae-7c8e3ca3518a,"Was offered a pretty good deal moment i opened the app. Decided to look around first. After adding in two habits i got another offer, half as much as the first one. After looking around the app for another few minutes, all offers were gone. Apparantly i was required to buy it 100% blind for the discounts to apply. So I'm not going to be using this app tbh, I'm downloading Loop instead. Free and without ads and honestly better visualization of data. :thumbs_up::thumbs_up:",2
f88de495-ed20-4066-9b3a-9e546bad1d08,It's mostly just a money grab. Sure it may work but they want you to pay after the free trial. I am struggling with money due to covid so this doesn't work for me,2
1d58d027-005f-45cf-818d-76f2780f68e3,Wont allow you to set times for the habbits,2
0db1918b-499c-407c-bf44-6df78c3a5976,"Used the app with premium subscription for a year even though the price was higher than market average. At first everything was fine, I loved design, the main reason why I chose it. But something happened in April and all my almost year long statistics of using habits became broken. I contacted developers, about the problems, updated on numeral issues, but after 6 months the app still stays glitchy, issues still there... Too bad, but I had to switch to another app.",2
0e326dce-a099-4cde-9335-c35f86bf4e4a,"So i was recommended this app by a friend, and it's a nice idea, but the notifications don't come up on my bar when they are supposed to, they pop up when I go.to the app, this is not helpful at all and at the end of the day, I'm feel like it's making me feel like a failure more than anything because it's really not helping me.",2
fa2098bf-0b71-419d-9460-75802a1fa398,Thought this was going to help me with things around the house. Eg. Time to clean fans. You need to set all the task. Thankfully I didn't pay full price. Not was advertised.,2
f8c2f515-2841-4e00-8a2e-767da782e856,Not more than faboulous,2
4f0975aa-384b-4c94-997a-2ada972fde97,"Such a frustrating experience. The app is not at all intuitive, I found it hard to navigate through it and somehow, after several days of use, I still have no idea how to mark stuff as done (for habits that I set for myself, without reminders). :woman_shrugging_light_skin_tone: Pity, because it looked really good in the beginning, and seemed to be what I needed.",2
b77e320b-7eda-4e77-bffe-40892283dec8,"Good app, until you try to add a few more remonders only to find out you can't because they spam you with their subscription. Really scummy to try to take advantage of the wallets of some people jist looking to set new habits. Really disappointed.",2
f54f6810-44df-4a83-b870-de0ee447429f,"I :heart_with_ribbon::growing_heart::sparkling_heart: the clean and simple interface. I tried a more popular app and it was very busy and noisy. Full of animations and over the top cheerleading. I'm not. 12. I want a plan, not a game.",2
6f7fe831-1497-4173-b913-93cf3bce1947,hmmm...actually apparently you can only set 4 items before you have to pay. its a nice looking app but too expensive just to set a fifth item. i had such hopes for this app cause it looked really nice!,2
d05cbe26-b2e0-4931-8931-5060d5ec8310,"Looks great - Sneaky & Annoying popups. Signed up for free, 1st thing you see is the 7 day free trial and it asks for CC #...you DON'T have too do this to use it, look for little X in corner that you can barely see. I feel many don't see this X and think you must do 7 day trial to use it free. SNEAKY tactic, making X-out so hard to notice. EVERY time you open app to use it they use this method of pop up to try and get you to subscribe. ANNOYING. Looks great, and fun to use, not user friendly",2
2e1d29bf-2d2a-43bf-b782-72747ac064ea,"Compré la versión pro en Apple y no lo puedo sincronizar, por qué?",2
7a202024-0c5b-4b78-a566-009fa555b373,"I like the app, but no matter what I do it will not give me notifications. I've tried everything and it looks like others have a similar problem. Once I open the app it will give me three or four at once but if it's not doing it throughout the day what's the point? What a waste of 30 bucks.",2
d128a63f-1494-449c-9ae9-44b468a7c39b,I would like to cancel my free trial but it is not letting me,2
5c3f850f-2e2b-431b-aaa3-24f00e72afbe,I need a refund the app doesn't work the way I thought. I have used it for a few hours and it's not what I am looking for.,2
cd404219-b3e2-478e-a750-555b14c892c7,"I don't even want to get started, even though it looks like a helpful app, because if I take advantage of the free trial & I like it, the only option is to pay yearly. I can't justify that. I'd love to pay the monthly subscription, but there's no free trial with that. I don't want to pay for a month if I don't know if I'm going to keep it.",2
4dfba90a-4374-4f4e-81f0-190c8be1a36c,"Nothing special, everything is paid.",2
ba330b44-77e8-4f1a-b350-35a3da891570,Pretty lame app considering I paid for it. I found a diffrent one that works with you for free. This is basically a calendar I have one already on my phone. Lame.,2
d454329d-6acd-4cc8-b9c6-f2ed6f821e0c,I really don't appreciate the way you target your users with subscriptions.,2
025b4557-8503-4c4e-b1c7-e405edd00866,App does not allow updates to your goals.,2
429a9f13-7bca-4bcd-a0ce-256a808699bc,Really cluttered for a habit tracker. There are cleaner and easier to use apps out there. This is more of a mix between habit tracker and Todo list,2
d816302c-6fea-46fb-9180-38090e869598,I can only set 3 goals for free?? B.S.,2
7856f500-cebb-475c-b51b-e0036aaea8ee,Too expensive.,2
01bc9281-1a11-40b4-8b62-856c4d7d5254,"Don't dare get a new phone! There is no way to login and retrieve your streaks etc from the old device. My premium membership is kinda useless if the app doesn't recognise me. Emails with the developer are just frustrating. The app itself works fine, a few minor annoyances, but probably don't pay for it.",2
cbcf44ed-d62a-434c-ba0d-7b8c53630bc9,"Really aggressive about selling itself, and not really very helpful. I don't recommend it.",2
face64d4-6d4b-4a27-941b-7ba591e41817,Very limited for free users,2
62820964-c427-449e-b9af-e0d1d5449073,Not very user friendly. Difficult to set up recurring tasks and tracking.,2
772a7b75-9e5f-4596-a4fc-c0ffb86655c6,Not impressed. There are other cheeper alternatives.,2
7d05a835-d62c-4d0f-b667-163df31ead36,The idea is good but not working properly. I set indiviudual notifications for individual taskd and they don't play!,2
f0610d06-bdc7-4af5-a78f-84ea3ec4df1e,"i really used to LOVE this app. So i re-downloaded it and had to see that now most functions require you to pay recurring payments. i would be okay with paying one time, but this is definitely too expensive. sad to see this cool app changing in such a bad direction.",2
ed235663-17b8-4fef-b072-49754c316bfc,"Can see the benefits of this app, but I don't like the one week trial period. Takes a longer time too build a habit and one week isn't long enough too see if you will need this app. Makes it hard too decide to pay a subscription on something where you don't know if you will actually use it.",2
de4d2e3d-01c9-42a2-9691-5433f9505198,"Honestly just found a better app, but why make it soo difficult to delete an account? The link for developer website takes you to a parent company that doesn't even list this app as one of its products. What's more, the whole process takes you in a circle: the end user agreement says to cancel directly to this app's settings or website; but, there's no setting to cancel in the app, and all web links bring you (full-circle) back to the developer. Very sketchy...",2
cd1788e4-5980-4f46-8ec7-7c0b1bed7f70,It costs too much,2
efa81623-72d0-454c-a4c4-105bd8d4ab3d,"I really enjoyed the clean interface and the simple settings are quite powerful, however I always have problems with the notifications that wasn't showing up. I already tried to figure out what was wrong with my settings but I still can't receive any notifications. Unsubscribed.",2
8f19ecbd-1794-4aa2-9dfa-798fe1569a5f,"the problem is that when you set a reminder for a certain time and I made sure to enable sounds but when the time comes it only shows a silent notification in the status bar, this is useless if there is no sound notifications and the screen is off",2
de1a04b8-62e6-440d-9b71-b4b17e1fddcb,"No where to sign in to access to cancel subscription. Making it very hard so that people won't. I don't like that slickness. 2 stars for the concept and simple layout if I wanted to keep it. I just think Fabulous app, offers way more and is more helpful too, so I'm keeping that instead. I thought I wouldn't mind to check it out but not worth it to keep. ****update I had to literally uninstall the app, then search google sign in Productive tracker Apalon for the home page to sign in and cancel!!",2
cfb6cef7-1fa1-41e4-84c3-37be1ca7c26f,It's really simple minimal app. Unfortunately way too expensive for me. It doesn't offer that much to justify the price. It is unuseful without premium,2
29c72f40-dba5-4393-bd4c-a4076c474522,"It wanted my info multiple times, did not fit my mobile screen very well for options of habits to choose from, including not letting me see all my options available for habits to start. It then made it very difficult to cancel and remove my information even within 1 hour of installing the app. They are much better free apps out there and only get better with a subscription than this one by far.",2
e592648e-7b9f-43b1-9e59-e96c6573055b,"Too much ads for the premium, each time with different price",2
d6acc0cf-49e2-430a-bb76-794089f8e260,Not worth it so far to me. Nothing special and actual not super user friendly.,2
d87804d0-b8e3-4a23-8614-e93833f33bd4,"It's not that it's a bad habit tracker. It's just that I'm not a fan of apps that the second you open it, it asked you to pay for a subscription. It just seems like a low blow.",2
ee29f84a-4957-44cb-8595-f09561c3b977,"It is dissapointing. I REALLY LOVED this apps design. Everything about it was great until I noticed the limitations of the free version. If they would have just allowed an unlimited number of habits I wouldn't care, I'd be content. But the fact that they restrict you so much that their practically shoving premium down your throat... It just makes this app sad.",2
f42849e9-8826-4bc4-9360-85f053f7fad0,sad that the free version is only for 4 habits. that's not really useful. love the design and look tho,2
90c47380-1ec1-4ee6-b4b4-d0e718f2e8c5,"I wanted to like this but the notifications never worked, even though I double and triple checked the notification settings in the app directly and in my settings as well, giving the app priority on notifications. Only after I opened the app each day of the trial period, would notifications start popping off. The layout is nice, but my main need was for this app was prompt notifications to keep me on track and it failed to do so.",2
b7cee085-d988-4844-87aa-824ed70f1e7f,It lacks the ability of adding tasks you completed prior (if you forgot to use the app and miss completing a task),2
47486d8e-67e1-49f4-8bd8-a599801faf24,I have reminders set but they don't seem to actually send my phone notifications until I open the app itself. I've checked my security setting for my phone and they're already set to allow reminders from this app. Not sure why it's not working? I heavily rely on the reminders!,2
318d1359-6732-4eef-9f95-fe570f8d6006,How do I mark that the task is done? Trying to log into web page for more instruction and I am not getting an email to reset my password.,2
21d7d4e2-2a5b-431b-98a9-22ccb4ee8ffc,I saw the reviews about paying for the app. I actually don't mind paying for a good app at all. But it needs to be a one time thing or a couple bucks a month. $9/month is too much to expect when there are similar products out there for less.,2
22cb35dc-7d49-46d1-8317-2ea28398a6fb,"I wish i could subscribe for monthly not yearly. I mean, idk if this work for me. Might consider to uninstall it, if there is no monthly subscribtion",2
2da3bd17-94a3-436c-84d1-9cccc01b7b32,Not impressed with instant buy app before trying it,2
9fa5bbb4-344d-4ce3-9a38-f607dadc6c16,Honestly this app is just like so many others. First you need to pay for more than one habits. People aren't looking forward to pay for them nor expected to. How is that a premium feature? Other than that this app is pretty good and very modern. Took 2 stars off for this.:skull:,2
196c3af3-beeb-4008-b075-1dc4f7ebb59f,It's too good to be true,2
93d3153c-9dd0-487f-9eee-ff1c0443cf88,"I tried to like this app and I bought the premium version but everytime that I go in, it asked me for upgrade to premium, which I already have, or it doesn't let me to participate in challenges, I guess that is a glitch of the app... Also if I go to the web version, it asked me to upgrade, it's disappointing",2
c03d193c-a303-4bd6-b145-dac36bcd0313,It's very annoying having to pay just to add another habit and you can't restart them without paying.,2
9feeb21d-6491-4eff-9a90-a77ab40b85ff,"Although i did not continue to use the app, not because it was not a fantastic app but just due to financial constraints, I had the most wonderful interaction with the customer service team, not only were they prompt and understanding, they refunded me in full almost 5 days after the subscription renewed and were nothing short of fantastic. Thank you so much, ONE HABIT YOU HAVE DEFINITELY INSPIRED IS KINDNESS THANK YOU FOR EVERYTHING",2
2dbca616-f564-41f9-8e20-63b3bb681f12,I really liked the design and how simple it is but having only 4 tasks literally does not help. like I know it's the free version and you want people to purchase the app. but only 4 task slots doesn't help. maybe 10 or even 8? would've rate it higher since it's what I've been looking for but what a shame.,2
2fc08a43-c3e6-4b1a-8eaf-7a4748dce758,I remember liking this application at one point but then it became time-consuming and in automation to go over for me I bought a lot of smart technology and now I'm down to living in one suite and paying $314 from rent and I'm probably not much further ahead in terms of my health situation,2
67aa67ca-70de-44b2-ae0a-040df796da09,"This app is so overpriced for what it does . the design okay , steaks are good but more badges and. Gamification can be fun to keep going",2
846b1bbd-bf72-48d9-ab21-47dad9bf6199,"There's no way to customize notifications (sound, push up notifications) and as someone with ADHD I need more than just generic beep. (Or w/e it is because I never noticed it)",2
cbf15a1e-0752-411a-a727-a35772b052fe,Less purchase pop ups,2
d712c806-0e1c-4ae0-aa20-457ccf76904a,wouldn't let me write my to do things,2
