reviewId,content,sentimentScore
ce868f52-f7b2-40c6-93bf-4add7007057f,Must try App. Bit confused initially. The more you use the femiliar you will get Start and my day with sectograph. Thanks Team for this usefull app.,4
6ece30aa-4cc1-4e43-9ddf-6f5578c630af,"So far so good. I feel like there could be a bit more options as far as colors, icons, details, etc but it's not a bad app. May change later",4
200a1bc2-6898-4bac-a3e1-fdf5ace0c382,I like it and it's shows me my day ahead a coool kind of way,4
005fc7b9-6ded-4577-8bd1-577718a227dc,"Still learning my way around the app, but I love this way of viewing my schedule",4
34089e62-0d02-4c7c-987c-e58ea5bc4edc,"With a little setup effort, I now have a widget on my screen which tells me where I am in my time blocking for the day at any given point. I wish there was more customisation for the widget eg adjusting the range of viewable time, making it more aesthetically pleasing beyond just colours. There's lots of options but not the ones I was looking for primarily. Still, it works.",4
e5751acf-52d7-4942-a7d8-0ebbd9cfc4d9,Its the home screen visual for me. Simple to use.,4
1d2efbc2-80a8-469c-b7ea-d0fded5dbbc1,"This is a refreshing change from usual to dos. Interactive and mindful. Could be more user friendly in terms of ease of use. Nevertheless, great application.",4
3223d30a-dbcb-4b2f-990d-33da986e59f0,"Hiya, love the widgets. Is there possible development of a theme store? E.g. cyberpunk At the very least, where could we download the colour templates?",4
5f1c81f7-0f5d-41bd-acba-6a93380037b5,"Been using this for months, I really like it. Sadly my contacts birthday is not show up even though I have marked to show my birthday calendar. Is this a bug?",4
c533272a-a613-42b3-8873-f095071c21a9,great app but should look for a way to display a summary of events in the next two weeks,4
4427fdb2-f4b1-4ad8-ac27-988ba454c029,Nice app,4
f5bb0dbd-bbb5-4894-8ae2-039f42af258d,I like the visual aspect. There's a learning curve,4
44951eb2-b584-4285-b4f1-3a4621e5ab8f,Please make the app available for free in the app Store as well,4
7a7b73e5-f32c-457d-a665-4b3df9d050b7,Very nice app. I would like to have a watchface like this also on Garmin. There is lack of watchfaces with calendar events and definitely myself and others will pay for it.,4
3c237d68-6a67-433b-9c15-2de387c6107c,"It is useful for tracking time! However, I would prefer if we can also create events and schedules on the app itself instead of through linked calendars. Edit: New update can now add schedules on in-app calendar! New smartwatch feature is also a great idea",4
e2de5b1a-b9ee-4266-8d84-f6ef826ee030,Good,4
d3eb2b7b-f476-42cf-ad8d-5bb81a689e3c,Nice app,4
7ea12666-0b2f-4a9e-bc1f-13d679ac7a94,Great app. Gave 4 stars because you can't customize the widget.,4
f14c6b54-528f-46cd-a6bb-9339cc353bbd,Good reminder app. Should add an extra dial/circle for next weeks appointments,4
e62ac4f0-45ce-4bd8-99bf-804c1d89f9a5,It's a different way to view your schedule and visually see what time you have things scheduled.,4
4557d169-32b5-4d3d-be21-0e87b9e200ce,The idea is very cool. I love it. I know where it's going and if they do five stars. But i'll surely recommend it anytime anyday. I wish you growth and development. Can't wait to experience the upgrade!!!,4
6e625857-75dc-4d73-b938-6956de64f33f,Good so far,4
0b69f057-8eba-44f3-8723-01a784a47248,Good,4
66212fcc-3d85-4225-9497-ea8a6b360e31,Amazing app like the design a bit confusing but love it,4
d55f8de6-a9d6-43e1-84d3-c6f3c6eeafbc,"It's great, though I wish there's a way to include syncing of reminders/tasks rather than events. But other than that, it's awesome.",4
c6ca5435-6090-4a84-9d8d-6af38cdbb786,"A brilliant idea, an entirely new way to look at the passage of time that strikes me as having advantages to this square-calendar-concept that is the default. I will admit I have used it in a while, but whenever I do I really enjoy this new way of seeing the time available to me and how it is filled. It gives a clearer perspective about how soon things are. If I had a smart watch and this was a function, I might just look at it all the time.",4
fd1ee421-9f38-4384-aef7-ebe665e3ca74,"I really like the app and associated Wear OS app, but it would be nice if the premium version was an app instead of an in-app purchase so it could be shared in the family library. I'd rather not buy it just for me, and don't want to pay three times for my family. edit: Removing a star. I just went in to upgrade to Pro and it's $8. Way too high for an app like this when there are less expensive options.",4
4ed04aba-25d2-4885-bd24-9394bc904e3a,Nice app. Would be better if more colors were added,4
02b0db3b-cba1-4c0a-bb05-a05a2105286e,Nice app for any aspirant.,4
704fc1e4-978b-4cec-8f73-227461d91af3,It's connected to my Gmail calendar and to Alexa.. And this combo makes the app fantastic.. No ads. works perfectly offline too and the Gmail calendar becomes useful now. Suggestions : if I could add widget of the app to my home screen. More customization required. Voice note. Thanks a lot you deserve 6 stars.,4
2d553281-9544-4fb5-b7cb-39f3a3ed2c11,Good App,4
2ba741cc-54c0-44ab-a40b-ca5398873788,A very good way to see your daily schedule.,4
57f1cce5-5cad-46b2-ab1d-1b69f48f5689,Nice app,4
331c654f-3ea7-4889-9a6d-ed74ff6e36c3,"Productive app, if used it consistenly.",4
8913af87-e165-4220-adc8-2bb5e614c405,Graphically.....seriously a very good concept.,4
0049238a-efa9-4f83-9580-b398d954bf4c,"This is a very good app, im personally using it to help with my weight lost. Being able to see and now when workout times are coming are key.",4
53beb0f8-7a62-458e-b152-3e1d780c42a2,Good app,4
7c1100fb-6a4f-469f-9a68-0c51862fa9f3,"It's really good,, serves the purpose",4
f2dd67e0-72b6-464b-ba58-4016e03fca35,I like the widget on my home screen. You see the time am what you're supposed to be doing at that time.,4
700c55b7-020c-45a0-97a1-3faf514ec597,"Nice overview of your full day. The only small issue is that zoom 5x4 is not working, so the widget cannot be centered on screen :(",4
2a6b6588-9a4f-466c-82fe-8622cce12b39,"Took me some time to understand the whole customization, but the outcome was pretty cool",4
9f73d902-69c1-4095-81b9-e255d1079d5b,Useful to my schedule and lifestyle.,4
d26e92a1-4793-4b0e-868a-c10102095472,Nice,4
fe5f1136-f810-4324-a9fb-ed316f67ec87,"This is a really interesting way to visualise your schedule, to see the overlaps & the gaps . I'm finding it to be very good for travel & conference planning, so that I can see how long I have between flights or scheduled events.",4
ebc0804a-1126-4930-9f8c-79627687b948,"I wanna love it but there is no way of adding times directly in the app, you have to go through Google Calendars no matter what :/ Edit: Up to four stars because dev showed a way to manage external calendars within the app, which means I can now make it work for my needs! Unfortunately though I still need to grant device calendar permission which means I can't use this app as a fully isolated platform. Instant five stars if that was possible!",4
39308f80-1d9d-47f2-90b4-06d02b068b9c,Nice,4
1314a293-38ef-42f2-9697-577be6ce91ef,Like the simplistic way to show my calendar yet the clock is visible and nothing feels crowded,4
9d0b532f-6413-4faa-b7f6-dbdc93fb6666,Good,4
2247ce80-d7d1-4891-a662-667bdabd0846,Enjoying the scheduling and syncing of the app and calendar,4
213c69fe-a6e2-433d-9c2b-24da6036cf69,I dig it. I've tried a bunch of day planner apps and so far I prefer this. It's an easy to use format.,4
8557c3c6-019e-4ca8-b5e0-3a68d3143f43,Love the concept behind this app. Dropping a star because it can be a bit unwieldy to customize. There is a different view in the Widget Pallete that I cannot figure out how how to actually see. Shows remaining time in current event.,4
4b4a1851-7265-4ef2-96dc-a0f9d078c3cd,Good app to track your whole day.,4
cf686fcf-1147-4ee0-9489-6138479e30fc,"I love this app so much, I'm just currently having a big problem with the way the widget colors display (or don't, in my case). Otherwise, amazing app.",4
689526f6-597d-4ad0-928f-042a9bea1707,"Pro version probably is much better, i recommend free for now.",4
c18d5474-5618-4ea1-a907-2b70b223c5aa,"Helpful app. I probably would have preferred if it had its own calendar rather than using my default calendar. Otherwise good, i like the widget",4
b3ccc4a8-0673-4222-90d4-8a513afbf41d,It helps visualize time with my adhd.,4
55872d47-0640-4d48-b7a2-f5ddf2b830b5,It's very good. Recommended.,4
2cee275e-2807-48e5-bc7b-b5918b397645,"The app is amazing overall and I use it daily. The Wear OS watchface customization is not working though. No matter what color, 12-24 hour, hand thickness, transparency I chose, even the preset light and dark themes don't work. It's always dark. Update: the aforementioned issue is for Xiaomi devices. Works perfectly with Samsung",4
98372785-df64-4fc8-b36e-e08baaf24c95,Phenomenonal tool for scheduling daily activities and planning. Soo daamn practical and cool. Really like how you can literally see how much time certain things take on a graph,4
034ce9a8-a7ae-4c99-824d-e4a4956f4fc6,Great app! But there's much to improve on!!,4
0ae72a1a-1f8e-43da-97bc-fdaaf1c2f1ff,Good,4
4c1bed6d-2a91-441f-9337-0328e69e6605,:sunflower::man_lifting_weights::man_lifting_weights::red_heart::red_heart::red_heart::sun_behind_rain_cloud::sun_behind_rain_cloud::sun_behind_rain_cloud::hibiscus::wilted_flower::rose::white_flower::cherry_blossom::horse_racing::smiling_face_with_heart-eyes::smiling_face_with_heart-eyes::cloud_with_rain::cloud_with_rain::hibiscus::bird::bird::dragon_face::smiling_face_with_heart-eyes::smiling_face_with_hearts::smiling_face_with_heart-eyes::collision::collision::deciduous_tree::deciduous_tree::sun_behind_rain_cloud::sun_behind_rain_cloud: :sunflower::sunflower::smiling_face_with_heart-eyes::star-struck::face_blowing_a_kiss::Bangladesh::Bangladesh::Bangladesh::Bangladesh:,4
2d76c78b-ed18-4621-b718-abe90fd37e20,Good and helpful app but also add an alarm in it so that I can follow time with more honestly. Also add more colors i.e custom colors in setting color theme of clock. Add more colors in styling an event.,4
d919c281-cc3c-491b-ab28-3c134b86b5f0,"Really enjoy this app. My only (small) request, have the widget wrap the text. sometimes, it shows one letter on the next line. Other wise, great app. Would be nice to format different widgets separately to better differentiate the widgets purposes (eg work vs personal). It would be nice if different widgets can have different hours. Set one for 24hrs, another at 12hrs, and another from 6am to 6pm (focused on work events).",4
7974748e-00d5-42e3-916f-fdc6d2178785,What an original and nice new approach to quickly view your upcoming events on your homescreen. Use it for a few weeks now and like it very much. Only miss one thing: the location in the widget. Update .. doesn't show anything anymore...,4
4535515a-74fc-49c4-955e-6ea4e2aa2ba2,Interesting way to plan your routine.,4
80c362af-61ce-4fcf-99dc-3e276c721396,"I really love this app,but there is one problem. There is no option where i can write ""done"" after i have done the work.That i can understant end of the day,which task that i did and which i didn't.If this bug is fixed,it will be the best app.",4
13e56c74-52cc-4a33-96da-bc7eba3cb00f,It's good still getting to grips with it!,4
f8d05e2b-e0e1-4098-8092-66efcd0c7e4d,"good experience so far. Nicely synchronizes with Google calendar. It also keeps track of the alarms on my phone. Lots of options and customization. Only complaint is that the widget stops synching with the current time after a while, and you have to manually sync it by tapping the widget after you realize that the clock face isn't accurate. Kinda annoying when you want a quick look at the time and events but it shows the wrong thing.",4
1b5350e5-18d7-47d8-b624-ce30206a613d,Nice app,4
26b6299c-4db6-4106-877c-3967238df7c3,"Brilliant app, love it on my phone but can't work out how to get it on my watch. Is the watch face still available?",4
a2dbba2b-f640-43d3-ae8a-0476a2b8a4f8,"Very cool and very helpful app. Looking forward to the repository and event editor update. And while I liked using Google Calendar, modifying and integrating all those features for Sectograph use will be very convenient. There are times when the time on the widget doesn't update and match my current time. I'd have to open the app and close to refresh. Maybe you could also add a 24-hour clock view. Would be nice to not have to spin the thingy if I just want to see my activities 12 hours later.",4
acd69022-a58f-4fa3-86cd-a1d2c78a9f60,Good,4
f6bd6930-edda-487c-a099-c82ec7f51f8e,"Awesome idea, but they should put more faces for the watch.",4
3949208d-dcd8-4572-9b03-d2f7f14e5384,"Very cool idea and well implemented, the only thing I wish it had was a tile for WearOS. As it stands the only way to use it on my galaxy watch is to replace my watch face which I don't really want to do. I'd much rather have a tile I could scroll to whenever I want. If the devs could implement that then it's an easy 5 stars.",4
a1ea0389-6548-4d69-bbe2-fb6ebd6e216a,"Easy to use ""the big picture"" of the day and also eye candy :) Note: It can be connected to the Google calendar.",4
d0c5ca46-fdff-4507-9835-a39eadc2f689,just good app,4
fc8c4541-c436-4692-85d2-bce9973731dd,"Good idea, very customizable and it synchronizes with my ticwatch S2 perfectly. I only wish it had an option to show the day of the week in the central area of the smartwatch without showing the time (it should be fairly simple to add this option). I don't understand why the 24h mode is not working anymore on my watch (the watch is synched it, i can change the colors etc)",4
214cf95c-e102-47fa-a89c-fdf847de3882,It's a unique way to view the calendar. Just something different.,4
bfaa657f-ac82-4d42-b7cd-cca0b7b9ea22,"An excellent time keeping tool, and developer is responsive with feature requests 5.16.2022: i would like to request another feature. Can we also sync the category colors from microsoft outlook (what ever the first category the app can see) as event colors in sectograph? I've sent an email with screenshots. Thanks in advanced :D",4
788c0f0a-d9a6-403d-83c9-a9fb64f12961,Visualizing schedule helps the awareness. This app seems very promising.,4
4d43b7f0-9cf4-4229-8af6-c06cb050c502,Nice,4
2dff6918-f2a5-4411-8baa-847b73bacdfa,Good. It bugs sometimes when overlapping events at the same time.,4
37108ea4-1dad-4ad0-9a31-00cde32c9805,Works gives a good visual and makes me more aware of how I spend time.,4
ec4f79a2-6146-44d7-a259-9bfc287184c0,Sencillamente una forma eficaz de ver la planeación durante el día,4
e7ac6788-0ffb-4155-b305-01b6814814c5,Only 4 bc I'm still getting used to it but so far like it a lot. Local sunrise/sunset notations on sectograph would be nice.,4
00871018-dc9a-4fc0-8f2f-1a510169e989,Pretty cool.,4
34fe0f46-c27b-4c79-b127-1d74cc055793,"Love the display, especially as a smart watch face. Only thing missing for five stars is letting me configure the watch tap so that it can do something useful, like open the watch's calendar app, instead of only switching to 24 hour mode.",4
1c71f07f-2345-4486-a7d4-d4899e7bc0d3,Good app,4
2cc506e5-3c58-450d-93b9-45502f40ed53,I like the widget :),4
d1f04fc6-cfc6-42bf-9f7e-e0a9c732ad2e,"Very nice app, I like the big widget for daily calendar and now I have a whole page dedicated to it. Some slight issues with graphics, but overall 3asy to use and flexible like to calendar",4
ab3761cd-2551-4de0-b85b-4217e8e8103c,"Great app. Could use a little more complexity but absolutely amazing concept. But again, more complexity and more simple user interface with some more integrations such as a watch face would be perfect",4
160b91a3-fde1-46df-b0ca-61a2818a1696,"This has been a very helpful app to me. The homepage widget made my work easier. But the difficulty I face is that I cannot remove the calendars which I want delete. Please tell me how can I remove them, that would be very helpful of you.",4
a38ebcb6-4319-4e7b-96dc-a7b430bfb957,Very useful app. I wish there was a popup reminder feature.,4
ad3dd3f6-5bf8-4ab1-a2e5-542a0397c386,"While I haven't had it long, so far Sectograph is an excellent time management tool which, combined with calendars, allows daily or currently added items to be effectively managed with items scheduled well in the future. After more time to work with Sectograph, I'll modify my review if needed.",4
6015a397-8032-4320-96d6-5a4912ea6fae,Works well for now. Still need to explore more.,4
aae92d47-c407-424b-894a-b32624d4af2e,"This app is good in reminding and helping to keep track of time ,it takes some time in knowing how it works but it is nice once you know how to",4
931db35e-a68c-4a1b-a81d-66073390d3ea,It works. It helps. I like the darkscreen mode.,4
9708d1c5-b6cb-4107-bdd6-c2975214a20a,"Great app, the very few issues I have are additional design options that aren't necessary, just would be a bonus. The premium version is very customizable and worth the money in my opinion, but even the free version is fantastic. One thing I would REALLY like is to be able to use the widget on my television with Google Chromecast as an app that I could access in the Play store there, so that my kid can see the daily schedule on display without having to take my phone.",4
41147086-5dd1-44da-b753-75ed7792c6e3,Links nicely with phones calendar. Use of different colours also good,4
8b128981-18c5-4dce-ad15-022bfa4ab65f,Uodated: I've gotten a new watch so I'm able to see it now. However I doesn't sync the color palette with what I set on the phone app for my watch. So the face colors are plain. I love this widget!! It's such a clear picture of the time and schedule!! My only thing is I wish it was compatible for the galaxy watch! I got the app because I saw it on the watch I'm the pictures but it doesn't work with the galaxy watch. :confused_face: If this was improved to work with the watch I would give it 5++ stars.,4
5aca4562-7024-472b-9059-0587eacbbaf2,It's a good app... could use some work.... not bad tho.... with separate files and the corticosteroids would be time and if unzoomed...,4
79985693-49f5-4efe-b8e7-8fa959ac5b57,It make remembering my events easier,4
6fc4f803-c820-44b1-9eaf-3e975d700b74,Effective for me in keeping track of busy times and free times in a glance,4
8ba0e8e7-2d6f-4a03-911d-517db9d211ba,Wish I'd found this sooner. Easiest way to visualise your day at a glance. Learning curve can be a wee bit steep. Would like to see some kind of weather integration.,4
9c1c5da9-1c1e-4a8d-939b-edce7171d525,A good way to display your calendar. If you need a widget to display your schedule for the next few hours and prefer it to be shaped like a clock? This app is for you.,4
554d588c-b0b6-4aae-b134-6644a07083ac,A very good app to manage ur work,4
ff797db5-7ba7-4930-85c8-7d23e1d755a2,It's coo.,4
706fb2d6-7598-47f7-9583-792ba757d6ec,Helped me to manage my schedule :beaming_face_with_smiling_eyes: even it s bit complicated to handle in the beginning,4
ca36866a-fed4-475a-8b5c-ddf6fbe6e441,Useful in organizing your day to day activities,4
446e9eaa-fcfc-42bc-97f3-bfc71200c6ff,Nice :thumbs_up:,4
24c9903e-0433-4a71-be85-0954f90b169b,I'm a paid user since a very long time and i love it But 4 star because there hasn't been any significant update or upgrade in features! Looks like the app has become dormant now and other apps on Play Store are taking over.,4
4937274b-7e29-4410-91f1-3c5e276d8554,"It's pretty good, but I'd also consider adding a feature making a clock that cycles its hour hand around once every 24 hours.",4
a018deb6-0a47-4139-8ebe-42fb4acb07e3,I enjoyed using this app. The degree to which it ups my productivity is astonishing.,4
4314a116-1383-42bb-99a8-fd8d32c1063c,"It's pretty good, and doesn't have ads. Which is better than most of the other scheduling apps.",4
e0f342af-e237-40ed-ac5a-658e373b5a0e,"It's an awesome app nd the best part is the fact that it's completely free...... The idea is fantastic nd it's functionality is awesome if u can remember to check ur schedule often...... Though I think the notification tones should be either louder or longer, that way it'll but harder to miss",4
74736f22-2bc6-475b-a772-d79c9e09ded7,"great concept, works very well. the design isn't that pretty though, customizing it doesn't really help. good app.",4
8edd03a7-4639-4467-877b-9fe0a86b649b,It's a beautiful app one of or the best for time management but one thing is lacking.no tracker to show how much effort has been put on a habit over time. Like a chart or graphic report to show how much work One has put into an activity over a period of time.i don't know how best to explain it but if the developers can research other apps you would see what am talking about.if that is added this app would be perfect 100%till them I would keep one :glowing_star: for myself :zany_face:,4
056aa107-7f04-4842-bca8-8512f80fcb18,"Once I got used to, it is a great way to track time. I like it so far. I hope there are larger widget.",4
d53c9c2d-767f-4b5f-aa9b-5940fafa2932,"Great app, I've really been enjoying using this app to see and divide my days and chores. Something I wish it could have could be an option for it to have a sort of alarm. With an alarm we could be hear that an important meeting is about to start or something like that. Other than that, the app itself is really useful and thus far haven't had any issues with it.",4
e1992c38-6952-4e3c-bca8-6c433c9cb9d5,Likes it,4
3daaa550-ed61-4ff7-a7af-b03f6c95c963,Dont ever write reviews but I really like this one. Lots of customization to make it look like how you want it to look. I do wish there was a setting to turn off the transparency as an event comes onto the circle but other than that it's really good.,4
77144c47-b44d-49ad-a569-6b0517d73e0d,Good app,4
397c015a-a0da-4ae1-996c-70f86d33b642,"This app is great, especially as a widget, I just wish it had way more color options for sections so I can match it to my phone theme.",4
1b2ee67b-ae37-4709-9a28-4f61f396dbc7,Good,4
24902883-0409-48ae-ae59-c3c99c05547a,"Easy to use, Simple design, Working well overall, these are some points which I give 4 stars to this application.",4
260768bc-829d-444f-9908-6bcd3e7b5556,تطبيق جميل يساعد فى تزكر المواعيد والمهام,4
aa692205-ced4-41a5-b420-1c8e6736e38b,This is worth trying to improve your day. A++,4
0bbef228-8e50-4090-b4a6-dbcca5438df7,"Its a great app to monitor your plan, a lot of costumization for the color on the widget and the fact this app face a watch face make it so much better and easier for me, the only down side from this great app is the app on the watch and the watch face doesn't sync automatically, you must manually sync it (send event to watch).. thats my only wish, for the app and the watch face to sync automatically.. other than that perfect app",4
14827ae0-7d89-480e-9035-ea3851df966c,"I've only had this app a few days but it has been helpful with keeping me on track with my schedule. I got the app because of the compatibility with Wear OS watches and for the most part, syncing changes in the app with my watch (Samsung Galaxy Watch 4 Classic) have been pretty good except for a few things in the widget pallete settings for smartwatches. Changes I make to the color of the hour hand the the sector event arches don't update on my watch. Other than that, it's been good.",4
b8ac60d1-cd6d-40d9-b6b4-a9b6071ee4f6,I like the visual presentation and how it connects to my Google calendar.,4
fda01255-9d53-4db0-b47a-47043a8eb5fd,"Good , the best but has many glitches, you can't save a single line event (like 5:00 am to 5:am ) on daily calendar... It works for single day settings but in daily it just add 1 hour to the event making it a sector event, also colors of sectors can't be changed",4
5495ce16-1e01-494d-89f9-b04808ea13d2,"Thoroughly enjoying this app. A bit of a mission to adapt if you're not a regular Google Calendar user, but that's turned out to be a ""me problem"". Just bought the paid version for palette options.",4
ac28731d-6929-4840-94d0-72a569778426,Integrates calendars well. Works from the widget. Now on a Samsung Galaxy Note 10 plus it does not work from the widget... hmm.,4
46f3fec9-40ab-45ab-85a8-512c4e1157af,"Everything nice, only i can't find dark mode.",4
2c8c034e-20a6-427f-baba-5d961702f8c7,Very nice app but some features are paid,4
ec650253-4ead-4736-94ce-ff99c4c7a3de,Good to use. Easy reminder,4
3c49103f-69c8-441c-96d1-5f0c60d09144,good,4
583e7c80-a44d-49c0-8ab2-598071bc12a7,I really love the idea. I used this method in college on paper. One thing that frustrates me is in order to see the events for a future date you have to move forward using the hour arrows. If I use the day ones I see the full day events.,4
37360dcc-c9e7-46de-805e-eea71060e0ba,option,4
11d7ebb8-593e-48b9-94c4-98004d187029,Good app Thnx :green_heart:,4
e2b937ed-3c00-4e14-a29d-d61b46924aba,"Great way to visualise my day and keep time. Improvement suggestion: Make it possible to choose between adding events connected to the calendar, and adding events in the app separate to the calendar. I need to add things to the app that I want to keep separate from my calendar otherwise the calendar has an overwhelming amount of routine things to look at at a glance, rather than being able to view my calendar and see important events.",4
893fce3e-deda-4108-b46f-03521c321120,"It use the calendar abilities, it's only a new visualisation for already installed calendar. However I find it helpful.",4
54aae886-5425-476d-bbe9-301d6e3f0f65,Lo que están logrando es muy bueno. Para el wear os estaría bueno poder ver la información de cada evento,4
ddbf59fc-7b3f-4a73-bacf-fa0e904b9963,"From what I'm seeing, this is going to be an awesome day planner app for me. Takes some getting used to, interface wise, but I like the way it's shaping up.",4
