reviewId,content,sentimentScore
118f65fb-7dff-4061-ae00-911ad8c0efab,"Still checking it out, but the widget is great!",4
ca765173-7044-4e28-a22c-935fad6e47e8,"Nice way to visualize the daily schedule, should be mandatory if you use wear Os (android Wear). Perfect :OK_hand:",4
aa439ff4-89b8-48de-bd25-924e15433623,"I would like to see an option for a larger widget. Other than that, everything has been great and easy to use.",4
1c75bf61-089f-45b5-b300-0a7e3424494e,Pretty good. I wish it could be used as an always on screen saver like always on clock Almode app.,4
e433502f-66f5-406a-9d70-c3c030f51160,Good and visual,4
4ebae0a3-5dfb-4a24-9a87-86445a08198a,Awsm app,4
32e464a9-753c-4bba-a93b-07fa84775165,Does what it says. Good app!,4
51d82570-1780-4b65-8030-9613ef077521,"Great visualization of my day , but feel there's a little too much at once, maybe more options to toggle parts - widget is the best part",4
e50f4bfb-665e-4e5f-b45f-0f2209e91b48,"It's probably the closest app to what I'm looking for. I'd really like to be able to either style or disable monochrome mode, and have the option to use the same style between the watch face and home widget so I don't have to go back and forth in the settings to make them match",4
4a3a99df-ee78-4972-8015-e0c4ff3e6a87,Recommend,4
abed8d28-deb4-48cb-a3aa-f81888fd0887,Good widget,4
e0912813-7cec-4c5e-8973-0adc95c8e200,Useful at-a-glance info.,4
12893090-e363-4231-aa02-420b6f34c3cc,It makes me easier to manage my time,4
9e262d5b-82dc-4f82-980f-eb46f092e75b,"It would have been really 5 star performance if they included Especially checklist tasks with reminders and their display on dial. Or they could add support for application like ""google keep"". I still need to use 2 different apps for similar kind of usage right now.",4
ca965d24-5abe-4265-a509-bec9dfd32d98,good,4
6405a314-4795-41cf-95e6-50945e4923e9,"This is one of those potential game-changer apps; thoughtfully designed, programmed well, and dare I say revolutionary. I found myself ignoring the normal calendar ""Schedule"" widget for lack of accessibility. The presentation of the Sectograph app and widget are both intuitive and attractive. It's a sure sign that a product is good when you start to rethink planning and scheduling from the ground up. I also applaud the developer for taking a more nuanced approach by offering a robust and functional app (without tacky ads) with optional and significant add-on purchases. After using it for a week I'm ready to fully support the creators with a purchase--probably the highly customizable pallete chooser but I'm also curious about the 24 hour display function. This is development done right. This is one of those apps that is so good you want to see what else has been made by the same people. Cheers.",4
04cac583-42cd-4af5-9263-3236f7d781ad,It's a good app for having a watch on all the reminders and events at one place.,4
3c42aa44-f453-4585-9257-0df23d203c27,It does what it's supposed to without too many difficult settings :thumbs_up:,4
71877be9-59d1-46ed-b6ef-d7349c9fe2d8,"So far I like this app. I would like to have the timeframes blocked out on the widget clock, for a better visual of my day.",4
ddb4f970-d6ed-434b-9aa4-36e2eed6d809,It's good,4
fa323faf-76ac-4158-8f6b-2fe4a1793f73,Good,4
4d907ad1-589a-4975-b138-c77b5deb68e8,Veryy good,4
e349713b-d794-4240-9bef-1535725e995e,"Still testing the app. Otherwise, so far so good...",4
69f4f0ba-bdbe-47a8-b6b8-a98043e98903,I think it serves its purpose as the day planner. Good job dev !,4
3284d2c8-bdb1-481c-989d-39e7c72338b8,Nice app,4
8a3868df-10da-49d0-9bf6-b098e900c5b6,A Good Time manager,4
6997b8f2-416b-4678-a0a1-ab26cae256af,Good it useful i liked it..,4
04cc1890-6fe1-4235-8c8f-7d796b49e883,"Been using this app for a short while. So far so good. It's purely a visual of events, time, and alarms, while all the actual event management still happens through the Google Calendar app, and which I think is brilliant. Still figuring out the app.... Like how does one track time on it? :thinking_face:",4
e97ce139-648b-48b2-91f5-b9dfa72cc55a,Good app.,4
e14fcbac-6030-4a62-bea7-77f898425604,Does motivate me to do stuff I really want to put off. Different,4
72169f55-f3e2-47fa-af2a-8a5d9e511724,Uma ótima ferramenta para integrar com a agenda Google.,4
e235215a-5bb8-4155-a9d7-cfcc67d1a67b,It is good,4
11fd72bc-e887-49b1-840c-a19c5a7cde4d,"It is really good, except without premium, u can't change the color.",4
3037539f-7bcb-40ed-a52b-b33afb8e58c5,It is great. Would've gave 5 stars is it has some wallpaper options. Please make some :folded_hands:,4
9198f50c-e288-419f-8ff9-11656a7d5ebb,Cool visualisation of my calendar and reminders ... Lekker idea,4
c1f4a9a5-3848-4b66-bd4a-2ec91d532f18,"Super app, but i cant understand a bit",4
1cf53da6-543b-414e-b3d3-947e2891a1ed,just discovered it and it will for sure help me planning tasks and focusing. requires a bit of effort to try all functions available. help hints on various choicea would be welcome,4
69061ddf-f20f-41c7-8aeb-3e87faa11269,Good,4
c087e0ee-4cab-497f-8f29-1246b614dfb7,Good so far. Visually time keeping is easy to follow.,4
a7ef2a1b-a5aa-40fe-9789-ef6d6cb56c68,After some messing about I got it to work,4
93a0ef1c-d1b7-41da-8eab-3ac0059f5413,Good,4
e81f5e66-c561-4aaf-8a43-75545451310d,"The most effective way to organize and follow your tasks, it is brilliant,! The only downside is that it does not have desktop version, I hope they will fix this gap soon.",4
e3b953ab-622f-4103-b1dd-6f9c8c3449cb,Does the job,4
9016ff7b-923d-43fa-935d-6e6ddf49df09,It's worked well for me so far. :),4
6d287e51-d100-4a80-93b7-3c64225e216f,Unique and interesting way to use your calendar and plan your day. Beautiful. I only wish it could integrate tasks as well.,4
42137db9-0806-44b3-bef7-77820ae8fee5,It shows our biological clock,4
f931d79d-5de8-4cd9-9575-943bc4b37e71,Nice,4
8c7dda34-5b8a-4ebf-9d6f-913ff546c672,Good app to plan a routine.,4
ba9c0d26-d15c-4909-a386-b2808073cc7e,"Takes some time to get used to, but a good app to keep a calendar schedule.",4
ea504db7-8888-4da7-a490-468c1daff91f,Nice,4
ac968afb-74b8-4d4b-8789-102efbd64a4a,"I like it, but I wish I could go to the days ahead and see everything planned instead of what is just at or ahead of the time right now. For example, it is 5pm right now, and I can only see what's happening after 5pm tomorrow.",4
d203aef8-9e24-4275-8e71-77d14636742f,Nice,4
683b169f-66a7-4bcf-a0fe-f6ae7b071f78,Superb application to track your days agenda. Gives you all your events at a glance over a clock to help you schedule your activities. A small suggestion to include reminders on the sectograph.,4
c986a184-f4b8-4fa4-beeb-62abedbcd1a2,Handy visual aid for people always on the go-like myself.,4
94201ea2-5fdd-44db-9dbb-ed08a6c4cde3,"It's a great app and the watchface is a perfect addition, but it would be even more perfect if the 24h mode was a feature of the watchface. (And an option to switch between 12h/24h mode and open meetings by tapping the sector.)",4
ac1daa48-c0a2-4cd3-9b26-58f576a94d4e,Good and easy to use,4
1f88d5a2-2916-43b9-b94f-37b017d728dd,"Still a couple of bugs, but it's not bad, I can work around them, it's worth that much!",4
18b4f08c-3d72-4cc8-a813-b46a45bebfb6,Good,4
90407629-f2b1-4377-bb76-5611c0d0bf2d,It's a good app. Development make it more better,4
63a9abfd-4a2c-4c2a-9cf1-5956abe0c582,I give it 4 stars but needs main edits: 1. There got to be alerts to remind one of the activity.. not just notifications. 2. Widget should be on lock screen beside being on the home screen. 3. This app can have the option of overcoming or controlling other apps; as to prevent distraction of following the routine.,4
70c4e139-14aa-4f4e-88fb-703e4616d86a,Nice work. I have to get used to :beaming_face_with_smiling_eyes:,4
902d6dc9-ac6f-4467-b976-29103a0794c7,Like. :thumbs_up:,4
a8b9f3df-8150-4cfa-ba90-7516a51b2065,"A nice app to keep you on schedule, wish it also had a to-do built in",4
f9c36ba0-5f6e-4723-8c96-2602e2420343,Great Idea.. Might need more enhancements,4
a313e947-1191-47c3-b6f3-5307a040f46f,So far I really enjoy it. The only thing is that I use special coloring in my calendar app (that uses Google calendars) and they don't work in this app. There isn't anything wrong with this but into meant I had to recolor things because they were defaulting to the wrong colors.,4
f8c825de-cbbe-4760-aeee-28d2598a4d9b,Nice app... Cool widget to see organized events,4
fde17380-68bd-4de1-8311-d69ad8c5b593,A Useful app for everyday task.,4
747ce834-850e-474f-9284-da306118cf2b,Nice app please continue improving,4
037b2add-37e8-4d4f-b7b1-3a5f2c8048e3,"Loved the concept: this is exactly what I was thinking about. There's one small issue however, it displays alarm one hour before it is actually scheduled (alarm set 21:30, the app shows it at 19:30). Hope you explain what I'm doing wrong or fix it soon.",4
3e9e4d1a-f163-4eac-90f7-4c77bbeb21ae,C'est très bien... mais ça devrait être moins lourd en daya,4
de6181b6-2b39-46f2-aa43-20260fef83a9,Pretty good integration with calendar apps into a nice visual layout,4
ab1b8888-7c7e-44c8-a5ca-0d26dd205aaf,Nice app,4
a5a2a631-1753-478d-b33e-8d360f5dd109,"Sectograph provides a visual interface for time management. If you've ever looked at a calendar list and thought OHMYGOSH how do I track this, Sectograph may be the app for you. I found it very helpful.",4
6817f65b-80b2-4301-8b3d-e7d7dc65b8bc,Very nice app overall but would be more convenient if there was a way to show the events location as well. I'm a Uni student and I need to check classrooms everytime. Thanks,4
40f8095c-11ac-4056-a61f-9c2f38a9bacd,Good app especially if u like to look at ur day in a different way it also helps u think differently which is good when u wanna have new and creative ideas,4
0108e16d-d526-4a08-866b-ad10b8c4f2d2,Its good. I wish i could re size the widget bigger than 2x2.,4
62cbcd69-0af1-44cc-a539-e84427be12f4,Good,4
e63daf10-e491-4189-97bb-bb9be56ff171,I like this app I can see my schedule for the day in a clock style so I can visualize it easily.,4
48f68087-d5a1-4127-bbcd-e2051dafa659,Good..lovedit.,4
e2b5556d-e56c-4c80-9467-6e267ba8261a,"Very good idea, I really like it. It will be just perfect when will be able to show also the google reminders.",4
0a37d511-9da1-4efb-9e1a-aca813196b1b,It's a good application to manage time and day,4
45d859ef-7079-40e7-aa3a-94f93c8d3336,Good app,4
ac61eec9-07d8-48c1-b12a-00e61842f631,It is pretty cool,4
02dab7f9-013c-4575-ac04-b242a470d237,nice,4
1351e442-bd37-4f92-96a2-f81a0c7aec4c,"Has helped me time block much more effectively. I love the fact that it tells you the time between events. I plot mealtimes, exercise and family time as well as work appts to make sure I am being balanced with my time. I can work 24/7 in my line of work but that isn't healthy.",4
82370830-a32e-4ca8-96c5-bcb8b8685a13,Very goog app,4
8388e6a7-3444-4f71-bcd0-275e5fb7cf60,good app,4
199065dd-5960-4dbe-9b6a-2d794a1509ec,"Good app, great widget, no unnecessary notifications or mixup with calendars.",4
025dbd32-6448-45de-b084-eb377ca60328,Simple yet so useful. Just add it to calendar and it's right on it clock face. Wonderful app just love it. One advice though if we got a icon instead of text it would look much better,4
1569c57b-b4bf-4589-914f-0b746bfed2f5,Good,4
89d0b58f-1662-479f-9828-86495fe8cc17,It does what it promises to do,4
e7bfdcf4-2b7a-4472-9918-f99457e07345,"Really love the app. Helps me organize my time and schedule. If you could just make the hours numbering in front of the sector, and adding an option for showing minute division lines would really help to read it better. Setting the hours numbering outside the clock makes it look kinda crowded, and with some of the hour numbers (12, 3, 6, 9) not shown kinda bothers me. Also please make a preview of the clock in the settings so we won't need to switch from the app to the homescreen to see the changes. Really looking forward to see these features fixed. Overall, great app!",4
8675c08d-e850-4c9a-ae4f-b7179640e68e,Good,4
8957afc7-36ca-496c-8860-d79e80fce22c,It's convenient,4
833999e1-fa41-4d8c-ba3a-403b541025c2,Its actually good,4
84168722-4c70-4e50-94d4-ea1e08af0954,Good,4
386ae1ba-b4e4-49d2-9030-9ad6a023510c,Pretty good,4
a3d87628-fa58-487c-95b4-a6b8f41af521,"No ads, no popups, a lot of features even for the free version! This app is just what I needed! No wonder it has a 4.6 rating!",4
e84545cf-2280-4c59-b72c-752ba94baecc,Nice app,4
abf4f5a6-0dee-49b5-a02d-09b1cd11a76c,good apps.,4
5a1a3b11-1a8f-4d79-b664-0e12f66dfd48,Good,4
bcd09833-4958-467a-a031-d3795f70dc8b,This very useful. But shows only events created in calendar and not the reminders.,4
ad424df8-fe7f-460d-9cf0-7dc93da76958,Its good. Keeps you in the loop and on the right track.,4
a6e5f176-4767-4940-8234-d93dbcf4c1bf,Nice work,4
b2f3e07e-914b-4807-8467-41e124e74d6a,"Great organisation app, took me a while to figure out the sector colours. I upgraded to the 24 hr version, the 12hr one isn't great.",4
90f1d778-f5a4-47f7-8f81-7b8cb8c50f28,Good simplistic approach to reminders.,4
4616e18a-affa-4970-ae7f-d62ee8c41d17,Simple but useful. Provides a very nice overview of my day.,4
9817b5c8-4543-46af-9f4f-a98d024de15b,Good app to remember and restrict ur work r event time,4
67fe58a8-4769-4a62-af73-c186087ee6b2,"Todo está muy bien, lo que pasa es que para añadir una tarea la tienes que crear en Google, y absolutamente todos los recordatorios que quieras añadir los tienes que crear uno por uno, incluso si es el mismo(eso si puedes poner un recordatorio en varios días)",4
288b9184-739b-482e-8770-36995d7c7975,Useful. Great idea. Has round clock activity feature. It is also a watch. Sync with other calendars. I would give it more stars but there aren't any.,4
fb204377-5627-491c-8fcd-a84733226152,Nice app to visualize my whole day :thumbs_up:,4
b29187e1-e633-4ee5-b253-9fafcb0db516,This app is really helpful.. it will be great if you provide option of alarm for some of the events..,4
f8bd2a9e-cfed-45ec-b3f6-71a9aab88975,it is good,4
797dbbe6-e6b4-4aa0-a209-c4adf62d5c49,"I just trying, later I'll confirm the rate until today I'll give 5 :glowing_star:",4
7b20632d-c994-4cf5-a26c-57d01824ac02,very good for organizing,4
f6909a08-143d-4065-b316-80c2d3a7c2a5,Cool app for personal track keeping,4
ac17edc5-b68e-4984-b74c-ef4392275816,هذا التطبيق عنجد روعة منظم ومتاح ميزات كثيرة عنجد اول مرة ادخل من روعة تطبيق عشان اقيمه خصوصيا ...ارجو اضافة عقرب الثوان اذا ممكن ليصبح الافضل علي كل التطبيقاااااات :smiling_face_with_heart-eyes:,4
ecafc701-6596-42f3-b7cc-ef65bef202e6,"A nice unique, useful representation of my days activities. Easy to see when I have obligations and conflicts",4
300e65e7-9cd8-4e3c-a33d-eb2eec762732,It's a good application,4
c785a1ba-779b-4179-b92d-a52b66167fd0,Still a new user. But I love the idea so far.,4
4e8a57b6-a493-4e60-8068-a9c6afc744f8,Quite useful. Calendar events will be shown in the clock itself,4
48c47869-330d-4cc4-88e2-02f19931c3d6,good app for time management :),4
a5338bce-8ad7-4e12-8b13-38c3f8ccd18b,nice app.,4
90b306ec-e951-4b5d-8fb8-40e882cacff6,The widget stops many times with Apex home. Nice app! Now every schedule is unforgettable.,4
cdd05d10-2889-418e-aaad-e7210004a586,"I like this app. If the developer provides the pomo function, it definitely will be a good weapon for time management.",4
0ffda536-e4d7-41cd-8755-a36a4eb34b7e,"It's a very good app, I can have my plans of the day organized in just one cycle, good way to manage your time, its amaziiing:winking_face:",4
ba2bfe3e-d417-40ed-9c05-8e2eda0e42e2,Helpful for visual people to see what their day will look like.,4
dade5c23-121f-4e84-9773-d951cfc59b12,Useful app really for managing events,4
3d7f9249-01d2-44e4-b64f-f410cca2b58a,Good,4
2b76aad2-2ead-428f-b941-675cf4d24c6e,It works terrically and it can be daily planned at the end of the day,4
4f0f3a41-0521-4d60-8e72-def488a83bd8,Nice graphic and it's easy to focus on your everyday agenda,4
c4a25aec-3a8a-403b-a34d-58ff0d5b9772,Nice visualation of time and appointments,4
6f9c6929-d2ea-4369-a2bb-3e64038419bb,It's a visual timer style. The only watch that can tell you how much your time left before next activity. Useful and cool enough you'd want to recommend your friend :),4
610f0e6a-f69a-4f14-9eed-bc9b723214d5,Everything's convenient. Just adding should be more handy. No need to open calendar and add the event. Just put the feature on the application itself. And it'll work so frictionless.,4
6ffd18e9-ab26-4ab9-82c5-04642cf055d7,Good App. I like the widget.,4
ff5d965d-320f-4771-82fd-dd6a76d154cf,Good,4
8c574827-eee4-4453-9ddf-7ba2030ce93c,useful,4
c71aa68a-2437-441e-8111-1a91591e59f9,Good app,4
b47b451e-54fc-4d85-abcf-0fe28dddf960,Nice application,4
d3b5881b-400d-41ba-b7a4-356d7ecb1598,I wanted something that would be visual and easy to use. With this app I can see at a glance what is going on with my day.,4
26641285-2372-4bef-9955-42fcbb0f33b4,"This is the app everyone is searching for but can't quite find over the biased editor's choices and other popular apps. For the first time ever with this watchface, I've realized that smart watches do have a real life usecase too.",4
766cf1ac-d532-44b3-8ce8-ad2b38c8e822,Handy to have my calendar events available at a glance--as easy as checking the time.,4
e1962185-9ded-47d9-99f5-7d733b18627f,"Still figuring it all put, but it's great at staying on schedule when each day is so different.",4
6be151e8-2fee-46e3-acb6-dcccef8ebe4d,I like that it is easy and convenience which is what I'm looking for but I also need a way to run analytics of times spent on each task. Will change to 5 stars if that is possible.,4
67a7403e-717f-4650-b2ce-9be3132f0184,Good,4
95f1fb06-a1c8-42b4-a1ff-bf81a3a0274d,I gave this app 4 stars because it does not have a way to connect to Google reminders. That would be handy!,4
0b8b2752-8aa4-49c8-82b7-4d99f6ec93d4,"Great app, very informative and works very well on Wear OS watches too! One minor request, can we have more options for tweaking the ""aways on"" watch face? Like disabling the count down and event duration arcs etc.",4
b0f376b7-06a7-4db9-89d9-014c8e1fdd6e,comfortable nice looking application,4
5256f257-966a-4947-8a42-f338596d85df,"Good to see full planning in a day. Anyway, I need extra big size of widget (4x4). Thanks.",4
8f82cd66-7f10-4603-bf4f-49d9a32915ab,Good,4
c78e9cb7-8583-47e4-a269-331f88895cca,Harika bir uygulama,4
3704dae2-88a0-4a5b-9a19-aece3cebfdba,"Only one issue that it should have in-built system to add events rather than using another calender, it makes all mess for this app ,don't know why developers have done this ,and add some beautifull ringtones for reminders this will make it an amazing app",4
ab52216c-1c47-4745-9c76-e65405c837df,"love the interface, great smartwatch integration but cant change the color palette for some reason tried reinstalling and resetting app no luck",4
2b836528-ddc4-43d8-976a-0d5a334f5879,Good,4
48c3042f-ad18-4a89-b63b-67e79eb59e88,Thing I like about this is the clever overview of my day.,4
b0951eb8-55b5-457a-a69b-983650324814,Nice app.,4
d61cc583-c4d8-4772-a9d1-68259efd9c4c,Good idea visualized,4
e82accc0-0c64-4014-99d0-491994945b1f,It's a great apps.... Just hope it can sync reminder to be perfect... Wondering what's different with pay and non pay version? :thinking_face:,4
b94899f4-6da1-4669-8a56-06bb9c8f1085,Better than a simple list of events. The 12-hour quadrant and graphical representation of events help you organize your day,4
2a043fda-a42d-43ad-a75a-8b783059a954,Helps give me a visual way to keep an eye on my time from one thing to the next. How do I get this to work on my watch,4
e1f452e0-ad8f-443e-be03-4e5724e06640,"Great app but how do you remove email notifications, I can't find an option on my Google calendar or the app.",4
5b11772b-e88b-44bd-8252-2919aa240a17,I can see the design of my day,4
02da1bc9-7aaf-4c99-83a4-0d3335b802fb,Useful in a student environment and more,4
487739b9-2399-409b-9ca7-972f33d50cc9,Great app but is there anyway to add my calendar from the Outlook app.,4
2578d391-11ae-47e0-a549-99c6091172ce,I like,4
26b375b8-be43-45ce-931a-16018a912d33,Хорошая прога выручает иногда,4
14601906-7dd1-4a62-9593-bc373cfdbfd3,useful,4
969e71cf-64b8-42f9-99ce-aa8fed55bd74,Good,4
a198ef0f-c36b-4a39-bd73-3ac82cbcc3e8,Thanks for the update. Dark theme working.,4
62b9269c-f152-4fd4-b893-9ed68d5f42b4,There is always a new thing to consider in it.,4
6325b5e1-0c6a-483a-8acf-86047140ae76,"Pretty good, keeps me on track and helps me plan my days out better than a calender.",4
4cb3d584-353b-484e-ba90-8a1d8ca64208,Since I am a very lazy person and procrastinate a lot. This app helps in overcoming that,4
d720a11d-db26-4bbc-bf4e-e0194c162646,Simple and to the point. Works well so far.,4
e461cea0-1d3c-4b2e-98b1-5757615505e7,Great app. It would be even nice with a smart watch I suppose but I'm not sure if it would work on everyone.,4
50b1f556-865d-4e59-ab14-76e87d9e6f06,Nice app,4
cc3981b3-a39b-447e-8bf9-3d7deeeaa55e,"Nice widget,",4
41d33192-7e7f-4c76-a88a-f6c284e20c6f,I'd really enjoy this app more if we can change the colors of the sectors individually. But overall it's still a really great app.,4
e609f5bc-5348-437c-adcb-a9fd40c89112,as a professional truck driver we like to keep things in order being on a schedule is a must without any delays or distractions,4
da1ac20f-cd93-4873-81cd-b2410ac86a5c,A good app that visualize your schedule and sync with calendars. Easy to monitor tasks.,4
d8a4e364-f68b-46b3-8f4e-f2dd6e863e79,"Wonderful, but with a bit of rough edges",4
1cd4b07e-e584-4faf-a817-ae402bb32a1b,Best app but the only flaw is once your phone is turned off and you turn it back on you have to add the widget to Honescreen. You have to repeat same thing every time your phone goes off.,4
84bcd6ed-e4f3-405f-92d0-708b85f003c0,"Great idea with a unique premise. If the widget had more function, it would be 5 stars.",4
795e2721-d233-4f2d-b1ca-e0591657e2ad,"Nice widget and simple to see schedule visually, once you get the hang of GUI. I am a real person FYI.",4
2d682a65-b8e1-4d51-82f7-28809ff5e137,Nice app.,4
dbfe960a-5f1a-4d30-bafb-fd0238d6e507,Quite complex but customizable for everyone.,4
e92912f8-380e-4cf8-a11d-f84b0fd9a204,Very good visual time management app. I've already recommended it to a couple of friends.,4
0684891b-9c6d-4ea0-a17d-c6fe254bf227,An interest form for seeing my schedule.,4
e8338124-c6aa-40a2-8e94-012313341a31,A,4
4a46cf92-6215-4b36-84e5-1a0bf555b19e,"Pretty useful, well if unlike me you can stick to a schedule",4
4e0e24dd-093a-4c9f-8f7c-96928b565f6f,Good app,4
a99cb110-b587-40d3-b935-6bf64c50375a,Is a great widget to organize your time. But I would like that the color's palet were free,4
acae2ac1-7346-4c61-a0a2-548d05ade301,"If you add the ability to assign events visual markers, like the coffee cup, graduation hat, camera and briefcase, as shown in the s.graph app icon that would be fantastic!",4
4ff2862f-f79b-44d5-80ed-a6039852de53,Nice function & design,4
1c38f3eb-51ed-4c02-90a8-f57fabf45734,"This app is pretty cool looking and a great way to view your upcoming events. It's pretty much, a widget for your calendar that also functions as a clock. You can also change the settings for it to handle other functions, as well.",4
32eaec61-1aee-4d49-972e-1c41ef4a5bb0,"Everything is brilliant, except — how i can hide declined events?",4
6a2352c8-fe12-41e9-b773-2cb467ba5215,I like the visual of the calendar on a clock.,4
c45a3b3a-04b4-4b0b-8b3e-faadbb5106d9,I like it! But where did the dark theme go with the latest update? I preferred that theme...,4
6fbe4ffb-3177-4d34-bcd0-0be22d625b79,I don't think I should have to pay that much money for the extra features but I like it and it wasn't that much; I'm just cheap.,4
5147e124-22db-45a6-8148-286ca1821332,"Was really great, now merely great. A few options I used are now apparently only in the paid version. :/",4
9c32aec6-a5f0-41e8-a845-85848d22bfc3,"The text colour in any place should be in contrast to the background colour chosen. It can be either automatic or customisable or both. Overall a very good app. 4 stars because of lack of this feature, otherwise 5 stars. Display weather or temp (as toggle in the centre); we can remove other apps!",4
4b8540e3-2a6a-43d0-9dba-8e183da61e94,I loved it the moment I installed and it only gets better and more visually appealing. The circular view events is intuitive and immediately useful!!!,4
2c6e4945-22db-4f2d-a2c7-88847173f57d,Useful. GF has an iPhone and is jelly.,4
b6c288eb-1725-4fd1-a70b-5945255628c2,Friendly application and presentable,4
c081af6c-48ba-485b-af0e-9143e2dd7cf8,I like the layout a lot. In one glance you'll get a good idea about upcoming appointments.,4
4afcdabf-1581-4f68-80f6-5a3c1ffff11a,Provides an effective and attractive way to see your upcoming schedule.,4
2dd1dbc5-f07e-4863-8bff-a7daa29c002d,Nice visual representation for your day,4
07460bdd-eea7-4b6e-8fa4-298886e26dc9,It's a visual reminder of the approach of important events.,4
532ac58c-71b5-4048-bd99-cc07667a09fc,I was looking for a way to incorporate google calendar with my bullet journal. Gives me the cool color coding and day planning that the spiraldex does without having to print templates out.,4
f859a6c7-2beb-41c0-accf-8cc5039c5978,Great app in all aspects. It would be nice to design hour and minute hands in a more classical way for smartwatch.,4
bbedb0e4-a675-4719-b614-2cd1588fafba,"It's pretty cool to visually look at how long your activities take each day. Allows me to experiment with my time. And it may make you feel better when you know that you really are a busy individual, but that's pretty subjective.",4
0eec2af3-2cc0-48c7-a714-ef7d8d0692da,Does what it says,4
d090f668-1fe0-4e0a-a8b5-558512c0c9c5,Nice App,4
