reviewId,content,sentimentScore
b3237f32-ed7b-47f2-877c-f5887aaf6b95,"The app is pretty good I love the UI, but I would really like to see the tasks scheduled for the day (without timestamps) in a way that I can see their names etc without having to tap them (on top of the calendar day view) Also improving widgets on Android to make them more customizable, for example only showing tasks for the current day, having a month/weekly view etc",4
c9c61d54-b697-4f86-aa80-abc22bf394f1,Good really good,4
34d2b5ec-7121-4f9a-84e8-78bc9ba6e318,Clean looking app. Seems user friendly,4
32e0bb0f-2101-48fb-b592-8294c61d7163,Simple and works. That's it,4
9a67b121-b137-499d-9ae9-e8f9c105d594,"Just downloaded it, very sleek design! Not sure if I'll personally stick with it, been using todoist and am used to tags and labels etc. but a really nice, minimalist app!",4
52dae61d-b87d-4d39-a7fb-7af57da4b7ae,Clean and practical. Gets the job done despite how simple it is!,4
9a628006-1d00-48f5-9ee4-8f8f2171f1ae,This app is brilliant for organizing your day. It shows how much empty time you still have and lets you set reminders for everything. My only complaint is that it is only for phones. Make a Windows or Mac version and it would be perfect!,4
45c37d15-4251-49ef-b4f7-fba20b193d49,Cool app. One thing I could recommend is to dial the vibrations down when clicking a day. An option to turn it off would be also great,4
a63c7653-66ce-4654-b956-081131a50077,"Simple basic design, able to easily plan an entire day to look at.",4
9f1a169b-f1d1-4b9f-8002-1cb001d9f0d1,It helps me a lot,4
02e40af4-1602-40dc-af06-dc0100d43b62,Looks good so far. I'll update when I get round to using it. Thanks for the prime.,4
4474a079-385f-4526-8810-08d9f70b6cb0,Cool to do app that looks good and is simple to use and syncs with calendar events.,4
855df9ff-ac15-4e9b-90ad-08d16a752a55,Good planner,4
63d5d5a1-f444-4d47-b54e-97b02ec12638,Good.,4
c86e1881-acb6-4115-9c09-c5d85c50bdaa,"Super intuitive, and I imagine it will only get better with updates. Better than apple or Google calendar but unfortunately not compatible with computers",4
99b3d70c-7d76-4b49-a54e-47f63a14e656,So far so good. I just wish we could make the text bigger or smaller.,4
68290b5f-56b9-41e5-a418-6d57d836ce03,Can't believe its free! Would love to kofi the devs. Its a simple drag and drop schedule to do list combination. It does bug out occasionally but it is really good otherwise - reminds me of an old app that eventually got taken down (Accomplish - to do list reborn) and Prosper hits the mark. If i could give a very cosmetic suggestion - maybe put the untimed tasks in a side bar that u swipe to see and use.,4
14259671-90ca-4d8e-a79b-78d77acde2f1,I am using it for the last one week and so far it is quite user friendly. Hope the last update will bring more functionality. Keep up the good work.,4
493dc8f8-cd9d-43ae-8051-459967647c29,"Enjoying it so far! Some things I like: -color coding -easy to duplicate tasks -easy to visually read. things I would like to see: -edit one instance of a recurring task -weekly/monthly overview of tasks -ability to add/edit tasks on desktop -widget for todays timeline, to quickly see schedule. Found a few bugs: -inbox tasks- once it fills up the page, not able to scroll down and see all tasks. -If you make a task 0 min, it just deletes the task and I'm not able to find it",4
ce26fb53-2292-4e97-b60a-d9372777e7ea,"A widget would be very much appreciated! Overall it seems like the best task app for students because most of the others I've tried doesn't go well with repeatable tasks. The design is very intuitive- it has everything one would need from a schedule, colour coded tasks, custom reminders, movable tasks and subtasks too!",4
7e3ca0d9-6520-40df-95f5-3a3fb658c0d1,"This app is exactly what I was looking for. The combination of inbox (kind of a to-do list) from where you can schedule tasks into the calendar is simple, but perfect. Intuitive and nice design. The only downside is that it's only a mobile app. Some kind of PC version (standalone or browser app) would make Prosper the perfect productivity tool for me. But I know that takes time and it's not a reason to give this app less than 5 stars :)",4
bb30c694-fd0c-44b9-8137-62a7cf2e0221,"Was a bit skeptical at first because I came across this on reddit, but after installing the app and setting it up, I really like the UI and the simple layout of everything",4
f21e8c95-b694-4bf2-a5dc-f59d16659496,Nice UI,4
72c8e495-9265-406e-a138-8ac0d6427035,Very awesome app however the calender view needs to be expanded on also the task list needs bit little more features.,4
52a24228-fef4-4a6f-ac1f-add0c95761aa,Useful app thanks,4
7d3cd7f6-2987-4524-9a5a-638c2333203f,"Clutter free, straight to the point :thumbs_up:",4
890152bf-542a-4568-9c3c-f7435ef9398c,"I really like this app. The ability to pick custom colors for each task and to make them repeat on certain days or at certain intervals is very nice. The ability to move tasks around is also very helpful if you don't quite get something done when you planned to. If there were a weekly view with the ability to drag tasks to a different day, that would be really nice too.",4
929fa99f-ceee-4f32-a2d4-b3ed1eeb8576,"So far I like how intuitive it is to make tasks and schedule everything in, very smooth and self explanatory. It would be nice to be able to change how I view the calendar instead just having a scrolling week up top. Sometimes in my planner I'm blocking out chunks of weeks that bleed into the next week and it's easy to just make color blocks so I can read it from space :) otherwise I'm really digging it so far",4
6cdf9786-73d8-4706-b83e-9cb823663234,"Seems very helpful, and I'm hoping I can get myself to keep with it so it can help me be more productive with my adhd!",4
f7a2ee9b-bb6e-4e85-9827-cbeba84473ba,A very minimalist and cool user interface and additionally doesn't require an account to use. Would definitely recommend this to everyone wanting to keep track of every day stuff.,4
a7cdd345-dffb-44e3-a154-db20b52445d5,It's pretty nice. Why is there two add though,4
6c9ae247-0c50-4339-8a56-384d1d05d064,"Very nice task manager for daily routines. Would be nice to have the ability to see some sort of marks or identifiers for unique events or tasks planned for certain days in the ""Month/Calendar"" view, when accessing the top-left button. (Such as: prepare to go on trip to ""X"" location.)",4
c118bcb6-cff3-406f-b21f-891ce6ace87d,"Nice and great apps, just installed apps, might try be Productive more :smiling_face_with_sunglasses:",4
c52ad9fa-a75b-4a5d-a1a0-a177eac3cb46,Nice,4
37c12b8f-a9d9-41a0-acfa-c019d81c565d,Very nice app minimalistic interphase. Keep good work,4
b379b3c7-b230-4712-9687-6d1c6ba6fa55,Nice clean interface. Looking forward to trying it out over time,4
