reviewId,content,sentimentScore
056d1f7c-4c27-4e6b-a49f-789c1cf8e3ed,Just provide me with free statistics,4
cb56eaa4-acb3-4441-a3a0-ef3887173265,Looks good so far. Will edit with a full review in a couple of months but it's user friendly and easy to find your way around.,4
07b4f939-8ce7-4dfa-8b19-0e333d4296f1,Such a good app helps you task and progress well But some features are paid the sad part ....,4
6dc0320f-1f7e-4235-a9a2-3b51afc64c2b,Very good app soo nice :thumbs_up::thumbs_up::thumbs_up:,4
d7af853a-0370-40ea-8eee-05f6201a0ece,Nice App,4
3282108e-2eb2-4ec9-9067-421bbd8237a6,"It's a really good and neat basic daily planner. I really need something like this because I always forgot important stuffs. Suggestion: 1. Please make the time ""Slider"" to just input edit the time, it's hard especially if I need to add multiple task, fast, before I end up forgetting again. 2. SNOOZE: I'm used to using alarms as early warning and 5 minute snooze as the proper alarm. Thank you.:green_heart:",4
ff62f999-a68a-434d-a53d-90cdb80873ce,Good,4
9921c3d2-51b6-4e7a-8d70-81a7ddbae751,Good app,4
fd7f93a3-8c26-4c28-b624-468cda695e8f,I like the app. Especially how the tasks are mapped out in the calender. Exactly what I was looking for in a planner,4
413df483-0b2e-4e36-ae88-8d46c02928ca,Good,4
71b4f4b0-5e18-427e-9968-34be5be7c802,It doesn't give me a noise to notify. But I like it,4
e8202993-93db-43e3-9124-53d585c4d8b6,"I have Persistent Severe Depressive Disorder, and this is the one app that's worked for me so far! It's pleasing to look at, easy to use, and surprisingly motivating for how simple the reminders are. It sucks that some features I needed are behind a paywall, but I understand the need. Fortunately, the lifetime option is affordable and worth it for me.",4
c942bb8a-0d1f-4805-8215-d1a94c841a04,"It's such a good app: it's simple, user-friendly and intuitive. And they made a great habit app as well!! I'd love to see tags/groups in both apps, presets for reminders (i.e. 30mn, 1h before..) and the same interface for the time duration as the habit app (which is better). I'd be nice to be able to change the color theme of the apps but it's not really important",4
65c4dcb8-a49c-40d5-a174-46da759fc8b9,"It's so easy to use. The only thing missing is an alarm for reminders. Otherwise, it's perfect for me!!",4
61a77bfa-8f59-461a-a0b7-f4e4e40dd2b7,"I think this app is great. However, this is the only app I've tested that widgets and advanced notification can only be used for premium version.",4
5965471e-94bd-4bd4-80db-460b98bbf006,"Wish the premium perks were free, but exactly what I was looking for a task/time management app. Very simple and to the point. Hoping it still works when out of service!",4
bbe579c3-a8a6-41d3-8197-ea65493b1b31,"It is really useful app, but it would be great if other task categorization options could be offered. I.e high impact, low effort or low impact, low effort.",4
0024fd83-88f8-4781-bafa-4fd5fc5402d3,"I was use others app manage time, but I like prosper. It's very ease for use and user interface verfy friendly",4
8f8650d9-2cda-40ed-89d3-977d2c1c661d,"Nice app. Now see, if I am going to have to sync this app with my calenders, then I should also be able to edit each task from this app as well. What's the point of syncing if I can't edit tasks here? Good app though.",4
52cfe910-b84a-412f-a764-3ecb9a193064,NICE APP,4
63b42dfa-7f20-4fe4-9bc3-3e2cea7e3496,"This app does wonders for my productivity. I see a drastic improvement already! :smiling_face: The developers were kind enough to gift me the full version for free, so I'm very appreciative :red_heart: I would definitely check out their other projects too!",4
2ec3e203-91f7-4db1-bfd3-97945d18dfea,So far so good but forget how much it cost after trial I can't afford any at moments,4
89adeee8-4922-4a77-a052-e2e391925b32,"Overall great app. A feature I would like to suggest : Instead of creating events through plus button ,setting the start time and end time and duration, we can just HOLD AND DRAG DOWN in the timeline on a particular date, to make new events for required duration. And when holding and dragging is done, it can give us a prompt to add name, color, reminders. For that purpose, make all 24 hours permenently visible in timeline, all the free hours can shrink. Please consider doing this.",4
2bdac478-8161-403c-99f9-941d538c91ec,"This app is simple to use I am speechless I have not gotten time to take a look at the prime features one would pay for, but I'm pretty sure the prime features are worth the purchase. Try this app get rid of the old Palm Pilot style calendars that are everywhere. Or sync your calendar with Prosper.",4
872ecbee-23ee-4c4d-890e-ba6670e5f0af,Very good app ....if i talk about another scheduling apps....they don't send notification or send notification in delay of tasks....but this sends notification of tasks at time.. and this is best for scheduling your day....,4
4484484a-8604-48f1-9dad-8c599d35dbd3,"Very great because it allows me to make a schedule for my day using time blocking which I love and adore, and also check it off when done completing it, thus giving me that satisfaction and dopamine release. Only suggestion; Please please make so when you make tasks in the out box/inbox area (not yet scheduled area) that you can plug those in easier to the next adjacent time slot, that it automatically chooses the next available time slot isntead of always making you do it manually.",4
317d7508-8d95-42c1-b619-a48dfb0f00a4,I'm really liking it! I recommend anyone give it a go. I really benefit from keeping visibility of my stuff even if some of it overlaps. Wishing for a desktop version to sync with.,4
a4dbfac0-1863-4294-87df-410c1a91c842,Hi sir I am using this aap from last 6 months . The aap is very good for doing task within a time no doubt about this. But a small problem is that this aap should have option for showing subtask without clicking the task. Please resolve this issue sir,4
7ea3672b-9bae-475c-b93c-dc051f230348,Seems to do what it says it will. Easy to use. Nice interface.,4
c491e508-686e-483d-a544-1bc4a963eac7,Really good app. Well designed and really helpful :OK_hand::thumbs_up:,4
f7e99eff-31c3-4346-806a-88284d495550,"So far, so good. A little too early to give 5 stars (I've only used it for 12 hours!) But I really like the timeline. It is super simple-just what I want! You set tasks for certain times during the day and as time passes you get little notificatuons when to start and can check them off when completed. Very easy and fun to use. So far has helped me accomplish the everyday tasks I might otherwise put off or delay. Might help me establish habits I want to develop. Will re-rate in a few weeks.",4
cd071f41-3385-434f-8134-a707cd47143b,"The application is great, no doubt about that. Just add feature which allows us to mark incomplete task. It would help us to see which works left undone. And also if supposed we were not able to complete a task, we should be able to write a remark for that that why such thing has not been completed or generally we can add any remark to the task.",4
0cc54420-861a-45a6-9648-44305314c4d3,"Great app, helps me lots with planning my day and my medication reminders. If it wasn't for this app, my days would be a lot more complicated.",4
962527cc-a81f-4d16-af3b-4924cfacf851,So far it to use and a straightforward task setup app.,4
b3665fa7-2c78-4975-b5dd-fbcbe9ec5f09,This app is pretty cool I like it easy to operate manage and it's got everything you need Great job,4
8a304c10-071c-469c-a2b4-5052ad544482,was ready for school earlier than usual,4
a214d0c3-516a-4ba1-a356-9d60b302f1e7,Good,4
c825c655-08bb-47a8-b6ee-a65f75981889,Task tagging feature required,4
654ee3a6-c8cc-4a72-bb52-3f238f2429a7,"Really great app if you're on the autism spectrum. Ive made a morning routine with a check list and an evening routine. The only thing I want changed is the push notifications. They should be more visual, with the icon, colour and title of the activity that it is reminding you of. And I'm not sure if I could change this in my phone settings somewhere but would be nice to choose the notification sound in app.",4
fb64a8ca-0fe1-4399-8bd0-8e209e1e53c6,Still learning,4
7b72a851-4199-4d91-95f9-7a483ca68289,"Great App, I wish I could review all the schedule tasks at once. Sometimes we do schedule a task for Sat/Sun but then would like to do it on a Thursday as we are already at that location or have free time",4
36702c2a-ebec-42fc-9da2-8ef039456d8a,"I like the flexibility of moving things around and the visualization of the tasks in a chronological way, it's very helpful for my tiny brain who can't focus unless there's shapes and colors. Unfortunately the lifetime subscription is so expensive is Brazil :loudly_crying_face: devs hate Brazilians",4
fc747229-b10f-475e-a819-d836d418d72f,works as it should,4
220ba692-52ce-493a-b0b3-298f69663d4c,Love the app but it would be great to have a sync button that refresh the connection with Google calendar. Something it takes days to refresh it. This is the only issue that I have right now,4
1fe1432b-abef-4741-b99f-3c02ff7836f8,well integration of tasks that are incomplete should be carried forward as suggestions,4
28ddd9a0-f40e-421e-b8a2-7ed42963a475,Good app,4
24b17c6c-9dc4-4757-9c20-1a810c927030,Ye good it helps me a bit with school and all that,4
3926d510-c34a-41fb-99f4-a4509bf9c2ca,"Looks awesome, but I need hourly tasks too.",4
b687e400-b018-47d0-9cd5-cc8b3320c7eb,"Useful app. My one critique is that it would be more useful if there was an option to see my week at a glance, as well as my day.",4
681e2b44-201b-4d17-be63-f278c9b3c568,"I like it so far, the drag and drop is amazing. Would it be possible to change the time setting from a scroll wheel to a type in? Or have a setting to choose?",4
4ab9fa50-feee-49b6-af15-b2a6e6285d01,It's early days but so far I'm impressed. I think it would be useful to be able to zoom out to see all tasks for a day & all tasks for that week instead of just the compact mode though. Maybe to zoom in and out etc.,4
9aa5acab-2744-4e54-8383-26d5a3351559,In avg 10/10 but there is some tech problem and bugs here and there but really happy with it... Already subscribe to it :melting_face::red_heart:,4
0bea96f0-c468-457d-9271-f273780268ed,"Repeating tasks are the most basic feature of any serious planning/calendar app - why is it a ""prime"" feature? If I can't setup more than one day at a time, how am I going to use your app enough to be okay paying for it?",4
71b5ca09-b4c7-40bd-8a51-18de4f36f257,Good,4
240474a8-e9b2-4f27-a58e-44d345e7a1fc,So far so good. Would be great if can view it in a monthly view with tasks listed and also a monthly view widget too!,4
9b5ad6e9-29ff-4e8e-883b-b3dc673d6727,Wery nice,4
e7841a3c-6763-440c-8a77-0cef17be612d,"Have only used it for about a week and a half. But so far, so good. I wish I could afford the upgrade. I bet it's amazing and so much more helpful.",4
a39e3086-0bd1-4046-9df2-0968fd1971b9,"It's the best app for productivity. I've tried almost 15 apps, then uninstalled them bcz they were not upto the mark. But this app- is soooo good (almost perfect). I really like the bright, beautiful colours. Overall it's a really nice app. However I have some suggestions: 1. Please introduce an option for daily automatic backup. 2. If possible, please design a pc version so that laptop users can also sync their data from the mobile app and utilize the amazing features.",4
42627a63-8b52-403b-9d80-de9f8e99d4a9,"Very user friendly indeed.. please include an option to delete an item completely if anyone wishes to do so, once it is all done... Also, if we could include any reminders for undone tasks of last few days/ week. Excellent app otherwise",4
ccf24538-a526-4619-a8c0-464822e293e7,Very simple but does the job. Can automatically repeat tasks for future days which is really helpful.,4
ac1a160a-b238-47a0-b849-624f4ae5b532,"Brilliant app helps me stick to a schedule with two boys, easy to use and generally overall really good...would of given 5 start but 4 stars as the only one negative is when I try to add as a widget it doesn't give me the full list only 4 show which is ashame (any recommendations to fix this would be appreciated) but overall brilliant app.",4
ecc0f9eb-6f2a-45f3-98a2-4ffacf881335,Good app for daily routine work. I like it.,4
00c93543-167a-4e48-845e-a8667e7762f5,good,4
2414c253-73aa-405b-a2d6-40c101a44e04,Been using it for a week and so far it is doing wonders. Hopefully they will add features like 1) landscape mode for tablets esp Xiaomi 2) addt'l features for repetition of occurrence (hopefully they add custom) 3) Hold and drag 4) reminder as well for sub task/s,4
c377f0e7-7279-45f4-9366-50a52b156b2d,This app would be perfect if it had a windows version.,4
ead94294-b70e-4989-bf4a-80b2a4cb2cb8,Good,4
0a63cb4a-d8e6-45e8-8987-2d542af38dd6,No complaints,4
0680ebf7-f4b2-491a-a453-faf62ed34ca8,"Useful & has potential. I've been using Propser for almost a week and have been enjoying it so far. I do think a few key tweaks/features are missing: 1. The app does not auto-scroll to the present time of day. 2. When scheduling a new task, I'd like the option of adding a task from my inbox. 3. The ability to send a scheduled task to my inbox for scheduling later. 4. The ability to select and move multiple tasks at a time along the timeline. Thanks in advance for your consideration.",4
071f57d2-9ed2-474c-bb80-2401ebb134b1,Great but no undo button so don't make any mistakes,4
bd3af316-f9cf-433e-a3e9-c681bbf0abe6,Muito bom. O aplicativo tem me ajudado muito a organizar meus dias. Amei o fato dele mostrar o tempo que pode ser gasto e perdido. Parabéns aos desenvolvedores.:clapping_hands_dark_skin_tone::clapping_hands_dark_skin_tone:,4
6544ed3d-ed21-4c33-ba05-e91c8727f6a3,It is good app,4
04354694-1489-4a9c-85e6-18f043596d0c,"Seems like a really nice app with plenty of features. Still testing things out to see if I remember I have it, but let's see how it goes!",4
e93b8a9b-e9d0-49bb-9126-9eac42d8dd45,"The app quite nice, I'm giving less stars to grab your attention(ill update rating later).. Wanted to request a feature, after importing tasks from Google Callender please give functionality to edit those tasks just as we can edit the tasks made from within the app,, or you could give us the functionality to import a CSV file directly into the app",4
09f7be94-22ed-4875-bf85-224290d7064f,"Interesting approach with lots of flexibility to build routines, tasks and build healthy habits",4
945b6c86-265d-4673-a45a-2500631118d1,"Love, love, love the app. This app has changed the way that I visualize my time during the day and it's been fantastic to use. The only complaint I have is the way the app shows items that overlap other items. If you're trying to schedule something at the same time as something else, such as a lunch during a work day, there needs to be a better way to represent it. Having the item fall below the other item with an ""overlapping"" tag is confusing and hard to look at. Otherwise, love everything!",4
a339d4f0-4798-485d-9786-13cef551639a,"Good. This app works well. There should be a ""Project"" feature that allows users to organize and save tasks and subtasks.",4
19e472d1-2b97-45b8-96a9-e997e5edd37d,Bonza,4
03a10852-4538-4c60-ae80-5141895e4224,"Great, simple app for daily planning. I love the calendar integration. I think it could benefit from differentiating tasks from events or blocked off bits of the day. Not all things on my calendar are tasks to be ticked off, and it'll be nice to set a sleep-time so that it doesn't look like I have 8 free hours a day to do stuff. Minor criticism, but would make it perfect for me",4
9903ef17-603b-496a-bb99-878ba56b5264,"Just downloaded, but loving the layout and how easy to use it is so far.",4
e4986460-5779-4947-9af1-6461f978d074,"from a fellow redditor, thank u man :thumbs_up_medium-light_skin_tone::sparkling_heart:",4
5fbaf362-4e74-4ead-bd87-67e3ecbcb8cc,"Love the app. It would be nice if there is an option to start a timer when you open a task as well, definitely would help people with ADHD more.",4
3a68606c-734d-4ff3-bdd9-3b511aecff81,"Pretty straight forward. Really nice layout, with simple features",4
378b1bb9-8f43-4a7b-9181-220dc36b7c74,"This app is really straight forward to use. Early days, but it has improved my ability to manage my day to day life. #ADHD Edit - Futher to initial review, l must have looked at most apps designed to my organising yourself easier and this is my favourite. It is worth the stars, but the ability to add a hyperlink and a link to a file on your device would make it complete from my point of view.",4
b0f80556-9286-404c-8a7b-fd4c307435e8,"Awesome looking scheduler and has major potential. But there are some noticeable issues: I'm not seeing any ability to search. No way to organize tasks. Also, no web version which is a bummer. Two-way calendar sync would take this app to another level. I will definitely keep an eye on this and most likely go with the premium version down the road. I really hope the developer continues expanding on this because it's off to a great start!",4
40658680-2779-48f3-8d87-d42bcaff5d64,The developer is a SAINT. Edit: I am using this app to get my life together after some chaotic events that took place over the holidays and its working great! Albeit Ive been using it for a day. But its already helped me organize my daily schedule for school and other tasks.,4
fd13c49a-364a-4658-99c2-3c2f7e810b83,Nice app with lots of customization for tasks,4
bcacd9b7-a7c1-4c53-be63-0eed5897e3c4,It took me so long to find an app like this but When I did I was so happy,4
8062b54a-b5a0-4cb1-be59-fd4af1371cb3,Very nice app For making your day productive!! But premium feature:neutral_face:??:eyes:,4
bd8c0b67-b9c8-4390-b0b7-3dab932e1ccc,"I'm giving 5 stars instead of my original 1 star, though I have unsubscribed",4
6abade46-650c-4453-b02a-f61d80a0c51f,"Good app but has no notification sound. If rectified, I'll change to five :star:",4
5f5e6e9c-f88e-4e22-ab98-57ae072869de,"Good so far, good planner",4
8c5e85a2-6228-423f-a9a4-7b858a1ee690,"So far so good, I like the idea and would hope for a desktop app",4
5a690243-9fcd-4623-8f9b-7d0e4b303be2,Another basic planner it might as well be a supercalendar I can't write programs but I know how to use them,4
b062af6f-8135-4bb5-a91f-7bdfa710f572,"Prosper is a fantastic time blocking app that has helped me so much with planning every minute of my life. I like it cause it's very minimalistic, easy to use and you are able to set the duration of every activity. Only suggestion that I have is if it is possible to select and move more blocks at the same time and to make blocks snap easier when they are close to eachother.",4
a738cf31-277f-4e45-bc01-6a8da94f206d,"This is the planner app I never realised I needed. In fact, I was one of the 'Who needs a planner app anyway?' people, having used Google calendar and Notion but I couldn't get it to work.But after a freebie by the developer, I decided to try this out. I'm glad I did! This has everything I've been looking for in a planner app. By far the best feature is the fact that the timeline shrinks between tasks and inbox is great! But please make the 'drag to change task time' a bit more precise.",4
08c534c9-ebd9-4a62-8215-daf46d7341b7,"Sleek design, easy to use, helps me become more productive.",4
3457b9d2-623d-405e-9e44-65bbcaa18ae7,Good,4
426efde7-7b2b-438e-b33b-850a2111bf4f,A decent app to help me boost my productivity :slightly_smiling_face::slightly_smiling_face:,4
afcc93e5-f5ca-4982-aba3-52da0e377b84,Thanks for the subscription. Looks like a nice app. Animations can be sluggish sometimes.,4
1f3b36d0-1f20-4104-9118-ef617303bd09,Is good,4
c629e248-5af2-4b01-aaab-264fd7300c3f,Seems like a very good app to keep my day organized!,4
3244546c-072e-448d-b0f0-05ab2af3c722,:thumbs_up: good,4
90d1e9d3-9407-40b3-b019-789083d35296,I like the task-subtask style of creating Action Items.,4
d68359b0-5ea4-4c29-aeed-fecdf6f6ddba,Fine,4
8db78685-8524-4fca-b108-eeb4c7e1b1a0,"It's fantastic, but it appears the widget with a list does not work for today, only shows tasks for tomorrow! That makes this far less useful & desirable for me. Otherwise it's a thousand stars. Eventually I will not want to have it bc I just won't need it if widget doesn't show the actual day that I'm living in, today. Or maybe something is malfunctioning for me, not sure yet. Thx",4
3871afa8-cee2-4006-8293-59cfc474bbb7,"This app is both very useful and user friendly. That options to choose duration is a good factor for easy planning. I also liked the ""inbox"" concept.",4
94fac826-103d-4bb6-8e99-aadb826fe32d,Its good,4
d7100404-5d4e-42a9-8e24-2c32e059d578,good use.thanks,4
8112a68f-8a76-4815-8cf7-49d9a72e51e2,clever app count your free time before your next event and very easy to use but i hope to solve widget i don't see date or days of week,4
d85cea58-8332-4272-9def-9c1487afcd87,Seems interesting to see how it works,4
ab29cdf6-83de-452e-923d-6e2b3646ceb7,Bin jetzt bei TickTick gelandet. Offene API um Daten auszutauschen. Und für alle Plattformen inklusive Linux verfügbar. Aber Prosper macht grafisch echt was her.,4
e3d21954-6890-4165-ab7f-94f423b86210,Nice,4
899fd5a3-1dae-4f0b-96e2-b7c3194eb816,First dey of using it. It's User-friendly And helpful. I like it :pinched_fingers:,4
d0fc652c-26bf-433a-a16a-c4d177567589,Pretty helpful!!!,4
3be52fb3-c4f4-4bc0-b215-6ea290361c55,"The only routine app that allows a task recur every X days. Well thought out features - no more, no less. Only wish the app font is modern than Poppins font.",4
d33bd580-ad52-4471-b6e5-01f29d718ba2,good app you can plan your daily tasks,4
f21b46dd-81c6-49ca-909d-ddc732dcf4f9,"Very nice, and easy to use. Just wish there was a feature that allows you to put one day stuff into all days. since my days are all the same",4
007cfd8e-df70-4ced-bef2-78529e032f07,"Has potential. I need subtasks to show and be interactive on the main screen (I don't want to select ""morning routine"" to see all the tasks I've got listed). Also, titles should have every word capitalized. Subtasks default to lower caps, annoying to have to capitalize each one. When adding a new subtask, the cursor should automatically move there so you can start typing without having to scroll and tap on it. Will keep an eye on this one, definite potential.",4
5eabfa6c-7d6f-4ed1-bf47-acbc49d5d390,I'm giving this a 4 star rating but just for the time being seeing as I've not yet fully been able to properly experience the app and have only just begun to explore it's features. I will go ahead and say it all looks very promising and it may even be the planner app I've been longing to find! Super excited to continue to check it out further. Will update my review after I do.,4
cd9830df-08a3-4bee-abc0-975f430ba7b6,"Good app, fair yearly pricing too.",4
36ed1e85-6e4d-4065-b7d0-048e9ffab052,"This app is the exact thing I have been looking for, for the past years. Beautiful UI, intuitive task creation, very friendly dev, with reasonable pricing for extra features. I know this app is still new, but it would be great to see some features like reminding a set amount of time before a task (currently has to be set as fixed custom time), completed tasks at the top as filled circles, or maybe even a calendar view. However, just as it is, my favourite day to day planner!",4
bf22fe03-bc0a-4429-879d-749c430e34df,Yes. Good.,4
38b2620d-76db-48d7-bc64-7395758d048a,I just got it I didn't get to try yet,4
85d27c03-9c72-47cb-b101-cd9c32f969a2,Good app,4
4b7207c5-dfd3-4b66-b983-2c470266fd04,I like it it's easy to use and cute,4
e091ae07-bb5c-4b82-9db4-4b1b402c7abe,Supper,4
1c5f4742-5011-4bf7-b778-c0252656f5ac,"Looks like a great app that I may have been willing to pay for, but not a subscription. Can't even try widgets without subscribing (a key feature for me)",4
3ffdaacc-3265-4500-9436-d8fd98fe2745,It's good,4
edbc697f-213d-40e7-8218-e3ec74fc3187,"I've tried 2 more Apps earlier and this is by far the best... The first day, it took me a long time to make the schedule... For the second day I copied the common tasks, or those that require very little editing... Two suggestions that will make this App a 5 star (atleast for me)... 1. Option to copy the entire schedule at once for multiple days.. 2. Although my notifications are on (with vibration), I don't think it's working; so that needs to be fixed Rest all is fine !!",4
8f89b131-7749-4c4b-ab49-fd282b0e8f39,Easy-to-use but what's the fun in that.,4
bfddebde-dea3-41d1-816c-be934080c624,"Pretty good so far, is there an alarm feature for this?",4
c43a31a2-920a-4778-b4ec-c3feb5323f68,Please add support for wear os .Good App.Keep up the Good work.Kindly add features like 1 Customized notifications 2 Time remaining feature instead of line for indication. 3 customized task time preset option 4 widget opacity level control Thanks,4
27b833f1-34fc-470e-9bc0-76d6dcaefdc7,"I really like the app, I do appreciate the free version...so much so that I am considering the upgraded version...I like the color theme...I do wish that the Pop up reminders were a little bit more colorful... maybe interactive would be nice too.",4
d66d72e8-3d50-4d7d-97af-ee7f2b1dc999,"The user interface is gorgeous, looks way better than Google's calendar!! Has several useful functions, only complaint is that there are only 3 colours for the tasks (without the premium) so you'll need to get premium for the full experience. Still the best I've used though, it as some serious potential!!",4
