reviewId,content,sentimentScore
be871924-36a8-45ee-ab8e-d7022f8ac0c5,Definitely increases productivity. Glad to be a premium member,5
3e297bf2-f48e-4254-9796-8947ee59639d,Love it.has been using it for 4 years now,5
580095ff-8978-41f8-b55b-02d92f3c453b,I have ADHD and Engross has been incredibly helpful in enabling me to be productive. Literally nothing but praise.,5
6eef159c-b534-4dad-b533-9d7fe19c38e5,Really good app for tracking study sessions and time.,5
970d46d7-4b74-40f0-b17c-306289be002b,Affordable!!!,5
2f7ead75-bd53-49f1-844b-c55129add96c,This app is so good fr.,5
627afd67-a89c-4754-b3d8-3dd087263c4c,Great app,5
893f3a55-5098-45ab-981a-2f7d3d0bd52d,"Very useful app , if you are a student then this application will definitely help in time management and makes you productive.:grinning_face_with_smiling_eyes::sparkles:",5
f0ea3265-a3e8-4fc1-a53f-a191d2809cf9,Awsome app...helped me with focusing a lot...<3,5
c336cbeb-8e4e-486d-90f6-11f82219ac75,The app worked great and did exactly what I needed,5
06cd0a5f-1494-4470-a925-2ea0a68e2ad1,One of the best apps I remember,5
209ac933-ec86-4f49-9fba-6092b00932b1,using this app motivated me to study and helped with consistency ^^,5
241416a2-2573-4750-bf25-3f4e74b10795,Highly effective Pomodoro app. Helps with losing focus and concentration.,5
7b68fa67-7317-4bc1-9d3e-0e6d432ee57c,"I like it so much , features are open and not pay",5
3e137e54-38fa-44fd-a6ba-f32024d53c4d,The best app I've ever used . I love it I'm using it 2 years ago and still .,5
283e6c04-da9a-483d-8d9f-2423a0043540,"Totally loving this app. Just bought the subscription as well and for only 200 rupees for lifetime :loudly_crying_face::sparkles:. Amazing. The feature ""hit me when you are distracted"" chefs kiss :pinched_fingers_light_skin_tone:. I love everything about this app. Has significantly increased my productivity. Loving it.",5
544bb0ff-9863-4ea9-9948-53ddced42370,Excellent,5
9769c1d2-5ff6-4c6b-ae98-ee8a22f626c1,I absolutely loved it,5
b3d58ae0-fa53-4cce-b12c-6366bd826258,I loved it :red_heart:,5
b2a83798-db7e-47b4-bb9f-1dc3fa1cfedc,Very productive app really useful like this app very much :growing_heart::growing_heart::growing_heart:,5
d6e1a75a-a088-4a02-9b93-2d38cebd9a3b,Fantastic App :thumbs_up:,5
fbe5f0f9-4e01-4736-97a9-8991d2733234,Better than other pomodoro apps,5
652bbf1b-47bd-4563-9934-ca68a815fb91,This is really so helpful,5
7af41a05-a083-4e1d-9a9b-1b46da887052,Really useful for studying,5
921fb107-9002-4833-871f-91115a719f07,This is a really good app! It helped me with school and studying so much,5
1cfe270b-a9ef-4a32-9ebc-8d7b51a80686,This is an amazing application for pomodoro.,5
cc46425e-f89a-466b-914d-9d1aa7a974b1,So good :thumbs_up_light_skin_tone:,5
4089c9e7-3ac4-41bd-bbf5-df6eab3c72f5,Great productivity app . I use this app daily. Must have for focusing on task Some suggestions from me . 1.flip to start and stop . 2. Add widgets. Especially a target hours one. It would be motivating 3. Increase the thickness of that colored ring timer 4. Add achievement section.,5
71435ef0-bb49-49de-bf2d-77aa819cb81a,"It's really nice to be able to access todo, calendar and pomodoro all in one and turn off wifi automatically even in free ver",5
5e783545-5784-4d90-bf6c-ef600eaef7b2,Please mke it available on windows laptop too.,5
e1ad70e9-9ae0-4a5c-9ede-11b2e6cd589b,Best app for students. it reduces my screentime 3 hrs to only 30 minutes a day . I would really thank the founder of this app who makes this amazing program and the tasks which he gave they are fantabulous . I loved it ..,5
cd0d6d3c-77f3-4a46-99dd-297309c3a217,Very helpful,5
fead832d-2ed2-4254-9b75-9ceead04d0e6,excellent app for daily continuity,5
87474f67-f6c1-4a38-8442-2051bfdb8aed,I use this app for concentration techniques. I found it very helpful. Thank you :folded_hands:,5
6ad64d85-94b0-4755-9517-b5f236b55a74,I've tried 3 different play store apps and one from f-droid This is my favorite so far. I tried forest and the other really popular one and some others. They were poorly organized. Have some minor gripes with this one but it's overall great best I've found,5
1094512e-88fb-4e9c-b0cb-96205725e1e2,Nice .and thank too you,5
c9ee7832-cf82-46fb-a16c-19018f583932,"I love this App, and I honestly think there should be a chrome Extention of this App For Pc users.",5
0147d21b-528e-45b6-80e7-e2fe581c1f5f,Effective pomodoro timer.,5
1edf3461-a87f-4520-a796-7a50307a7fc9,very useful for studies go fot it without thinking anymore thanks engross for upgrading my productivity,5
a910ecb3-943c-4ab7-8f32-7b96acd2fac2,Great app,5
7a2d54e0-02ed-4f09-85e6-fc14ef860662,"One of my favourite apps! Clean design, easy to use, and does what it says, and more!",5
e5796180-4dda-47af-8f22-5c03c6b086ae,"This app is so detailed with little features that you would never have thought of but they make it so intuitive and helpful!! The UI is really simple but effective, there's no irritating ads and the free version still has so many features. The premium is so cheap and a one time purchase unlike other apps! The help desk is genuinely lovely and helpful. You can make detailed sessions with revision time, breaks, and work time really easily and it makes you so productive! Great app, I love it!!",5
83f808bc-41e2-47dd-bd5b-fef3892c1d36,Excellent,5
bf45b762-3afc-426a-9780-993c8429ba35,Very useful app,5
ec42fd89-dc30-45dc-83b5-fee094572b3d,Best app. Please do something. Bcz when you minimize it. Or doing online classes in phone. It's stop working in background,5
54cff6e7-4cfd-41f9-b576-0eacadfb07b1,Simple and easy to use,5
8481791c-808c-4d88-ab00-67e727715879,Helping my ADHD way too much,5
2ff6fdea-c5bd-4281-8b9c-daea145732f2,Use full app,5
759f9e0e-3e80-48ed-a3b1-88792560438f,"very good app, I enjoy using it",5
a6f4d406-6b29-46e1-a834-14b9c390efa0,great app-`♡´-,5
9113b5f9-2cb1-4dfe-9c17-2516b530b59e,"Fantastic app, only one off purchase for 5 quid for the premium features, and it is simple and does everything I need in a pomodoro-like time tracker. I use it to work, read, perform admin tasks and track progress. I don't use the tasks feature as I use todoist for this and have done for a while, however the tracking features are exactly what I needed.",5
24446392-d4bf-47b2-a210-aca643b02a23,"Amazing app, very helpful and tidy",5
e9e3b929-3b26-424f-beb9-29bbb1e864b7,Helpful,5
88d4c93f-e98d-45a5-affc-a512f404ad5f,This is an awesome app needed for every aspirant or student to stay focus and track it . It's an amazing app . Before using this app I was a student who loved studying but used to get often distracted . But this app helped me to stay focused and also it orgainses my daily tasks ...,5
b2da1beb-91e4-4d7f-97b2-d8df0992bc97,"Great app, really helpful to focus. Also we can track active learning time throughout day... No adds no distraction ,very easy to use and creat personalized goals.",5
d3caaceb-8b67-4e2a-b394-7736f7d41232,Great app... Very useful for serious students,5
373cdab8-e44d-440c-8616-a99e59d6557a,"Highly functional, straight forward to use, with lots of cool and handy features beyond the obvious.",5
f764671f-3946-4ef7-9f4c-21ac2ad8d1e7,Best for students. Recommended to install it :),5
13912c5d-46de-41ba-8e3d-5bc3089fc02d,Superb app :sparkles:,5
a6e2970f-e436-4f97-8fb1-58c05505ae32,Really a good app,5
9c6acece-d8ec-4aea-88ca-27affffdee95,"This is the best pomodoro timer I have come across on Play Store. The marvellous thing is that you can also count the number of times you get distracted, each time showing some interactive message which increases the efficiency. It has contributed a lot in enhancing concentration towards my studies.",5
80837569-a32e-47bc-acfd-64e94e92e954,Best app to stay focused,5
d146f109-fafa-4976-abef-8f48bebf8599,Best productivity app ever!,5
1049c678-a4e4-477b-97f5-b23117dc4e5b,"Great application. Really helpful for focussing better especially to those who get distracted easily. Its a one-time payment app for certain features and we have to pay separately for iOS and Android versions. It has stopwatch, timer, to do list, event reminders features, and also graphical representation for our analysis of how much we did daily. Please add a feature for adding events in the next month or later. So that we don't miss the reminders.",5
cc2f7be0-cee4-459c-8b56-ec70cead2788,amazing,5
fc30eab9-3bb4-4a80-bb8f-d156bc0022b4,A very precise app to to manage time schedule for the work,5
71918876-c703-4024-b655-c3dd79eb11ca,Awesome app. It allows you to strictly turn off internet for deep focus. The to do list feature along with the progress tracking is the best which isn't found anywhere in other apps. Best apps so far. Simple to use.,5
ec396170-a809-4b78-b9e4-c14778222960,Add group study pls it's need ... All are best in this app,5
006d76f0-cf99-478d-8019-8052cea9c425,"Engross has the multiple functions that are especially helpful together. The to-do list that syncs with calendar plus the focus modes are fantastic. I just tried the stopwatch for dishes rather than the timer, and it motivated me to work faster. Much appreciated :clapping_hands:",5
9e77dd40-8895-4b54-91b5-dd6c5dbcca96,Great,5
fe5a5882-d639-4968-a35a-df95b1230a4c,"Really good, helped me increase my study time",5
10fedf0d-b738-4874-8bde-60f763d7b125,Love it,5
8f5b1745-4b4e-4c31-a4d5-633583d3b895,It's a great app Thanks to the person behind this ...!,5
5cb6a7ed-49b5-4fcd-abe4-23169c88a17f,one of the best timer app for tracking your study sessions..,5
56ad31c0-8cfd-45d9-a833-898bd5ed918b,Fulfilled exactly my personal need. Keep it up. I looked elsewhere for anything better–there may be some but I failed to find–so for now this has been the best for what i need.,5
debe8b5e-08a6-4f5a-9943-c665cb3731fb,"The perfect pomodoro app, no lag after any set and very easy to use",5
eb3b2d0e-ea55-4a53-b4ca-e1accf99298c,This is the beast have maded by engross team,5
30887079-f94b-4020-9a2b-4fb5a7b6ff05,Excellent service :cherry_blossom:,5
4bddf23c-559a-4b6a-9948-3845ffce9440,Works exactly how I need it to,5
b7f830f4-6587-4068-a96a-4f6f40aa2323,Helpfull app :heart_suit:,5
abdb346d-4049-42b7-8c24-d4e9933b33eb,Great app! Love that I can give percentages to to-do items (i.e. number of pages I've read out of a chapter). Keeps me motivated!,5
aa84fec4-9ff4-437b-a6de-c5f37ab9d50c,It's really very useful,5
b75888cf-b2ab-4e6f-9a5d-4dc37030d4f8,Really good :thumbs_up:,5
9cf57eed-34d8-4e0a-a361-e9e7b08fcab0,"Great app for planning, task management. The distraction counter is very helpful. Would love to see a PC version so that I could sync across my mobile phone and laptop",5
0a52ced1-d566-4b72-83c1-944f1e84974d,Awesome app,5
2717ce1a-6862-4e15-97d6-8ced358dafed,It's very useful app for productive study. Easy to use Best features,5
dd2006e9-b500-4c7f-8841-9cd908bce4a2,Very useful app for students like me who get distracted easily..,5
6e934b3b-a5fa-4022-a90f-684238754f91,Love this app.,5
ddfbe3db-6f02-42b0-b40b-c15f5843ae74,"It is honestly a very useful app, it helps me to track my time while studying and it helps me to stay focused throughout my study session. Really recommend :red_heart::red_heart::smiling_face:",5
12691ed7-0925-47c4-a64c-971a6f48d284,Noo ads best pomodoro app in the world Thanks Team Engross,5
98611933-368f-45dc-a13e-9748e50bd33f,Very helpful app. Using it for years. Please add notes option,5
c8d81c6e-05c1-4706-b9e1-3e8ceecd6069,Perfect,5
978ca34a-dfbb-4217-b445-491b14bb008c,love this app,5
1520fa88-22af-4d09-92ff-71f3cb3e3c88,This is a very good app especially for students,5
b38ad1fc-6aa4-4566-952c-e69100aa94ce,Fantastic app,5
155829fa-a731-4e5a-8b35-de99cf00d9c5,This app is game changer for students :fire:,5
fce553e9-5574-48c3-b875-5a9af28d36ea,Simply does what it should.,5
744c813d-09c5-447d-b5e5-961390218764,I just love this app:heart_suit:,5
39c1c7dd-0d2f-4369-9ada-36a766cdf133,This app really works in keeping you focused. I get way more done using this app,5
ea4a512d-9686-463c-8aba-562beac2b80c,Bought the premium right after installing the app and using it. Simple interface and I am so in love with the statistics!,5
01148a1f-e6b2-4d12-b2c2-9635425dcd87,"After going through multiple apps, I have decided to settle on this one, it's very useful and organized and easy to use, no distractions, and most of the features are free and the premium option doesn't dominate this app like the other ones. Highly recommend.",5
11f5b74b-131c-4312-9cde-84d0a9fbb00a,Best app to be productive!,5
08bf7663-eeda-4019-9511-be3c504b8ea2,I've tried like a million timer or pomodoro apps and this is the best one I've found. Finally found one. Easy to use and navigate. You don't have to waste your time in planting or watering trees.,5
2fbab5e6-867e-4996-93f6-25001d0064ad,Very helpful in focus,5
7a4241ac-6a8d-4a22-8270-4c9f9e8285a1,Best App in this category,5
573d3c1a-ec14-4696-99c9-c3bc1ee13480,very useful app. thanks. Was searching for this kind of app for a long time.,5
3ddac953-b0fd-4360-a978-b9c43a02141e,"Simple,efficient,worthy. Task stats and focus stats in updates just added more glory to outstanding timer and productivity monitoring",5
255e7fb0-2464-4675-bfc3-040c64544f62,The best i will say . Like the one i was looking for. Love it . You can even count how many times you have gotten distracted in the time being (best for a daydreamer like me ):red_heart:,5
4c24e753-6bb4-4576-8e0f-2a88c13c1f16,"Please fix bugs, I have uninstalled and reinstalled 3 times but it does not want to open due to app bugs. I really love using this app, especially the premium version as it helps me focus immensely",5
190c1333-5885-4823-bc37-ae1154343d27,I highly recommend it for people with focus problems cuz i had that too and it has helped me a lot with it's great settings and simple layout,5
1514337e-0d8e-4dff-b3b9-2e97ab4432c4,Excellent app.,5
abe9a8d4-3c5e-4d30-ac8c-5626320877a6,Very helpfull for students,5
619977c0-1de6-42c3-83bc-0767d6a22d83,Best and favorite,5
c7d1ad22-8e4e-4a52-9d0a-23dd52e4cb1f,Awesome and full of features.,5
9efa4fc7-f0b0-43bd-b430-46814ca20564,Really helps u focus,5
181858a5-dc5f-4a1a-b4cd-eb3f73749c48,It is great and the best app for students,5
5a5e16b5-3f36-4857-8afe-26739cc7bd1a,Excellent app for study focus and tracking!,5
f9a6f872-66a6-4faa-9222-eca493c47918,Awesome,5
b8a4049a-fcae-41f2-9d11-76217a3ced99,"Great Experience. It's helping a lot. As Engross is keeping things simple, ease of use is another highlight. Enjoying it",5
18123c86-d229-48a2-a77a-36568ffcc739,The best decision to get engross premium. 2 years in and still satisfied.,5
6da990e4-eec4-4b3f-b3a2-9ccfc025fe7a,"Please include a feature to instantly get which week, day, month has maximum hours!!",5
cb290726-a217-4825-88db-e0aa28016a36,"This app is just awesome. I like each function of this app, especially showing the present time and the time of after taking session. If I get the function of analytics and growth showing. It would great for me.",5
8c983efd-64ac-4d4d-913b-989453c3131a,Very good app,5
d7f227a2-549f-49ac-b9bf-357baf978762,Ahh...this is such an amazing app. Just wish there was an alarm or something to notify the end of a session instead of just the vibration.. Ok. Now I found it...so 5 star:star:,5
98f413fa-f210-4ac0-838d-2f062f747292,"Great app for people like me who struggle with time blindness and ADHD. With the distraction count feature, it helps me stay focused and keep track of my attention. I used it free for a day and a half and immediately subscribed, because it's truly worth it. I have used lots and lots of pomodoro apps but never found one like Engross, where I can assign myself tasks AND actually work on them, all in one single app. I now complete all my tasks and still have time to spare. Absolutely amazing :sparkling_heart:",5
732c24e8-3c68-491a-9c45-800f61e640a9,"Amazing app, Tasks, timer, maintenance of log of each time spent is Highlight of app!!!",5
a5d8cd87-c614-4b5a-bd93-32b6c5fead72,Really cool :smiling_face_with_sunglasses: app,5
983d609d-e729-404c-8634-ef4dd66e23e4,Perfect. Also I purchased premium ver in the first place.,5
7144d4d2-b5de-428a-9611-013eb8498d5a,Easy to use,5
f943564d-50e4-4321-b883-0f34e62d9b8b,Simple.Good.Great features.,5
34852f40-7e77-4eec-96ba-5e447bd39191,very nice experience,5
216b4788-f93e-4cea-a5e2-d85bfc799901,Very good and efficient application,5
d293b2b5-ef4e-4cd4-a9c4-2c260f33d615,"This app is amazing. I've tried a lot of different focus apps, trying to find what's right for me and this won. There are so many features that this app has & most of it is free except for some color themes & a couple more advanced options. There's a to-do list that is really helpful & you can even put your tasks in order of priority. There aren't any ads & it's a simple yet effective design. You can set the timer to pomodoro or stopwatch which was really helpful for me. I highly recommend!",5
210dfe88-efe1-4524-a4ed-67c8742b088c,Awesome app!,5
220e81ab-aee1-423d-a3c6-07354a07905c,Fantastic App!,5
cc171a5e-6100-472c-8ee6-a65b9365be1b,Very nice app. Its helps me beat distraction and focus on my work.,5
24d3ef9e-cab2-415b-9677-45f2c71d166f,easy to use,5
505dc143-07cc-4d3c-afbc-3908d56b6d81,"Literally the best all in one focus timer, to do list and goal setting up. Unpaid version has so many features and the paid version totally worth it for the amount of features it offers its very affordable too Edit: it's MADE IN INDIA guysss...makes my Indian heart warm",5
0a77ff55-3b8b-4e92-b49d-989ff7d0510c,Loved it Owned it,5
0626f137-b8d9-43b3-acd5-49dce7bf1e85,It's a very useful app it has timer for sessions and stopwatch also i love it,5
99afd2c6-157d-44a6-b5af-bbd8aa6589a9,i love this app and use it a lot when i need to focus for some time. it really helps and for being free it has the needed functions and works very well!,5
b9a8628f-a379-4b70-ab7e-6a989bcabbc4,"This app is actually really helpful, if you are searching for a good pomodoro timer, ofc this one is a good one",5
325dec80-ce00-46ec-8ca2-886f33c4b096,:smiling_face_with_sunglasses::smiling_face_with_sunglasses::clapping_hands::clapping_hands::clapping_hands::clapping_hands:I just love it amazing work team yall are very talented keep up the work,5
471aa9bf-b40a-4181-9b82-7603d7cbd589,well designed,5
976ce0fe-1a75-4aad-b45e-21380471b9aa,"Love the pomo timer. It would be perfect if the widgets included one for the timer, but otherwise yeah it's still 6/5 stars for me. I've tried SO many pomo timer apps and this one is way better than all the others I tried in terms of being flexible and easy to use. Edit: ooh still hoping for the timer widget, I love widgets because they help my productivity so much!",5
63c9b997-b240-4638-b299-7596f40e4eb1,Hindustan,5
96722203-e2df-4421-9117-49c94d613963,Fully functional app,5
88e1fd56-a6f3-4e1f-ad6e-9a8ff0c1ffc4,Great app,5
bbb85275-6b9d-4682-b815-768a133f1524,Probably the best application!,5
42f9757f-c339-4a4a-89bb-98caf9bad163,"This app is surely one of the best study app you will ever find. What i personally love about this app is its so simple, but got everything to increase your productivity.",5
68f4434e-a4f8-4240-8940-d670c2ee485c,Cool! The fact that it made me study like my mom is standing with a stick beside me:face_with_tears_of_joy::grinning_face_with_sweat: zero distractions:smiling_face_with_sunglasses:,5
1bc40ff2-4308-4948-82f0-83565a209e48,Just great...,5
0121e0e2-5ca5-4c33-a409-1bc662f98d66,"This app was exactly what I was looking for. I needed a few functionality like flexibility in pormodoro timings, day/weekly statistics etc, a few tags or groups to categorize my pmodoro sessions plus it is free which works well for students like me. Great work.",5
71fd6a5b-82f5-4b63-bb9b-b87ef5117cb0,Simple and without ads,5
e9a3d6b6-a62e-4d19-ac69-7da319b7d552,I think this app will change my carrer,5
2624dbc6-4987-43df-a722-4fa8e5faad1a,The app is superuseful saves time must use :slightly_smiling_face::thumbs_up:,5
1c29b39a-e904-41cb-807b-6f2613818df7,Great study app. Notifies you when your timer is about to end. And helps with avoiding any distractions.,5
6d8da443-27c2-4fed-8db8-2cc0eec2dcae,Amazing app for students,5
bdcf4680-29dc-4160-b13f-3a93e6e92fc4,Gd ui,5
b509ec9d-3e98-44db-9605-0690fe4a4089,It's awesome by this app I can easily track my day,5
54d47063-32f6-47b3-baf7-81cc5a2edfb4,"Engross developers, you are genius. Best focus application ever",5
c51d08bd-6493-45dd-8e02-d1745cde83e9,"App is really great! I have one small issue, instead of distraction button I only want timer there. Please give us that option, thanks!",5
afedbe60-c8be-4066-8068-bfd03fe053a1,Simple and effective,5
9734badd-737e-4ec8-a35b-e9f6cf0956fd,loved it man it's help me alot .i feel this is the best:heart_suit:,5
0f0bc38d-7ee4-4786-97e0-09f5e8ccc211,"Bsst timer app i have ever used It has customisable timer for work and break, show stats etc,.",5
0b1ab23c-b5d0-4ae6-993d-5a8d8e6b619d,"Best pomodoro App,i kept searching for a good pomodoro app until i found this one,you can change the working time/break time/long break time/and the number of session before a long break end/these may be simpl things but a small number of apps actually have them. This app also help you improve your focus by recording when you get ditracted. Here are some more cool things: -you can change the theme. -you can write a to do list -disable apps that make you unfocused(premium) -whitenoises.",5
9d76994d-25eb-406c-a0d7-c7cb29fb5bf1,"Just what I was looking for, well done you guys have made a great app :thumbs_up_light_skin_tone:, it's add free too :)",5
ec04264a-fea5-4fd2-8c3e-0e2dddb07b45,Super effective..!!!!,5
db66e8f8-1648-4cf1-915f-905ea9720af8,It fully gave my requirements.,5
e857b7ac-2e53-4362-bdf0-4c709fd25e74,Wow,5
8d12df9c-b511-42ab-aa73-554fea89e050,"I have been using this app for over 3 years and it has done what I need it to do and it is simple to use. I mostly use it for time tracking, so I can not speak to the tasks/calendar functions. I bought the one time upgrade and have no regrets about making that purchase. Simple, easy to set up and use.",5
c871b44b-e8e8-4133-ae3f-1d4d974fa3cb,Very helpful,5
c5281105-1fa8-4001-8376-171f4691307e,Easy to use . Really increases the productivity,5
9c1381fd-a3ab-442e-85da-034fcc178d9a,I really love using engross!!,5
feeb4da9-bd7a-48cd-825c-1a401f2be37a,Great app.Works perfectly so I would recommend it.,5
7b4eca58-3b78-4d03-90ca-e1d2758bc8e6,"Super app , I especially liked the distraction button, it helps to come back and focus again on my work!!!",5
a55be20c-eb8f-4ed0-8568-e18d10d4c0be,It really increased my concentration and i can focus for lingers hours..really helps in managing my time throughout the day..Good app:clapping_hands:,5
eb031548-d086-40a6-91ba-06de94f36a13,Really the best productivity app out there Clean ui and loads of customizations,5
7bc73d01-295d-49e7-8fbd-b2d484d2069f,The best:red_heart:,5
efc04573-b1cb-497e-8fe2-80110a10572d,This is the best.. I can focus 10 times more with this app:loudly_crying_face::sparkling_heart:,5
6d5606c0-a34a-4168-9aac-8c0ec07fea9d,Love the app. Had problem with app crashing whenever I set reminders but the creator helped fix it. It's just what I needed.,5
8ab5a2b8-901e-4996-8f57-13479842751d,Lifesaver.,5
3689a170-23d4-4222-9720-20eba46fed99,Best app for focused study,5
a435a154-97c8-4ab8-a07b-c763a56a8932,really amazing app. I am now able to concentrate more in study than before. Thankyou very much:two_hearts::smiling_face_with_smiling_eyes:.,5
6c0c3f9a-0f66-4454-9781-4b5fb33cd9fd,Very good! I ĺike it its really helpful Thank you :smiling_face_with_smiling_eyes:,5
64897e0c-c826-41e8-891b-138b661e1dd5,"Can't fault it, helps me a lot.",5
8063b15a-3617-4918-be91-a3a51970daa7,"Hi, there! I have used many timer or stopwatch apps but I find Engross to be one of the top 3 apps on my list. It has helped me beautifully! Positive Things: 1. Has Timer Option 2. Has Stopwatch Option 3. Has a Calendar Bar 4. Has a Task Bar 5. Manages Distractions 6. Tracks Progress Things to Work on: 1. Please do make more features and white noise available in the free version. That is all, thank you for your patience with my review. Hope it helps!",5
023b1123-4520-4197-9cf8-88ca69964b69,"It's a great tracking app, and the support has can solid!",5
b7e76cd7-30d0-4167-98c2-edf50341e70d,Excellent,5
b719f47d-eb75-4858-a386-61506a0d1b8b,I found it very helpful as this app me show my productive time and reminds about my work and this is a very great app that I have seen :thumbs_up:,5
ee94b144-aef9-4d75-988d-18e8ab76d4fa,The app really does help. My productivity is going higher every time I use it.,5
76a22f45-28e5-4807-981c-1ca71a307120,Its great,5
a79d03b9-f2dd-4fb2-9405-29b09e256cf4,"Me gusta mucho lo fácil que es de manejar toda la app. La función de registrar las veces que te vas desconcentrando me ayuda a ser verdaderamente conciente de cuando pierdo el foco. Las otras funciones no las uso, pero me parece una app muy completa ;)",5
c19a54ac-94ef-4306-9eb7-1d82fda1ac39,Just perfect.,5
58595a58-e4c6-49d3-9233-cb47096595bd,Perfect app for productivity.,5
47cb020d-2794-44e0-a82f-92146d248e8f,Wow awesome :maple_leaf::maple_leaf:,5
e0309f55-d8b8-44cb-82b3-a733c7de2851,Great app,5
4dbebf87-e6dc-4711-a520-a12746ed214a,:thumbs_up:,5
84c000f5-3bf6-46f3-a424-1412af1ac2d1,great!,5
1e47d4c9-090f-48a0-8144-acf7e8c60fed,Great choice for studying and keeping a record of previous studies,5
ff66862c-ddee-4658-99b3-eb2af133d7e8,ये app बहुत अच्छा है इस से पढाई मे foucs बता है,5
1d2cc09f-6a34-4c51-9374-d9b1c6c50c7c,Best app for students to increase productivity thanks :folded_hands: u should give more features free for underprivileged students :pleading_face::folded_hands:,5
fea145cb-6640-44a1-bee9-425b399c7db3,Best app for tracking productivity and focus,5
2e1c6568-b8a4-4386-acfe-891106cd0949,Best pomodoro app out there. Love the app blocking and white noise features. Wish I could run this in a browser. That would be amazing.,5
