reviewId,content,sentimentScore
21e8bc40-bb7e-4091-9217-b43b33acf248,Helps to be focused and avoid distractions. Easy and intuitive to operate.,5
951b6505-9bce-4f35-83a8-d6d37cde3fcc,Really helpful,5
0ccfaff2-1955-4ef5-97e5-964f26eb9ef6,amazing app . useful for students and all people with high dreams. this helps one to be highly focused,5
fee87bb0-b7aa-4897-a433-21394bc692cf,it is very useful,5
44d3f6fe-967c-402a-8381-d97561a5a4a8,a great app,5
d778bf74-51b0-421c-8872-1587a502ead6,"I was so engrossed in my work, that I forgot to reset the timer!!!:face_with_tears_of_joy::victory_hand:",5
1aa93b1a-c2f9-4d33-944c-96de6fd93723,This app really helps... it will fill you with guilt if you are not abiding by,5
36e78741-eec3-4037-924f-388805f85fdc,excellent!,5
0ae6643d-e408-47c7-92ae-0e008a33a36b,great app,5
f28a00e6-7958-4442-9071-b2e3ff60e1a7,great app..,5
0d8b9bd3-69f2-40fa-bfe8-0b5a85b56ea3,Great for focus and productivity.,5
3c7cd00d-eb2b-496c-9053-9ab0181bcba8,I love how it forces me to work,5
df12b13c-26b9-4fa0-a5f6-ae0b079c4b1c,great,5
d23ca070-3d67-4791-a4f5-e0e7f19b2aaf,easy to understand,5
a1cd2d7a-30b0-4530-9938-6a405e381d36,great app,5
bb2fe75b-c334-4b0b-9bab-041395327ba2,"One of the best apps I've had, *definitely* worth the premium version :)",5
3b75dbce-c780-423d-a6e0-9fb2ce6991de,Wonderful app to cultivate focus on study activities. Premium version worth your money.,5
6b7c9fc4-b494-4062-9408-e640fbece004,Great app. Helps to keep me motivated while studying. :),5
f723089a-742f-43e2-af1f-1772b66b5f03,Great app to use for studying:smiling_face_with_heart-eyes:,5
5626424d-ae8f-4de1-b91f-3c2114455c76,awsome!!,5
3a07ecc3-d134-44d1-adc5-27fda77d1106,i love it..umma.,5
244ae74c-df1d-4dcf-994e-97c7ce557ef0,Well worth the premium.,5
2ec36d79-5339-498d-902d-5808a438eaa3,i like it..this app very useful..good job!,5
3d915206-ad15-4c8f-a4f2-0ddcfc4ad78e,Very useful app...never found an app like this one before.,5
2a6d30dd-5dc2-439a-bdbc-abc867235602,best app:smiling_face_with_heart-eyes:,5
c5dccd89-0955-4406-88ae-4cabe8cbbabe,very nice app...,5
64f77616-faf4-4b7b-be1e-2addf68f1ffd,i really do love this app very much it made me study like a machine:grinning_face::grinning_face:its very useful for the students who are easily get distracted during studies.so i'll recommend this app to be installed for those who want their work to be done efficiently and finish at right time :thumbs_up: :thumbs_up: :thumbs_up:,5
c4eb4e40-63b9-4c41-b613-f43c1968e36c,Excellent app for students. Helps us in being productive.,5
3a446943-215c-4c01-bd11-cf6432b76595,Nice one,5
19f65877-994f-4e5e-ac7f-6dc35459bf8d,finally! this app does exactly what i want (an alarm every hour to nudge me to take a break and make sure I'm focusing on my priority work instead of being side tracked. i have tried a million apps and they either aren't quite right or have too many ads or can't be customised enough. this one is perfect!,5
2861514c-f484-458d-9e55-07152748affa,"keep me organized, quite useful I love it",5
40639fdd-f443-46c1-8548-6fa809a6febd,great,5
5f793149-4b04-462c-9d6a-3324feb11ea4,Wow Amazed,5
2fb42910-5d81-4f06-a820-a0330bc9331b,great stuff,5
2d0803f9-25ee-40d9-96b2-02b7ab3a9761,Helps me stay focused and motivates me to complete my work on time!! :beaming_face_with_smiling_eyes::beaming_face_with_smiling_eyes:,5
f4650270-77f8-41b8-b0eb-ed88ee454705,love this app:smiling_face_with_heart-eyes:,5
47463d65-2547-49ed-a9d5-4e887ef1074b,ITS GREAT APP,5
3265b0e7-8715-4685-bcf7-1d56975d115c,Awesome,5
79ef9714-0a9f-44ae-a06e-338a9c0c0f1d,It's has been of immense help in my exam prep,5
430ca312-6c60-47d6-bc87-73252adfe4ed,damm gud,5
fce9402b-188e-4f5d-bfa8-815f4a29260e,Great app! It helps me to improve my productivity. Just purchased the pro version. :winking_face:,5
abcbb18e-7d60-497f-92e2-1f18303c021a,Really liked it.,5
b5acf300-ea8b-4ca5-aa51-45c456218d5d,Perfect for students. The 'hit if distracted' method gives more awareness of the mind and helps in keeping distractions in check,5
de511c7d-ce40-44af-b8a0-9ed84a611d16,makes me productive,5
b834a542-85b0-48ca-a58c-58a65ef49f0c,"it help me to get more things done,thanks:hot_pepper::hot_pepper:",5
226882ac-247c-4a8c-9b6e-b2a72db0d91d,love this,5
aebacf55-298c-4f1a-b9dc-30d8c4d4821a,awesome,5
7d9208bf-32ad-4ed7-bcef-95a6f90f2d3b,Great app. It's exactly what I wanted,5
0fa7d8ef-3f27-47a3-acb8-4e60af94163e,best app to beat distractions,5
90f9cd3f-6ba5-40ce-a510-0faf0a5ba439,its one of the best productive app ever. been using it from 4 months.,5
98f15a07-fc9b-4b34-a791-e791d703c056,helps me so much. I have a habit of doing things in sessions with complete focus. It helps me creating sessions and thus helps me in meeting my targets. keep it up.,5
2ef126ec-499f-44e9-92f8-8cb36435698c,loving the experience,5
daabff93-fe85-40bb-b75c-ccf1ca4a0777,really helped me concentrate,5
2e245670-c378-4fbc-8b40-241fa02a26ea,love it!,5
1e41dfb7-84a0-49b9-980a-726aaa097a6a,excellent,5
1adf5ada-ed75-4df1-966e-fc46b9e4f809,it is superb,5
b868ac23-5ab2-4a91-beb4-c310e53ec1e2,Best pomodoro app. Bought the pro version. Would recommend the developer to provide the following features: →Screen Overlay: To prevent user from using the phone for a specified amount of time. →Shortcut for Apps: An option to access some apps from the timer screen →Notification Sounds: Option to change the notification sound for notifications from this app. →Widget: To-do widget. *Please work on the suggestions and I'll change my review to 5 stars. Thank You! EDIT: Thanks for the reply!,5
87b5b33e-03cb-46f6-bca0-afbb8e29a6a3,"Great app with low battery usage on my OLED phone. Love being able to run multiple sessions at once since it lets me do 4 work sessions with breaks at once! Great for when I need to commit to a certain amount of work. Tapping when I'm distracted helps me be more conscious of it. I already knew my most productive times of day, but a tracker for how often I lose focus is great anyway.",5
3899e5af-eace-4a80-b738-2d05a069221b,Great simple Pomodoro app with nice statistics. Will there be a Windows / Web version in the future? Thank you for the great job,5
b5a68b6b-53ca-4637-90e3-256f6e65ae6f,Exatamente o app que eu procurava.,5
3cf8785e-e49d-480b-b6e6-0e72a83e489d,I love it,5
5daa8e8e-8822-47f8-81e6-4fbde6d599fc,makes me more productive and helps get work done efficiently without slacking off,5
11516893-f82f-499a-be4d-05af0c7db5ac,Really helps you keep yourself organized and planned.,5
faca103a-f6c2-43f2-b334-3de4c0d75f57,A very useful app. I use it everyday. 5 stars!,5
4e240c24-27ef-47c9-bddf-30fe272b484d,"Useful, Easy, Intuitive app that helps you focus and figure out how you work best. Was dealing with a severe bout of writers block when I decided to give this a try. I've accomplished more work in the last three days than I have in the last week. Absolutely worth the cost for premium.",5
fb85e51a-97dd-4687-9660-c5406054951b,very useful,5
4008c42e-f29d-4689-8678-4ab73952aabb,Cool App,5
280cc999-3f95-4ef9-8bbc-ab6a390c1f14,great app,5
94ffd9ff-0397-428c-8608-c55010ec5574,"The best thing you could do to get your life in order. I suffered with addiction to my phone, using it for around 10-12 hours a day. Using this and YourHour together, I'm slowly coming out of it. :red_heart::red_heart:",5
009566d3-bed4-4d9a-883b-13a6ba330976,best,5
777f0540-65f6-4123-87d8-da1491da4716,A productive app,5
02fdf1b2-5d09-466c-90c7-129827b46879,Better than 90% of the productivity apps out there.,5
7c264c14-191b-4209-8611-3ea8d4393b1c,it's working and it's a great app to study and for management of time :smiling_face_with_smiling_eyes:,5
aabd9e53-c6ca-4595-afca-9982e45e7121,This application has been very useful for me.,5
427fd5b4-3b0a-4ebb-b69d-77c2b6822f36,it is very useful i love it,5
0559ba0b-000d-4fb0-8c5b-8c074b4058dd,I love this app it helps me focus and get more work done. I would really recommend it to anyone who gets distracted easily.,5
bdbc6452-9b01-4122-8859-369551424ccb,Loved it best app,5
66f8f631-0a20-4261-b5a4-753748324ce4,I love this app.. It is just awesome :glowing_star:. Every time when i tried to use my phone during my study.... It has remind me to be focussed.... Due to it now i can study continuously.... Thanku to this appp......:red_heart: :red_heart:,5
8f0a13d0-a876-49e7-aec3-e1a233166748,"An amazing app, I'd like it more if the tasks could have sub-tasks and if I could add some comments/images to the tasks and sub-tasks. I totally recommend this app",5
c4154069-5b71-49ef-883c-7385f7261d7d,best app it helps me to focus,5
ae4f05ab-d7e3-4054-8247-58c94dc10047,thanks very nice app,5
db92f78a-c3d0-4dc1-a55c-2d261a7e2787,impressive,5
2dee446b-bee4-48d2-91d7-eea69c9c5524,LOVE IT!!!!,5
d0708926-a305-4f83-8765-e37c819f9ee0,very helpful :face_blowing_a_kiss:,5
93b4ef7b-e9f2-42b9-8fdb-48b8f41338d2,thank u so much for this app:loudly_crying_face:,5
60045f9a-709a-40b4-bb27-e880c7a9ce99,wonderful... all in one pls add the phone addiction feature also which counts the time u r using ur phone,5
95e53d56-611f-4a2e-a70f-1e9a333612ea,"Awesome , thanks for this :red_heart:",5
e398a1e6-5e7a-487d-ab6f-e856a4dd2033,Very useful time tracker.,5
bd8fde34-2248-48b6-b79f-31c5c13396e0,"great app to break distraction, helps to get focused",5
cad8e888-2358-40c6-85ec-2702eae78e76,its the best pomodoro app...totally love it ....helps me concentrate even when im not in a mood to study,5
688f2040-e5b4-46b7-9693-d3c0a2048cd2,great :thumbs_up:,5
91c99634-be4e-41e3-8719-bb2045bb937a,It is so useful it help me so much,5
9cc4b210-3551-44f0-9bae-601521f1184b,"it's very helpful app, to do list, pomodro clock, reminder.. all ain one app. thank you developers.",5
9640dbbf-ba0a-41a3-8d8e-c7adc7258005,Awesome app :smiling_face_with_smiling_eyes::smiling_face_with_smiling_eyes::smiling_face:,5
3346ed96-79d6-401d-8fb4-9af553034d89,simple and straight forward,5
c3d380bb-ebff-4e2d-8bae-758fda2c9d41,"I have tested almost all Pomodoro timers, this one is the best by far, doesn't have time waster elements (like growing trees), there are a few things I would be excited to see added: 1) Landscape mode. 2) Able to manage it on notification. 2b) Or a cool floating/bubble (worth transparency would be perfect). 3) Tags should be organized alphabetically by default. 4) Colored tags, so we can easily spot our time flow through statistics. This is a special app, give them a coffee!",5
2391ab25-6f36-4ef7-a6d4-155be27cc3f5,use full app,5
364ef6cf-85a9-4b59-9087-cea31488adbd,"super,super funcional, lastima que tenga funciones de pago porque la verdad mecere mucho la pena!",5
3e825ccd-17e4-418b-ac57-0249f7fea69d,such an good app for my job.,5
ec37f7ad-cdb1-4d3a-9e14-c1521c886252,"Excellent app to focus on work with unique yet useful feature of hit when distracted! Liked so much that moved immediately to paid version! Value every penny. allow to use almost all features a planer, t9 list, reminder, halt add 5 mins oltions etc.. which I need.. a great app.",5
bd358a14-7744-40de-b3c2-640eccacec5e,Perfect!!!,5
8ab499e4-3d7a-42b6-a6ab-e5249f3da5ea,very cool application that helps you no to distracted . A very good part of it is that it is always help you to motivate nd improve you self concentration to do something.,5
da291f4f-e047-4ee4-935b-a65464c46f5c,Best pomodoro app I used so far :two_hearts:,5
5a80ab89-f844-4c82-be79-fca16d2ea4a6,Nice app !,5
48c30ecf-f21f-4ab1-893d-e430ddd80fc2,amazing,5
82b21a99-b631-488c-a226-43fe39ae5724,incredibly useful if you follow the schedule properly.,5
af219916-2cd3-4329-9254-6f7db2457618,"It's an amazing app to track your work progress, I wish we could use few more labels and statistics in free mode",5
d530c446-97e3-4730-aad4-b0a04439ab2d,love it. It does what it says. All distractions beaten :oncoming_fist::collision:,5
da6dad41-f823-40f9-b853-28a0679fba7b,thank you makes this gives me very much satisfaction while studying,5
72a26904-82d4-4a02-8476-abb29bd8a2e7,love the app help in my study,5
5f6885ee-0cd2-4070-8c44-70f798d6b89a,its greatest app ever i found.. you can make daily routine and all weekend plan as your wish .. so make a day planner and start working for your goal..:smiling_face_with_sunglasses:,5
53fb7bf6-358d-4e03-b518-fea3c15ada22,great,5
7e777223-35dd-4c24-b5e6-2fa53ab183f1,Great app! Please make an option to have a notification via flash (flashlight). This would be helpful when working/studying in areas where you don't want to disturb others (e.g. a library).,5
2474f614-318b-40a5-a029-ed3d1f112240,Hands down the best. I've tried so many different apps but this one is my ideal app.:blue_heart::green_heart:,5
cd01d7c4-701d-48d4-8fb8-7883a171b5aa,only app that i have purshased ever,5
ae87b502-c6ff-442e-bf3e-e813934d775e,i am successful man also yes,5
828be8dc-1566-41cd-a0d0-e2bf66031c66,havent been revsing this hard before this app. thank youuuuuu,5
1b59938f-3b66-49b3-8986-db6eb0def533,very useful,5
903cd631-0cde-460a-9a4c-48e5c024a2c2,perfect,5
6c3122a3-e2b0-4f0b-bfa4-9d4ee747d8cc,Love this app!! thank god i saw an ad advertising this app. my exams were near and thus really helped me. thank you so much for the app!!!,5
07fcbc31-e132-4be5-8502-21903294bede,Its the best productivity app with so many features :D,5
4eaf9e70-b743-48cc-9580-458d1bea1a9f,"The improvement I want to make this a 5 star is more encouraging text or break suggestions. This is great because the division of work and breaks helps manage my stress and prevent getting sucked into distractions. Five minute breaks are too short to really get invested in most distractions. Also, I can see when I got distracted the most; if I remember what thoughts or circumstances distracted me, I can learn to overcome them next time. I'm slowly learning how to plan my day accordingly.",5
1ab13d47-52db-449d-be6c-5a66b90fe6ce,"Simple, subtle, gets out of the way & most importantly quite useful in my quests of life",5
a4e9a9a3-cf53-4cff-b49d-d28a506e1858,Outstanding response and follow-up by the developer to several questions & a suggestion. The program does exactly what I need.,5
c41c4895-95a3-42b2-806c-3aeaf0afb37a,Very useful for studying (:,5
3d079031-a5ac-4ea3-af5e-13401d11dde8,Simple but great experience,5
fe053dd7-a075-4200-9c71-f1cba33862c5,best productive app,5
32538ec4-b365-4c9c-8f6a-1b13b520dd07,amazing app,5
fd43a9d1-16ec-46df-b526-bff592c931d6,"the best foucs app ,that I found its worth",5
5b7ed9b7-aeb3-4956-9b1c-4493f55ee401,wow it gives us motivation to study !!........,5
bc527535-3fd7-4414-8c1c-651a10f8261f,its just great .what u can add is music with study . because some people do prefer that .n it has really helped me stay focused.great one,5
41e2ba01-bf26-4437-ba60-9fc2f05231a9,I'll give 5 rating....before the app I was not able to concentrate on my studies but when I install these app I'm studing for hours an hours. It helps me a lot and I'm very statisfied from these app. It improves my concentration level and helps me to not getting distracted.....Thankyou so much team for giving us such helpful app.....,5
717e9fd6-b506-493c-886c-726f954ecadb,Very Good App,5
610101ff-7fc2-4095-8183-3d10dc27a313,awesome,5
04b0a067-5bf8-4fd4-b852-9328e4bf3369,helpful,5
63ffcebc-f0f7-425d-a552-3cff066e4b6b,Great app to stay in focus,5
6f3dd0b8-e827-4486-a68a-9f1063604caf,Very good app if you want to focus on your career then you should definitely install this app.,5
1937b097-cfb9-478e-81c5-da8e948f33f1,Great app for studying for exams using pomodoro technique,5
42b7c646-e5a8-4868-ba18-42a1c4b12d88,its very useful,5
804fad35-1c76-4625-936d-0bdabf3cf3c7,perfect plan,5
60a100e7-aa0c-4bac-a060-261da404f2c0,I am a grad student that suffers from ADHD-I (Inattentive type) and this app has really helped me get reading and studying done and track how many times I get distracted. Bought the pro version. Love it. 10/10 would buy again.,5
13ddf7cc-c27f-443c-b085-12119a57bb78,nice and awesome,5
b768a692-25d4-4ad5-a89c-06f84a079b2d,"Great app!Very useful. I am a premium user ,I find that adding landscape rotation for app would be very useful for users who use their devices on table on a stand etc. Please add it developers.",5
2b06a535-bbc9-4bb7-9237-062d3132ab5b,"This app is awesome, has lots of features, but it would be PERFECT if you could turn ""Do Not Disturb"" o automatically when starting a timer! I'm willing to pay for it, but please, consider it!",5
957aaac8-6191-4e2a-8b07-6463029fc333,VERY NICE!!,5
97b75fd1-11d3-4241-9acd-048f0ac05e4e,best app,5
e5bdd03a-e285-4f96-a551-6835f5692b63,"Amazing:smiling_face_with_open_hands::smiling_face_with_open_hands::smiling_face_with_open_hands: ... I want to connect with developer,please contact me soon...",5
f976ee0c-5b31-44c4-b766-30cf8aa9916c,A no-fuss pomodoro timer that keeps track of your sessions and saves some historical data for monitoring. Was exactly what I was looking for. Purchased premium and it has really helped me manage my time and avoid distractions.,5
ca3d4cfa-f7e6-4cc3-aedd-6bf882a8cae0,very useful app,5
9eefb918-a381-4206-94de-4b4ddcd0dc67,best focusing app ever,5
6ec8868d-9adb-4b7a-91f3-b5630fe081de,very nice,5
d659d2df-f74b-4837-b337-0d3763e10c7e,it's really Amazing App....love it :smiling_face_with_halo::smiling_face_with_halo::OK_hand_light_skin_tone::glowing_star:,5
144a8ddc-af40-4732-9730-28a5b3e71f87,the best app for study and the devloper also help to fix all issues MUST TRY THIS APP,5
09648591-04d6-43de-8438-a9e5ad798fe0,its very useful,5
e8b38382-0485-4363-a38a-c2a8f45cf610,This app is a really useful one that helps in time management...superb,5
2e90a40b-a232-41d6-82e3-13bbee6766b4,Great app for helping concentrate on work,5
9717564b-af03-4954-a88c-0cafa56f96ea,very useful for staying focused,5
396e98eb-026e-42cb-8b5a-addd67644bf4,very productive and useful,5
853453f7-4970-45d0-bd29-342e6d5007ce,Love Engross :red_heart:,5
d93249f1-9356-4a5c-ac67-410944cd14ad,I love it! It helps me keep focused on the task at hand. Are you perhaps working on widgets? I'd like to see the Todo list on my homescreen for quick glances.,5
5160e08d-91ce-4c02-b793-34d7bd2023b4,Great app kindly add rotate feature it will be great,5
d5e873d3-6140-450d-b144-de60b81bf433,"What a focus to perfection ! I have always been helplessly addicted to my smartphone, but with Engross, things are changing. It is quite considerate of my time, and being a student, I would love to use this app as much as possible! Thank you Engross! :red_heart::bottle_with_popping_cork:",5
c762caef-489d-4e64-b0bc-fbaedcf96c0c,it's an amazing app...... it helps a lot in avoiding procrastination.,5
53f74254-e80e-4231-bafb-e4e73b4f8565,great and appropriate,5
3d59ec07-0491-4954-9568-fa5da0ef2c24,the best app for every medical students,5
112d96f2-4685-4cbb-9e3b-906f3583c3e9,"Love this app. Somehow the small trick of acknowledging that I am distracted really helps me to keep working through a pomodoro. And actually, not having the pause button (in free version) helps me to stick until the end.",5
06e0e87a-f9b6-4a8e-893e-0e30649bfa6a,real good for productivity it has so many uses,5
2e513c53-0eda-49e2-81c6-cbf7aaaf81f2,It's agood app for students I try this app its fantastic,5
f0ed542a-6b29-4fe2-bb43-5e3b87332209,This app is amazing..... just download it and see the magic....,5
e3633f3b-4703-4af8-970a-c555a4a93da3,put a backup option,5
e54cf9c3-bd81-4568-bb3c-2afec1fa31f4,"Excellent tool! Has made a huge, positive impact on my ability to remain focused, on task and much more productive. I have tried many productivity-improving apps. For its effectiveness and simplicity, ""Engross"" works the best.",5
80dafae2-059c-43db-b21f-68173418945a,nyc app help me stay focus,5
25ccf31d-e627-4dfc-ac05-120c43fbfa67,this is a great app. thanks!!,5
397856cd-04ac-4e3a-b283-6aedae9411b9,"Самая крутая штука из всех, что пробовал! Сделайте для iOS! / Guys, I need iOS!",5
edc7fd0a-ae6f-4558-abc2-d90df1fc09c9,Has really increased my study time daily and helped me focus.,5
42c4eaaf-8517-4ae6-a418-ff25935b73f6,very nice,5
b2b63b25-25e7-48c3-af26-7d3c36956946,perfect app for a student! :grinning_face_with_smiling_eyes:,5
d12634af-0aa1-4ee8-99e2-aadc3528dec5,thank you! its a good/productive app,5
adb0fe5d-6188-4119-9159-a9a39e925d11,Great !,5
826227f5-3698-4834-b28c-99a709b92bdf,this saved my time as well as increased my working hours through motivating statements... this is one of my loving apps... I JUST LOVE IT :two_hearts::two_hearts:,5
33336888-1978-45ef-be5d-ae7cb3051d9f,"Loved it, literally. <3, Awesome workd Devs.",5
b05d7365-7683-479d-bca7-9397f8dd8d59,Best pomodoro timer app I've ever used. The perfect balance of flexibility and simplicity. Instantly became one of my most used apps for work and school.,5
35c63c4f-829f-4af9-b9da-e45eeda91be1,wonderful for studying and beating distractions,5
80a468c2-d0a1-4322-84c4-cdc770d25690,"I'd love to set my own default ""break"" length so i don't have to set it every time. great app!",5
61256c8c-49bf-468a-9511-8416e1f4725c,The best,5
214a46fa-87df-4ced-9731-d5a12162ef2c,Awesome app.Useful,5
c3a9a768-a5d3-4f3c-b96a-faa2e12c63c0,awesome experience!!,5
0b41e7e4-26f0-4896-a53a-e8a427720a34,"Excellent Pomodoro timer - clean, simple, fast, yet full of nearly every feature you could need in a timer! I especially love the ""Add Five Minutes"" feature. The only suggestion I would make is to include the ability to manually add in time worked, as sometimes I dont have my phone but would like to track all my minutes in one place.",5
fb17a37a-c534-4636-8f7b-cb48951ce0a8,Thnk u so much.Time saving app.Can do better Focus.It deserves 5*:smiling_face_with_heart-eyes::thumbs_up:,5
74f4ab30-a777-40f7-b5d3-acfdb47876ec,Great App! Do you have a PC Desktop version? I'd like to be able to sync it across all of my devices for greater effectiveness.,5
35734f15-dc34-4094-8c27-69b2777057f7,amazing app!!! best app to get in hold of life..,5
04e06f51-c731-4411-815c-009491a28352,"I've been using this for 2 years for my finals and it helps me time my sessions and breaks and it helps a lot if you get distracted. A good studying session is 25m, anything beyond that will result in you not focusing as much as that first 25m. Have a 5m break every session and you'll have an effective studying strategy.",5
4763a98a-64cb-4329-a2b5-9841b43363a3,"With the flexibility of the timing for each set of sessions and the clear indicator of when work time will be over, this app has consistently worked for me with a wide variety of projects.",5
793e57cd-6957-43c7-8b97-ddddd48f8bcb,"I have a hard time staying focused when I am studying. Currently, I am studying for some Cisco certifications and i was struggling as usual. I downloaded this app and my study sessions have improved dramatically with the 25 min study / 5 min break set up.",5
75aa34fc-04f0-4713-b7c6-1bde8969acf1,"Love this app, helps me manage my ADHD when working and studying, love the revision part when studying and it keeps more focused..",5
38c2dc3a-a9fe-484b-9095-07f4b0e39a3e,I use it everyday!,5
ce360020-a692-4b57-bc2d-ef20257cf887,Wow ooh it's a good apo,5
1f49bf4e-7d88-416f-9430-021fb5234892,Very helpful. Keeps me on track,5
37192a5c-274c-4fa4-b71f-57477f49b5ec,"Best productivity app so far! I was looking for something like this, really happy.",5
af930f89-80d3-40db-9e35-11efefd99161,It's a keeper. Has helped me a lot in studying.,5
595f1dbf-531c-48e1-bbfd-ec233dbaa8cf,This is the best app. And the premium is quite cheap.,5
e258bade-eb63-46e9-bab1-309da64626a9,I have not got that why there is a premium option for this.... If this would rather be not there then it is the best app i ever had....,5
df08d9e7-029e-4201-bb35-2d5fa244ff1e,really appreciate your work,5
3bf3f17b-cc51-46f9-a6ad-1ccd2ef5eefa,Perfect app :thumbs_up:,5
cafcc2ff-6619-4cf5-a57a-0b88ba1eea4b,Everything is just perfect. You could put just a short 'beep' when press distraction button,5
67713e53-1e08-485a-801e-fca4aa6ff3ab,this is the first time i purchased for an app and i love it. thank you engross ♡♡,5
65119322-da63-4eb5-bd70-b717270d27f6,#Hailhitler,5
bca1c8c0-c8ae-440f-a1b1-84594926a158,They fixed the bug as soon as I emailed them. Thank you so much. And it's truly a great app to improve your focus and build your work ethic,5
308ce800-a48a-43a9-bad9-f235514b4444,"Me, I don't have adds because I paid for the full app, but same before that, the adds were not disrupting or to blattant. It deserves a try and personnally I think it is an awesome app and it helps me a lot with my studies",5
9f840ccd-00cf-4f73-8faf-05e9a3515069,"The app is superb , I have increased my study rate by more than 3 hours a day , it helps me keep record of my distraction, focus and also records my progress . I don't recommend any app unless and until it have bulk amount of positive points , I recommend this app specially for students who are facing problems in their studies.",5
d8a622b5-2490-45e0-87f9-3b9deb0ffa8f,Its a fantastic app... its a boon for students... i loved it,5
45e434f3-ca22-4dcd-b4da-73ca26a2a383,Best app Very usful for student Must try,5
f703d027-2b48-4860-87ae-e7618f372e90,Best Productivity App I've used of this kind ! Premium features are worth it,5
4dd2288c-61ab-4525-b22f-89ff52b756b9,A well designed app and covered All the aspects of time tracking for being very productive. Purchased the full version within 30 min of using it.,5
57d86d27-8590-4149-83a9-9a6a2d970aca,Great app. It really helps you stay focused on your work.,5
2a144956-4cef-4458-bc46-4734338e04e5,This is an extremely useful study app!,5
a95936e6-d70c-4f47-8dd1-6926eead1126,It's amazing and by far my favorite app. Just want to know why on Earth does this simple timer and hit if distracted eats so much more battery than what I though it would eat up.,5
8f0bb8d5-6640-4f02-a0e2-87fc57de4278,Best app,5
