reviewId,content,sentimentScore
33b4aef2-62df-462d-8ccf-eba15b5310d6,"Honestly, I have been reading Manhwas for years now, and usually, the main character is forced to change in a life or death RPG type fashion. I'm talking about like 100 push ups, sit ups and burpes a day or he dies and I can't lie I've always been sorta jealous of that (The RPG portion not the you'll die if you dont do it part). Anyway, Habitica is just that! Gamefying my life is 100% the right move for me. Plus, I can create a Party with my friends, which makes me accountable. 5 out of 5",5
88f03c8d-6edb-43b7-adcd-54b0c751f49e,Super great and super fun,5
ae3ceb9a-037b-4d47-ae7e-838ac1fe6602,Best to-do list app ever,5
f0452f24-8b7b-40f8-915f-0169326c39a6,"I have only had this for a day but I really love it so far, very easy to use. Haven't noticed any ads yet which is pleasant, and I just started so I haven't gotten to the extras it shows in the examples.",5
8bb260e5-351c-4426-a9ce-fee95873fcfd,"I was searching a way to be more productive and motivated in University, I discover this app and know me and my girlfriend we use it for personal projects and daily life, really good 5/5 !",5
ac39b76e-b45a-4c69-a888-5e1c880364f5,inspiring app,5
4dcb1337-fbc2-4d31-a7a9-24702bc851a8,"The best 'simultaneously fun & useful' app I have ever used. My (game addict) spouse & I are already seeing positive changes in our behavioural patterns (especially the ones that usually drive the other person crazy) after just a few days of use. Had I known that the prospect of hatching the egg of a digital flying pig motivates him so ridiculously highly to do chores, I would have installed this app on his phone many years ago.",5
1b077bcd-0736-4965-be84-e9199ddd7190,"Clean, super speedy, and mobile. Love it! Also has some of the fastest and most responsive customer service I've ever seen. It's phenomenal!",5
fdd6c456-b6a7-4ead-83fc-92f96d571716,Great app,5
403f12c5-d74b-4db9-ab29-b8775a2bbf48,"Great app, works smoothly now! Makes me more accountable and I love the cute pets. Definitely one of the better to-do list apps out there",5
d956472d-017b-4a77-b6d5-08a28233995c,This is my fav app. Great for community incentive to get stuff done and super fun pets and egg hatching and battles!!!,5
854bf331-0b66-43ac-bac6-6b05ac8eda65,The best game ever,5
aa215fb8-c0d2-47f7-b64f-ff102cdc6df2,"Personally, I just needed a checklist to help me focus and remember things but when I found Habitica I was really intrigued. I highly recommend it to any folk that can't focus without exciting motivation or something to look forward to. Many options (habit tracker, daily tasks, a long-term to-do list) and helpful tools (optional notifications, due date, able to view completed to-dos, and MORE) all alongside a simple to understand layout. Perfect, with a cherry on top!",5
0193d129-3e65-48ab-a313-1a61fafb2282,"Such a great app, it's helping me a lot! it's really interesting and has great mechanics. The community is wonderful and everyone is really kind! I really recommend this if you like rpg-like games and if you need to be mor regular with tasks!",5
57032a6a-1535-44dd-b1a0-73b12c9d1b46,"I love this thing. I wanted to start using it again so I reinstalled it, but I can't figure out how to delete old tasks and there is no info anywhere on how to do it so I ended up uninstalling it again. It shouldn't be that difficult to remove old stuff to where looking for 30 minutes yields no results.",5
e838fe24-aaf0-4662-8f41-8cf320d37356,I love your game very thanks for making it very very useful and fun game I like your game,5
bbaefdc2-18a5-4a78-9078-3d1f5238bc83,Amazing App....i completed my first quest today. Fighting the boss in the quest motivates me so much. I have already bought 4 quests to play in the future. The only thing that is lacking is that developers should make more quests. I hope the developers will make more quests and introduce more bosses in the future. Thank you,5
4e996d23-ea08-4438-8961-a4c580fa3b8d,I love the app keep up the good work :thumbs_up:,5
9ecbbd17-bc2f-490d-abd0-eee82e3968ec,Love it,5
67024628-4770-4016-acbb-5575fae2bb7d,Amazing and life-changing app!,5
346453e4-cc52-4136-8bee-38f78d7a6657,I love it it helps me get on track with everything if you guys added a adventure mode and survival mode it kind of is i would just keep doing tasks!,5
356e6cc6-a06e-4638-858f-cb67adb2f988,"I didn't know just how much I needed this. It's improved my life significantly already, and now I get to play games with my friends overtime.",5
28b4c4a8-887e-4093-9db8-00e9c4a1ebac,"Best productivity app yet! Amazing concept of converting tasks and habits into a game. I love the quests, it makes you and your members become accountable in accomplishing your tasks and dailies and earn bigger rewards.",5
97ec746f-868c-4bd9-9298-4bfcced593fb,UI is so good,5
a57019cf-cc73-4ab2-85b5-609899805326,Woo your house is this the walkie-talkie so you know how are things,5
683502a7-831f-4223-af9d-e41e861286bb,Lmao I finished my entire boring book list in less than half of a month. It made my daily tasks and also chores way more fun than I ever expected! My parents were happy.,5
97db2e25-5aed-4af1-8fa0-d6a04b452b5a,"This app has helped me so much with changing bad habits and streamlining a routine. I downloaded it last year and wish I had known about it earlier! I am reaching goals I didn't think possible with the daily habits I've set up for myself. I am becoming more productive with my to list. I used to spend so many hours building virtual worlds on various games, but now I can improve my own personal life while having a little fun. Highly recommend!!",5
f95a501e-6336-4e6b-957c-d626a5d6ec26,Killer app,5
9be4eda7-276e-4922-9c28-c64f37aedebb,"I really love this app - I've been doing it off and on for years and it's just always fun, interesting, really well set up, the in-game items and quests make it so much more fun and rewarding to do real life tasks and chores, and the app doesnt hound you constantly like some other apps (but it can if you want it to). Overall it will always be my go to favorite Todo and checklist app",5
6995d457-fffe-44cd-ae94-3ff86bcc9011,So helpful app,5
6f8763e7-df39-401e-a64d-3c4a9080f210,"for my silly adhd brain this app makes it so i actually get stuff done! being able to set rewards is so helpful, yippee",5
20259478-874b-425a-adfe-34b01af6cb46,"I don't think I've ever rated an app before. But this app is amazing. And deserves praise. I don't really need the subscription or in-app purchases to make my experience better, it's awesome enough with the free version. But I'll probably pay for the subscription. Just to give these people money. Because I love this app.",5
413c8d4d-dd8b-4b92-bf29-5beded7eb4e7,"Honestly, best app for my adhd and procrastination! Makes doing things that I put off, fun, because I can earn things and level up by doing them!",5
57ec9e96-135c-4838-a0c6-6b4125b37413,This app is the absolute best!! I have improved so much in my life thanks to this app making it feel like a videogame. I just love it.,5
d7c98df0-a35a-4e82-a272-2aedccd3feb0,Really helped me stick to my habits,5
de1f538d-8375-45b7-a2c4-dd4d673a8362,"This app chanced my life, thank you.",5
dd78d685-71d3-44df-a1c4-0e87ddfaed49,The best app all gamers actually need! I have a request make a simila app but only for students,5
e882e3f0-5776-40c7-afb1-21acfe85b032,Reward yourself,5
f905e72c-9ac6-4949-ba57-b71e46e67f31,"download this app If you're looking for the GAMING aspect of it, it's not super. But if you're looking for a task, habit, to-do list tracker with really good motivation tools and barely any ads, this is the best app ever. There's so many useful functions and yet it stays simple, casual, and easy to use + appealing to the eyes. You can make your own rewards and buy it for coins you earn by completing your tasks which is one of my favorite features. Best habit motivation on the app store rn.",5
4e84ad0d-161c-4581-8487-f89f286db4f3,Life changing! The motivation in a game mode to accomplish beating and build habits is genius! Thank you to all developers who work on this app.,5
56366ceb-6d45-4c51-9799-23a4a5e975f8,Very impressive habit tracking app. I've played with quite a bit with habit tracker apps and daily planner apps and habitica does it the best. And at $0 cost too! Takes a while to set up but once everything is in place I found this to indeed improve my daily productivity. I would say only improvement would be to make option to organize and label reminders in Dailies.,5
02502c53-80c1-4c2f-8d55-193429acd199,"Excelent app, fun, engaging, really made me change my habits în a fun and entertaining way. Andyou can have a lot of fun with no conditioning în the free version. Witch I find very nice în order to help as mana people not only for the profit. Thank you",5
16e88418-59f2-4b32-9d50-798a70908275,"I was introduced to this years ago but didn't think gamifying habits would be a great idea. Until recently when I was at my lowest of concentration in life, I thought of giving this app a try, and it has been GAME-CHANGING. I'm surprised how the app really keeps me thinking of my habits way more often and how I always try to push myself out of my comfort zone with a reward planted in my head in advance. Definitely recommending this to anybody who loves keeping progress in games.",5
2f5c8c40-d4e3-482e-8800-3f720c101a10,Best to control yourself,5
fec60f30-73f8-436b-8955-daf41a38c342,It's just about the best app ever except for the US date format! That's driving me crazy :zany_face:,5
d546d757-9d15-440c-9676-06d77c378777,This app is actually really amazing and has been helping me very much with my everyday tasks,5
43dd60b8-a6da-47c8-92ec-314feb03a861,FABULOUS,5
a5585451-7745-40a9-9d6a-ca7b272ef08d,"This has made me so much more motivated to get my tasks done, it makes doing chores fun and like a video game!",5
26685f2b-1962-4ae1-8db7-2d2e59846f7c,"Really love this. I enjoy the complexity and the fact that you can buy 'rewards' for keeping up with stuff and that there and consequences for not doing your dailies. Edit: I have no idea what you have done to your app but the dailies on my android s20 completely mess up they change after you tick them, move around. Near impossible to use now",5
8ddae3cf-767a-4a64-a714-0017775bfec5,The best app EVEEEEEEEEEEEEEEEEEEER,5
383b5ee3-49d3-4e59-ac99-5848d1e36af0,Amazing App,5
a36cfed1-d305-4f46-826e-b30d25240790,"This is an innovative, effective, and adorable way to hold yourself accountable!",5
61aea043-ce0e-44b7-8873-e741586ee06b,I absolutely love this app. 11/10,5
f25b7a38-1553-41cc-a198-b52b8bfedcf6,awesome app.,5
106ed064-985d-43ce-81bf-2d88ab736c49,This app it's just perfect. I wish that it was more known,5
a8eabc07-fbf9-4ca3-84e6-f72524591274,Extremely helpful,5
f6f1d19b-6350-4d5f-ab74-b189cdddb6c9,"(this is a long review, dont read it if you dont want to. Thank you) Personally, I highly recommend this app because, first of all, it's like playing a video game irl. Second of all, i feel motivated to do things because it's fun to tik it off the lists and get my experience up. Third of all, i can customize myself and buy armor and weapon, there are also pets that you can collect. To me, this is the best, motivational app ever.",5
f295ec3c-15ef-4931-97cd-2638a1d48613,"This app is amazing! It's been so helpful to my ADHD so far. My only gripes are that, occasionally, there are glitches that make it so if you drag to reorder something it goes farther than it's supposed to, and it will display the habits as a different habit than it is. These are easy to fix by restarting the app, though. I also really want a way to copy a to do, habit, or daily so that I don't have to rewrite a long check list on a to-do that only appears again on an irregular basis.",5
f242083c-ae6c-4ed6-8c42-5d89ca816ab7,Very fun,5
73a284af-bc2b-4c79-a4dc-59f9f4157fbd,"its just amazing how they gamified a habit tracker, it appeals to a lot of these young kids who are trying to build good habits",5
f577e415-2880-430c-950a-cae50d309e5c,I could never love an app like i love this one! Not only the creativity amazes me but the efficiency as well! My life is surely better now. You're missing out if you don't try it !,5
b320ab8e-c4fc-4453-85f8-c8c4fe95b663,"Awesome concept. Like making real life into a game. Only thing I'd say is if you could have an undo button. I press plus by accident and it levels me up. I like to earn the achievement, no mods round here. Thank you",5
e9d94f26-8e20-4ff2-9102-6dbe62d97a17,"It has all the functions and features that I was looking for in an app for tracking productivity, and it's pretty much a video game. It makes being productive fun. It's completely free and very helpful.",5
dbe5c850-0a62-4c4a-87ae-7a8a91d21178,"I got a new phone recently and can't log in into my account. I signed up with Facebook eons ago, but that isn't an option on the current login page. Only sign in with Google or email is available, and the latter didn't work with my Facebook email but gave a pop-up prompt to try logging in with Facebook (which again, isn't an option). Please help me EDIT: support was able to help me out. I can finally manage my life again haha thank you!",5
21b051fe-7e56-426c-83a1-0b66011734ef,"I really appreciate this app, getting rewarded when I complete my habits that I set up is so motivating (if you do it honestly ! ). By getting game coins feel like I am playing the game of life and I have the will of becoming myself level max, by adding more habits as we go along.",5
eec6df97-e116-4569-b2d6-e574b8ae3b3f,"After I found out that my previous chore gamifier was going down in 2023 (Chore Wars), I hopped into Habitica and it has kept me active!",5
2f1b777e-9d5a-42c0-b2f8-f63402b11db5,A really fun way to set habits! I don't really have any complaints!,5
87b838db-08b7-4a9b-abdb-ab057c4757c5,This app has been incredibly helpful for setting up habits! I love the variability of difficulty for tasks!,5
c4c13ae0-359d-4b56-b3a3-1013d63fbb54,Greatness . . .,5
98036de6-5b62-4833-9ae3-5cc7eba90e4f,"This app went beyond my expectations. I thought it was just going to be a habit tracker but Guilds, to dos, due dates, challenges, rewards, widgets for phone, no cap this app goes above and beyond. Best habit tracker without a doubt. Ps, the designs of the gear looks sick. I'm really satisfied with this all.",5
3129a2b0-1069-454b-8388-7a01dd874da7,Best app I've had for getting stuff done.,5
24eeac03-29d7-4838-9163-17ba220e8ddc,It helped me out of my depressions... This app should be used by everyone with depressions since it really helped me get out of my 10 year long depressions (diagnosed btw). I will 100% put my money there once I have a job again (I am right before that point) but until then: This app is phenomenal and a wound healer! Edit: I GOT A JOB! This app helped me get on my feet again and get a job. I am so grateful,5
1b2fd2c0-c1e5-479b-8898-e015442c783a,I love how Nobel the app is really!,5
f5fc6927-2510-4a42-9481-d79c1619336e,this app was THE BEST unil i realized you must be online to complete tasks... just why ????,5
b7e61959-fe26-4458-be9a-1af350bdd0db,Best forcing functions I've seen in my life. It helped me to much,5
0edbe8a4-9aa5-468c-94f4-0eb3c84e937d,Helpful,5
d2ecdbdf-8965-4839-8563-b16eb5732de2,Cool yeah,5
33c2074f-6871-4650-843e-3f4e9b628bfa,I love this app,5
b7ee334e-8cb9-4654-a76f-fd3c2649696e,"Love this app so much, although I prefer to use the version on laptop/PC as the platform is more likeable there other than that, very good for listing tasks and such!",5
21d5fe65-e4c4-43b1-95bc-7360beac57b5,This adds the extra reward to help keep you on track.,5
48c3b91c-d79e-4158-aea8-8ac75b1f256d,This app is probably the only reason I've become more organized this year. It's easy to use and it makes even the most mundane tasks fun because of the rewards. Love it!,5
2d6567ef-0649-47d8-8b2f-7c623f341d63,"First I experienced force closing of the app, so talked about it here, then instantly the developer team contacted me and updated me that the issue was resolved, further they suggested me to try using the app again. It's absolutely great now. Thank you for the fastest support :red_heart:",5
9a6c27bb-cafd-4e9f-b7a1-02d8371f3f51,Amazing app. Better than ' Super Better ',5
b511984f-c29c-4e73-b2f9-6f8c74771576,"Just a brilliant app, really improves my life.",5
23be383f-15b8-48b1-b3d7-86c8364e2885,Love this app - very motivating and the community is very inclusive and kind.,5
94df2382-0b0d-485d-a2cd-1e82d40bd7d7,This app is so cool. Thanks from an ADHD person.,5
82ea5696-184f-4a9e-9bc6-b5e24c84ff67,"Favorite app EVER, for 560+ days now. I use it daily, put all the to-do's and aspire-to-do's there and get a super satisfying burst of dopamine when I check them off and receive that sweet, sweet gold for gear and costumes. It WORKS - things I used to loathe doing (dishes, drinking water, read non-fiction books, learning instead of procrastinating) have become second nature! I'd still be addicted to Genshin or some other games if it weren't for Habitica. This app literally changed my life.",5
14abd703-fab1-422d-956d-48ddae114676,This app is great. I wish it works offline tho.,5
a5b90b77-cdf2-4ed8-a2d9-1e520136e78e,Great Concept :),5
12b08071-52d7-427c-a47e-4619a10c9a61,"I have been hunting for a good app to help me build a healthy schedule, and make me motivated to actually keep to it. This app is honestly great for both siblings and friends to use together!",5
16b393e2-0a0c-4ce1-ab8e-30b99efda5e5,It sells your information,5
7d15d885-7456-43a7-b04e-d15622aca8d0,It's an amazing life-changing app Sooooo good Most useful app for me besides Anki,5
bae6c1e5-ea4b-4a62-8352-2ebefbac0a27,"I really like the app it has a very helped me in ways that cant be described . It has been a motivater for me in managing my time effectively and helped me in remebering things i usually forget. It has a very unique system of gamifying the daily tasks, as a gamer i can relate to it. That what got me into this app in the first place.",5
ec4519d3-037b-4607-a545-24cdd08eb287,Fun and easy!,5
8aa42c57-c876-448d-925c-219382ce9fa6,Best App Ever,5
a524f9dd-93a8-4731-a7b0-487c14b75592,"The best producticity app, ever! It's fun to use this app. Besides fun, it dramatically increases my productivity. I've tried producticity To-Do apps, and this works best for me! This is my suggestion: Please add offline support and add a feature to subtract streak, if checkbox checked and clicked to be unchecked, then it's -1 streak, so I dont need to set the streak manually.",5
071a1137-7c6a-45d6-a015-4d96a6864dc5,Update: Im not sure if they just recently added the widgets but it is a huge help !Best productivity app :> Although would recommend if we could sync it in out own calendars (e.g. google calendar). Another request is if we can categorize to do's by date without repeatedly inputting it :>,5
ed750b7c-156f-4f2e-aaf8-fab26a977790,"This app is exceptional! I like it so much. Have you ever considered adding a stat for the habits so it could be easier to track, and for us who would like to focus on certain habits?",5
6cf151bf-b985-4025-b702-499e20fee10f,Love it. I have found it to be the best way to keep myself on track. Much blessings to the entire Habitica family behind this awesome app!,5
76034c0f-83ba-49b7-8f5a-407dad4c0d46,Love it! The new update fixed the previous update. Thank you devs for releasing a patch this quickly,5
c65a3f1d-e992-48fd-b06b-26a44deafa4b,"Actually works, especially if you are gamer. Realized it was perfect for me when I found myself doing chores just because I would get coins for cooler armor. Haven't missed brushing my teeth or taking my pills since download",5
76a36b2f-3cce-4915-af13-0de4b6ff5fb9,"Absolutely epic app!!! Would 100% recommend this to everyone who wants to be more productive with their days. It motivates you to do the things you have to so with quests, parties, challenges, guilds and pets, and let's you level up your armour!!! It's really cool!! I have never seen an ad in this app as well!!",5
719e2f5b-5d79-4ff2-906b-4cd7b4f2905c,So much fun! It sucks that you have to pay for gems but there's a lot that you can do without them. This app has definitely helped me get my life back on track.,5
dc934975-d03b-4331-b3b2-76bf873f8c8b,"Really Helping Me Change My Life! I'm definitely recommending this to friends and family! It's a great way to start enjoying ""leveling up IRL"" by creating small habits like ""clean room - 10 minutes"" so that you can constantly get a nice dopamine hit by just starting tasks. And once you've started, it's so much easier to keep going. Breaking up big tasks into small, 10 minute accomplishments just helps out so much, whether for daily chores like doing the dishes or starting a big project.",5
0bb2d95f-76f3-4185-b907-1ac3223d7582,The app has a potential! It will be nice if the app works even you are offline and will just sync when the internet is available. Thanks and have a great day!,5
1d6a533c-3c82-4901-833e-107783c60a60,"This app is great, I just want to request an update that would keep me tracking my habits and dailies even I am offline. Also, I would also love if you improve the widget version of the habits so that it wouldn't need much space in my screen just like the widgets in ""to do's and dailies.""",5
d40111cd-5983-4297-9258-86a7f3834314,"I love this app, doesn't encounter any bug yet. There is one thing that I think will help the user experience even more. Instead of streaks, why not have a statistics like data such as line graph to see the fluctuations of a non-linear progress of a habit.",5
7d9dae35-3caf-4aed-aaac-5ebd2bce715c,great.,5
e32f5be9-0a19-4062-93ef-22c2a72e671e,Love this app so much! it's better than other apps which let you only add 1-3 tasks then ask for monthly payments to add more.,5
18b07d15-9993-494d-9982-54156f2680ad,This is literally the best todo list and Tasks app ever. Delivers 100% of what it promises.,5
b3fcfabc-fb29-4ccd-9283-452010794e23,Helped me so much. I'm keeping this forever. It's helped me be more productive and live a better life. Thank you so much!,5
043b766f-fd5e-47f1-88b6-3498240d60d9,An incredible app Great note taking features Great at gamifying tasks And you can add code to extend features Not that you'd need to,5
88102ebf-017a-470e-bc28-e66dac3b7a49,Nice for a gamer procrastinator! I accept the Challenge.:victory_hand:,5
12aa6939-204b-40ac-baaf-f18f63678066,"It's really fun and has done wonders for the things I have wanted to do. Even if you are not into the gaming,.it just keeps the things you want to do in one place. I love it.",5
f0a5a76c-b48a-46e3-b5de-4d185086348e,"I love this app, enthusiasm for all developers in developing this application! :fire:",5
a068fe11-bee1-428a-910d-59653088c4bb,Gamify task and habit tracking! ADHD friendly,5
bdfa0752-b76a-4225-84a2-adc2ebb20c0d,Totally recommend to anyone who really need to list things in everyday life. Totally love it. Easy to use and many features.,5
334a8ae2-a49c-4921-a192-8b17ae9995c7,A perfect app if u want self-improvement,5
a060c621-b5fe-4ceb-a180-3d63f834aa74,Absolutely amazing app. Easy to use. 10 stars ;)),5
f55eacbd-b4fb-4995-9b6d-7ec8feb5f34d,"This is the best app on my phone. I love this, and it helps me do my tasks. To whoever made this, thank you.",5
e286b0a4-dccf-408b-916c-f6d7d5731365,Habitica is amazing,5
a18642b3-a0d3-4871-99d5-6bbd8a90ef90,Best planer for past gamers:double_exclamation_mark:,5
85467bb8-3cca-4bda-b775-8556013b1c52,I love this app for productivity! The only thing I would like is a wiget so I can access my tasks quicker,5
ca670ee7-9757-4965-91dd-777454da6c73,It changed my life,5
96a5978e-671b-46f4-8624-ad2c78396ad3,"I was skeptical at first, but this app has proved a lot more useful than I thought it would be. The best feature is how it simultaneously allows for customization and depth of content. There are various features that you are free to use as little or as much as you want to, depending on your needs. This makes for a fun, challenging, yet also low-pressure environment to give you a boost on improving your lifestyle. The app works for you rather than you working for the app, empowering you to grow.",5
e2917ec1-5ce2-4576-bb62-b217eb265eff,"I've had this app for almost 3 years and I can sincerely say that it's borderline perfection. You can customize it to your hearts content, the motivation potential is massive, a great example of this is my tasks to deal with projects, to-dos, learning, exercise, and so much more every single day. It's basically the only reason I'm even close to a high schooler/pseudo college student depending on the subject. Try it out for a few months, you'll get sucked into productivity like never before!",5
1d402fe9-4c34-42b4-a3be-c89f258905cf,"Exceptional! Good concept, very adictive",5
5245a29f-758c-4483-b0ad-8945e5291f26,Amazing app!!! I have only one suggestion and that is it would be nice to have bio's for our profiles that can be seen by our fellow party members. I feel it would bring more character and information to our profiles.,5
42c978e9-9b73-4d94-aba5-c5025236ce8c,Really love the concept of this app. It's fun and motivating,5
5cddd51d-a0e4-4370-bf16-431104818acd,Great way to get organized and have fun,5
98a77a7e-ed97-47bd-a410-231bc7eb06c9,As someone with adhd who never has people over I struggle to do chores because there is no reward I care about enough to force myself to do the task. This app has gone a LONG way towards helping my motivation.,5
f9523d32-75a5-43b2-bf84-2aedaf181e6b,Really useful and fun application to get all your task done ! Really pushing myself with this to lvl up!,5
