reviewId,content,sentimentScore
9c32c46b-1cb4-450d-97d9-0204047f8f90,Mass and superbb,5
c325ebdf-3358-441d-9ede-26d385404c98,Actually amazing. No ads. No paywall. No constant insistence on upgrading to premium. I love this app and I don't give 5 stars easily.,5
38eb4098-0105-4007-ac6b-f1917a365e13,"Desde hace mucho tiempo traté de buscar aplicaciones para poder organizar mi día y marcar tareas diaras para hacer hábitos, pero ninguna app me había funcionado, pues simplemente las dejaba en el olvido o me limitaban el numero de tareas diarias sin suscripción. Esta aplicación realmente me ha ayudado a ser más productiva y llevar un mejor control de mis dias y tambien crear nuevos hábitos. Gracias :)",5
a274a648-8057-433d-ad83-884578041641,this app changed my life,5
3e5f1d4b-471e-462c-8c16-df7410a91493,Best app it is not like other apps who just a simple interface it is game for me I highly reccomend this app. Just use it for 1 week u will the boost in your productivity . At last I would like thanks to developers I really appreciate your efforts .keep going good luck!,5
6675074a-d7d7-4ecf-a01f-b69f77ff3e5f,I have hopes for this one..,5
897cfd3b-2d3c-4a86-bd1f-43832900f35c,Just downloaded it and it already seems very promising. It is really loyal to the game format!,5
4278e690-adc0-4efe-9ab7-0c99a64b5d95,trying to explore this,5
08c708f4-dac7-4999-a1c0-36a672835b83,"it's really good, needed this for a long time and I'm glad gpt o4 recommended it",5
da7aa506-6a5b-4887-8e15-f8a078c536f2,"This app is perfect for someone who grew up playing EverQuest and World of Warcraft. I initially thought I wouldn't really be motivated to progress the small, pixelated character, but collecting the backgrounds and pets/mounts proved to be highly motivating. I still use todoist to keep track of some more complex or recurrent tasks, but nothing actually motivates me to complete tasks like this app. (I move the tasks todoist gives me for a given day over to this app in shorthand form)",5
9a2e3c27-0e32-4831-8a57-5d03ba1af534,Been using this app for a long time. Nothing else really works quite the same. Great job devs!,5
db2d9f34-5725-40f0-8892-a14eeff7bbb2,Where every quest matters.,5
a6b388f6-6c39-4d4d-974a-60d73487ffb1,make life as intersting as game,5
2da203f9-c909-4ed0-abe9-27bede02e9d1,I actually need this app,5
44f322f6-73f8-4e4e-ad04-c65a9f29044c,amazing,5
d7dfd48c-7c0c-4862-a526-76743ca3587c,"It is a game changer. I love everything. Please add the offline mode, I want to use to do, habits and daily tasks in offline mode, atleast give me daily tasks in offline mode",5
7b89ad27-5703-4e10-a56d-85ae46401d2a,"Super fun and also genuinely helpful, makes it seem like you're doing silly quests irl",5
9b21d8d4-7a48-416a-97d7-8fc3c8c5b686,"fun, easy to use and very helpful for the forgetful.",5
680306e7-e2bd-4747-9f8f-0c416ebc509c,Give option to chnage task colars according task priority then this is best app .,5
6f61515f-9bd5-4c23-a5bf-d62fd7d1aad0,"not gonna lie..this is the best one.so fun to use,and yeah creative",5
d36abc43-48fc-4890-86d4-bf85d5fc01ca,Literally the one app that consistenly motivates me to complete tasks.,5
6dc8b595-4e0c-4c59-827f-c8d1c7847583,"This app has really helped me with self-care, but it's also really fun since you get experience for every daily task or habit you complete, and if the habit is bad, then you will lose health, which helps stop bad habits. I also enjoy being able to customize my character and unlock new stuff by leveling up. :star: 5 stars! :star:",5
1496464a-9580-4759-afe8-9a4432294a7a,"Very great app. Has all the functionality I need and a really nice UI. I've started to improve my daily habits right away, it makes it fun.",5
7ec12a9f-9f7e-4a8c-853c-94594a92872e,Such a great way to check in with yourself.,5
ff5be17c-b8a7-4180-a077-264b3deb6618,"Love this app! No unnecessary product ads, no random words, it is crisp and saves a lot of time. I hope they don't introduce any changes :sparkles:",5
532b4afa-e026-41bf-bbbe-8e6ffb984984,exploring,5
f68b3b9c-3d70-4059-9602-9d3558d02e86,great app,5
010d3d90-9ac8-487d-b152-0a5cc6881e8e,"Espero que mejore, pero es puro perfeccionismo e insatisfacción por la vida, porqué la verdad me sorprende lo rápido que me enganchó, deje de jugar Minecraft y WorldBox por tenerme abierta la pantalla de Habitica, realmente cumple la función de trabajar de manera divertida tus hábitos y darles dirección, quieres más y más, algo que se supone que ya queríamos en la vida real, pero ahora es más fácil y evidente, recomendado para los gamers que también quieren triunfar en más áreas de sus vidas.",5
2f5cac83-2c5b-49ac-ab64-dcde9b1ee724,Game changer,5
87ebe4f6-6355-42c6-8231-0832995fe4c9,"Great for managing all of the tasks I will absolutely forget without it. Has every feature I need free. Subscription benefits are solely cosmetic, and I really appreciate that. Personally, it took awhile to get used to using it, and I lapse now and then, but it has really helped me be organized and get things done.",5
a43b3e65-64eb-4f91-b246-77b7d3f17a52,Cool app for self growth,5
547a346f-95d5-43d7-bacb-796ab88785f7,Use this everyday,5
ad555427-a8ea-4649-9284-7444fba86e03,great app help u alot with tracking your goals,5
35a9a798-7285-41f6-ab97-8b3aa89c0563,"starting habits check, tomagochi little creatures check, plebs turning into heros that make your panties drop check. I don't know what you're looking for but this hits all my boxes :winking_face:.",5
c8849d8b-601a-43dd-bd75-201bbb180aaf,love all round,5
bfa65527-bac2-43cb-a1f7-46bee6ce6087,the best habit app,5
6365c65a-0b19-4993-af79-ed3fdb113ab2,helped,5
3b38746f-1ee8-4761-96c1-a955ab6171bf,me ajuda muito,5
75663c55-b8fa-4e7d-87bb-d5ff12ff5498,Cool app,5
4e04dd61-66fd-40d8-a935-f51f04794b5d,"The best habit app so far! Highly recommended for everyone to use! I have been using this for months every single day to track habits, personal tasks and work. Really love the idea of having an avatar, level, quests, equipments, and losing hp points when missing out daily tasks. I neglect a lot of self-care habits and this app forced me to make those healthy habits. Thank you, Habitica!",5
b76be6df-2977-4722-8ed2-152f16662e38,great app.hope it keeps me moving through out my day get it done why not give it a try,5
cd317f68-e95d-40f0-8982-6d27bcda7dc1,"I've been using it for about 3 years now, and although I use it less frequently now it is genuinely super fun, relatively helpful, and worth getting if you feel like it'll cost you",5
a4d3109f-043c-4721-a34c-b81e1317d8df,great app,5
aca9ea78-c5ea-4b1c-b04b-74aa4fa5a107,just a spreadsheet,5
1454e5be-4dd0-4226-a17a-e68d5bf38d4c,helps so much,5
8d066e11-aa65-4bce-ad46-50dbd3978a71,wow its good,5
3c4b56ba-d53c-4fa6-bf5a-e9e22a0ca566,Ist very nice.,5
3ac2177f-1051-484d-8ecb-aa9e3077a29f,So far I love it I'm just now taking time to add my tasks and such after having the so for about a month.,5
c12aa3a5-b7c8-4361-bf48-2811aacd1f93,This app changed my life for the better and im not exaggerating in the slightest,5
d4e2004f-ddbf-4e95-9f13-09e37bc29b1f,very useful app,5
69fe4459-dfcc-47ad-9938-cb718ed26c7e,love the start,5
6dff2b9a-b714-4ef9-ab9e-6f33c910f116,starting on!!!!!,5
d1aba4f6-609d-4c55-9cb2-7594aa31e71e,great!,5
6ac00151-0092-4436-8e52-b6175b1e7ed0,cute and fun,5
a4260626-094f-4a9e-9a28-4817e0aebebc,Amazing. Just amazing,5
e6a9be79-b7b8-40bd-8351-ca595735b532,cool,5
d9c07649-56fe-432b-92a8-da021d511e63,yeh bhaut accha app h just guide to me I obsessed with this app,5
4ff53ea7-0dee-4b64-952d-d775d1810b6a,One of my top 3 app most useful apps! Love it!,5
53e82130-b2d3-4f7b-9362-c919ca62465a,epic,5
9ab29492-0973-49d4-a806-97af1785ed98,Thank you for the wonderful update. Been using the app for years. Thank you developers. Thanks!,5
95d51870-96f0-497e-9458-c76780aa66a2,Great for lazy gamers to lift yourself up and move.,5
46482d95-606a-4550-b661-694b79a35053,Great game to track daily tasks and reminders. I would highly recommend.,5
528661fb-7043-4a45-8e6c-5a4aaae857b0,"I was Looking For this type of of Productivity app. I tried many app to build Gamification but I failed at Last I found this Great App. I really want to complete my task a Gamified Manner and this app is best for that. One Thing you should add in the Profile section. Please Show ""Party Name"" in the Profile section of Every Player.",5
d24bb4c2-321e-499a-bdae-0decde40d68a,"This app is so fun. I love it. It really helped me with all my school works and habits. I would recommend this app to anyone I know. However, it would be really great if you had a timer to do a task, whereas if you can't do it in time, you'll lose coins/health. I would really appreciate a timer, for tasks. And also a feature where you can set if a habit is done once or twice (or more times) a day. Thank you for this wonderful app!",5
d08d30d8-e7ae-40e5-b98d-441480cfdb8c,cool,5
7637a0de-e619-497e-a8a8-1a1465e4da33,it's perfect,5
3e8c7c5e-c0e4-4418-8f71-4387da7de5c9,Best ever app to gamify your tasks,5
dd6e1874-9588-45cb-865d-9a78cbc7ba38,It's the best! I'm glad I tried it,5
bcc22ea0-555c-46fc-bb2a-dcff7ece0136,Hey! :) I've been using this app to turn my chores into daily quests and I did not think it would motivate me so much! I don't use the rpg features in game but I like the layout and usability of this app more than of other habit trackers. Something that I would love is if there would be a calendar view for your dalies: eg. I like to spread out my quests evenly throughout the week and if I could see on which days I already have a lot to do I could create new quests on different days.,5
cfc77c33-2623-43c6-a6e9-dbef77d229ac,perfect for gamers,5
d71d3c3e-e924-4912-8bae-2c40e8d579a5,Fun & Mutual Aid,5
2f82a2af-163a-41ef-bb3d-7270a354bd61,Awesome app. It enables me to gamify stuff that usually is boring as hell. The tasks are still boring (no app can change that!) but it adds the extra touch of fun that makes me get stuff done. Highly recommended!!,5
e443a0d8-b937-4a82-aa18-558c2faf0432,"Looks like what I always dreamed of. Perfect app. No ads, no pay to win. This is the stuff I love to support!",5
fbe9e319-317d-485d-9629-0999e1906122,"This is a great way to gamify your habit creation. Especially if you like checklists. Having 100% control of the goals, tasks & all related info makes it easier to want to use and to start using. 0 complaints.",5
f3c6bc42-6c58-4044-988c-9f618107e835,I have just started it and making my life a game is a good thing,5
651e32d3-c083-4bc4-becb-55e254eaab6f,"This game makes building good habits fun and keeps me entertained with quests and tasks. Good way to keep me focused on what I need to do, I definitely recommend it! I just became a subscriber because I really want to support whoever made this! I'm exited for more updates :)",5
495c9be0-2a85-4fc5-95b6-3d4999694c2f,LOVE THIS,5
282732c9-b100-423f-9af7-080506f4dcf2,great. no improvement needed,5
6b60d6a5-a24c-4697-89d9-eca707439acd,"its good, highly recommend",5
ac56662c-f292-4d8e-98ea-2ec4b24b65b5,Huge fan of Habitica. Used it for about a decade. It was called HabitRPG when I started. Only to-do list app I have stuck to. Encourages you to build good habits in a fun way. Community-built. No ads...worth subscribing to support the app.,5
26e963bc-6b04-456a-a46d-42fc9b32eb62,helping me a lot,5
250000a0-7cc7-42aa-8699-77bb80ff2215,Really helped me improve my habits and wellbeing,5
89fdd7de-2f4c-430f-adfd-d5a55b8622c6,"This app does actually help, I didn't think it would and I was like whats the worst that can happen. ended up doing all of my daily chores super early in the morning and got stuff done before time when server I'm bored I ""play"" this game. very unique idea and works for ADHD",5
521a8f59-abf4-4f39-aa34-97aab36a6464,change is great!,5
e7f16ce4-ef9e-4eda-b455-c14107844fb8,"This app is amazing! It helps me manage my time in a fun way! For people who dont have it, it helps u manage your tasks in the form of a game, u can add habits you want to start/end on it, if you do a bad habit youll lose health if you do a good habit you gain xp, the tasks give u coins and u can even make rewards to buy w them! This app is fantastic reccomend it 100%",5
638c8ebe-71be-476c-b4a2-3846652cea1e,cool,5
782e49d6-9546-4814-ab94-b38898b57c01,Love this. Make doing stuff fun and engaging. paid with a custom AI and what a winner this is! :raising_hands_medium_skin_tone:,5
29c171ad-f4e4-4772-9537-405c510ccae5,The app is great and easy to use. It offers a walkthrough on how to use and it's free and fun. So far I haven't seen any ads.,5
d0d94d9b-df59-42d2-9880-ac946c5357aa,Makes you real again,5
a4bd4722-35c3-4466-bdbd-b2b6069e9489,This app is awesome!,5
d69c19c4-77d8-4099-a5e5-5fda5e11ee13,:thumbs_up:,5
61ff91aa-a9a2-4745-b664-d02a06277142,"One of the best habit tracker app, gamifies your tasks. This way you as character always grows in level for completing tasks and habits.",5
6c124d12-4983-4a25-968e-7c7191c26069,"this is such a fun idea. it has helped me to be super productive and also get things done that are simple, but I couldn't be bothered doing! such fun!",5
212722fc-05d2-4a43-81e7-40cef0ccba26,Kudos for making this open source!!,5
86303cce-c156-423d-8b47-8537d964ed6f,very good,5
ba29debb-504b-4847-bcc2-78a7a69d4601,exactly what I needed!,5
733298a2-4932-40d2-b4a7-aa929d6f2ef2,This app can literally change anyone's life man,5
4a1be503-ad53-47d0-886d-e1c03f05df91,"It's the only app that REALLY helped me and with having 3 parts for daily works (works that you wanna do everyday), to do list (things that you wanna do only once), and also habits (for works you wanna do each day you like and how many times you like to do.) it really helped me to have everything in ONE app. thank you for this app!",5
daa77277-3f55-4f5e-8888-7f0709f5ded2,gud stuf,5
09c86058-ae60-4633-bb59-893cc0d27211,gud,5
6bd2b39c-0f02-463b-8eb7-e37ed4092351,the only app that truly fun to use and keeps encouraging me to do my tasks,5
cb3e6719-6067-4c5c-94e0-de5a727022fa,cool,5
832cacce-ff9e-4619-b831-ab99448e1336,awesome way to boost productivity once you get used to the UI,5
12dfff67-43af-4867-824f-92b51688bc17,So far so good! This seems to be like a really awesome and useful app.,5
3c000e66-6ef8-4586-be38-cf696d434596,Gratitude,5
b94854ca-568c-402c-8c91-332a27eacd90,nice app i love it,5
760222d1-ac12-470a-8290-b1419f8d68b4,gym for life,5
b1f1f58b-1369-410a-8a4f-3377f2a224a6,beautiful!!,5
f0a4bcfe-9a00-4a38-8fd7-96f0a0b95ce6,so far so good,5
1a44dc72-ceff-4560-9c0d-d96722d7364b,cool app,5
53a8d5b6-daf9-4774-9b21-8a9ec470aa48,layer,5
4373e6a4-1091-45af-a3ea-5d4240cdd5d2,A very great experience. It has all the features required for the tasks and very fun to use.,5
193c80d2-4c51-41c2-897e-2b90d4c548a9,I love it,5
68638a5f-40b6-4648-8a5a-7708b8d20595,"I just love Habitica, I mean its perfect for me. Instead of using those useless to-dos applications with a lot of ads I suggest Everyone to use this masterpiece. Its a perfect app, And now I am keeping it forever with me Like a system app. It just have one issue , The server of the app is liitle slow try to improve it, anyways. Thanks for making such a great app.",5
ca414db6-f205-4eb5-b722-4223eaad5fb9,Great app. There's just one thing that I want and that is being able to sell/exchange equipments for coins. Especially that my previous equipment doesn't apply to my current class,5
953525c2-e24e-4cb0-989b-3dd1b08e8b37,sounds great,5
59e34a73-9315-4323-98e9-ecfa0016aefb,Great,5
c0b13c64-57c1-4102-be55-04ff938ce44c,Sometimes I use it diligently. Sometimes I prefer my paper lists. Absolutely no complaints about this app. It works wonderfully well. You don't have to play the games for it to be extremely useful.,5
bb24af49-0d5a-4be3-a420-607434f22483,great for adhd,5
5e62b314-1b3d-4c0e-ac5b-526e7c3ce04f,Love the pixilated theme,5
1a7a2f8c-2223-4e8d-8890-66c0f6415919,i love the features. it's more than a habit maker,5
9f8eeb08-bea8-459d-ad2a-51eb2d542f1b,"My favorite app!! Habitica has helped me stay organized and on schedule for years now. And I love the fun of the avatar backgrounds, costumes, and quests.",5
9152b4fe-d57e-4437-ac13-0a4dd7ef9d92,"Acabó de encontrar la app para curar la procrastinación, thank you guys :rocket::rocket::rocket::rocket:",5
6bbcb3a0-1d9a-4ecd-a3c8-615eeb1ef079,"This app has helped me to go to bed on time, and get more done. I look forward to completing tasks so that I can: defeat Bosses (enemies), earn coin, win items, complete levels, and grow my avatar in strength, intelligence, perception, and constitution.",5
71f6e504-00b9-4d8f-8471-eb31f9dc139d,really fun idea lol,5
013bb655-e249-4b2b-8048-4a6e935a92b1,great and creative workspace,5
c1594226-7d2f-45fc-9ba7-e48996cd890e,It has helped me tremendously and I do like the video games concept around this app,5
b477bb44-d7f4-43bf-b8df-b08db8c740e4,Habitica has been a game-changer for building habits! The gamification of my daily activities and tasks has made staying organized and productive fun and engaging. Big thanks to the Habitica team for creating such a useful app!,5
87d89693-2d6a-4027-94ab-c15e8842c873,"I like this app because it makes it easy to track my habits, good and bad. I appreciate the work the developers have put into this app! It has been very helpful.",5
96237a0c-3367-4b21-8944-1552ec80a2b7,This app is the only way that I found to be motivated to do the things I've been meaning to do!,5
95b77463-ebca-4795-884c-70bb372aeb27,this is by far the best app for productivity,5
f6735e08-311b-4c24-8423-be3853b13248,best app to keep me on track,5
91d89464-d73a-409c-9cb0-487eb0c3dd87,just started using. it's like playing Survival Game.,5
f21ce6dc-11cf-470a-b474-c0c325fd9ce8,Jesus Loves You in that way!,5
db0980a7-424b-4bf8-9e7e-484d4bcc05a0,Thanks for app! Just two little big things. I want to receive reward from complete subtasks. How i can do it? It's very important for this app. Please give us users this opportunity.,5
4b27db65-f690-4373-a9db-2f226514df7a,it is a game,5
c1d334ce-b004-498d-b0bd-86a3623da7e8,helpfull,5
ae058256-646a-4bf8-afd5-525a6e3966a1,"really cool, helps with ADHD.",5
72cbfc7c-64ce-4ea3-92a1-8c0e10c70574,Amazing app,5
b590d954-de9a-4023-830e-f55708af481f,mi gustas,5
deee7163-4057-4f4b-aa6b-c09c7ddb0de5,"Amazing, it has a great community and fun quests",5
6d9e8240-02ef-460b-a01a-da45438cde98,great app,5
66f390c4-f8c6-4997-90c2-e54160595a30,Helped me stay motivated to do the work I need to do!,5
c332c643-4ae6-48b4-89b9-eb0d28e05918,best,5
e2f6b424-730e-42ad-8f19-40a9e5535fbb,really love this app. Using it as a motivation to keep my pray in check. But I'd really love it if you could add some sort of like a pause/continue options in the dailies bcs there are times I couldn't pray bcs of my period and I dont wanna to lose the points in experience and health. Please consider it!! Thank you <3,5
3629f939-6ec8-496d-812d-f00b93442ba0,I love it. Its helping me improving my life and its giving me motivation to do thing I usually dont do. thank u devs :),5
f98e02cb-35f9-4289-904b-4e28a3f1b04a,"Download, you won't regret it",5
d20ec815-3878-4bb6-93d2-820664315581,best,5
2dca7e84-9ce3-453a-ade2-951dcadae4a1,"This app literally changed my life.... Before Covid, I used to be athletic, but after that I Became quite fat and lost my confidence. That's when this app helped me regain my confidence and made my life a lot better",5
3d81f3c4-85cd-4372-ab25-feea7346afb7,Superb,5
d9447406-b9c7-4297-9638-aea2de62f458,"Perfect for ADHD kids and young adults. Engaging, gaming- like content.",5
57c34ed3-d7f9-4ca8-91f0-96f69def12d7,Rewards points give me boost really great concept,5
817dc4ee-9d8a-4797-a60b-b2651d33a181,very good app,5
d642b564-d616-4f15-9bbd-eab000baa531,great app,5
867ee732-f958-45fe-aaa6-dd643d01292a,"great, just great. My life is an RPG now",5
4d12af5c-e3e1-409e-be1c-b6ff5954e51c,very useful and cool. many thanks,5
2c383373-e498-4857-9d6b-f00cd48c6c05,Amazing :smiling_face_with_heart-eyes:,5
a5d6f271-507a-49eb-9275-044514841615,"This app has helped me achieve order. I have ADHD and the quests and community has been very useful. I've stuck with this app for over two years, and pay to support the developers because it is so important to me.",5
bdd77be4-528d-4035-bc4c-aa435f83ecc3,I like this apps check know everyone,5
4d9e3823-afa5-4b74-92ef-9095e80788e4,"I just started this application, the icons are simple and easy to understand. Colorful gradient. I want to see what they can offer, ciao! :beaming_face_with_smiling_eyes:",5
fb18f8cb-b628-4e9c-be2f-5ce310808449,"Great app, genuinely changed my life in a way, issues have been fixed and everything's looking good!",5
facb2444-208a-4141-bd66-cdd880faa9bb,"I love this app, its changed my life and I always remember to do things now.",5
a5ae69eb-3820-4f15-aea2-cb163c1fdee1,very nice,5
faeaa8e7-6b32-418f-be5a-b473e12339f3,great app! definitely recommended,5
05a0add5-b8c2-477a-b3ac-4d793a9ba56d,amazing :thumbs_up_light_skin_tone: :clapping_hands_light_skin_tone:,5
3a2492a0-3798-4ad5-8986-64f7180b6e91,"I searched for this for years, and I'm glad to see it.",5
5d25ef04-9de0-49df-8d6f-db07991129e7,it is a great app that really helps me to grow from nowhere to a self improvement person like I see in anime edit: lmfao I am an anime fan,5
8f3d65e6-32f2-4ff1-9305-bea21e50fb60,very cool :),5
18b81178-fb51-49c0-af05-fcb56e8c2318,Just what I wanted,5
fc697c18-4aa2-4753-a0dd-0d43ed1168b6,Loving this app so far.,5
53710cbd-0298-4a90-b70a-c10617599a68,Great app for tracking habits,5
a1e71df5-db89-4d0e-b727-dd7b09f4e150,So much fun. Really is a super cool way to manage ur daily tasks and to dos and just a fun way to do things. Especially if u have Adhd.,5
31d5492d-d4be-40d2-bb04-6663aa30ebdd,"i love this!!! its such a fun app :3 ive been looking for something like this, THANK YOU!",5
65e86e46-6e23-4616-aea7-bb22f5134100,great app I think,5
008ac4a9-28d3-4cb5-ad5e-8215913b3871,"im new here, I already put 5 stars since it gives a great impression",5
64a04b55-546b-4b5e-a0fd-2aaacf62259c,Good stuff.,5
050b899b-3608-4c95-99e9-5e52e1f0295e,"Helps me get stuff done, also very good support!",5
d878c681-8382-4810-8d76-c6b270fde41a,"Great Great Great! Just one lacking: It is not usable in offline. I have to struggle because of that. I often need to stay away from internet..... I would advise the developers to have a offline version, or there should be any feature like, scheduling actions. I mean, it will store actions taken by me while offline in a local storage, and it will sync that action whenever i will be online.",5
3bda0db8-50ac-471a-b386-895f2e4762c8,perfect fitness app,5
057a1d88-4d00-48a6-8904-aeb454516a8d,Finally found the best app for planning your task with fun which has fullfilled my expectations!,5
fdcbc68f-79fc-485c-bcc9-97ee101a729c,cool app,5
98b883d6-ae9c-47b9-9e2d-2a285de3968e,dayum jst very good,5
b0932e9f-3883-4de4-a99b-359e2c031a55,This app is great for making habits,5
3f64044e-e858-4b53-8c4f-1a54e396262b,it's a great app,5
d8ca08e6-6b65-4fc8-9ed1-5578a5f79c08,Absolutely amazing!! I struggle with anxiety and depression and Habitica has really helped when I'm in a mental funk. I find myself actively wanting to do things so I can check them off and progress in the app. Great way to keep track of things and form habits!,5
4724bb86-2084-4e54-9259-408716f6c096,Oh god I love the point of this app AND WATCH SUPPORT ID CHERRY ON CAKE!!! I would love it even more if it had tiles in the watch app,5
c3d6724f-4527-4031-8267-d3053c6961eb,great app,5
bdbce071-8e50-4527-9b58-37dfb71f5ab7,very helpfull,5
83d6030e-f9b3-4bad-a9cf-824ceb1cc773,Awesome!,5
ba683617-83a3-4ea9-b97f-8b8bde8cfddb,habitica is great,5
29bc4412-bb52-48f4-8432-9de4fddc7f52,Can you guys add more competing stuff like party competion something like that... Anyways it's a great app I really appreciate it ! Great work keep it up !,5
eaa6914b-5ccb-438f-b490-b86bbadc4f75,a well thought out app that is fun to use!,5
2eb3eb31-e82d-474f-9307-7c0f142bb7cd,"This app is literally great and absolutely free from ads ( free version ). The surface is clean and minimal. Easy to use and also easy to organize. This platform deserve a 5.0 overall review!:rolling_on_the_floor_laughing::red_heart: I love this platform so muchhhh. It made me productive and start new habits and avoid some bad habits. So if you're struggling with ur bad habits, unable to manage your time, donno what to do & looking for a free application, this app is for you. I could say this application is for everyone cuz........",5
6c414df1-00fb-4443-a582-3f1b284130ae,this is fun! who knew my address self needed this her whole adult life !? to stay organized--it works!!,5
2c7f6522-3572-4ed8-a67f-38848b455c3b,JUST AWESOME,5
5f49af78-b593-421f-b3c8-bc0797011cd8,Rly helpful!,5
2b91c7ed-4347-4d90-ab5c-95e1eef38572,Love it,5
7082400a-b91c-437d-b5af-69d6c740049b,"Reliable tracking app. Very useful, and whoever is reading this, if you don't have it, you're missing out.",5
fc432245-af3b-4a7e-9706-7b7661c91274,"I rarely ever post reviews, but this app genuinely changed my life. I've been able to do things I've been struggling with due to drastically declining mental health. But I now get excited to engage in habits or get things done just to gain experience and work towards completing quests. Whoever thought of this, you are amazing and a genius. Thank you for helping me take my life back",5
5cc71179-1cdf-491c-9759-f6297d64e8ea,This is a great way for people to get off electronics and do what they need to do each day like exercise,5
2ffbd9d8-186b-4a9a-bfec-01721e5591fc,"I am still understanding how it all works, but I love the journey and use this daily now to keep progressing in and out of the app!",5
fd4c940c-b1c8-4294-9a9d-ab50669ec0e9,good program really helpful,5
