reviewId,content,sentimentScore
43ee97d0-643e-40be-a6a5-8ab2a62020a1,"This is amazing. It's ""To Do List: The Game."" I am currently a level 40 warrior on my to do list, and the ability to make that statement is one of those things I never knew I always needed. In addition to organizing your tasks by habit, daily, and to-do, it has challenges to help with problem areas such as cleaning, sleep schedule, or stress reduction. There are also many guild available for new challenges, support, or both. Wonderful for organization, getting things done, or personal growth.",5
d2033530-1d04-4c2f-b96b-a470e71557e2,Helpful app,5
68eb6b20-5f93-4ec0-917b-c8ec98ba4909,"Best one to help supporting me on doing my work and to-dos. The other productivity app has never worked for me, until this.",5
0027e9f6-3bf6-4bf1-a21e-502fb7af6ad9,"I have used this app for the past few months and have found it life-changing in a lot of ways, pushing me to expand my horizons and find the motivation to develop healthy habits. If you're reading this, I highly recommend downloading this. That being said, one issue: there's no notifications for party chat yet, which is sorely needed since I want to know what my party members are up to, what quests they're thinking of doing, etc. Add this one simple thing and the app will be nearly perfect!",5
c5d43420-44c8-44bb-8bb1-e4b656190093,"Habitica is fantastic and very cute! It forces me to be accountable, and helps me aspire towards my goals. The habits are helpful. The +/- sign provides instant punishment for bad habits or acknowledgement of my achievements (via gold). Improvements: 1. the ""create new habit"" option disappears on my android after I make one. 2. Have a calendar showing which activities I completed throught the week/month 3. Don't delete completed tasks automatically (maybe cross out)",5
07996dbd-6a3d-4974-b019-d1fc34246381,Great idea! Wish I could use it with my family to manage tasks and chores and assign the tasks to different people,5
85260b40-6823-4eec-90af-48b074855d1f,With the help of this app I have completely turned my life around. I'm managing to complete tasks and motivate myself to do those really ungratifying jobs that would otherwise go unfinished. The app is well-made and such a great idea - download it now! :thumbs_up:,5
d48cb168-654f-4807-a006-e8463b48d2b5,"Amazing, flexible tool for staying productive and conquering personal challenges. Awesome community features. The app has improved a lot with the last updates.",5
71cf01c8-f1ef-4b57-905f-5ccc433c46c4,Habitica is downright Awesome! The pet and mount system is very motivating for me to get my dailies checked off.,5
43332cb6-58cf-4600-8d58-033ff123999c,I'ts helpful,5
3fe49dac-96a0-4a80-af19-aa1e9397f8ac,"Great app! I'm always on top of my game with all of my tasks & am constantly staying motivated to do things that annoy me! Thanks, Habitica! It's really amazing what a little spark of motivation can do for you.",5
68ae69fd-6ba2-489d-9ced-a8f60f219c80,"This app (and I'm not exaggerating) changed my life. I am now a much more productive, organized and fulfilled person.",5
c92e8ebe-72c7-401c-b17e-adfabd16885a,amazing app and it will be better if added offline mode,5
cd3647c9-5262-4aa9-bd45-1fe49f666c31,Excellent app!!,5
672833f2-0f22-4ba4-8bb4-91cbad53298e,Love it,5
325c39fa-9be6-4a34-8e70-9e6e18c8b51d,"Habitica has helped me so much in the past two years! I am a pro at procrastination, and struggle with motivation. Habitica gives you a customizable experience that you can tailor to fit your goals and experiment with methods of rewards. This is furthered by the incredible social aspects of the app. Along with joining a party for a solid day to day drive to get things done, you can join an infinite number of guilds!! The guilds are incredible, there's something for everything- from adulting to thesis writing to job searches to cosplay! The current gem I've found is the New Years Resolution Guild- I strongly suggest joining them and participating in their Challenges, and checking into guild chat to see what solutions and ideas the members have come up with. Habitica also posses a very helpful wiki that has all kinds of tricks and ideas to get you organised and forming good habits! TLDR: experiment, join guilds and read their chats, join challenges, and have FUN!",5
017f0438-66d2-4241-a460-0db9ce2cee0c,A GREAT app.,5
cb95d707-abcd-4fb3-98df-6c7947744db5,Best Todo list there is.,5
d71c2988-27f2-40aa-be79-09d9efa0d327,Best app if you want to motivate yourself and stop procrastinating,5
58661a7d-6ba5-4e70-912f-0ac73855c0f9,"This app is amazing. I have been jumping from habit tracker to habit tracker until i found this. I am over 100 days in and actually have made improvements. It is all about what you put in to the app and even though i have yet to make a party of real life friends playing, i talk about it lots with fellow students!",5
51a095f5-0ff8-45bf-af39-d26b6083f4cd,Just loved it,5
773a436e-c576-45a9-b920-b1240c5ddcd6,This app/site has been a daily part of my life for two years. Had it on my iphone and have it now on my S7. Amazing work from a small team plus the volunteers.,5
0f8a275c-0e95-4617-981f-18f4c9a30fc3,"Super helpful! The rewards and punishments for habits and tasks are really motivating, and I love the pixel art. This app is really useful for breaking my day into manageable chunks and reducing stress.",5
9936647a-7cbf-4674-9bc0-1e8fd1b1cf64,As a forgetful person this was great at reminding me of those things in a fun way. Also motivated me to change some bad habits and keep up with my good ones. Just needs a ranger class! Great app.,5
74c2ec69-a144-40ce-896e-4f425d17ebf1,"It really helps me finishing my tasks! Unlike other apps I don't get bored on this one. It's a really great app, 100% recommended",5
483e2efc-9955-451f-bf66-631f5d33f4b4,"Love this app so far! Naming all my tasks with thematic flourish to keep things interesting. One feature I really would love to see added is a way to customize notification sounds for this app, and maybe even for specific reminders? It's easy to miss reminders if they sound like every other app on my phone.",5
bea48ee9-f2b9-41d6-a455-bce51bf2b5fa,Quests didnt work for me but i love this game. Very good at keeping track of what i need to do and check off to do lists + dailys,5
cebf42ee-cd6c-41ee-a3bc-d41947f5b2aa,i absolutely love this app! i have been using it for about a week and have already get more productive than using my textbook to track dailies and to-dos as i did before. the motivation in the app perfectly suits me!,5
94201336-eba4-422d-8880-150727cfe7ef,It is the simplest and most effective way to get things done.,5
3691aebe-5cb4-4d0d-beb8-d525a235c963,great app love the fact that it can also be used on the PC to better manage your tasks,5
fec7f085-e70f-4d2c-bba2-34f9ce595a0c,"I love the app and I use it every day. But till now there are options I never used because I don't know how it works. How do you build a party if you don't have friend irl who play this game? Btw stuff like statistics would be great to see when I did what, so I could see better where my problems/bad habits are. It's sad that you can't get diamonds as a regular person who hasn't real money to buy diamonds. However I love the game, 5 stars because it works all the time",5
22c84dad-6075-40d1-8337-8dd66230a75c,Taking better care of my life is so much more fun with habitica! I'm actually finishing tasks and not trying to avoid my life nearly as much!,5
bc9b7e40-9ff1-4e62-b710-c3bbbbb17829,"An engaging and fun way to make a positive change in your day-to-day life! You can use both positive or negative feedback to make new habits or break old ones. You can track daily to-dos, and long-term goals. It can definitely make you feel more accountable for your acions, especially if you join a party and quest together. The website can be a bit buggy/laggy at times, but I have had the app for several months and have not run into any issues yet. It has definitely helped me make positive changes to my life, from little ones to big ones, and I highly recommend this app!",5
1b2425e6-59cf-4f76-a039-04e6b24fa1c8,The new update looks good! I often use Habitica on PC but having it on the phone makes it easy to check out my tasks when I'm on the go. PS I really love the idea! Thank you and keep it up! :),5
e6d2cff5-907a-4958-b1a4-48289acbbfa1,"It looks simple and goofy, but it is actually a very well made app. I love it.",5
45150f3d-b7e8-4f80-9bc8-53678269b51f,"Has helped me to get back on track with some things in life. Great idea, great app.",5
439ede07-55a0-447a-9bab-1641fbc9aacf,An amazing way to boost one's productivity and adhere to new habits.,5
59354867-11bf-44ca-bb1b-fd275828d3c3,Love this! For medical reasons I have difficulty prioritizing and staying on task. This app helps me a lot! Very happy with it.,5
8fe6a200-b0ea-4a25-bd29-34b5bbeb8efb,It's really helpful,5
a867c433-9612-441e-8e3a-5e468efb9b63,This so very COOL!!! Something I've always wanted &lt;3,5
fdce23a9-01e8-499a-b6f1-8a8e1899ca0d,This is such a cool idea and it is super helpful,5
dbeb104b-fc26-45dc-a13b-e8a57b733671,The team did a great job at executing a gamified system that motivates me to do thing while making the responsibility completely on my own actions. It makes life and habit building so fun now.,5
f8fb553b-e370-4bb3-b80f-0fb51b20cc1a,Really enjoy seeing my little avatar level up when I do my tasks. It's nice to be able to be social and reward myself with armor and weapons and animals for my avatar.,5
c7051e00-554c-404d-a22f-48a05812900a,"This is fantastic. The game aspect can be ignored if you like. The pairing of good and bad habits is a great idea, as is linking it to a game!",5
67421f3d-6dd6-439c-b108-f6c4d451e0b6,"Really amazing! I sometimes stop using it, sometimes come back, but it always brings me more productivity.",5
3152cfa0-0b45-43bf-ac33-916634b610fc,U end up wasting more time on phone..and it will make ur life as game... just use your mind human !,5
56823243-bb83-484b-8b3d-e76b1a82e2c0,Best habit game i can find,5
c178bc1f-28d0-4e50-9caf-6e42c00c2877,This is the very essence of positive reinforcement,5
dd103673-1864-46ff-9954-599ac9a8f7e8,I love this concept. Got me to do lists set up and got smoking as a negative to take away points. Going to set up real life rewards soon and once my house is cleaned I can totally reward myself with something I been wanting that is long as I don't smoke too much ;) thank you for making This! This is totally what I been needing in my life to help motivate me and keep me on task. Super excited to have this. May go pro after my Tupperware business takes off :),5
f5866e07-acfc-4eaf-a3a7-95289a820d45,Making self-management more interesting!,5
bc3d9262-451e-4a2b-ad83-488453a825b2,"My life, while not yet complete, is now on track thanks to this.",5
cce46d0c-73bf-4fb5-948e-2f0437fa0351,Before this app I would spend all day on one thing I chose arbitrarily after breakfast. Now I manage my time and accomplish things instead of hacking away without making progress!,5
54f9f8ae-1b6a-4d1b-b22d-81268432c55a,Life Changer!.....One day one of the richest person will say my secret to succeed is HABITICA :smiling_face_with_sunglasses:,5
9a70af24-178a-4cc8-b70b-9f417806602f,Very nice and useful App,5
0a1a99b8-812d-4516-8fe2-9319b265c058,I love this app! I just wish there was a way I could see a graphic of my habits and tasks.,5
02e63f2b-9708-46d1-b36f-319cd3a793c2,Very helpful,5
70ae86dd-239c-4254-b2c9-da4b10d5acae,Brilliant,5
ed13fcdb-f9cf-4dcf-897a-327830d3946b,"Thomas Frank brought me here. It's an amazing app, congratulations. Keep on working more, because your current work is really world-class.",5
a9113185-bbb7-4c3d-967c-de6ea3909bf7,Best Ever!!,5
2257dbca-3860-4058-beeb-fef0f8939168,this app is really great to motivate you to get out of a depression slump. I'll use this forever!,5
e895b21a-1f34-4a9f-b23a-6596a3fd6a76,It's helping me to get on top of my memory and focus issues due to ADHD. Love it,5
054816c4-7fbc-4a38-8ceb-809c15007747,"This is SO perfect! Now I can't stop doing chores and improving myself, while I gain gold that I can spend on custom rewards like playing video games for an hour, chips etc. Been such tremendous help for my lazy ass. If anything, I'd love to be able to customize more values, like task rewards for the different difficulties, loss from not completing tasks etc. Always try to see the fun in what you do.",5
55dc1d0f-109f-42fc-b9ca-2f78e7713a59,Helped me get my life back on track! Been using it for over a year now.,5
28368e35-787a-4375-8ca3-ac57146bd830,It has helped me things done more consistently.,5
563dabab-bd75-49f5-84ac-f6a6fe335b3e,This app is one of its kind,5
2012bd75-eaae-4de5-9100-994a1d2c8f40,This app would be down right amazing if the system for tagging goals wasn't glitchy af. Fix that and it's 5 stars,5
997f0ab0-690d-4a47-8be5-1a1f098a536b,This app makes my real life plan into a game mission,5
d4453bfa-5bb1-403b-bac7-e3fbddd9c3ac,It's awesome,5
c1ab2c0b-c546-4198-9582-dc8f63d2c158,I love it,5
9ca7b3e9-014b-4ff0-9fc1-eba141f3d0ea,An amazing app for managing your life while having fun with an amazing community!,5
3b1d3a95-8a9c-46e9-8203-2b3d520d5702,No ads and does what it should really well.,5
a1b56b2f-23ca-46f9-81ea-9c00f92ebbae,"I find it hard to stick to any sort of schedule, but after two years I find myself coming back to Habitica every once in a while to organize my life and set new goals. It's a great platform with a great community, and really helps me stay active!",5
042ef3de-2591-423c-a68f-934e1c2601e1,Gamify your life! A fun and very committed community committed to self improvement.,5
5802eec2-1b08-41c4-9dbc-20d54cae49ee,Gamification aspect is amazing.,5
ba740abf-c431-467e-b623-6fac33304362,Perfect app,5
5f47455a-b8f0-4990-ac9b-705c9e5bb444,This app is helping me get my life together in a fun and exciting way,5
3d697ac1-79bf-490d-b806-4ceacbea5366,Love it,5
5d30669f-d8c7-4c84-8d45-cb7e09ef5af6,Very useful for keeping track of good and bad habits,5
d95d8c6d-4f47-48d3-942f-38d221541e7a,Fantastic app! The website is great as well. This app is incredibly helpful at improving the level of control I have over my life and my motivation!,5
3c13189f-30e6-4040-b54d-7eeb327334d7,I love the cute thing. Keeps me motivated,5
0987549b-0626-4a78-99d5-c07210ae6a21,I use this every day since downloading over 3 months ago. It's a wonderfully creative way to keep track of productivity and motivate yourself to do tasks :) 5*,5
5fb51be4-f3f2-4089-a1f6-416f864fea36,"This app now runs my life. It has honestly made me so much happier, and much more productive. And it's fun, too! It basically makes life much less confusing, by neatly sorting all the things I have to do, and then rewarding me for doing them. Not just in-game rewards, either: you earn gold in the game, and then you can design your own real-life awards that you buy using in-game money (for instance, by spending ten pieces of Habitica gold, you can allow yourself to watch half an hour of television). Obviously you can cheat, by pretending that you've done things that you haven't, and rewarding yourself withoutbhaving earned it, but you'd only be cheating yourself, because the real reward is the progress you've made in your life! Before Habitica, I was unhappy and struggling to find purpose. Habitica gave structure to my life, which helped me to achieve much, much more than I previously was, which gave my life a new meaning. I am now a happy and productive person!",5
9160b99a-ad62-4c9f-8bb3-18719dbb6682,"This site is awesome and helpful! Every so often i find myself thinking or saying in conversations ""oh, i'm gonna put that down in my dailies"" or ""yeah, since i got a habit i can check off for that, ..."" and then realizing other people don't know that game vocabulary, while it's weaving into my day to use it as a tool to remember and track my daily challenges. Very awesome! Sometimes the app is slow on synchronizing or not connecting to the internet (not sure it's not my internet data's fault though) - apart from that, great! :)",5
dfbab8b3-e3c7-4422-b384-a3b62626e485,If you're into gamifying things in order to encourage yourself to be more productive then this is the app for you!,5
b8cf7706-4961-444a-b036-b970e9a034ae,"This is an amazing and fun app, highly recommend it",5
bddf9995-c2b8-4b4d-9413-57e84e044af3,"Great app, it really help me :)",5
39d71ed4-3ea6-4d7f-bab0-97766e5c29ca,This app is so fun since I actually did something productive to gain some stuff.,5
9bbda162-6700-4016-85ce-ca69d0f9a42a,"The new quest is awesome, gold purchasable and finally a challenge for a large party. Please keep releasing quests like this, for players who have subscribed for awhile! Everyone else, this app is wonderful. Really has made a difference in my self-care and positive habits.",5
9d3ddbe0-f259-4c9b-8ad7-7818b31185dd,It's a great app for those who try to make their life easier.,5
21dd050b-5edb-4440-91e9-8e83d3a53acf,Ive been looking for a to do app game forever and this is so much better than I expected. I love it! Motivates me to do things for experience!,5
093c0956-a0b7-4ac9-8f6a-bdf182008452,"Habitica is great and is an app I'm willing to put money forth on gems. (And I rarely can say that) Only some of the gripes I have with this app is gifting my friends on Habitica. Come on Habitica! I'm basically asking to spend my money here. And please, please, please increase our health bars as we level up. It's unfair to be a lvl 19 with the hp of a level oner. And all the damage I should've been doing has not been showing up! Please fix that.",5
f0e2b168-49c9-4d0b-8d04-cff3faac760f,Unexpectedly useful for my lifestyle. One of the best habit forming apps for my lazy procrastinative lifestyle. There is room for improvement for the UI: Reordering of tasks doesn't sync with server on Android and iPad. The text edit box can be too small and long paragraphs in tasks will get cut off,5
56d28a4c-f75c-4282-83bc-846cb5c26989,Getting XP for getting it done!,5
e7d25894-a710-4079-a4bb-1a0300e74b29,Habitica has proven very very useful in helping me get on track and feel good about doing things I should be doing. It has been an amazing happy motivator.,5
168f363d-fe5f-491b-812f-b70ac0477a0a,"This app is fantastic! I highly recommend it! Not only does it make boring daily tasks more interesting, but you get to know more people who share your same interests. Also, who wouldn't want to earn gold and experience for doing such distasteful things as scooping out the litter box, washing dishes, and doing laundry????",5
e7e8347f-d8a7-4166-a0c6-d80abfbf0e1c,Thomas Frank recommended this... So Nice :),5
fe0838dc-2722-4418-9172-a77555b77633,It's a great app. Keeps a track of the missing action on the habits. A great motivator to keep the health up of your avatar by doing keeping up with the habits diligently.,5
298247f9-eea9-403e-ae9e-67a3bf6cb479,"Wow I've seen a couple apps with this concept, but this is well thought out",5
b622ee3c-911e-4018-b774-c899a943128e,A really good way to be more productive in your life. I saw a big improvement in how much I've been able to accomplish on a daily basis. It's super practical and loads of fun.,5
121c106e-58b3-4a6f-a1d7-7cd0f7d930d1,"I've been looking for an app like this for some time, great app to help stay motivated. Absolutely love the widgets I have the stats at the top and the to do and dailies side by side for easy view. Fun to try level up and buy items, great job guys.",5
d4e21cb8-e9ea-4553-88f4-bc8fcb7f4c34,I think that this app is fantastic! I think it would be great to have the ability to add a custom picture or badge to your rewards section. I would love to design my own badges to earn.,5
3fe10c9d-d75a-4e75-a58b-320971b26f4f,The best! I love it!,5
e486a165-5681-444d-94d0-d09f1eb3c23e,The best productivity app ever!!,5
97924d1d-de00-468f-9093-e9ba581f27d9,Awesome Todo list gamification,5
b2935f6e-1cb2-4bc1-b9e1-672d98cff944,A great habit builder and task manager.,5
490fd126-df5e-4932-8f16-9c55ad75e002,"Thats just what i need. Thank you, thank you, thank you. Im serious. Its a life changer, game changer Just amazing. And one suggestion: music. A cool lobby or elevator music can change everything. Still 5 stars tho.",5
855487db-f592-457b-b5f2-85b18d0d46c1,This is amazing! It is the best way to make/break habits ever!,5
4ea1d696-1380-4fd2-83f5-b96f6379a932,"Love unique concept it's graphics are nice, and features are cool. Really feels like a game.",5
5b161835-056a-4110-afb9-d497bfca6d84,Very good.,5
abbb8ea7-85dc-4c55-96e1-fe27f77a3ba7,THIS IS THE BEST APP EVER IT BOOSTS MY PRODUCTIVITY IN SUCH A CREATIVE AND FUN WAY THIS IS WAY TOOOOOO UNDERRATED,5
20196003-4044-482e-85ba-a8d5d786cc0d,This is the best app ever made. Now everybody can level up doing their works or chores or everything they seek for. But it would be fun if there's offline mode in case you're at school or work. Oh and please add widgets,5
f1dd36a6-6b14-4869-aec1-c2295a9bc72b,Just started out seems great,5
fed9c817-5a7a-45a2-b34e-644974ef0810,Great for incentivizing me to get stuff done!,5
aa1b4785-e37c-45b9-8dd7-fd84c807843e,I loved it!,5
1bb5987b-1f75-47d4-aecc-367199e48600,AMAZING,5
98aceaed-f9c8-460c-a9ec-5ef81cb5cd06,Great app Need more colour,5
83b4fdc6-4d3c-4965-b0c6-cdf2e10c8cdd,"Really it's great idea, i really praise you for this kind of work",5
e151324b-5186-4cae-9f59-275d6d047d7a,"Fun way to get motivated. Cute pets, sweet gear, new friends! Helping me to get the things I say I want/need to do done.",5
90389eae-999a-4b68-95d5-d9130927f0ff,First year college student with ADHD and two school-age kiddos... This app is a life saver!!! Instant gratification reward system for all the things you should be doing anyway!!!,5
26f5c1d0-12b7-4f60-a11c-772ed0740203,Very beneficial,5
2d0038a3-79f2-48de-8a0f-61ab5b5a2cbb,I've been Habitica and the app for years and it keeps getting better. This new update makes everything look slick and work more efficiently.,5
710b6672-0e71-4156-9403-ff9aa1d2dffe,"This app really changed my life... got me to do basic self-care tasks on a regular schedule, as well as continuosly working towards my goals.",5
41ed8338-b427-42a3-adcf-5162b80b72ed,Awesome app.....great app idea....love the way it works....moreover having both the +and - together in the habits tab is great....now this gives me the choice to do a better work or my old habit.. .awesome would recommend it to all .....hope it grows further...thanks HabitRPG group....,5
6177e128-ef7a-4bee-8dba-eef6b3190bda,LOVE IT &lt;3 &lt;3,5
aee58bff-fa0a-47b4-8a30-05bd789e0f2d,helpful,5
b4719b63-77fa-46ea-b7b6-9458d32594f9,Just love it! Changed my life and that's one I had to take a subscription to thank you for your amazing work.,5
764746aa-d005-4f4e-ac3d-08c38219d99f,Absolutely loving the new update. Well done guys.,5
5e24a027-9c72-43b9-a5e1-af368e68cf53,"This app is amazing. The community is absolutely lovely and encouraging. Just today I witnessed the people cheering on another user as they prepared for an exam. That alone makes this app a 5/5. If you are looking to improve yourself and have a support group, this app is the best without question.",5
d55584a8-4cb5-457a-871b-3154af6717c3,"By far the best habit builder app I've ever used. There's real incentive to keep on track and is definitely reinforcing my good habits and breaking down the bad ones! I'm meditating, doing yoga, and all the other things it was so hard to find time or motivation for before!",5
9007d47d-d0f4-49e3-b3e6-173e44bbd9fd,5 stars just on concept alone!!! Go far with this idea....take it beyond apps. You can do it!,5
4c780ab8-16f6-4207-b8f0-d1a08393d5f2,Cool idea!,5
6a94bdf3-9780-4bfe-a12b-20e77afa6229,I use this app whenever I'm falling behind on my tasks and need to keep myself accountable! More engaging than checking off a list. Great for my small business!,5
eec1736a-1359-4655-a890-77524083c234,Im a boy and I can't change. The avatar,5
4e6ece3f-6c3d-4438-863b-0320b5884f6b,Love love LOVE! This app helps me suck less. :),5
84c64e0b-6772-4e3e-b023-6e5e717b7063,This app is great and gives flexability of editing so ypu can choose for the most part how you want to attack your regular tasks and build your habits. It is rewarding to be able to earn coins and exsperience for just doing what you have to even if you dont utilize the gaming function so much.,5
1099ce60-7c76-41f2-9887-a013c1550e40,"I absolutely love this app...but if I could have 2 things improved, I would definitely add the ability to make lists instead of tags and the ability to have reoccurring to-dos instead of having it in the dailies section. If these features were there, it would be the most perfect app ever.",5
f41df3e1-50d8-4576-884b-c46c9ab0f7a8,The custom rewards is my favourite feature of this app,5
96808ef2-c86c-40bd-bc58-995cfd435db5,I love Habitica. It's an amazing tool and social support that helps me keep organised and motivated.,5
ba2a598f-d809-4998-8ce7-3e9f1f3872a9,This really helped me finish the tasks I needed to get done. 10/10 highly recommend,5
1411d341-8d9e-4c35-8d62-2b5f734a756f,"App, website, and company in general are all amazing. Great game/to do list. Been using it for over a year and I like it even more than when I started. It keeps me motivated and has a great aesthetic. Very easy to use and understand.",5
ce593cc9-cad3-44f1-a61c-767216051d10,Easy to use and keep track of any type of task. Recommend for anyone who writes down notes or to-do's or even goals. It will cleanly display them and remind you if they have been neglected,5
33369b58-7514-447c-a214-8b6f3b3490b8,This is the best thing ever happened to me,5
c97a7ddc-effb-4fbe-99f1-296068486408,"This program is a combination of to - do list, good habit former and supportive community. A must-try.",5
786a02d9-587b-4d77-98e1-5ecd16ca67ba,Everything that I needed:heart_decoration:,5
