reviewId,content,sentimentScore
cb69d51d-8e78-448e-9b06-48ec453e8097,Best productivity app ever.,5
41d0b4de-2118-47cb-8417-d144bf62ae33,This is a really fun and awesome why to help you sort your life with the bonus of dopmine fun things.,5
4e805073-7a71-4d18-b1cf-bc7fb40cc51b,So far this seems super cool! I'm excited to try it more and leave a more informed review!,5
1da72d60-bd67-41fc-81b5-8376fd5750e4,"Just love this app,it's really awesome for managing your dailies and to-dos,for anyone who loves gamified version of work to be done this app is all yours ;)",5
ceeafcaf-7abc-45e3-8ed5-c3477a3fd6ef,I love this so much,5
80ae75a3-7c8e-4c2d-9154-877988eecb39,Love it! Such a brilliant idea and really well executed. One of the best apps I've ever used.,5
5ad13404-9486-4201-8d19-e25807a4c577,"One of the best apps that I've used so far... I'm a procrastinator, due to which my grades had suffered a lot... I came across this app on a site, and decided to give it a try... One of my best decisions",5
48c7488d-1cf4-44aa-a184-a022f0c10cfe,"I really really love this app. The gamifying is really good. And I especially love the guilds with various creative monthly challenges. Another pro is that most people don't spend too much time chatting. The chatting is limited to a healthy amount (cuz ppl r busy with tasks) and it is still social enough to provide enough encouragement, sharing of thoughts and pointless banter to take ur mind off stressful stuff .",5
a0034227-efee-41dc-9739-6632d98d5ae3,Just like Solo Leveling,5
7053a5c7-2acb-404c-9dd9-9fe42d44c48e,Best productivity app I've used!!!,5
cffd0126-1402-471c-b89c-e30f707bdb3c,"Excellent app!!! I would rate it 6/5 if calendar option somehow exist. Imagine you do have birds-eye view in days, weeks or even years. May not be a rating/review more kinda suggestions hehe. Admins and Developers great job! Salute to them for making this app awesome. :)",5
9d4d48bb-9a8a-484e-a1e6-ef86005cdc99,Great tool to develop new habits. I owe habitica a lot.,5
125b35e2-6f3a-4a5c-b8d3-db7f82fdba4f,excellent app,5
b26896da-c341-4bb7-929b-a717783d73d3,By far the coolest darn app I have ever played in my life!! I love the whole concept of what is trying to be portrayed here. I doubt I'd actually be good at it because I kind of procrastinate on things a lot:face_with_tears_of_joy:but it sure is fun already so maybe I've got a chance. But thank you developers for creating this. This can really help people towards their future:smiling_face_with_smiling_eyes::folded_hands:in the most bizarre but absolutely amazing and fun way:smiling_face_with_open_hands:,5
9f7553fe-1c91-4098-8c1e-44fd67d8007c,"Love it. Pretty simple, and it helps me get things done, and even helped to break bad habits like sleeping wayyy too late and waking up at like 12PM. I haven't talked to other users all that much but from reading tavern messages, the community seems very helpful and supportive. I've been using Habitica for about a year now, and I plan to continue using it until I can finally get things done without having to be threatened by a party quest boss lol. 11/10",5
37340a02-5dd7-4e07-bb1c-6f887d1afc13,Very nice productivity rpg game,5
7d17f5db-eb6b-4e9a-a0c8-5235ac7b1df9,"This is the best! This inspired me to complete my tasks that I always seem to forget in doing. I also had fun at the same time! I really love the RPG-style theme. While using this I realized almost all rpg mechanism are in this but trading so I hope you guys put a trading system or item gifting or whatsoever in the next updates. Also, I wanna try becoming a subscriber for free so, hope you guys give me atleast a 1 mo trial hehe:sparkling_heart:.",5
e94c1674-4faf-4a20-b7ed-7b40a1ff0aaa,"I LOVE THIS APP. It helps me so much when I want to get something done, and when I need to do something daily, like take my vitamins, or wash the dishes. There are also so much nice people when you join guilds. 10/10 would recommend to a friend. Note: This app is way more helpful if you're into games, points, and competitiveness. (I'm very competitive :grinning_face_with_sweat:) But it's still super helpful even if you're not that interested in that stuff. Again, 10/10 would definitely recommend!",5
74e41ae9-56cd-4f4c-b17d-e0952f241e79,Actually for once in my life am getting stuff done lol,5
cd493340-4745-4106-adfe-0f7effd3df97,"Helped me get in control of my habits, helps me keep accountable! The setup allows me to select how difficult any task is and scales to it, very helpful",5
3bb6d765-8379-4c99-9d98-deba4350508d,Really fun and keeps you working on day to day tasks.,5
e47473cd-53c4-45b5-976c-74b65b17bec5,"I've only just started up, but this app has progressed so much since I last saw it! UI is really tidy and easy to use. It doesn't feel like everything is locked behind a paywall (though I plan to support). Tasks/rewards/etc. are easy to customize, so the game can be tailored to exactly what you need. I have ADHD, so an app that makes every task a fun/novel experience is fantastic. I'm hoping this becomes a well worn tool in my belt. Thanks to the devs for creating such a useful resource :red_heart:",5
7db1e76a-43ef-475f-82f0-9e057906519a,Plz plz plz plz make it offline guys!,5
848c3231-2f82-44c0-aa71-a505b48b98f0,"This app really changed my life. I was able to make my life work with this. I've been trying to get my life on track and out of depression, and this app showed me how. Now I am keeping my house clean, keeping up with my social life, doing homeschool with my kids, and keeping up with then :smiling_face_with_smiling_eyes: I didn't think that was possible last year.",5
b85298be-208e-4b9d-931a-6400a0a4140a,Its awesome,5
1fe69b3b-df60-4ac3-9517-225d3385d316,"Helps me SO much. Like seriously, commit to this, get into a ""party"" (kind of an online group for this rpg), and it may help you like it's helped me! I am really lazy so the progress I'm making is miraculous. It really kind of.. forces you to do what you need to do and it's my favorite mobile game there is. Hats off to the developers and anyone else involved!",5
43ee00cf-c4c5-4518-82f1-128ebc1a4968,"Amazing, creative and motivating. Kudos Designers love the Gameboy pixellated feel really made me nostalgic. Amazing app",5
5f955bff-45e3-48e3-b1fe-e1de50ba2746,"This app is very nice, it did help me",5
074bbffb-3f0f-45d8-9f61-8280929b1b26,"I've been using this as a motivation and self-rewarding To-Do list. It works, and there a lot of communities of people here! Ranging from LGBT to mental illness, it's great.",5
f7fb1c07-4b5f-4a95-93db-9678dadca3b9,It just might be one of the best apps ever made. It has helped so much with my productivity and has such wonderful features. I love it!,5
55171479-64c8-4b4e-80ee-e49776e5a02b,The app is really smart,5
d2d76407-bbec-4dad-afcd-94c0a4448fa6,Thanks for free widget,5
85279456-4d10-4f9e-a6ad-c3e469503a76,I'm thoroughly enjoying this app so far. I've been a lot more productive and on point with my tasks as well as keeping up with my personal studies and hobbies. The game aspect has been great for me to hold accountability of my actions while finding joy in completing self-made goals and gaining experience and items.,5
08f082ab-a3cd-4835-a8ce-bf430ddb0673,Super fun way to keep up with tasks,5
3170e646-0548-4509-ba6b-e9bc741e9891,It was amazing,5
9d179f36-97bf-4ef1-b47d-f2ba830d3359,"Very good app to help keep and develope new habits! Best gamification of tasks, habits and to do lists!",5
9fd20437-3c6b-4467-8315-cffb4fe00abf,"It's hard to not get bored when I being serious on something. So, I always think that life is a game. And this is a great app that can help me to get rid from my boredom when I build my good habits. Thank you very much for the developer. 5 stars from me. :smiling_face_with_smiling_eyes::star-struck:",5
76680e9e-a6fa-4c71-9b73-49c7e54e871e,Best productivity app,5
b6e3a2f4-0a7d-409d-94e3-cb8155cef0f9,Very creative. and a good idea too!,5
27b14c21-9bd3-489a-b3c5-99b7327147ad,Very usefull and fun,5
34f71d6e-ec64-412e-84c9-d692680a9df7,I'm here for the Ninja Cerebral,5
82fbace4-9d70-47a7-b5d0-3b486d037f1c,"The BEST app for motivation and tracking! Even putting the game aspect aside, I have never seen a more user-friendly app for habit/task tracking. I love how there are different categories for habits, tasks, and daily to-dos. It's customizable. Getting coins is motivation! Ive recommended it to everyone! Only thing I wish it had: a way to see your stats based on your missed to dos or frequency of habits. For instance: most health lost due to *blank* etc.",5
618773fe-00bb-44d2-85a7-1c7462b9f97b,"Habitica had helped me a lot in my efforts to improve my life. I've been using Habitica for 2 years now, and it really provide me with the motivation & support needed for me to achieve my objectives.",5
bf497b90-3e5f-4781-820e-91daa610e0bc,This is an awesome app idea for really anyone to use. Just a great app,5
4cfd6355-81a0-44fb-a9d6-592929196921,Awesome app. Helps me keep track of my daily tasks and routine. I like the fun reward and punishment system in the form of an rpg game. Keep up the good work!,5
01743de6-447e-4054-8b81-b2fb9e123dde,This app has actually really made a difference in my life. I am so grateful BUT I feel it could be WAY better. Can you add in: A Timer (for workouts) and perhaps Minigames?? (The higher level your character the more powerful stuff like that :grinning_face::grinning_face:) Thank you devs!,5
16e67da7-383a-4853-8477-e66c912b1315,Great way to keep track of things to do on the computer and phone,5
b7cf1384-391b-4ee4-90d5-09f68e220c75,Super great!!,5
aae75296-1000-4a83-bb9f-f88afe542505,I seriously like it,5
f1af20ab-5d88-4bf5-acaa-23c971dcda78,Thank you this made a difference,5
41d2958e-0907-4c2f-858b-cc27dd897fc8,"What an adorable and inspirational app! I have actually done things I was considering putting off because I didn't want to lose too much life and thus important items I really need/like. I've even gotten my partner to download it! It also doesn't penalize you too harshly for ""falling off the wagon,"" so to speak, and not using it for some time. As in, days to YEARS. It's the perfect combination of motivational and understanding, which is the perfect recipe for success, at least for myself. :nerd_face:",5
8ce70e77-ceea-4b0e-9d0d-919ebf2ace19,Really helps me to keep things organized and is a great way to keep myself on track!,5
1da5589a-fae2-4213-bcb0-90f0ee8bbc17,Just love it,5
45aa8c93-4f87-4805-9a7f-fdd49bf35832,Excellent for daily tasks and scheduling future ones,5
3216e267-03a6-47c4-8286-c80a74ef6156,Life changing app. If you have any affinity to video games and want to better your life you're in the right place. This app saved me.,5
82777187-ca38-499b-9c3a-3ca8e73d403f,"Excellent app, they greatly improved the quality since last time I used it. I'm a user of the web page for 5 year now, and the app was a little outdated but know it is very complete and useful. Thank you!",5
821adfea-1caf-49d8-9700-07e722261eca,"I have used this tool continuously since 2015 and it's a fun way to get yourself to do tasks that otherwise you might not be motivated to do. I've been a subscriber for almost two years. I would highly recommend Habitica, whether you prefer to do it all on your own, quest with others, take up challenges, or just keep track of your flossing. There's a lot to out and I've never gotten bored in almost five years.",5
a19703e7-dfcb-46d3-85d9-a4db196a80ca,This is the first time I found an app which can read my mind. This app really knows the scientific importance of reward. I really advice anyone to install this app and give it a try especially if you are a student.,5
4f823996-4065-4fe3-9da9-0c9be2ea3666,I've never enjoyed accountability before this... Our whole family partied up and is having a blast PLAYING to do chores. Wonderful concept!,5
548d6b31-cc05-427b-9416-432495da3125,Super helpful for habits and breaking bad ones,5
3a71eef2-cf54-420a-b908-6ceb82dbd6d5,"What an absolute boon. My boyfriend has ADHD and a love for video games--this app helps him remember and complete tasks much more easily than unengaging notes-app checklists. It really does wonders for motivation. Habitica is helping me survive grad school AND manage the mental load of day to day activities. I'm really excited for the new ""groups"" feature to be rolled out as well. Thank you so much Habitica!",5
804772dc-3f4d-46c7-8cb2-4d6894665e07,Awesome,5
447cb430-7a68-4b0c-924c-1fbe9fba6d1d,This is great! After having played it for three days I was begging my mom for chores to do!,5
fbb26704-da41-40bd-a843-8b453a0b7cb7,10 out 10 recommend for anyone who wants to stay organized and goal oriented without knowing you're doing it! This app is For beginners looking for a concept to start planing or motivating & go getters who want a fun and resourceful way to sort your goals and stay motivated.,5
3d0e0ecd-56b0-4c4e-8251-fc88a7047d6c,"I love Habitica! I've used it for several years, both the browser version and the app. I love how simple it is and I love the social aspect! I've been able to make friends and find support through guilds, and my party really pushes each other to be our best and continually improve! This app has helped me focus on self care and get better grades in school. I'm building healthy habits and having fun with the creative quests and interactions! Habitica is amazing!",5
33e9e01b-3843-4ca1-bb6e-0b93702de8b5,Has really helped me get more done and stay on task!,5
c1d46cbf-ae48-45d3-9df9-938d26c78d84,The best out there.,5
5ba8bdc1-e4cc-4507-982f-5ce473bb7677,"Great app. I don't even play video games but I love the set up of this application, the split into habits, dailies and tasks is perfect. The streaks and rewards are motivational, I like the capability to set reminders and being able to have a task list widget on my home page. I tried a couple other to do apps and none have kept me consistent besides this one.",5
3e03362b-d0aa-4572-bb80-c3701532acf3,"Great! No errors found, super useful, fun, good design, and small (I guess?). Super recommended!",5
7c4e8975-cd6f-4425-8c3b-bad08b11e346,Fantastic app.... I have tried many other productivity app and used to find it difficult to follow them every day. After I switched to this app.. it became all fun and I am getting motivated to complete the tasks as I earn rewards Suggestion to developer: I use browser version more than mobile app. please add reminder feature to browser version as well. Also please add auto date parser while adding the task. It will save a lot of time in entering the task. You ca take reference from ticktick app,5
9e4bde7b-2871-4e7e-a338-1947a88ae56e,"I love the interface, the overall concept and easiness of interface. Rewarding and fun to use, has helped me alot with my life goals!",5
6b2caf37-119b-458a-ac51-0f2611d5ca38,The only app that really helped getting through my really busy schedule,5
32dd66b6-0bbb-433e-8d6a-5847f06c5216,Helpful and fun,5
01356bcf-9cf2-4d04-8dcd-a6468f17ee2f,"I love this app. It keeps me on track and I have fun while doing it. Whatever aspect of you daily life you want to improve, you can set tasks and goals to help you achieve it.! :hundred_points::person_raising_hand::sunrise_over_mountains:",5
e7738364-a564-4ef1-b891-67569e46ee2a,Really helped me stay on top of online classes this year!,5
5450c5a4-cb07-42a2-aae3-83ca190d1202,"I love this app. It's helped me so much. There's only a few things that bother me about it, like how you can't change the order of dailies but besides that it's fantastic.",5
5a791516-7ff3-4364-a388-6b5bd58ae830,The best app for people with or without ADHD,5
5f9a523b-aa03-46fe-b509-5d0fc925b98e,"This app is fantastic! It helps to organize tasks and bring new positive habits into your life. And does it in a gamified, entertaining way. You should at least try it out!",5
68fe9d5a-6344-4dc0-a09d-ef8943f6706a,Thank you,5
bc63522a-b404-4267-b733-fa6f1db33b04,Very nice app. Let´s you make reminders and actually feel rewarded once you do it.,5
e8646551-28e0-47d7-953a-aceed3828cab,Love love LOVE the idea behind this!,5
20a7cc7c-04e5-4e94-b215-01ed349ef56f,"The best app to become a better person and acheive your daily goals developing great habits! The whole community is cheerful and i may thank you for taking the time to develope such great considerate features for free, you've really helped us all :sparkling_heart::sparkling_heart:",5
f9fa4b80-16fe-4661-a828-66f4a81bab65,"I love this app. It's amazing and has made me a bit more productive with the few days I've had it. I just wish there was some sort of game that comes with it. I know it isn't the point of the app, but I feel like if some sort of game was added, there would be more incentive to do all your tasks. I know it's probably just me who has this issue, but a game really would add a lot to the app (even a tiny one).",5
bd85c49a-e6ac-4502-a404-1c779b7ca374,"So far the best productivity app, with this being productive is fun",5
30a8f093-eea6-489b-a20f-c96e0bddb348,I soooo love this app. I am not a gamer but gamifying my habits makes it more interactive. You wouldn't want your avatar to die so you'll do your tasks.,5
0c2c3d43-a2e1-43c3-9efe-f641cdf0ae59,I am in the unique circumstance of liking to gamify my life and also being horrible at incentivizing doing daily chores. This is literally the perfect app for me.,5
6fc228ca-e5d2-418c-b932-23702f28839c,"So far, I love this app and the idea behind it. It holds me accountable for my tasks and habits which i really love. I would totally give it a shot.",5
3ff968f4-8559-42b6-b90f-8be2f7bd7f1f,Beautifully done app,5
ede5202e-2ddb-4bed-aa3a-fa2c04d07160,Puts the fun into prodfuntivity!,5
c6f6b1d0-e46b-4ef9-befa-a35f67050cce,"Awesome app. Great for staying productive and getting things done. I have one suggestion for the developers though, in the party chat, when people cast skills for the party, it tends to block up the chat and interrupt conversation. It would be nice to have a different section where it shows when party members use their skills. This also leads to chats being deleted faster. Anyway, just a suggestion. I appreciate the app and it being free. It has been good for me. Thank you for your time.",5
a96b3cf0-c4a3-48ef-b669-e641719b2249,Amazing app that helps me stay motivated and productive!,5
7083433d-b8f8-4d2c-ae81-ed4710da295d,By far my favorite To-Do and habit tracker app. The game and in-game incentives really help and make it fun! Highly recommend this app!,5
cfbd2b16-7e41-4358-a783-5e556249af4c,"Really good recommend to anyone who wants to get their life together. Be diligent and strict with it and you'll see significant changes long term, and the fact that it rewards you for your achievements gives you that dopamine hit you need to keep going. You can even make your own rewards with things like an hour of TV or social media or whatever as long as you achieve enough tasks and the app accommodates that. 10/10 really good for turning your life around.",5
362c0c84-9d06-47da-8180-b6ea10ca48c1,I haven't been using Habitica for that long but I've already fallen in love with it! It's really helpful if you want to keep your life organised. Amazing :OK_hand:,5
ccf5ff00-98d5-4019-9796-810d54044114,Phenomenal community. I was productive for the first time in years because of this app. Would recommend to anyone.,5
f0d4059f-3b47-46b8-8321-178537560cc3,"I really love this app! It helps me stay on track, and do what I need to do. It prompts you to do your tasks, because you earn points and level up when you do them. It has different sections for tasks (habits, to-dos, and dailies). You can set reminders, choose the difficulty of the task, set a due date/frequency, and so on. It also has other fun activities, and it is easy to use. I would really recommend if you procrastinate a lot like me or are just looking for a fun way to get things done! :)",5
2c59cacf-4c5e-4787-90fc-2ee52d869643,"I deal with depression and anxiety which makes it difficult to sometimes even get out of bed and stay motivated to complete daily tasks. I'm a high school student with tons of work as well. This helps me keep track of, motivates me, and gives me a sense of accomplishment to keep me going. I have shared with app with friends, family, and even my therapist who encourages others to use it! Its easy to use and helpful to just about everyone! I definitely recommend this app!",5
291996eb-1ba6-4a34-9ff2-b57ffa32ee1d,"I'm in love with the app. It motivates me a lot and really helps to stay on track. Apart from the cool gamified features, it also has a huge and very friendly community, where you can get support and answers to pretty much any questions.",5
e99c00e2-07bd-4a5e-a0b4-0d0a43ce22b6,Awesome,5
1bd86a50-ab0f-425f-b7ee-7bfd950da836,Love it!,5
94c78fc6-d5b7-4480-ace8-2096b60b79f0,"My favourite productivity and habit tracker app, even though I don't use too many features it can provide. It's attractive, and it feels like more fun, but I like to keep it simple. Together with my (paper) Productivity Planner I am unstoppable!",5
9e15c5ab-4c36-4fc7-9df9-afd5880016a9,Very cool app!! I love it.,5
71e717d6-8c5d-4dbd-9c3e-da58567359b3,Adore this app! It helps me stay on course and have fun too! Ive been trying to cut down on phone time so this makes a game out of my regular life so this game is perfect!,5
3dd0e65c-03e2-4c75-acdf-b666bb078bb0,"I just got the app and it is truly and honestly great! I'm super disorganised but this has really allowed me to consolidate all of my tasks. An incredibly smart, entertaining yet useful, and engaging app. I truly can't oversell it and now I really wanna stop writing this review to go level up my character. I want a staff!!!!",5
1ef471ba-d069-4306-b1d3-ab694459983a,"Great app, would be nice to be able to check the checklist items in todos.",5
2b8e37f0-efa1-4f68-9196-4fe76f1c1bc5,Nice and easy!,5
d718ed88-86dd-4872-a903-8362c18aa3f8,Apps like these motivate me to keep going.,5
655b7650-4b79-4217-8c2a-5eadfb9884dd,Awesome way to stay productive,5
675e3679-cb76-49a9-a210-82e6fede1919,"At first I was very sceptical, but after using it for a month im a huge fan.",5
28f39887-ad96-4afa-b311-b6bdca90ac33,"Life changer... Definitely a must have, complements the discipline/habit building journey wonderfully... A must have... Seriously am grateful i found this app... To always Good Days:red_heart::thumbs_up::fire::flexed_biceps_light_skin_tone:",5
c3e790eb-f347-43bb-adf7-5b9f64454851,It's an amazing app which makes you stick to your routine. I will surely recommend this to friends and family. I would like you to add some more feature like a timer (Pomodaro Technique) and please provide a option for adding attachments to the tasks. Also if possible instead of notifications reminder alarms are better. I f you could add them I would be highly grateful... Thanks for such an amazing time management App. :grinning_face_with_smiling_eyes::thumbs_up:,5
b29d714f-c780-46ab-9c14-3cd70019b149,"Very useful and helps to keep organized. Gameify you're life! Plus you can find like minded people and join challenges, parties, and guilds. 5 Stars!",5
45bd2861-8d7d-4c32-9554-b56d206a8a68,Most unique app I've ever used. So far so good. Fun. Makes me want to earn coins by completing goals and tasks so I can buy some fancy stuff or a pet.,5
1ebb2e9d-349e-40bc-b5f5-26138e1a9f49,"Getting my work done in a motivational way, with friends in a group! :D",5
6bb3223b-faae-4664-a97e-5edc2b9419d0,Be honest guys,5
ca78ed8f-121a-4fb8-a770-248aff9afcff,This has helped a lot keeping me on track with dailys!!,5
d6904a5c-78e7-4bb9-a428-3c32286c14ea,Best,5
95608e97-1f81-47c0-ac2a-59a0ca967644,So useful and cute!,5
48625da5-cb90-4b26-95df-581488e0cab3,I can't delete tasks from the old challenge anymore,5
6424d30e-2437-43cd-844b-3cc64e70632b,Changed my life!,5
86b2eea0-a11e-438e-887c-4a551bd9b4b7,I've used this for 5 years. They keep improving it and it gets smoother and better with each version. Love it.,5
f5926bd2-7811-4fdd-a90c-4a89e31ee775,LOVE IT!!!!!!!!!!,5
f7e27dd1-94a3-491b-877c-22aee62f546c,"Changing my review to 5 starts as the server issues were in fact fixed and after using the app I really like it, great sense of community!!",5
e95f92b6-64a9-4017-982c-9f2510b78146,Very fun! Makes me want to get things done!,5
2715cb5a-8868-42fd-82e4-06ae767186ea,Such a thoughtful self-help app. Life saving for ADHD. THANK YOU for the wheelchair option in the icon... the diversity was such a nice surprise. I do wish there were different task layouts to choose from for the front page -- I'm just easily confused I guess! Thank you staff.,5
4127e20b-b2b5-4101-b52e-022582c8612f,Its such fun!,5
b14dbc52-5926-446f-9e35-b7edcc999279,"has motivated me, kept me productive, and is continuing to do so for more than a year now! used this app for two full school years, tried others, but nothing really compares to habitica! this app is awesome and super fun! makes work more satsifying to complete and the party system is very helpful as well :)",5
61421e7b-3b25-4658-8b5b-7045c4811736,Best habits app,5
2bc79056-d186-411c-8c9a-b1d80bc81133,"Can't describe how much this app helped me.I couldn't keep a habit at all,but with this app I reached a point where now I can have multiple habits.I love it so much.It's helping me everyday,every year.Wish all the best for the developers.This app has everything you want and it's beautiful+helpful.If you are looking for a habit/task app then this app is for you.Just download it already.It will help you.:heart_suit:★",5
b7c614ba-da4c-4c40-8408-68317e21ea14,"I like it easy to set up, every thing is online and accessible from everywhere keeps you motivated, with daily task, habits and to do list, and between a task and the other one enjoy spare feature that offers.",5
a7cb9030-4d82-4a17-9603-5a681e6a5326,this has gotta be like one of the best most unique and useful apps out there. seriously great! :black_heart::black_heart:,5
