reviewId,content,sentimentScore
3fdc0781-7f37-4c2e-a352-c41909745b02,"This app deletes the notifications on purpose so it can sell premium version with ""permanent notifications"" (version 1 didn't do that). Also the latest updates ruined the app with bugs. The first break triggers a long break. ( long break on after session 1, no skipping). Also author doesn't listen to reviewers, assumes things and doesn't do proper testing. It was a good app while it lasted. I am very sad with this uninstall.",1
1e8f84c4-044d-410c-9438-a4dc6d7bdc6f,why cant I buy the premium app with my Google rewards??,1
2ede67c7-12f4-4512-b5da-df4121bc392a,rubbish couldn't get it to work would like a refund,1
9581133d-3ca5-4391-b68e-770dc15bde19,bad,1
3f1280d2-2d1c-4aa1-b068-66a7d52fdf6e,"Current problems following app upgrade. 1. Swiping to move from work to break and back isn't responsive, 90% of the time it doesn't work 2. You can't actually stop the app. Unbelievably there's no re-set button. It carries on regardless whether you've finished work. You have to turn off your phone to stop the app. 3. Currently the sequence I set, i.e 4 work shifts followed by a long break isn't working. I start the app when I get to work and the 2nd sequence is a long break?!? How hard can it be to create a pomodoro app which offers this basic functionality",1
811317e3-2f03-45b6-b47d-b0067751fb1e,"i have purchased the upgrade , but my phone broke, and in my new phone when i have downloaded the app it again says to upgrade. plz help",1
3af08c97-0901-4497-9c7d-7fa263aa0767,can't edit or reset timer :-(,1
7a8c55af-03fb-4b5d-8cf5-e1b6d7836400,garbage,1
98988559-5be2-465a-a94a-6abe517e3edf,destroyed the app with the new update.,1
caf3f7b4-c5e3-42aa-9192-bdd0e8edfa99,"Used to be fantastic. New update deleted all my progress, doesn't auto-advance anymore, and simply doesn't work. Have used this for months add more looking for something else. Bummer.",1
9fb6a8be-b6d9-41c1-88b9-32c787278918,"Перестал работать счетчик сессий, не воспроизводится музыка в конце сессии. телефон redmi 6 pro.",1
0e493fe2-e68e-4ffd-a3a7-3effd2a9696d,"App is broken. when it is time for a break, it goes into the negatives and doesn't go back to work.",1
423b5945-ec0f-48b4-89fe-148dc7516793,On OnePlus 6 running Android 9 the app will silently stop the 25 minutes session (no notification - even if I have them checked in the app settings) and wait for user input. If I push the STOP button on the notification it will exit. If I push the PAUSE button it will start to a new 25 minutes session.,1
4c2a8513-e989-4dbd-86ca-a7292592ded1,Crashes all the time Edit: It's fixed now. And has no problem.,1
b4e3f93b-0aaa-4abf-b363-6a9b35f7298b,"Notifications don't work, how do I know timer is up?",1
8b78b76c-f5e4-4dce-a419-7b34ead89f1f,Who came from Nelson quest?,1
315de5f6-43a3-46ee-8b96-e3d4cb3cf277,It stops every freaking time it comes down to zero. I'm tired of this.,1
cc2be1b4-4877-4653-8e8e-52908b6daec9,:smiling_face_with_smiling_eyes: upvotes,1
65971426-bf31-419a-97fc-a2ec032bee4d,Is the break timer supposed to into the negative numbers?,1
ff9093ad-8c6d-4b25-9303-8d57e13b1788,App closes when timer counts down,1
f4be2280-36a2-468b-a4e6-ccefa6888280,unnecessary used of Ram,1
1b6d70c3-cf94-4a0c-a9b1-f7c537743dc6,Inexplicably disables WiFi on a session start by default. Who hurt you?,1
88810ed0-3434-4d6f-b395-71fd9d22313b,Did not work. Alarm would not sound.,1
2cd71e0e-c593-478f-9e83-ce036fedd7f0,This app shut down on it's in between the session and I have to start the session again from the start. Please fix it,1
b3f019f1-92a6-4645-be58-76c70cd50ac8,"There is a problem, it doesn't notify you when the session start and the counter start counting negative numbers instead of going from 25 to 0",1
6488c7ef-f6e4-4d21-a05a-dba3323fef08,Doesn't work with the screen locked. Useless.,1
8d595edf-e091-4485-bd0e-70e5c54bac6a,"Please make the app run in background ... when i remove it from recemt apps, it shuts down. background running luke a music player does would be great",1
ffa60cd9-4a34-436f-b026-6c83e6d94b6b,"Kept on crashing, didn't give notification properly and never maintained the serial for which never notified for long breaks.",1
509d44e3-ab4e-41d5-ba88-dedaad8f29c4,Time goes negative.,1
2982b6cd-3145-4f6b-81c4-0d3fabd0bb56,The timer after session goes negative and keep on in negative,1
d16797ae-54fa-4064-a169-5a5f3ccd4a2a,App stopped notifying and started counting backwards into the negatives,1
59ba1787-2a51-44a1-8438-640652c0d30e,Greaaat!,1
cddc607c-3794-418d-98a7-5ac374a49bab,I cannot reset the counter,1
26d381d6-0e7d-4ce4-b7f4-1247f8a3c449,No notification sound to mark completion of session/break :-/,1
2f24cfcf-d919-4b8d-8040-3e98a0dc209c,No notification sound...,1
b101bd69-5a68-4d7d-a64d-57397a7cc045,Ridiculously buggy for such a simple concept.,1
f81b6960-fbe6-4f75-b086-d33d21e8c861,Mellifluous....,1
1001c4e0-b388-457f-a8d7-79deabddb22a,namely disabling notifications during work session. HTC10. Any way to solve?,1
5a8a917f-e1b3-46fd-b127-97d5d55e0b7c,No sound,1
27af348f-7186-42fd-92ab-cd3f9cf89800,It looks broken,1
1aac91e8-df86-40bc-81ac-8af4066c1a83,Looked clean and simple but froze my phone. Also it spaced the long break incorrectly and I couldn't change the long break duration. Uninstalled after one day.,1
62cb5bad-3802-47e7-8961-65a8c29954a8,when you close the app in App Switcher/Menu,1
0f014cd3-f10c-43ad-b104-94347f9dbd96,"This app doesn't keep time if it's not in focus. I've had this installed for over 6 months expecting that the dev would solve that problem, but no, he hasn't. This app is terrible, don't waste your time. The devs response is to keep it running in the foreground, who wants to do that?",1
c2cf7468-815f-458c-8dc8-b00e96da1e30,This app is fantastic considering it's free and open source. But I'm docking it 1 star since it doesn't let me swipe away notifications (e.g. when timer is finished).,1
5bf4fa7c-b5bd-4e80-94b2-bb3ce649a751,No I don't have any battery management apps installed.,1
4fb0386e-5d2a-49ce-b262-ce32161c687c,"Keeps pausing when doing other things. For instance, I'll go watch an educational YouTube video on my phone while this is timing. Come back and the timer is paused and it is asking me to rate. Literally unusable because it is not performing the function I down loaded it for",1
c3aeb455-cc64-455d-8e3f-ff5dfbb7f077,Please give an option to pause the timer.,1
191defce-7dba-4f3e-9ec4-e9c069724e57,"Does not work on Android N even after update ""fixed issued with Android N""",1
dd530c04-a6e0-4721-966d-7a9b9f90d3e7,Just kidding... This app is really awesome! Thank you devs for creating this masterpiece... Really helps me study. But this app really got me into trouble last weekend as I didn't pickup my landlord's call for over an hour.... Fml,1
51807b0f-1576-4dc7-921a-94fb4075f106,"Notifications (sound, vibration) do not work.",1
605d5bbe-1f18-4f79-b2cc-523e93b56839,WiFi randomly turned on during break,1
