reviewId,content,sentimentScore
a14cde18-3eec-459a-bec3-30a75731dd2e,"Integration with Mi Band Tools: Create application notification and: disable Ignore Non-Clearable option, set Multiple Notifications Filter to 300 seconds (or duration of your break period), add Content Filter to ""Break in progress"", set Content Filter to be Inclusive, then click ""Duplicate Notification"". For duplicate notification, set the same options, but some values are different: set Multiple Notifications Filter to 1500 seconds (or duration of your work period), set Content Filter to ""Work session in progress"" . Now, your Mi Band will show a single notification when your work period or break period run out. The review itself: The app seems to have great UX and works well (I like it more then Brain Focus I used previously)",2
07d32710-b296-4226-be2c-8a28a007dd1f,"I really don't like the new version. I accidentally swipe up and the timer starts over. You should be able to disable these swiping gestures. I'm looking for another version. Accidental swipe occurs when im trying to swipe to add a minute or pause or whatever. its not intuitive this new way. maybe put labels so people know where theyre swiping. look at the app Brain Focus. I prefer the look of your app, but the customization of BF is far superior. To each their own. Good luck to you.",2
a4145fbc-17bb-4e9b-9059-ae27a71b7ba5,"Default (unpaid) behavior of this program is what I can get with the preinstalled timer/clock program on my phone, or even better with my hand-watch and piece of paper. But pay $5 for ""advanced features"" in an (ugh!) OSS -- no, thanks. There's no tick sound, btw.",2
461733e3-12a4-445f-9721-b0f366321934,timer poco versatil y te cobran por funciones,2
f245b32b-12e0-4424-a3cd-240710f4de0c,After turning off my screen the application doesn't remind me that the session is over until I turn on my screen again. It looks beautiful but I can not use it in this state.,2
cbf900c8-709c-4c29-ae0e-a6ac8de962bb,"notification sound does not turn off. update, notification sound bug was fixed but I'm hearing the notification sound through my phone speakers and bluetooth when I have bluetooth headphones connected. If bluetooth is connected I would like to hear the sound just through bluetooth and not the phone speakers.",2
a5413322-410e-4a0c-9dd4-0a3cfc9ce91a,"It's a good idea but timer resets if app loses focus or screen locks, defeating the purpose of notifying me when the next break comes. Having to manually check when the next break's coming is useless for me.",2
7fc85b13-b455-40a1-b6f8-73923bf8e37e,Didn't like it! Can't modify the study length.,2
60f6cea9-8bac-42f8-82ce-f40af98328e5,Doesn't seem to alert me unless/until I turn on screen. Not sure if configuration issue but at best this is unintuitive.,2
ee6fdab9-bf1e-4a6c-8bbb-01363f9cbbff,It has bugs Need updates!! Sometimes the notification sound doesn't working . If I close the app window it's will stop working counting . Sometimes When I pause the counting and turn it back it starts counting again from the beginning. In the notification list when it counting it gives you when the session will end but not how much of time rest . The work session duration is limited to 60 min !! When my phone is locked the counting would be hidden. Need ubdate for it's design. Thank you !!,2
87bcf4b7-38b6-4292-9315-bc961d7ba402,Dwload immediately,2
9787eca2-9ae3-41af-b968-55a8d0a6ed10,It doesn't work sometimes and even though i set other settings it will stop after 25 minutes.,2
9d56b2f7-078a-431b-bbcb-e1905a18c487,App lacks assessment tools...,2
ac962dea-afcf-4b75-b81c-b36b56870210,Background is very awkward There should be a customize option,2
fc8eea16-fd0f-4149-b4eb-6a0bf7a5ce2c,"i started the timer, began working, and not three minutes later i happened to glance at it and it had reset itself to 25 minutes. it has a lovely ui and good customization options, but if it doesn't fulfill its literal only purpose, what's the point?",2
fe21da2c-4ef8-47ab-8ce2-7cd566fb6d2b,I wasn't able to update ringtones as alert tone as the default one are not that loud,2
b452a1f8-e10a-4004-928a-d5762a6ad365,Unfortunately every time my phone locks the running timer is reset.,2
9347e4c6-b40c-473a-a08a-a30d50bcda8a,No me deja ponerle sonido. Se acaba el tiempo pero si no estoy pendiente del móvil no me entero,2
3cbac70a-911c-47a6-91ec-0f681174165b,No meu aparelho apresenta uma pequena falha no designer. As letras da ultima linha se apresentam sobrepostas ao botao e não é possível ler direito,2
ba01fa8b-63bb-47c4-9b1b-06d4b5cba366,"Good looking app but way too silent, can't hear the notifications at all which makes this pretty useless",2
0551313f-3aee-4ccd-8346-3e44f09b16da,"35 sessions in 3 days. I love it. But I'm having a problem. It doesn't play a sound when the session or the break is over. It does play a sound, yes, but for 1/20 of a second, it just mutes right away, but it vibrates. I've tested it with 1 minute pomodoros. Muted the phone, unmuted it. Restarted the app. Still. Idk why. EDIT: worked after I cleared data and cache.",2
0a133d42-0e55-46db-912a-7eb6ea28a1d1,1. Work session pauses automatically 2. Notification sounds may or may not ring 3. Long breaks at times are skipped,2
a5b4721f-69c3-4a67-b95f-ca3145e9c445,"It's a timer. The very least you could ask of it out of the box is to keep time. Complaints about the timer pausing are still unaddressed as of writing, and it tracked less than a minute after I started it an hour ago.",2
040fe132-08ae-45a8-93ee-556d6ad571fb,"Nice app and features, but it doesn't work. The timer will stop, especially if in the background. If displaying the timer as the main screen, there are not any issues. If the timer didn't stop, 5 stars for sure. Now searching for another app...",2
2a69c41e-494c-4cc6-bc94-33d1422f07b7,"Sometimes it doesn't ring and goes on with the next session. Sometimes doesn't count the time at all. Need to keep the phone on ring to allow app to ring, which can create distractions. Too many bugs, uninstalling.",2
41c28d09-0c12-4b82-b5eb-1ed8dcd4648d,"When i started this app it was good but when time is over, this timer doesn't worked, and i skipped my time, twice.",2
328ee0e1-e05f-4e16-9407-04c32936a1cb,No use when playing Spotify at the same time. Correction: the sound played but was very quiet. Trying new version can select sound. But all the android alarms are too unobtrusive. Could you supply a loud alarm sound with app so this would work better?,2
